      -----------------------------------------------------------      
     |                   =====================                   |     
     |                           x T B                           |     
     |                   =====================                   |     
     |                         S. Grimme                         |     
     |          Mulliken Center for Theoretical Chemistry        |     
     |                    University of Bonn                     |     
      -----------------------------------------------------------      

   * xtb version 6.7.1 (edcfbbe) compiled by 'albert@albert-system' on 2024-07-22

   xtb is free software: you can redistribute it and/or modify it under
   the terms of the GNU Lesser General Public License as published by
   the Free Software Foundation, either version 3 of the License, or
   (at your option) any later version.
   
   xtb is distributed in the hope that it will be useful,
   but WITHOUT ANY WARRANTY; without even the implied warranty of
   MERCHANTABILITY or FITNESS FOR A PARTICULAR PURPOSE.  See the
   GNU Lesser General Public License for more details.
   
   Cite this work as:
   * C. Bannwarth, E. Caldeweyher, S. Ehlert, A. Hansen, P. Pracht,
     J. Seibert, S. Spicher, S. Grimme, WIREs Comput. Mol. Sci., 2020, 11,
     e01493. DOI: 10.1002/wcms.1493
   
   for GFN2-xTB:
   * C. Bannwarth, S. Ehlert and S. Grimme., J. Chem. Theory Comput., 2019,
     15, 1652-1671. DOI: 10.1021/acs.jctc.8b01176
   for GFN1-xTB:
   * S. Grimme, C. Bannwarth, P. Shushkov, J. Chem. Theory Comput., 2017,
     13, 1989-2009. DOI: 10.1021/acs.jctc.7b00118
   for GFN0-xTB:
   * P. Pracht, E. Caldeweyher, S. Ehlert, S. Grimme, ChemRxiv, 2019, preprint.
     DOI: 10.26434/chemrxiv.8326202.v1
   for GFN-FF:
   * S. Spicher and S. Grimme, Angew. Chem. Int. Ed., 2020, 59, 15665-15673.
     DOI: 10.1002/anie.202004239
   
   for ALPB and GBSA implicit solvation:
   * S. Ehlert, M. Stahn, S. Spicher, S. Grimme, J. Chem. Theory Comput.,
     2021, 17, 4250-4261. DOI: 10.1021/acs.jctc.1c00471
   
   for ddCOSMO and CPCM-X implicit solvation:
   * M. Stahn, S. Ehlert, S. Grimme, J. Phys. Chem. A,
     2023, XX, XXXX-XXXX. DOI: 10.1021/acs.jpca.3c04382
   
   for DFT-D4:
   * E. Caldeweyher, C. Bannwarth and S. Grimme, J. Chem. Phys., 2017,
     147, 034112. DOI: 10.1063/1.4993215
   * E. Caldeweyher, S. Ehlert, A. Hansen, H. Neugebauer, S. Spicher,
     C. Bannwarth and S. Grimme, J. Chem. Phys., 2019, 150, 154122.
     DOI: 10.1063/1.5090222
   * E. Caldeweyher, J.-M. Mewes, S. Ehlert and S. Grimme, Phys. Chem. Chem. Phys.
     2020, 22, 8499-8512. DOI: 10.1039/D0CP00502A
   
   for sTDA-xTB:
   * S. Grimme and C. Bannwarth, J. Chem. Phys., 2016, 145, 054103.
     DOI: 10.1063/1.4959605
   
   in the mass-spec context:
   * V. Asgeirsson, C. Bauer and S. Grimme, Chem. Sci., 2017, 8, 4879.
     DOI: 10.1039/c7sc00601b
   * J. Koopman and S. Grimme, ACS Omega 2019, 4, 12, 15120-15133.
     DOI: 10.1021/acsomega.9b02011
   
   for metadynamics refer to:
   * S. Grimme, J. Chem. Theory Comput., 2019, 155, 2847-2862
     DOI: 10.1021/acs.jctc.9b00143
   
   for SPH calculations refer to:
   * S. Spicher and S. Grimme, J. Chem. Theory Comput., 2021, 17, 1701-1714
     DOI: 10.1021/acs.jctc.0c01306
   
   for ONIOM refer to:
   * C. Plett, A. Katbashev, S. Ehlert, S. Grimme, M. Bursch,
     Phys. Chem. Chem. Phys., 2023, 25, 17860-17868. DOI: 10.1039/D3CP02178E
   
   for DIPRO refer to:
   * J. Kohn, N. Gildemeister, S. Grimme, D. Fazzi, A. Hansen,
     J. Chem. Phys., 2023, just accepted.
   
   for PTB refer to:
   * S. Grimme, M. Mueller, A. Hansen, J. Chem. Phys., 2023, 158, 124111.
     DOI: 10.1063/5.0137838
   
   with help from (in alphabetical order)
   P. Atkinson, C. Bannwarth, F. Bohle, G. Brandenburg, E. Caldeweyher
   M. Checinski, S. Dohm, S. Ehlert, S. Ehrlich, I. Gerasimov, C. Hölzer
   A. Katbashev, J. Kohn, J. Koopman, C. Lavigne, S. Lehtola, F. März, M. Müller,
   F. Musil, H. Neugebauer, J. Pisarek, C. Plett, P. Pracht, F. Pultar,
   J. Seibert, P. Shushkov, S. Spicher, M. Stahn, M. Steiner, T. Strunk,
   J. Stückrath, T. Rose, and J. Unsleber
   
 * started run on 2025/04/09 at 05:20:53.989     
   ID    Z sym.   atoms
    1    6 C      1, 2, 7, 8, 10, 15, 16, 18, 19
    2    8 O      3, 6, 14, 17
    3   15 P      4, 12
    4   16 S      5, 9, 11, 13
    5    1 H      20-41

           -------------------------------------------------
          |                Calculation Setup                |
           -------------------------------------------------

          program call               : /srv/scratch/z5358697/.xtb/bin/xtb gas.coord --gfn2 --sp --chrg 0 --norestart --parallel 1
          hostname                   : k163
          coordinate file            : gas.coord
          omp threads                :                     1


           -------------------------------------------------
          |                 G F N 2 - x T B                 |
           -------------------------------------------------

        Reference                      10.1021/acs.jctc.8b01176
      * Hamiltonian:
        H0-scaling (s, p, d)           1.850000    2.230000    2.230000
        zeta-weighting                 0.500000
      * Dispersion:
        s8                             2.700000
        a1                             0.520000
        a2                             5.000000
        s9                             5.000000
      * Repulsion:
        kExp                           1.500000    1.000000
        rExp                           1.000000
      * Coulomb:
        alpha                          2.000000
        third order                    shell-resolved
        anisotropic                    true
        a3                             3.000000
        a5                             4.000000
        cn-shift                       1.200000
        cn-exp                         4.000000
        max-rad                        5.000000


          ...................................................
          :                      SETUP                      :
          :.................................................:
          :  # basis functions                 134          :
          :  # atomic orbitals                 128          :
          :  # shells                           66          :
          :  # electrons                       116          :
          :  max. iterations                   250          :
          :  Hamiltonian                  GFN2-xTB          :
          :  restarted?                      false          :
          :  GBSA solvation                  false          :
          :  PC potential                    false          :
          :  electronic temp.          300.0000000     K    :
          :  accuracy                    1.0000000          :
          :  -> integral cutoff          0.2500000E+02      :
          :  -> integral neglect         0.1000000E-07      :
          :  -> SCF convergence          0.1000000E-05 Eh   :
          :  -> wf. convergence          0.1000000E-03 e    :
          :  Broyden damping             0.4000000          :
          :  net charge                          0          :
          :  unpaired electrons                  0          :
          ...................................................

 iter      E             dE          RMSdq      gap      omega  full diag
   1    -65.3714956 -0.653715E+02  0.651E+00    4.03       0.0  T
   2    -65.5435645 -0.172069E+00  0.430E+00    2.80       1.0  T
   3    -65.5620467 -0.184822E-01  0.147E+00    2.74       1.0  T
   4    -65.5656599 -0.361312E-02  0.611E-01    2.39       1.0  T
   5    -65.5672830 -0.162315E-02  0.301E-01    2.55       1.0  T
   6    -65.5676234 -0.340436E-03  0.125E-01    2.53       1.0  T
   7    -65.5676714 -0.479135E-04  0.456E-02    2.54       1.0  T
   8    -65.5676783 -0.694881E-05  0.202E-02    2.55       1.0  T
   9    -65.5676793 -0.103510E-05  0.592E-03    2.55       2.6  T
  10    -65.5676794 -0.844071E-07  0.285E-03    2.55       5.5  T
  11    -65.5676794 -0.112199E-07  0.661E-04    2.55      23.6  T
  12    -65.5676794 -0.209187E-08  0.312E-04    2.55      50.0  T

   *** convergence criteria satisfied after 12 iterations ***

         #    Occupation            Energy/Eh            Energy/eV
      -------------------------------------------------------------
         1        2.0000           -0.7549102             -20.5422
       ...           ...                  ...                  ...
        52        2.0000           -0.4382302             -11.9249
        53        2.0000           -0.4079173             -11.1000
        54        2.0000           -0.3978298             -10.8255
        55        2.0000           -0.3662250              -9.9655
        56        2.0000           -0.3642195              -9.9109
        57        2.0000           -0.3631667              -9.8823
        58        2.0000           -0.3591772              -9.7737 (HOMO)
        59                         -0.2655449              -7.2258 (LUMO)
        60                         -0.2344224              -6.3790
        61                         -0.2106999              -5.7334
        62                         -0.1994350              -5.4269
        63                         -0.1562707              -4.2523
       ...                                ...                  ...
       128                          1.3658360              37.1663
      -------------------------------------------------------------
                  HL-Gap            0.0936323 Eh            2.5479 eV
             Fermi-level           -0.3123610 Eh           -8.4998 eV

 SCC (total)                   0 d,  0 h,  0 min,  0.059 sec
 SCC setup                      ...        0 min,  0.000 sec (  0.436%)
 Dispersion                     ...        0 min,  0.000 sec (  0.482%)
 classical contributions        ...        0 min,  0.000 sec (  0.091%)
 integral evaluation            ...        0 min,  0.014 sec ( 23.563%)
 iterations                     ...        0 min,  0.023 sec ( 38.738%)
 molecular gradient             ...        0 min,  0.021 sec ( 36.322%)
 printout                       ...        0 min,  0.000 sec (  0.340%)

         :::::::::::::::::::::::::::::::::::::::::::::::::::::
         ::                     SUMMARY                     ::
         :::::::::::::::::::::::::::::::::::::::::::::::::::::
         :: total energy             -65.008247145099 Eh    ::
         :: gradient norm              0.036289951541 Eh/a0 ::
         :: HOMO-LUMO gap              2.547864724567 eV    ::
         ::.................................................::
         :: SCC energy               -65.566478244172 Eh    ::
         :: -> isotropic ES            0.109968780204 Eh    ::
         :: -> anisotropic ES         -0.010764881911 Eh    ::
         :: -> anisotropic XC          0.030764004613 Eh    ::
         :: -> dispersion             -0.056427844080 Eh    ::
         :: repulsion energy           0.558231099073 Eh    ::
         :: add. restraining           0.000000000000 Eh    ::
         :: total charge               0.000000000000 e     ::
         :::::::::::::::::::::::::::::::::::::::::::::::::::::

           -------------------------------------------------
          |                Property Printout                |
           -------------------------------------------------

    * Orbital Energies and Occupations

         #    Occupation            Energy/Eh            Energy/eV
      -------------------------------------------------------------
         1        2.0000           -0.7549102             -20.5422
       ...           ...                  ...                  ...
        46        2.0000           -0.4635849             -12.6148
        47        2.0000           -0.4610508             -12.5458
        48        2.0000           -0.4573645             -12.4455
        49        2.0000           -0.4550185             -12.3817
        50        2.0000           -0.4505655             -12.2605
        51        2.0000           -0.4393758             -11.9560
        52        2.0000           -0.4382302             -11.9249
        53        2.0000           -0.4079173             -11.1000
        54        2.0000           -0.3978298             -10.8255
        55        2.0000           -0.3662250              -9.9655
        56        2.0000           -0.3642195              -9.9109
        57        2.0000           -0.3631667              -9.8823
        58        2.0000           -0.3591772              -9.7737 (HOMO)
        59                         -0.2655449              -7.2258 (LUMO)
        60                         -0.2344224              -6.3790
        61                         -0.2106999              -5.7334
        62                         -0.1994350              -5.4269
        63                         -0.1562707              -4.2523
        64                         -0.1455162              -3.9597
        65                         -0.1448669              -3.9420
        66                         -0.1306892              -3.5562
        67                         -0.1161940              -3.1618
        68                         -0.1078881              -2.9358
        69                         -0.0304574              -0.8288
       ...                                ...                  ...
       128                          1.3658360              37.1663
      -------------------------------------------------------------
                  HL-Gap            0.0936323 Eh            2.5479 eV
             Fermi-level           -0.3123610 Eh           -8.4998 eV

     #   Z          covCN         q      C6AA      α(0)
     1   6 C        3.751    -0.116    22.774     6.806
     2   6 C        3.865     0.083    19.167     6.226
     3   8 O        1.656    -0.253    18.201     5.759
     4  15 P        3.940     0.379   144.504    21.594
     5  16 S        0.931    -0.409   157.073    21.198
     6   8 O        1.656    -0.246    18.091     5.742
     7   6 C        3.864     0.085    19.141     6.221
     8   6 C        3.751    -0.113    22.733     6.800
     9  16 S        1.976    -0.138   146.870    20.397
    10   6 C        3.799     0.036    19.964     6.362
    11  16 S        2.068    -0.125   146.278    20.356
    12  15 P        3.842     0.391   144.006    21.557
    13  16 S        0.926    -0.384   155.858    21.116
    14   8 O        1.655    -0.269    18.478     5.803
    15   6 C        3.865     0.082    19.179     6.228
    16   6 C        3.751    -0.116    22.786     6.807
    17   8 O        1.655    -0.245    18.080     5.740
    18   6 C        3.846     0.090    19.058     6.210
    19   6 C        3.751    -0.117    22.796     6.809
    20   1 H        0.925     0.059     2.206     2.323
    21   1 H        0.925     0.060     2.194     2.316
    22   1 H        0.924     0.060     2.198     2.319
    23   1 H        0.924     0.062     2.172     2.305
    24   1 H        0.924     0.064     2.157     2.297
    25   1 H        0.924     0.065     2.143     2.289
    26   1 H        0.924     0.063     2.164     2.301
    27   1 H        0.925     0.059     2.207     2.323
    28   1 H        0.925     0.062     2.173     2.305
    29   1 H        0.925     0.059     2.211     2.325
    30   1 H        0.925     0.081     1.965     2.192
    31   1 H        0.925     0.083     1.949     2.183
    32   1 H        0.924     0.065     2.147     2.291
    33   1 H        0.924     0.060     2.201     2.320
    34   1 H        0.925     0.054     2.265     2.353
    35   1 H        0.925     0.064     2.156     2.296
    36   1 H        0.925     0.060     2.196     2.318
    37   1 H        0.924     0.060     2.195     2.317
    38   1 H        0.924     0.048     2.339     2.392
    39   1 H        0.925     0.053     2.282     2.362
    40   1 H        0.925     0.072     2.063     2.246
    41   1 H        0.925     0.069     2.091     2.261

 Mol. C6AA /au·bohr⁶  :      26565.031830
 Mol. C8AA /au·bohr⁸  :     863113.808912
 Mol. α(0) /au        :        258.365611


Wiberg/Mayer (AO) data.
largest (>0.10) Wiberg bond orders for each atom

 ---------------------------------------------------------------------------
     #   Z sym  total        # sym  WBO       # sym  WBO       # sym  WBO
 ---------------------------------------------------------------------------
     1   6 C    3.992 --     2 C    1.022    21 H    0.983    20 H    0.981
                            22 H    0.972
     2   6 C    3.913 --     1 C    1.022    24 H    0.970    23 H    0.967
                             3 O    0.911
     3   8 O    2.401 --     4 P    1.300     2 C    0.911
     4  15 P    5.265 --     5 S    1.509     6 O    1.315     3 O    1.300
                             9 S    0.981
     5  16 S    1.858 --     4 P    1.509     9 S    0.145
     6   8 O    2.405 --     4 P    1.315     7 C    0.897
     7   6 C    3.909 --     8 C    1.023    26 H    0.970    25 H    0.966
                             6 O    0.897
     8   6 C    3.991 --     7 C    1.023    27 H    0.984    29 H    0.980
                            28 H    0.976
     9  16 S    2.270 --     4 P    0.981    10 C    0.970     5 S    0.145
    10   6 C    3.964 --    11 S    0.993     9 S    0.970    30 H    0.968
                            31 H    0.965
    11  16 S    2.287 --    10 C    0.993    12 P    0.973    13 S    0.112
    12  15 P    5.270 --    13 S    1.582    17 O    1.301    14 O    1.271
                            11 S    0.973
    13  16 S    1.890 --    12 P    1.582    11 S    0.112
    14   8 O    2.389 --    12 P    1.271    15 C    0.913
    15   6 C    3.913 --    16 C    1.021    33 H    0.970    32 H    0.966
                            14 O    0.913
    16   6 C    3.991 --    15 C    1.021    34 H    0.985    36 H    0.981
                            35 H    0.975
    17   8 O    2.399 --    12 P    1.301    18 C    0.890
    18   6 C    3.910 --    19 C    1.021    38 H    0.972    37 H    0.969
                            17 O    0.890
    19   6 C    3.987 --    18 C    1.021    41 H    0.982    39 H    0.980
                            40 H    0.978
    20   1 H    0.996 --     1 C    0.981
    21   1 H    0.996 --     1 C    0.983
    22   1 H    0.996 --     1 C    0.972
    23   1 H    0.996 --     2 C    0.967
    24   1 H    0.996 --     2 C    0.970
    25   1 H    0.996 --     7 C    0.966
    26   1 H    0.996 --     7 C    0.970
    27   1 H    0.996 --     8 C    0.984
    28   1 H    0.996 --     8 C    0.976
    29   1 H    0.995 --     8 C    0.980
    30   1 H    0.991 --    10 C    0.968
    31   1 H    0.993 --    10 C    0.965
    32   1 H    0.996 --    15 C    0.966
    33   1 H    0.996 --    15 C    0.970
    34   1 H    0.997 --    16 C    0.985
    35   1 H    0.996 --    16 C    0.975
    36   1 H    0.996 --    16 C    0.981
    37   1 H    0.996 --    18 C    0.969
    38   1 H    0.997 --    18 C    0.972
    39   1 H    0.996 --    19 C    0.980
    40   1 H    0.995 --    19 C    0.978
    41   1 H    0.995 --    19 C    0.982
 ---------------------------------------------------------------------------

Topologies differ in total number of bonds
Writing topology from bond orders to xtbtopo.mol

molecular dipole:
                 x           y           z       tot (Debye)
 q only:        0.032      -1.900       0.053
   full:        0.119      -2.416       0.208       6.170
molecular quadrupole (traceless):
                xx          xy          yy          xz          yz          zz
 q only:       14.534       8.903     -25.754      -4.212       7.705      11.219
  q+dip:       19.237      11.606     -28.974      -1.953       5.709       9.738
   full:       19.159      12.124     -30.067      -2.610       6.918      10.908


           -------------------------------------------------
          | TOTAL ENERGY              -65.008247145099 Eh   |
          | GRADIENT NORM               0.036289951541 Eh/α |
          | HOMO-LUMO GAP               2.547864724567 eV   |
           -------------------------------------------------

------------------------------------------------------------------------
 * finished run on 2025/04/09 at 05:20:54.086     
------------------------------------------------------------------------
 total:
 * wall-time:     0 d,  0 h,  0 min,  0.097 sec
 *  cpu-time:     0 d,  0 h,  0 min,  0.065 sec
 * ratio c/w:     0.671 speedup
 SCF:
 * wall-time:     0 d,  0 h,  0 min,  0.059 sec
 *  cpu-time:     0 d,  0 h,  0 min,  0.053 sec
 * ratio c/w:     0.886 speedup

