      -----------------------------------------------------------      
     |                   =====================                   |     
     |                           x T B                           |     
     |                   =====================                   |     
     |                         S. Grimme                         |     
     |          Mulliken Center for Theoretical Chemistry        |     
     |                    University of Bonn                     |     
      -----------------------------------------------------------      

   * xtb version 6.7.1 (edcfbbe) compiled by 'albert@albert-system' on 2024-07-22

   xtb is free software: you can redistribute it and/or modify it under
   the terms of the GNU Lesser General Public License as published by
   the Free Software Foundation, either version 3 of the License, or
   (at your option) any later version.
   
   xtb is distributed in the hope that it will be useful,
   but WITHOUT ANY WARRANTY; without even the implied warranty of
   MERCHANTABILITY or FITNESS FOR A PARTICULAR PURPOSE.  See the
   GNU Lesser General Public License for more details.
   
   Cite this work as:
   * C. Bannwarth, E. Caldeweyher, S. Ehlert, A. Hansen, P. Pracht,
     J. Seibert, S. Spicher, S. Grimme, WIREs Comput. Mol. Sci., 2020, 11,
     e01493. DOI: 10.1002/wcms.1493
   
   for GFN2-xTB:
   * C. Bannwarth, S. Ehlert and S. Grimme., J. Chem. Theory Comput., 2019,
     15, 1652-1671. DOI: 10.1021/acs.jctc.8b01176
   for GFN1-xTB:
   * S. Grimme, C. Bannwarth, P. Shushkov, J. Chem. Theory Comput., 2017,
     13, 1989-2009. DOI: 10.1021/acs.jctc.7b00118
   for GFN0-xTB:
   * P. Pracht, E. Caldeweyher, S. Ehlert, S. Grimme, ChemRxiv, 2019, preprint.
     DOI: 10.26434/chemrxiv.8326202.v1
   for GFN-FF:
   * S. Spicher and S. Grimme, Angew. Chem. Int. Ed., 2020, 59, 15665-15673.
     DOI: 10.1002/anie.202004239
   
   for ALPB and GBSA implicit solvation:
   * S. Ehlert, M. Stahn, S. Spicher, S. Grimme, J. Chem. Theory Comput.,
     2021, 17, 4250-4261. DOI: 10.1021/acs.jctc.1c00471
   
   for ddCOSMO and CPCM-X implicit solvation:
   * M. Stahn, S. Ehlert, S. Grimme, J. Phys. Chem. A,
     2023, XX, XXXX-XXXX. DOI: 10.1021/acs.jpca.3c04382
   
   for DFT-D4:
   * E. Caldeweyher, C. Bannwarth and S. Grimme, J. Chem. Phys., 2017,
     147, 034112. DOI: 10.1063/1.4993215
   * E. Caldeweyher, S. Ehlert, A. Hansen, H. Neugebauer, S. Spicher,
     C. Bannwarth and S. Grimme, J. Chem. Phys., 2019, 150, 154122.
     DOI: 10.1063/1.5090222
   * E. Caldeweyher, J.-M. Mewes, S. Ehlert and S. Grimme, Phys. Chem. Chem. Phys.
     2020, 22, 8499-8512. DOI: 10.1039/D0CP00502A
   
   for sTDA-xTB:
   * S. Grimme and C. Bannwarth, J. Chem. Phys., 2016, 145, 054103.
     DOI: 10.1063/1.4959605
   
   in the mass-spec context:
   * V. Asgeirsson, C. Bauer and S. Grimme, Chem. Sci., 2017, 8, 4879.
     DOI: 10.1039/c7sc00601b
   * J. Koopman and S. Grimme, ACS Omega 2019, 4, 12, 15120-15133.
     DOI: 10.1021/acsomega.9b02011
   
   for metadynamics refer to:
   * S. Grimme, J. Chem. Theory Comput., 2019, 155, 2847-2862
     DOI: 10.1021/acs.jctc.9b00143
   
   for SPH calculations refer to:
   * S. Spicher and S. Grimme, J. Chem. Theory Comput., 2021, 17, 1701-1714
     DOI: 10.1021/acs.jctc.0c01306
   
   for ONIOM refer to:
   * C. Plett, A. Katbashev, S. Ehlert, S. Grimme, M. Bursch,
     Phys. Chem. Chem. Phys., 2023, 25, 17860-17868. DOI: 10.1039/D3CP02178E
   
   for DIPRO refer to:
   * J. Kohn, N. Gildemeister, S. Grimme, D. Fazzi, A. Hansen,
     J. Chem. Phys., 2023, just accepted.
   
   for PTB refer to:
   * S. Grimme, M. Mueller, A. Hansen, J. Chem. Phys., 2023, 158, 124111.
     DOI: 10.1063/5.0137838
   
   with help from (in alphabetical order)
   P. Atkinson, C. Bannwarth, F. Bohle, G. Brandenburg, E. Caldeweyher
   M. Checinski, S. Dohm, S. Ehlert, S. Ehrlich, I. Gerasimov, C. Hölzer
   A. Katbashev, J. Kohn, J. Koopman, C. Lavigne, S. Lehtola, F. März, M. Müller,
   F. Musil, H. Neugebauer, J. Pisarek, C. Plett, P. Pracht, F. Pultar,
   J. Seibert, P. Shushkov, S. Spicher, M. Stahn, M. Steiner, T. Strunk,
   J. Stückrath, T. Rose, and J. Unsleber
   
 * started run on 2025/04/09 at 05:20:50.435     
   ID    Z sym.   atoms
    1    6 C      1, 2, 7, 8, 10, 15, 16, 18, 19
    2    8 O      3, 6, 14, 17
    3   15 P      4, 12
    4   16 S      5, 9, 11, 13
    5    1 H      20-41

           -------------------------------------------------
          |                Calculation Setup                |
           -------------------------------------------------

          program call               : /srv/scratch/z5358697/.xtb/bin/xtb gas.coord --gfn2 --sp --chrg 0 --norestart --parallel 1
          hostname                   : k163
          coordinate file            : gas.coord
          omp threads                :                     1


           -------------------------------------------------
          |                 G F N 2 - x T B                 |
           -------------------------------------------------

        Reference                      10.1021/acs.jctc.8b01176
      * Hamiltonian:
        H0-scaling (s, p, d)           1.850000    2.230000    2.230000
        zeta-weighting                 0.500000
      * Dispersion:
        s8                             2.700000
        a1                             0.520000
        a2                             5.000000
        s9                             5.000000
      * Repulsion:
        kExp                           1.500000    1.000000
        rExp                           1.000000
      * Coulomb:
        alpha                          2.000000
        third order                    shell-resolved
        anisotropic                    true
        a3                             3.000000
        a5                             4.000000
        cn-shift                       1.200000
        cn-exp                         4.000000
        max-rad                        5.000000


          ...................................................
          :                      SETUP                      :
          :.................................................:
          :  # basis functions                 134          :
          :  # atomic orbitals                 128          :
          :  # shells                           66          :
          :  # electrons                       116          :
          :  max. iterations                   250          :
          :  Hamiltonian                  GFN2-xTB          :
          :  restarted?                      false          :
          :  GBSA solvation                  false          :
          :  PC potential                    false          :
          :  electronic temp.          300.0000000     K    :
          :  accuracy                    1.0000000          :
          :  -> integral cutoff          0.2500000E+02      :
          :  -> integral neglect         0.1000000E-07      :
          :  -> SCF convergence          0.1000000E-05 Eh   :
          :  -> wf. convergence          0.1000000E-03 e    :
          :  Broyden damping             0.4000000          :
          :  net charge                          0          :
          :  unpaired electrons                  0          :
          ...................................................

 iter      E             dE          RMSdq      gap      omega  full diag
   1    -65.3829178 -0.653829E+02  0.648E+00    4.18       0.0  T
   2    -65.5524503 -0.169532E+00  0.423E+00    3.16       1.0  T
   3    -65.5715819 -0.191316E-01  0.139E+00    2.94       1.0  T
   4    -65.5739452 -0.236338E-02  0.557E-01    2.71       1.0  T
   5    -65.5746303 -0.685039E-03  0.244E-01    2.82       1.0  T
   6    -65.5747912 -0.160866E-03  0.126E-01    2.79       1.0  T
   7    -65.5748396 -0.484566E-04  0.480E-02    2.81       1.0  T
   8    -65.5748490 -0.934801E-05  0.229E-02    2.81       1.0  T
   9    -65.5748508 -0.179910E-05  0.567E-03    2.81       2.8  T
  10    -65.5748509 -0.115118E-06  0.267E-03    2.81       5.8  T
  11    -65.5748509 -0.543623E-08  0.547E-04    2.81      28.6  T
  12    -65.5748509 -0.652889E-09  0.254E-04    2.81      61.5  T

   *** convergence criteria satisfied after 12 iterations ***

         #    Occupation            Energy/Eh            Energy/eV
      -------------------------------------------------------------
         1        2.0000           -0.7609628             -20.7069
       ...           ...                  ...                  ...
        52        2.0000           -0.4375330             -11.9059
        53        2.0000           -0.4115085             -11.1977
        54        2.0000           -0.4023882             -10.9495
        55        2.0000           -0.3784178             -10.2973
        56        2.0000           -0.3751060             -10.2072
        57        2.0000           -0.3713802             -10.1058
        58        2.0000           -0.3687939             -10.0354 (HOMO)
        59                         -0.2653896              -7.2216 (LUMO)
        60                         -0.2417135              -6.5774
        61                         -0.2046278              -5.5682
        62                         -0.1756736              -4.7803
        63                         -0.1690289              -4.5995
       ...                                ...                  ...
       128                          1.2875191              35.0352
      -------------------------------------------------------------
                  HL-Gap            0.1034043 Eh            2.8138 eV
             Fermi-level           -0.3170918 Eh           -8.6285 eV

 SCC (total)                   0 d,  0 h,  0 min,  0.062 sec
 SCC setup                      ...        0 min,  0.000 sec (  0.437%)
 Dispersion                     ...        0 min,  0.000 sec (  0.508%)
 classical contributions        ...        0 min,  0.000 sec (  0.098%)
 integral evaluation            ...        0 min,  0.014 sec ( 23.092%)
 iterations                     ...        0 min,  0.025 sec ( 41.233%)
 molecular gradient             ...        0 min,  0.021 sec ( 34.304%)
 printout                       ...        0 min,  0.000 sec (  0.304%)

         :::::::::::::::::::::::::::::::::::::::::::::::::::::
         ::                     SUMMARY                     ::
         :::::::::::::::::::::::::::::::::::::::::::::::::::::
         :: total energy             -65.012812383797 Eh    ::
         :: gradient norm              0.032630308711 Eh/a0 ::
         :: HOMO-LUMO gap              2.813775184488 eV    ::
         ::.................................................::
         :: SCC energy               -65.573849516232 Eh    ::
         :: -> isotropic ES            0.104492067914 Eh    ::
         :: -> anisotropic ES         -0.008686318899 Eh    ::
         :: -> anisotropic XC          0.031243204064 Eh    ::
         :: -> dispersion             -0.053454473806 Eh    ::
         :: repulsion energy           0.561037132435 Eh    ::
         :: add. restraining           0.000000000000 Eh    ::
         :: total charge              -0.000000000000 e     ::
         :::::::::::::::::::::::::::::::::::::::::::::::::::::

           -------------------------------------------------
          |                Property Printout                |
           -------------------------------------------------

    * Orbital Energies and Occupations

         #    Occupation            Energy/Eh            Energy/eV
      -------------------------------------------------------------
         1        2.0000           -0.7609628             -20.7069
       ...           ...                  ...                  ...
        46        2.0000           -0.4747940             -12.9198
        47        2.0000           -0.4664783             -12.6935
        48        2.0000           -0.4635877             -12.6149
        49        2.0000           -0.4605608             -12.5325
        50        2.0000           -0.4571402             -12.4394
        51        2.0000           -0.4457286             -12.1289
        52        2.0000           -0.4375330             -11.9059
        53        2.0000           -0.4115085             -11.1977
        54        2.0000           -0.4023882             -10.9495
        55        2.0000           -0.3784178             -10.2973
        56        2.0000           -0.3751060             -10.2072
        57        2.0000           -0.3713802             -10.1058
        58        2.0000           -0.3687939             -10.0354 (HOMO)
        59                         -0.2653896              -7.2216 (LUMO)
        60                         -0.2417135              -6.5774
        61                         -0.2046278              -5.5682
        62                         -0.1756736              -4.7803
        63                         -0.1690289              -4.5995
        64                         -0.1619475              -4.4068
        65                         -0.1568513              -4.2681
        66                         -0.1440543              -3.9199
        67                         -0.1280849              -3.4854
        68                         -0.1124925              -3.0611
        69                         -0.0455559              -1.2396
       ...                                ...                  ...
       128                          1.2875191              35.0352
      -------------------------------------------------------------
                  HL-Gap            0.1034043 Eh            2.8138 eV
             Fermi-level           -0.3170918 Eh           -8.6285 eV

     #   Z          covCN         q      C6AA      α(0)
     1   6 C        3.751    -0.115    22.760     6.804
     2   6 C        3.878     0.085    19.128     6.218
     3   8 O        1.655    -0.244    18.065     5.738
     4  15 P        3.882     0.378   144.543    21.597
     5  16 S        0.926    -0.417   157.438    21.223
     6   8 O        1.655    -0.247    18.113     5.745
     7   6 C        3.857     0.085    19.137     6.221
     8   6 C        3.751    -0.119    22.835     6.815
     9  16 S        2.024    -0.134   146.704    20.386
    10   6 C        3.831     0.045    19.802     6.332
    11  16 S        2.023    -0.176   148.523    20.512
    12  15 P        3.820     0.368   144.926    21.625
    13  16 S        0.926    -0.373   155.340    21.081
    14   8 O        1.654    -0.229    17.814     5.698
    15   6 C        3.853     0.088    19.088     6.214
    16   6 C        3.751    -0.113    22.729     6.799
    17   8 O        1.655    -0.252    18.185     5.757
    18   6 C        3.822     0.082    19.211     6.237
    19   6 C        3.751    -0.118    22.814     6.812
    20   1 H        0.925     0.060     2.200     2.320
    21   1 H        0.925     0.065     2.142     2.289
    22   1 H        0.925     0.060     2.196     2.317
    23   1 H        0.924     0.060     2.199     2.319
    24   1 H        0.924     0.065     2.139     2.287
    25   1 H        0.924     0.050     2.315     2.379
    26   1 H        0.924     0.064     2.152     2.294
    27   1 H        0.925     0.059     2.216     2.328
    28   1 H        0.925     0.073     2.053     2.241
    29   1 H        0.925     0.059     2.215     2.327
    30   1 H        0.925     0.088     1.894     2.152
    31   1 H        0.925     0.089     1.884     2.146
    32   1 H        0.924     0.055     2.253     2.347
    33   1 H        0.924     0.050     2.318     2.381
    34   1 H        0.925     0.055     2.258     2.350
    35   1 H        0.925     0.070     2.083     2.257
    36   1 H        0.925     0.066     2.131     2.283
    37   1 H        0.924     0.056     2.251     2.346
    38   1 H        0.924     0.068     2.113     2.273
    39   1 H        0.925     0.065     2.140     2.288
    40   1 H        0.925     0.060     2.204     2.322
    41   1 H        0.925     0.070     2.085     2.258

 Mol. C6AA /au·bohr⁶  :      26547.479011
 Mol. C8AA /au·bohr⁸  :     863394.368002
 Mol. α(0) /au        :        258.316077


Wiberg/Mayer (AO) data.
largest (>0.10) Wiberg bond orders for each atom

 ---------------------------------------------------------------------------
     #   Z sym  total        # sym  WBO       # sym  WBO       # sym  WBO
 ---------------------------------------------------------------------------
     1   6 C    3.991 --     2 C    1.023    22 H    0.984    20 H    0.980
                            21 H    0.974
     2   6 C    3.909 --     1 C    1.023    23 H    0.970    24 H    0.967
                             3 O    0.895
     3   8 O    2.403 --     4 P    1.310     2 C    0.895
     4  15 P    5.273 --     5 S    1.532     3 O    1.310     6 O    1.305
                             9 S    0.991
     5  16 S    1.873 --     4 P    1.532     9 S    0.140
     6   8 O    2.410 --     4 P    1.305     7 C    0.904
     7   6 C    3.911 --     8 C    1.020    26 H    0.970    25 H    0.970
                             6 O    0.904
     8   6 C    3.988 --     7 C    1.020    27 H    0.985    29 H    0.980
                            28 H    0.978
     9  16 S    2.301 --     4 P    0.991    10 C    0.988     5 S    0.140
    10   6 C    3.956 --    11 S    0.990     9 S    0.988    30 H    0.954
                            31 H    0.953
    11  16 S    2.275 --    10 C    0.990    12 P    0.940    13 S    0.145
    12  15 P    5.293 --    13 S    1.574    14 O    1.344    17 O    1.309
                            11 S    0.940
    13  16 S    1.910 --    12 P    1.574    11 S    0.145
    14   8 O    2.424 --    12 P    1.344    15 C    0.889
    15   6 C    3.914 --    16 C    1.021    32 H    0.973    33 H    0.966
                            14 O    0.889
    16   6 C    3.988 --    15 C    1.021    36 H    0.983    35 H    0.980
                            34 H    0.980
    17   8 O    2.408 --    12 P    1.309    18 C    0.903
    18   6 C    3.910 --    19 C    1.022    37 H    0.970    38 H    0.969
                            17 O    0.903
    19   6 C    3.989 --    18 C    1.022    41 H    0.982    40 H    0.980
                            39 H    0.974
    20   1 H    0.995 --     1 C    0.980
    21   1 H    0.996 --     1 C    0.974
    22   1 H    0.996 --     1 C    0.984
    23   1 H    0.996 --     2 C    0.970
    24   1 H    0.996 --     2 C    0.967
    25   1 H    0.997 --     7 C    0.970
    26   1 H    0.996 --     7 C    0.970
    27   1 H    0.996 --     8 C    0.985
    28   1 H    0.995 --     8 C    0.978
    29   1 H    0.996 --     8 C    0.980
    30   1 H    0.992 --    10 C    0.954
    31   1 H    0.992 --    10 C    0.953
    32   1 H    0.997 --    15 C    0.973
    33   1 H    0.997 --    15 C    0.966
    34   1 H    0.995 --    16 C    0.980
    35   1 H    0.995 --    16 C    0.980
    36   1 H    0.996 --    16 C    0.983
    37   1 H    0.997 --    18 C    0.970
    38   1 H    0.995 --    18 C    0.969
    39   1 H    0.996 --    19 C    0.974
    40   1 H    0.996 --    19 C    0.980
    41   1 H    0.995 --    19 C    0.982
 ---------------------------------------------------------------------------

Topologies differ in total number of bonds
Writing topology from bond orders to xtbtopo.mol

molecular dipole:
                 x           y           z       tot (Debye)
 q only:        0.589       0.551       2.048
   full:        0.451       1.004       2.409       6.732
molecular quadrupole (traceless):
                xx          xy          yy          xz          yz          zz
 q only:       12.120      20.575      -8.974     -15.938       7.461      -3.146
  q+dip:       12.803      19.370      -7.281     -20.104       9.242      -5.521
   full:       13.359      20.408      -8.755     -20.192       8.472      -4.604


           -------------------------------------------------
          | TOTAL ENERGY              -65.012812383797 Eh   |
          | GRADIENT NORM               0.032630308711 Eh/α |
          | HOMO-LUMO GAP               2.813775184488 eV   |
           -------------------------------------------------

------------------------------------------------------------------------
 * finished run on 2025/04/09 at 05:20:50.541     
------------------------------------------------------------------------
 total:
 * wall-time:     0 d,  0 h,  0 min,  0.105 sec
 *  cpu-time:     0 d,  0 h,  0 min,  0.068 sec
 * ratio c/w:     0.647 speedup
 SCF:
 * wall-time:     0 d,  0 h,  0 min,  0.062 sec
 *  cpu-time:     0 d,  0 h,  0 min,  0.056 sec
 * ratio c/w:     0.901 speedup

