      -----------------------------------------------------------      
     |                   =====================                   |     
     |                           x T B                           |     
     |                   =====================                   |     
     |                         S. Grimme                         |     
     |          Mulliken Center for Theoretical Chemistry        |     
     |                    University of Bonn                     |     
      -----------------------------------------------------------      

   * xtb version 6.7.1 (edcfbbe) compiled by 'albert@albert-system' on 2024-07-22

   xtb is free software: you can redistribute it and/or modify it under
   the terms of the GNU Lesser General Public License as published by
   the Free Software Foundation, either version 3 of the License, or
   (at your option) any later version.
   
   xtb is distributed in the hope that it will be useful,
   but WITHOUT ANY WARRANTY; without even the implied warranty of
   MERCHANTABILITY or FITNESS FOR A PARTICULAR PURPOSE.  See the
   GNU Lesser General Public License for more details.
   
   Cite this work as:
   * C. Bannwarth, E. Caldeweyher, S. Ehlert, A. Hansen, P. Pracht,
     J. Seibert, S. Spicher, S. Grimme, WIREs Comput. Mol. Sci., 2020, 11,
     e01493. DOI: 10.1002/wcms.1493
   
   for GFN2-xTB:
   * C. Bannwarth, S. Ehlert and S. Grimme., J. Chem. Theory Comput., 2019,
     15, 1652-1671. DOI: 10.1021/acs.jctc.8b01176
   for GFN1-xTB:
   * S. Grimme, C. Bannwarth, P. Shushkov, J. Chem. Theory Comput., 2017,
     13, 1989-2009. DOI: 10.1021/acs.jctc.7b00118
   for GFN0-xTB:
   * P. Pracht, E. Caldeweyher, S. Ehlert, S. Grimme, ChemRxiv, 2019, preprint.
     DOI: 10.26434/chemrxiv.8326202.v1
   for GFN-FF:
   * S. Spicher and S. Grimme, Angew. Chem. Int. Ed., 2020, 59, 15665-15673.
     DOI: 10.1002/anie.202004239
   
   for ALPB and GBSA implicit solvation:
   * S. Ehlert, M. Stahn, S. Spicher, S. Grimme, J. Chem. Theory Comput.,
     2021, 17, 4250-4261. DOI: 10.1021/acs.jctc.1c00471
   
   for ddCOSMO and CPCM-X implicit solvation:
   * M. Stahn, S. Ehlert, S. Grimme, J. Phys. Chem. A,
     2023, XX, XXXX-XXXX. DOI: 10.1021/acs.jpca.3c04382
   
   for DFT-D4:
   * E. Caldeweyher, C. Bannwarth and S. Grimme, J. Chem. Phys., 2017,
     147, 034112. DOI: 10.1063/1.4993215
   * E. Caldeweyher, S. Ehlert, A. Hansen, H. Neugebauer, S. Spicher,
     C. Bannwarth and S. Grimme, J. Chem. Phys., 2019, 150, 154122.
     DOI: 10.1063/1.5090222
   * E. Caldeweyher, J.-M. Mewes, S. Ehlert and S. Grimme, Phys. Chem. Chem. Phys.
     2020, 22, 8499-8512. DOI: 10.1039/D0CP00502A
   
   for sTDA-xTB:
   * S. Grimme and C. Bannwarth, J. Chem. Phys., 2016, 145, 054103.
     DOI: 10.1063/1.4959605
   
   in the mass-spec context:
   * V. Asgeirsson, C. Bauer and S. Grimme, Chem. Sci., 2017, 8, 4879.
     DOI: 10.1039/c7sc00601b
   * J. Koopman and S. Grimme, ACS Omega 2019, 4, 12, 15120-15133.
     DOI: 10.1021/acsomega.9b02011
   
   for metadynamics refer to:
   * S. Grimme, J. Chem. Theory Comput., 2019, 155, 2847-2862
     DOI: 10.1021/acs.jctc.9b00143
   
   for SPH calculations refer to:
   * S. Spicher and S. Grimme, J. Chem. Theory Comput., 2021, 17, 1701-1714
     DOI: 10.1021/acs.jctc.0c01306
   
   for ONIOM refer to:
   * C. Plett, A. Katbashev, S. Ehlert, S. Grimme, M. Bursch,
     Phys. Chem. Chem. Phys., 2023, 25, 17860-17868. DOI: 10.1039/D3CP02178E
   
   for DIPRO refer to:
   * J. Kohn, N. Gildemeister, S. Grimme, D. Fazzi, A. Hansen,
     J. Chem. Phys., 2023, just accepted.
   
   for PTB refer to:
   * S. Grimme, M. Mueller, A. Hansen, J. Chem. Phys., 2023, 158, 124111.
     DOI: 10.1063/5.0137838
   
   with help from (in alphabetical order)
   P. Atkinson, C. Bannwarth, F. Bohle, G. Brandenburg, E. Caldeweyher
   M. Checinski, S. Dohm, S. Ehlert, S. Ehrlich, I. Gerasimov, C. Hölzer
   A. Katbashev, J. Kohn, J. Koopman, C. Lavigne, S. Lehtola, F. März, M. Müller,
   F. Musil, H. Neugebauer, J. Pisarek, C. Plett, P. Pracht, F. Pultar,
   J. Seibert, P. Shushkov, S. Spicher, M. Stahn, M. Steiner, T. Strunk,
   J. Stückrath, T. Rose, and J. Unsleber
   
 * started run on 2025/04/09 at 05:20:49.936     
   ID    Z sym.   atoms
    1    6 C      1, 2, 7, 8, 10, 15, 16, 18, 19
    2    8 O      3, 6, 14, 17
    3   15 P      4, 12
    4   16 S      5, 9, 11, 13
    5    1 H      20-41

           -------------------------------------------------
          |                Calculation Setup                |
           -------------------------------------------------

          program call               : /srv/scratch/z5358697/.xtb/bin/xtb gas.coord --gfn2 --sp --chrg 0 --norestart --parallel 1
          hostname                   : k163
          coordinate file            : gas.coord
          omp threads                :                     1


           -------------------------------------------------
          |                 G F N 2 - x T B                 |
           -------------------------------------------------

        Reference                      10.1021/acs.jctc.8b01176
      * Hamiltonian:
        H0-scaling (s, p, d)           1.850000    2.230000    2.230000
        zeta-weighting                 0.500000
      * Dispersion:
        s8                             2.700000
        a1                             0.520000
        a2                             5.000000
        s9                             5.000000
      * Repulsion:
        kExp                           1.500000    1.000000
        rExp                           1.000000
      * Coulomb:
        alpha                          2.000000
        third order                    shell-resolved
        anisotropic                    true
        a3                             3.000000
        a5                             4.000000
        cn-shift                       1.200000
        cn-exp                         4.000000
        max-rad                        5.000000


          ...................................................
          :                      SETUP                      :
          :.................................................:
          :  # basis functions                 134          :
          :  # atomic orbitals                 128          :
          :  # shells                           66          :
          :  # electrons                       116          :
          :  max. iterations                   250          :
          :  Hamiltonian                  GFN2-xTB          :
          :  restarted?                      false          :
          :  GBSA solvation                  false          :
          :  PC potential                    false          :
          :  electronic temp.          300.0000000     K    :
          :  accuracy                    1.0000000          :
          :  -> integral cutoff          0.2500000E+02      :
          :  -> integral neglect         0.1000000E-07      :
          :  -> SCF convergence          0.1000000E-05 Eh   :
          :  -> wf. convergence          0.1000000E-03 e    :
          :  Broyden damping             0.4000000          :
          :  net charge                          0          :
          :  unpaired electrons                  0          :
          ...................................................

 iter      E             dE          RMSdq      gap      omega  full diag
   1    -65.3800986 -0.653801E+02  0.644E+00    4.12       0.0  T
   2    -65.5499011 -0.169803E+00  0.422E+00    3.08       1.0  T
   3    -65.5684311 -0.185300E-01  0.140E+00    2.95       1.0  T
   4    -65.5715641 -0.313304E-02  0.564E-01    2.64       1.0  T
   5    -65.5726872 -0.112304E-02  0.284E-01    2.77       1.0  T
   6    -65.5730383 -0.351093E-03  0.126E-01    2.76       1.0  T
   7    -65.5730843 -0.460000E-04  0.480E-02    2.76       1.0  T
   8    -65.5730924 -0.809929E-05  0.211E-02    2.77       1.0  T
   9    -65.5730933 -0.960842E-06  0.556E-03    2.77       2.8  T
  10    -65.5730934 -0.882718E-07  0.266E-03    2.77       5.9  T
  11    -65.5730934 -0.815969E-08  0.530E-04    2.77      29.4  T
  12    -65.5730934 -0.765027E-09  0.237E-04    2.77      66.0  T

   *** convergence criteria satisfied after 12 iterations ***

         #    Occupation            Energy/Eh            Energy/eV
      -------------------------------------------------------------
         1        2.0000           -0.7602070             -20.6863
       ...           ...                  ...                  ...
        52        2.0000           -0.4412765             -12.0077
        53        2.0000           -0.4087409             -11.1224
        54        2.0000           -0.4001625             -10.8890
        55        2.0000           -0.3746325             -10.1943
        56        2.0000           -0.3716141             -10.1121
        57        2.0000           -0.3695615             -10.0563
        58        2.0000           -0.3667992              -9.9811 (HOMO)
        59                         -0.2650413              -7.2121 (LUMO)
        60                         -0.2345644              -6.3828
        61                         -0.2166139              -5.8944
        62                         -0.1921511              -5.2287
        63                         -0.1580251              -4.3001
       ...                                ...                  ...
       128                          1.3146583              35.7737
      -------------------------------------------------------------
                  HL-Gap            0.1017579 Eh            2.7690 eV
             Fermi-level           -0.3159202 Eh           -8.5966 eV

 SCC (total)                   0 d,  0 h,  0 min,  0.068 sec
 SCC setup                      ...        0 min,  0.000 sec (  0.411%)
 Dispersion                     ...        0 min,  0.000 sec (  0.463%)
 classical contributions        ...        0 min,  0.000 sec (  0.095%)
 integral evaluation            ...        0 min,  0.019 sec ( 28.324%)
 iterations                     ...        0 min,  0.025 sec ( 37.317%)
 molecular gradient             ...        0 min,  0.022 sec ( 32.985%)
 printout                       ...        0 min,  0.000 sec (  0.383%)

         :::::::::::::::::::::::::::::::::::::::::::::::::::::
         ::                     SUMMARY                     ::
         :::::::::::::::::::::::::::::::::::::::::::::::::::::
         :: total energy             -65.012599101406 Eh    ::
         :: gradient norm              0.028789465293 Eh/a0 ::
         :: HOMO-LUMO gap              2.768973303479 eV    ::
         ::.................................................::
         :: SCC energy               -65.571913752117 Eh    ::
         :: -> isotropic ES            0.108706946409 Eh    ::
         :: -> anisotropic ES         -0.009969074305 Eh    ::
         :: -> anisotropic XC          0.031205114239 Eh    ::
         :: -> dispersion             -0.055764183585 Eh    ::
         :: repulsion energy           0.559314650711 Eh    ::
         :: add. restraining           0.000000000000 Eh    ::
         :: total charge              -0.000000000000 e     ::
         :::::::::::::::::::::::::::::::::::::::::::::::::::::

           -------------------------------------------------
          |                Property Printout                |
           -------------------------------------------------

    * Orbital Energies and Occupations

         #    Occupation            Energy/Eh            Energy/eV
      -------------------------------------------------------------
         1        2.0000           -0.7602070             -20.6863
       ...           ...                  ...                  ...
        46        2.0000           -0.4646257             -12.6431
        47        2.0000           -0.4631319             -12.6025
        48        2.0000           -0.4610364             -12.5454
        49        2.0000           -0.4562450             -12.4151
        50        2.0000           -0.4489765             -12.2173
        51        2.0000           -0.4452927             -12.1170
        52        2.0000           -0.4412765             -12.0077
        53        2.0000           -0.4087409             -11.1224
        54        2.0000           -0.4001625             -10.8890
        55        2.0000           -0.3746325             -10.1943
        56        2.0000           -0.3716141             -10.1121
        57        2.0000           -0.3695615             -10.0563
        58        2.0000           -0.3667992              -9.9811 (HOMO)
        59                         -0.2650413              -7.2121 (LUMO)
        60                         -0.2345644              -6.3828
        61                         -0.2166139              -5.8944
        62                         -0.1921511              -5.2287
        63                         -0.1580251              -4.3001
        64                         -0.1543929              -4.2012
        65                         -0.1480625              -4.0290
        66                         -0.1403261              -3.8185
        67                         -0.1211992              -3.2980
        68                         -0.1139131              -3.0997
        69                         -0.0328566              -0.8941
       ...                                ...                  ...
       128                          1.3146583              35.7737
      -------------------------------------------------------------
                  HL-Gap            0.1017579 Eh            2.7690 eV
             Fermi-level           -0.3159202 Eh           -8.5966 eV

     #   Z          covCN         q      C6AA      α(0)
     1   6 C        3.751    -0.112    22.705     6.795
     2   6 C        3.876     0.088    19.087     6.212
     3   8 O        1.655    -0.250    18.155     5.752
     4  15 P        3.934     0.378   144.511    21.594
     5  16 S        0.926    -0.416   157.394    21.220
     6   8 O        1.655    -0.250    18.165     5.753
     7   6 C        3.864     0.082    19.177     6.227
     8   6 C        3.751    -0.117    22.810     6.811
     9  16 S        1.977    -0.130   146.532    20.374
    10   6 C        3.801     0.036    19.968     6.362
    11  16 S        2.044    -0.117   145.949    20.333
    12  15 P        3.856     0.396   143.825    21.543
    13  16 S        0.926    -0.415   157.344    21.216
    14   8 O        1.655    -0.265    18.406     5.792
    15   6 C        3.864     0.083    19.167     6.226
    16   6 C        3.751    -0.116    22.788     6.808
    17   8 O        1.655    -0.247    18.111     5.745
    18   6 C        3.868     0.091    19.035     6.204
    19   6 C        3.751    -0.116    22.778     6.806
    20   1 H        0.925     0.058     2.227     2.334
    21   1 H        0.925     0.057     2.236     2.338
    22   1 H        0.925     0.059     2.206     2.322
    23   1 H        0.924     0.074     2.041     2.234
    24   1 H        0.924     0.061     2.184     2.311
    25   1 H        0.924     0.063     2.160     2.298
    26   1 H        0.924     0.062     2.175     2.306
    27   1 H        0.925     0.061     2.183     2.311
    28   1 H        0.925     0.061     2.190     2.314
    29   1 H        0.925     0.060     2.194     2.316
    30   1 H        0.925     0.089     1.884     2.147
    31   1 H        0.925     0.082     1.958     2.188
    32   1 H        0.924     0.062     2.175     2.306
    33   1 H        0.924     0.062     2.174     2.306
    34   1 H        0.925     0.058     2.227     2.334
    35   1 H        0.924     0.063     2.169     2.303
    36   1 H        0.925     0.061     2.185     2.311
    37   1 H        0.924     0.064     2.153     2.295
    38   1 H        0.924     0.048     2.341     2.393
    39   1 H        0.925     0.066     2.129     2.282
    40   1 H        0.925     0.056     2.244     2.343
    41   1 H        0.925     0.069     2.098     2.265

 Mol. C6AA /au·bohr⁶  :      26557.141272
 Mol. C8AA /au·bohr⁸  :     863159.684159
 Mol. α(0) /au        :        258.330930


Wiberg/Mayer (AO) data.
largest (>0.10) Wiberg bond orders for each atom

 ---------------------------------------------------------------------------
     #   Z sym  total        # sym  WBO       # sym  WBO       # sym  WBO
 ---------------------------------------------------------------------------
     1   6 C    3.992 --     2 C    1.023    21 H    0.984    22 H    0.980
                            20 H    0.976
     2   6 C    3.905 --     1 C    1.023    24 H    0.966    23 H    0.965
                             3 O    0.894
     3   8 O    2.400 --     4 P    1.297     2 C    0.894
     4  15 P    5.283 --     5 S    1.537     6 O    1.306     3 O    1.297
                             9 S    0.995
     5  16 S    1.868 --     4 P    1.537     9 S    0.140
     6   8 O    2.407 --     4 P    1.306     7 C    0.908
     7   6 C    3.911 --     8 C    1.022    25 H    0.970    26 H    0.968
                             6 O    0.908
     8   6 C    3.991 --     7 C    1.022    28 H    0.983    29 H    0.981
                            27 H    0.976
     9  16 S    2.285 --     4 P    0.995    10 C    0.975     5 S    0.140
    10   6 C    3.963 --    11 S    0.989     9 S    0.975    31 H    0.966
                            30 H    0.965
    11  16 S    2.283 --    10 C    0.989    12 P    0.978    13 S    0.106
    12  15 P    5.257 --    13 S    1.559    17 O    1.304    14 O    1.274
                            11 S    0.978
    13  16 S    1.862 --    12 P    1.559    11 S    0.106
    14   8 O    2.392 --    12 P    1.274    15 C    0.911
    15   6 C    3.912 --    16 C    1.021    33 H    0.969    32 H    0.967
                            14 O    0.911
    16   6 C    3.991 --    15 C    1.021    34 H    0.984    36 H    0.981
                            35 H    0.975
    17   8 O    2.396 --    12 P    1.304    18 C    0.890
    18   6 C    3.909 --    19 C    1.021    38 H    0.971    37 H    0.970
                            17 O    0.890
    19   6 C    3.988 --    18 C    1.021    39 H    0.983    40 H    0.980
                            41 H    0.979
    20   1 H    0.996 --     1 C    0.976
    21   1 H    0.997 --     1 C    0.984
    22   1 H    0.995 --     1 C    0.980
    23   1 H    0.994 --     2 C    0.965
    24   1 H    0.996 --     2 C    0.966
    25   1 H    0.996 --     7 C    0.970
    26   1 H    0.996 --     7 C    0.968
    27   1 H    0.996 --     8 C    0.976
    28   1 H    0.996 --     8 C    0.983
    29   1 H    0.996 --     8 C    0.981
    30   1 H    0.989 --    10 C    0.965
    31   1 H    0.993 --    10 C    0.966
    32   1 H    0.996 --    15 C    0.967
    33   1 H    0.996 --    15 C    0.969
    34   1 H    0.997 --    16 C    0.984
    35   1 H    0.996 --    16 C    0.975
    36   1 H    0.996 --    16 C    0.981
    37   1 H    0.996 --    18 C    0.970
    38   1 H    0.998 --    18 C    0.971
    39   1 H    0.996 --    19 C    0.983
    40   1 H    0.996 --    19 C    0.980
    41   1 H    0.995 --    19 C    0.979
 ---------------------------------------------------------------------------

Topologies differ in total number of bonds
Writing topology from bond orders to xtbtopo.mol

molecular dipole:
                 x           y           z       tot (Debye)
 q only:       -0.725      -1.322       0.772
   full:       -1.085      -1.678       0.915       5.587
molecular quadrupole (traceless):
                xx          xy          yy          xz          yz          zz
 q only:        5.618     -16.575       0.583      -8.032       4.249      -6.202
  q+dip:        9.319     -16.699      -0.487     -12.816       7.368      -8.832
   full:        9.449     -17.628      -0.268     -12.599       6.726      -9.181


           -------------------------------------------------
          | TOTAL ENERGY              -65.012599101406 Eh   |
          | GRADIENT NORM               0.028789465293 Eh/α |
          | HOMO-LUMO GAP               2.768973303479 eV   |
           -------------------------------------------------

------------------------------------------------------------------------
 * finished run on 2025/04/09 at 05:20:50.063     
------------------------------------------------------------------------
 total:
 * wall-time:     0 d,  0 h,  0 min,  0.126 sec
 *  cpu-time:     0 d,  0 h,  0 min,  0.070 sec
 * ratio c/w:     0.557 speedup
 SCF:
 * wall-time:     0 d,  0 h,  0 min,  0.068 sec
 *  cpu-time:     0 d,  0 h,  0 min,  0.057 sec
 * ratio c/w:     0.837 speedup

