      -----------------------------------------------------------      
     |                   =====================                   |     
     |                           x T B                           |     
     |                   =====================                   |     
     |                         S. Grimme                         |     
     |          Mulliken Center for Theoretical Chemistry        |     
     |                    University of Bonn                     |     
      -----------------------------------------------------------      

   * xtb version 6.7.1 (edcfbbe) compiled by 'albert@albert-system' on 2024-07-22

   xtb is free software: you can redistribute it and/or modify it under
   the terms of the GNU Lesser General Public License as published by
   the Free Software Foundation, either version 3 of the License, or
   (at your option) any later version.
   
   xtb is distributed in the hope that it will be useful,
   but WITHOUT ANY WARRANTY; without even the implied warranty of
   MERCHANTABILITY or FITNESS FOR A PARTICULAR PURPOSE.  See the
   GNU Lesser General Public License for more details.
   
   Cite this work as:
   * C. Bannwarth, E. Caldeweyher, S. Ehlert, A. Hansen, P. Pracht,
     J. Seibert, S. Spicher, S. Grimme, WIREs Comput. Mol. Sci., 2020, 11,
     e01493. DOI: 10.1002/wcms.1493
   
   for GFN2-xTB:
   * C. Bannwarth, S. Ehlert and S. Grimme., J. Chem. Theory Comput., 2019,
     15, 1652-1671. DOI: 10.1021/acs.jctc.8b01176
   for GFN1-xTB:
   * S. Grimme, C. Bannwarth, P. Shushkov, J. Chem. Theory Comput., 2017,
     13, 1989-2009. DOI: 10.1021/acs.jctc.7b00118
   for GFN0-xTB:
   * P. Pracht, E. Caldeweyher, S. Ehlert, S. Grimme, ChemRxiv, 2019, preprint.
     DOI: 10.26434/chemrxiv.8326202.v1
   for GFN-FF:
   * S. Spicher and S. Grimme, Angew. Chem. Int. Ed., 2020, 59, 15665-15673.
     DOI: 10.1002/anie.202004239
   
   for ALPB and GBSA implicit solvation:
   * S. Ehlert, M. Stahn, S. Spicher, S. Grimme, J. Chem. Theory Comput.,
     2021, 17, 4250-4261. DOI: 10.1021/acs.jctc.1c00471
   
   for ddCOSMO and CPCM-X implicit solvation:
   * M. Stahn, S. Ehlert, S. Grimme, J. Phys. Chem. A,
     2023, XX, XXXX-XXXX. DOI: 10.1021/acs.jpca.3c04382
   
   for DFT-D4:
   * E. Caldeweyher, C. Bannwarth and S. Grimme, J. Chem. Phys., 2017,
     147, 034112. DOI: 10.1063/1.4993215
   * E. Caldeweyher, S. Ehlert, A. Hansen, H. Neugebauer, S. Spicher,
     C. Bannwarth and S. Grimme, J. Chem. Phys., 2019, 150, 154122.
     DOI: 10.1063/1.5090222
   * E. Caldeweyher, J.-M. Mewes, S. Ehlert and S. Grimme, Phys. Chem. Chem. Phys.
     2020, 22, 8499-8512. DOI: 10.1039/D0CP00502A
   
   for sTDA-xTB:
   * S. Grimme and C. Bannwarth, J. Chem. Phys., 2016, 145, 054103.
     DOI: 10.1063/1.4959605
   
   in the mass-spec context:
   * V. Asgeirsson, C. Bauer and S. Grimme, Chem. Sci., 2017, 8, 4879.
     DOI: 10.1039/c7sc00601b
   * J. Koopman and S. Grimme, ACS Omega 2019, 4, 12, 15120-15133.
     DOI: 10.1021/acsomega.9b02011
   
   for metadynamics refer to:
   * S. Grimme, J. Chem. Theory Comput., 2019, 155, 2847-2862
     DOI: 10.1021/acs.jctc.9b00143
   
   for SPH calculations refer to:
   * S. Spicher and S. Grimme, J. Chem. Theory Comput., 2021, 17, 1701-1714
     DOI: 10.1021/acs.jctc.0c01306
   
   for ONIOM refer to:
   * C. Plett, A. Katbashev, S. Ehlert, S. Grimme, M. Bursch,
     Phys. Chem. Chem. Phys., 2023, 25, 17860-17868. DOI: 10.1039/D3CP02178E
   
   for DIPRO refer to:
   * J. Kohn, N. Gildemeister, S. Grimme, D. Fazzi, A. Hansen,
     J. Chem. Phys., 2023, just accepted.
   
   for PTB refer to:
   * S. Grimme, M. Mueller, A. Hansen, J. Chem. Phys., 2023, 158, 124111.
     DOI: 10.1063/5.0137838
   
   with help from (in alphabetical order)
   P. Atkinson, C. Bannwarth, F. Bohle, G. Brandenburg, E. Caldeweyher
   M. Checinski, S. Dohm, S. Ehlert, S. Ehrlich, I. Gerasimov, C. Hölzer
   A. Katbashev, J. Kohn, J. Koopman, C. Lavigne, S. Lehtola, F. März, M. Müller,
   F. Musil, H. Neugebauer, J. Pisarek, C. Plett, P. Pracht, F. Pultar,
   J. Seibert, P. Shushkov, S. Spicher, M. Stahn, M. Steiner, T. Strunk,
   J. Stückrath, T. Rose, and J. Unsleber
   
 * started run on 2025/04/09 at 05:21:00.190     
   ID    Z sym.   atoms
    1    6 C      1, 2, 7, 8, 10, 15, 16, 18, 19
    2    8 O      3, 6, 14, 17
    3   15 P      4, 12
    4   16 S      5, 9, 11, 13
    5    1 H      20-41

           -------------------------------------------------
          |                Calculation Setup                |
           -------------------------------------------------

          program call               : /srv/scratch/z5358697/.xtb/bin/xtb gas.coord --gfn2 --sp --chrg 0 --norestart --parallel 1
          hostname                   : k163
          coordinate file            : gas.coord
          omp threads                :                     1


           -------------------------------------------------
          |                 G F N 2 - x T B                 |
           -------------------------------------------------

        Reference                      10.1021/acs.jctc.8b01176
      * Hamiltonian:
        H0-scaling (s, p, d)           1.850000    2.230000    2.230000
        zeta-weighting                 0.500000
      * Dispersion:
        s8                             2.700000
        a1                             0.520000
        a2                             5.000000
        s9                             5.000000
      * Repulsion:
        kExp                           1.500000    1.000000
        rExp                           1.000000
      * Coulomb:
        alpha                          2.000000
        third order                    shell-resolved
        anisotropic                    true
        a3                             3.000000
        a5                             4.000000
        cn-shift                       1.200000
        cn-exp                         4.000000
        max-rad                        5.000000


          ...................................................
          :                      SETUP                      :
          :.................................................:
          :  # basis functions                 134          :
          :  # atomic orbitals                 128          :
          :  # shells                           66          :
          :  # electrons                       116          :
          :  max. iterations                   250          :
          :  Hamiltonian                  GFN2-xTB          :
          :  restarted?                      false          :
          :  GBSA solvation                  false          :
          :  PC potential                    false          :
          :  electronic temp.          300.0000000     K    :
          :  accuracy                    1.0000000          :
          :  -> integral cutoff          0.2500000E+02      :
          :  -> integral neglect         0.1000000E-07      :
          :  -> SCF convergence          0.1000000E-05 Eh   :
          :  -> wf. convergence          0.1000000E-03 e    :
          :  Broyden damping             0.4000000          :
          :  net charge                          0          :
          :  unpaired electrons                  0          :
          ...................................................

 iter      E             dE          RMSdq      gap      omega  full diag
   1    -65.3832679 -0.653833E+02  0.611E+00    4.11       0.0  T
   2    -65.5503283 -0.167060E+00  0.379E+00    3.12       1.0  T
   3    -65.5695480 -0.192197E-01  0.143E+00    2.89       1.0  T
   4    -65.5718084 -0.226037E-02  0.594E-01    2.66       1.0  T
   5    -65.5727330 -0.924575E-03  0.253E-01    2.77       1.0  T
   6    -65.5729409 -0.207900E-03  0.130E-01    2.75       1.0  T
   7    -65.5730092 -0.683008E-04  0.483E-02    2.76       1.0  T
   8    -65.5730184 -0.918470E-05  0.209E-02    2.77       1.0  T
   9    -65.5730195 -0.110012E-05  0.519E-03    2.76       3.0  T
  10    -65.5730195 -0.732010E-07  0.239E-03    2.76       6.5  T
  11    -65.5730195 -0.518753E-08  0.558E-04    2.76      28.0  T
  12    -65.5730195 -0.112699E-08  0.234E-04    2.76      66.6  T

   *** convergence criteria satisfied after 12 iterations ***

         #    Occupation            Energy/Eh            Energy/eV
      -------------------------------------------------------------
         1        2.0000           -0.7626390             -20.7525
       ...           ...                  ...                  ...
        52        2.0000           -0.4315246             -11.7424
        53        2.0000           -0.4075467             -11.0899
        54        2.0000           -0.3981504             -10.8342
        55        2.0000           -0.3735545             -10.1649
        56        2.0000           -0.3705354             -10.0828
        57        2.0000           -0.3666270              -9.9764
        58        2.0000           -0.3646888              -9.9237 (HOMO)
        59                         -0.2630933              -7.1591 (LUMO)
        60                         -0.2398387              -6.5263
        61                         -0.2043930              -5.5618
        62                         -0.1829061              -4.9771
        63                         -0.1681534              -4.5757
       ...                                ...                  ...
       128                          1.3013175              35.4107
      -------------------------------------------------------------
                  HL-Gap            0.1015955 Eh            2.7646 eV
             Fermi-level           -0.3138910 Eh           -8.5414 eV

 SCC (total)                   0 d,  0 h,  0 min,  0.067 sec
 SCC setup                      ...        0 min,  0.000 sec (  0.399%)
 Dispersion                     ...        0 min,  0.000 sec (  0.462%)
 classical contributions        ...        0 min,  0.000 sec (  0.096%)
 integral evaluation            ...        0 min,  0.018 sec ( 27.133%)
 iterations                     ...        0 min,  0.026 sec ( 38.323%)
 molecular gradient             ...        0 min,  0.022 sec ( 33.263%)
 printout                       ...        0 min,  0.000 sec (  0.300%)

         :::::::::::::::::::::::::::::::::::::::::::::::::::::
         ::                     SUMMARY                     ::
         :::::::::::::::::::::::::::::::::::::::::::::::::::::
         :: total energy             -65.010169447097 Eh    ::
         :: gradient norm              0.033071959480 Eh/a0 ::
         :: HOMO-LUMO gap              2.764554740607 eV    ::
         ::.................................................::
         :: SCC energy               -65.571904486011 Eh    ::
         :: -> isotropic ES            0.105398274592 Eh    ::
         :: -> anisotropic ES         -0.010104761819 Eh    ::
         :: -> anisotropic XC          0.031636310706 Eh    ::
         :: -> dispersion             -0.054287355375 Eh    ::
         :: repulsion energy           0.561735038915 Eh    ::
         :: add. restraining           0.000000000000 Eh    ::
         :: total charge               0.000000000000 e     ::
         :::::::::::::::::::::::::::::::::::::::::::::::::::::

           -------------------------------------------------
          |                Property Printout                |
           -------------------------------------------------

    * Orbital Energies and Occupations

         #    Occupation            Energy/Eh            Energy/eV
      -------------------------------------------------------------
         1        2.0000           -0.7626390             -20.7525
       ...           ...                  ...                  ...
        46        2.0000           -0.4702806             -12.7970
        47        2.0000           -0.4693605             -12.7719
        48        2.0000           -0.4622662             -12.5789
        49        2.0000           -0.4590187             -12.4905
        50        2.0000           -0.4473821             -12.1739
        51        2.0000           -0.4413202             -12.0089
        52        2.0000           -0.4315246             -11.7424
        53        2.0000           -0.4075467             -11.0899
        54        2.0000           -0.3981504             -10.8342
        55        2.0000           -0.3735545             -10.1649
        56        2.0000           -0.3705354             -10.0828
        57        2.0000           -0.3666270              -9.9764
        58        2.0000           -0.3646888              -9.9237 (HOMO)
        59                         -0.2630933              -7.1591 (LUMO)
        60                         -0.2398387              -6.5263
        61                         -0.2043930              -5.5618
        62                         -0.1829061              -4.9771
        63                         -0.1681534              -4.5757
        64                         -0.1556054              -4.2342
        65                         -0.1485406              -4.0420
        66                         -0.1423290              -3.8730
        67                         -0.1198714              -3.2619
        68                         -0.1069690              -2.9108
        69                         -0.0391327              -1.0649
       ...                                ...                  ...
       128                          1.3013175              35.4107
      -------------------------------------------------------------
                  HL-Gap            0.1015955 Eh            2.7646 eV
             Fermi-level           -0.3138910 Eh           -8.5414 eV

     #   Z          covCN         q      C6AA      α(0)
     1   6 C        3.751    -0.117    22.798     6.809
     2   6 C        3.821     0.082    19.205     6.236
     3   8 O        1.655    -0.250    18.164     5.753
     4  15 P        3.824     0.363   145.107    21.639
     5  16 S        0.927    -0.381   155.738    21.108
     6   8 O        1.654    -0.229    17.820     5.699
     7   6 C        3.850     0.083    19.174     6.228
     8   6 C        3.752    -0.113    22.714     6.797
     9  16 S        1.997    -0.165   148.045    20.479
    10   6 C        3.819     0.047    19.780     6.329
    11  16 S        2.012    -0.145   147.155    20.417
    12  15 P        3.824     0.384   144.279    21.577
    13  16 S        0.926    -0.393   156.287    21.145
    14   8 O        1.653    -0.249    18.137     5.749
    15   6 C        3.819     0.081    19.224     6.240
    16   6 C        3.751    -0.117    22.809     6.811
    17   8 O        1.655    -0.252    18.184     5.757
    18   6 C        3.873     0.082    19.171     6.226
    19   6 C        3.751    -0.119    22.839     6.816
    20   1 H        0.925     0.070     2.089     2.260
    21   1 H        0.925     0.058     2.224     2.332
    22   1 H        0.925     0.063     2.162     2.299
    23   1 H        0.924     0.067     2.120     2.277
    24   1 H        0.924     0.056     2.242     2.341
    25   1 H        0.924     0.069     2.093     2.262
    26   1 H        0.924     0.054     2.267     2.355
    27   1 H        0.925     0.062     2.180     2.309
    28   1 H        0.925     0.063     2.169     2.303
    29   1 H        0.925     0.061     2.187     2.313
    30   1 H        0.925     0.069     2.095     2.263
    31   1 H        0.925     0.085     1.926     2.170
    32   1 H        0.924     0.069     2.095     2.264
    33   1 H        0.924     0.061     2.187     2.313
    34   1 H        0.925     0.060     2.199     2.319
    35   1 H        0.925     0.068     2.103     2.268
    36   1 H        0.925     0.058     2.226     2.333
    37   1 H        0.924     0.064     2.154     2.295
    38   1 H        0.924     0.062     2.179     2.309
    39   1 H        0.925     0.065     2.137     2.286
    40   1 H        0.925     0.062     2.177     2.307
    41   1 H        0.925     0.061     2.186     2.312

 Mol. C6AA /au·bohr⁶  :      26546.021873
 Mol. C8AA /au·bohr⁸  :     863249.101289
 Mol. α(0) /au        :        258.304266


Wiberg/Mayer (AO) data.
largest (>0.10) Wiberg bond orders for each atom

 ---------------------------------------------------------------------------
     #   Z sym  total        # sym  WBO       # sym  WBO       # sym  WBO
 ---------------------------------------------------------------------------
     1   6 C    3.989 --     2 C    1.022    20 H    0.982    21 H    0.980
                            22 H    0.975
     2   6 C    3.911 --     1 C    1.022    24 H    0.970    23 H    0.969
                             3 O    0.905
     3   8 O    2.409 --     4 P    1.309     2 C    0.905
     4  15 P    5.302 --     5 S    1.569     6 O    1.351     3 O    1.309
                             9 S    0.945
     5  16 S    1.899 --     4 P    1.569     9 S    0.144
     6   8 O    2.425 --     4 P    1.351     7 C    0.884
     7   6 C    3.908 --     8 C    1.021    26 H    0.973    25 H    0.964
                             6 O    0.884
     8   6 C    3.989 --     7 C    1.021    27 H    0.984    28 H    0.981
                            29 H    0.979
     9  16 S    2.272 --    10 C    0.986     4 P    0.945     5 S    0.144
    10   6 C    3.965 --    11 S    0.988     9 S    0.986    30 H    0.964
                            31 H    0.960
    11  16 S    2.269 --    10 C    0.988    12 P    0.932    13 S    0.143
    12  15 P    5.257 --    13 S    1.568    14 O    1.326    17 O    1.306
                            11 S    0.932
    13  16 S    1.893 --    12 P    1.568    11 S    0.143
    14   8 O    2.402 --    12 P    1.326    15 C    0.886
    15   6 C    3.910 --    16 C    1.023    33 H    0.973    32 H    0.969
                            14 O    0.886
    16   6 C    3.990 --    15 C    1.023    36 H    0.984    34 H    0.979
                            35 H    0.977
    17   8 O    2.406 --    12 P    1.306    18 C    0.906
    18   6 C    3.908 --    19 C    1.021    37 H    0.970    38 H    0.965
                            17 O    0.906
    19   6 C    3.990 --    18 C    1.021    40 H    0.984    41 H    0.980
                            39 H    0.974
    20   1 H    0.995 --     1 C    0.982
    21   1 H    0.996 --     1 C    0.980
    22   1 H    0.996 --     1 C    0.975
    23   1 H    0.995 --     2 C    0.969
    24   1 H    0.997 --     2 C    0.970
    25   1 H    0.995 --     7 C    0.964
    26   1 H    0.997 --     7 C    0.973
    27   1 H    0.996 --     8 C    0.984
    28   1 H    0.996 --     8 C    0.981
    29   1 H    0.994 --     8 C    0.979
    30   1 H    0.995 --    10 C    0.964
    31   1 H    0.993 --    10 C    0.960
    32   1 H    0.995 --    15 C    0.969
    33   1 H    0.996 --    15 C    0.973
    34   1 H    0.995 --    16 C    0.979
    35   1 H    0.995 --    16 C    0.977
    36   1 H    0.997 --    16 C    0.984
    37   1 H    0.995 --    18 C    0.970
    38   1 H    0.996 --    18 C    0.965
    39   1 H    0.996 --    19 C    0.974
    40   1 H    0.996 --    19 C    0.984
    41   1 H    0.995 --    19 C    0.980
 ---------------------------------------------------------------------------

Topologies differ in total number of bonds
Writing topology from bond orders to xtbtopo.mol

molecular dipole:
                 x           y           z       tot (Debye)
 q only:       -0.973       0.047      -0.104
   full:       -1.279       0.028      -0.356       3.376
molecular quadrupole (traceless):
                xx          xy          yy          xz          yz          zz
 q only:       16.825     -13.785      -1.515     -21.648     -18.757     -15.310
  q+dip:       23.553     -19.301      -6.556     -19.458     -22.560     -16.997
   full:       23.585     -18.900      -6.499     -19.977     -22.877     -17.086


           -------------------------------------------------
          | TOTAL ENERGY              -65.010169447097 Eh   |
          | GRADIENT NORM               0.033071959480 Eh/α |
          | HOMO-LUMO GAP               2.764554740607 eV   |
           -------------------------------------------------

------------------------------------------------------------------------
 * finished run on 2025/04/09 at 05:21:00.319     
------------------------------------------------------------------------
 total:
 * wall-time:     0 d,  0 h,  0 min,  0.128 sec
 *  cpu-time:     0 d,  0 h,  0 min,  0.070 sec
 * ratio c/w:     0.547 speedup
 SCF:
 * wall-time:     0 d,  0 h,  0 min,  0.067 sec
 *  cpu-time:     0 d,  0 h,  0 min,  0.057 sec
 * ratio c/w:     0.846 speedup

