      -----------------------------------------------------------      
     |                   =====================                   |     
     |                           x T B                           |     
     |                   =====================                   |     
     |                         S. Grimme                         |     
     |          Mulliken Center for Theoretical Chemistry        |     
     |                    University of Bonn                     |     
      -----------------------------------------------------------      

   * xtb version 6.7.1 (edcfbbe) compiled by 'albert@albert-system' on 2024-07-22

   xtb is free software: you can redistribute it and/or modify it under
   the terms of the GNU Lesser General Public License as published by
   the Free Software Foundation, either version 3 of the License, or
   (at your option) any later version.
   
   xtb is distributed in the hope that it will be useful,
   but WITHOUT ANY WARRANTY; without even the implied warranty of
   MERCHANTABILITY or FITNESS FOR A PARTICULAR PURPOSE.  See the
   GNU Lesser General Public License for more details.
   
   Cite this work as:
   * C. Bannwarth, E. Caldeweyher, S. Ehlert, A. Hansen, P. Pracht,
     J. Seibert, S. Spicher, S. Grimme, WIREs Comput. Mol. Sci., 2020, 11,
     e01493. DOI: 10.1002/wcms.1493
   
   for GFN2-xTB:
   * C. Bannwarth, S. Ehlert and S. Grimme., J. Chem. Theory Comput., 2019,
     15, 1652-1671. DOI: 10.1021/acs.jctc.8b01176
   for GFN1-xTB:
   * S. Grimme, C. Bannwarth, P. Shushkov, J. Chem. Theory Comput., 2017,
     13, 1989-2009. DOI: 10.1021/acs.jctc.7b00118
   for GFN0-xTB:
   * P. Pracht, E. Caldeweyher, S. Ehlert, S. Grimme, ChemRxiv, 2019, preprint.
     DOI: 10.26434/chemrxiv.8326202.v1
   for GFN-FF:
   * S. Spicher and S. Grimme, Angew. Chem. Int. Ed., 2020, 59, 15665-15673.
     DOI: 10.1002/anie.202004239
   
   for ALPB and GBSA implicit solvation:
   * S. Ehlert, M. Stahn, S. Spicher, S. Grimme, J. Chem. Theory Comput.,
     2021, 17, 4250-4261. DOI: 10.1021/acs.jctc.1c00471
   
   for ddCOSMO and CPCM-X implicit solvation:
   * M. Stahn, S. Ehlert, S. Grimme, J. Phys. Chem. A,
     2023, XX, XXXX-XXXX. DOI: 10.1021/acs.jpca.3c04382
   
   for DFT-D4:
   * E. Caldeweyher, C. Bannwarth and S. Grimme, J. Chem. Phys., 2017,
     147, 034112. DOI: 10.1063/1.4993215
   * E. Caldeweyher, S. Ehlert, A. Hansen, H. Neugebauer, S. Spicher,
     C. Bannwarth and S. Grimme, J. Chem. Phys., 2019, 150, 154122.
     DOI: 10.1063/1.5090222
   * E. Caldeweyher, J.-M. Mewes, S. Ehlert and S. Grimme, Phys. Chem. Chem. Phys.
     2020, 22, 8499-8512. DOI: 10.1039/D0CP00502A
   
   for sTDA-xTB:
   * S. Grimme and C. Bannwarth, J. Chem. Phys., 2016, 145, 054103.
     DOI: 10.1063/1.4959605
   
   in the mass-spec context:
   * V. Asgeirsson, C. Bauer and S. Grimme, Chem. Sci., 2017, 8, 4879.
     DOI: 10.1039/c7sc00601b
   * J. Koopman and S. Grimme, ACS Omega 2019, 4, 12, 15120-15133.
     DOI: 10.1021/acsomega.9b02011
   
   for metadynamics refer to:
   * S. Grimme, J. Chem. Theory Comput., 2019, 155, 2847-2862
     DOI: 10.1021/acs.jctc.9b00143
   
   for SPH calculations refer to:
   * S. Spicher and S. Grimme, J. Chem. Theory Comput., 2021, 17, 1701-1714
     DOI: 10.1021/acs.jctc.0c01306
   
   for ONIOM refer to:
   * C. Plett, A. Katbashev, S. Ehlert, S. Grimme, M. Bursch,
     Phys. Chem. Chem. Phys., 2023, 25, 17860-17868. DOI: 10.1039/D3CP02178E
   
   for DIPRO refer to:
   * J. Kohn, N. Gildemeister, S. Grimme, D. Fazzi, A. Hansen,
     J. Chem. Phys., 2023, just accepted.
   
   for PTB refer to:
   * S. Grimme, M. Mueller, A. Hansen, J. Chem. Phys., 2023, 158, 124111.
     DOI: 10.1063/5.0137838
   
   with help from (in alphabetical order)
   P. Atkinson, C. Bannwarth, F. Bohle, G. Brandenburg, E. Caldeweyher
   M. Checinski, S. Dohm, S. Ehlert, S. Ehrlich, I. Gerasimov, C. Hölzer
   A. Katbashev, J. Kohn, J. Koopman, C. Lavigne, S. Lehtola, F. März, M. Müller,
   F. Musil, H. Neugebauer, J. Pisarek, C. Plett, P. Pracht, F. Pultar,
   J. Seibert, P. Shushkov, S. Spicher, M. Stahn, M. Steiner, T. Strunk,
   J. Stückrath, T. Rose, and J. Unsleber
   
 * started run on 2025/04/09 at 05:20:42.219     
   ID    Z sym.   atoms
    1    6 C      1, 2, 7, 8, 10, 15, 16, 18, 19
    2    8 O      3, 6, 14, 17
    3   15 P      4, 12
    4   16 S      5, 9, 11, 13
    5    1 H      20-41

           -------------------------------------------------
          |                Calculation Setup                |
           -------------------------------------------------

          program call               : /srv/scratch/z5358697/.xtb/bin/xtb gas.coord --gfn2 --sp --chrg 0 --norestart --parallel 1
          hostname                   : k163
          coordinate file            : gas.coord
          omp threads                :                     1


           -------------------------------------------------
          |                 G F N 2 - x T B                 |
           -------------------------------------------------

        Reference                      10.1021/acs.jctc.8b01176
      * Hamiltonian:
        H0-scaling (s, p, d)           1.850000    2.230000    2.230000
        zeta-weighting                 0.500000
      * Dispersion:
        s8                             2.700000
        a1                             0.520000
        a2                             5.000000
        s9                             5.000000
      * Repulsion:
        kExp                           1.500000    1.000000
        rExp                           1.000000
      * Coulomb:
        alpha                          2.000000
        third order                    shell-resolved
        anisotropic                    true
        a3                             3.000000
        a5                             4.000000
        cn-shift                       1.200000
        cn-exp                         4.000000
        max-rad                        5.000000


          ...................................................
          :                      SETUP                      :
          :.................................................:
          :  # basis functions                 134          :
          :  # atomic orbitals                 128          :
          :  # shells                           66          :
          :  # electrons                       116          :
          :  max. iterations                   250          :
          :  Hamiltonian                  GFN2-xTB          :
          :  restarted?                      false          :
          :  GBSA solvation                  false          :
          :  PC potential                    false          :
          :  electronic temp.          300.0000000     K    :
          :  accuracy                    1.0000000          :
          :  -> integral cutoff          0.2500000E+02      :
          :  -> integral neglect         0.1000000E-07      :
          :  -> SCF convergence          0.1000000E-05 Eh   :
          :  -> wf. convergence          0.1000000E-03 e    :
          :  Broyden damping             0.4000000          :
          :  net charge                          0          :
          :  unpaired electrons                  0          :
          ...................................................

 iter      E             dE          RMSdq      gap      omega  full diag
   1    -65.3824742 -0.653825E+02  0.622E+00    4.26       0.0  T
   2    -65.5498372 -0.167363E+00  0.389E+00    3.06       1.0  T
   3    -65.5692531 -0.194160E-01  0.146E+00    2.98       1.0  T
   4    -65.5719338 -0.268065E-02  0.607E-01    2.72       1.0  T
   5    -65.5728742 -0.940438E-03  0.270E-01    2.85       1.0  T
   6    -65.5730281 -0.153897E-03  0.137E-01    2.82       1.0  T
   7    -65.5730907 -0.625805E-04  0.512E-02    2.84       1.0  T
   8    -65.5731014 -0.107076E-04  0.238E-02    2.84       1.0  T
   9    -65.5731031 -0.167155E-05  0.596E-03    2.84       2.6  T
  10    -65.5731032 -0.132042E-06  0.282E-03    2.84       5.5  T
  11    -65.5731032 -0.735604E-08  0.557E-04    2.84      28.0  T
  12    -65.5731032 -0.103906E-08  0.255E-04    2.84      61.4  T

   *** convergence criteria satisfied after 12 iterations ***

         #    Occupation            Energy/Eh            Energy/eV
      -------------------------------------------------------------
         1        2.0000           -0.7576523             -20.6168
       ...           ...                  ...                  ...
        52        2.0000           -0.4357726             -11.8580
        53        2.0000           -0.4094689             -11.1422
        54        2.0000           -0.3990266             -10.8581
        55        2.0000           -0.3736312             -10.1670
        56        2.0000           -0.3709228             -10.0933
        57        2.0000           -0.3682270             -10.0200
        58        2.0000           -0.3616952              -9.8422 (HOMO)
        59                         -0.2571663              -6.9979 (LUMO)
        60                         -0.2453753              -6.6770
        61                         -0.2065448              -5.6204
        62                         -0.1768582              -4.8126
        63                         -0.1659974              -4.5170
       ...                                ...                  ...
       128                          1.3632604              37.0962
      -------------------------------------------------------------
                  HL-Gap            0.1045289 Eh            2.8444 eV
             Fermi-level           -0.3094308 Eh           -8.4200 eV

 SCC (total)                   0 d,  0 h,  0 min,  0.065 sec
 SCC setup                      ...        0 min,  0.000 sec (  0.447%)
 Dispersion                     ...        0 min,  0.000 sec (  0.467%)
 classical contributions        ...        0 min,  0.000 sec (  0.094%)
 integral evaluation            ...        0 min,  0.017 sec ( 25.720%)
 iterations                     ...        0 min,  0.025 sec ( 38.726%)
 molecular gradient             ...        0 min,  0.022 sec ( 34.203%)
 printout                       ...        0 min,  0.000 sec (  0.314%)

         :::::::::::::::::::::::::::::::::::::::::::::::::::::
         ::                     SUMMARY                     ::
         :::::::::::::::::::::::::::::::::::::::::::::::::::::
         :: total energy             -65.010968307210 Eh    ::
         :: gradient norm              0.042022369197 Eh/a0 ::
         :: HOMO-LUMO gap              2.844375767483 eV    ::
         ::.................................................::
         :: SCC energy               -65.571894266992 Eh    ::
         :: -> isotropic ES            0.105953495404 Eh    ::
         :: -> anisotropic ES         -0.013172426044 Eh    ::
         :: -> anisotropic XC          0.030594875941 Eh    ::
         :: -> dispersion             -0.055844271879 Eh    ::
         :: repulsion energy           0.560925959782 Eh    ::
         :: add. restraining           0.000000000000 Eh    ::
         :: total charge              -0.000000000000 e     ::
         :::::::::::::::::::::::::::::::::::::::::::::::::::::

           -------------------------------------------------
          |                Property Printout                |
           -------------------------------------------------

    * Orbital Energies and Occupations

         #    Occupation            Energy/Eh            Energy/eV
      -------------------------------------------------------------
         1        2.0000           -0.7576523             -20.6168
       ...           ...                  ...                  ...
        46        2.0000           -0.4707838             -12.8107
        47        2.0000           -0.4671832             -12.7127
        48        2.0000           -0.4615651             -12.5598
        49        2.0000           -0.4546207             -12.3709
        50        2.0000           -0.4471988             -12.1689
        51        2.0000           -0.4413698             -12.0103
        52        2.0000           -0.4357726             -11.8580
        53        2.0000           -0.4094689             -11.1422
        54        2.0000           -0.3990266             -10.8581
        55        2.0000           -0.3736312             -10.1670
        56        2.0000           -0.3709228             -10.0933
        57        2.0000           -0.3682270             -10.0200
        58        2.0000           -0.3616952              -9.8422 (HOMO)
        59                         -0.2571663              -6.9979 (LUMO)
        60                         -0.2453753              -6.6770
        61                         -0.2065448              -5.6204
        62                         -0.1768582              -4.8126
        63                         -0.1659974              -4.5170
        64                         -0.1646246              -4.4797
        65                         -0.1416988              -3.8558
        66                         -0.1389482              -3.7810
        67                         -0.1175238              -3.1980
        68                         -0.1095879              -2.9820
        69                         -0.0417953              -1.1373
       ...                                ...                  ...
       128                          1.3632604              37.0962
      -------------------------------------------------------------
                  HL-Gap            0.1045289 Eh            2.8444 eV
             Fermi-level           -0.3094308 Eh           -8.4200 eV

     #   Z          covCN         q      C6AA      α(0)
     1   6 C        3.751    -0.116    22.789     6.808
     2   6 C        3.852     0.083    19.171     6.228
     3   8 O        1.655    -0.260    18.326     5.779
     4  15 P        3.854     0.370   144.833    21.618
     5  16 S        0.926    -0.364   154.963    21.055
     6   8 O        1.654    -0.224    17.731     5.684
     7   6 C        3.874     0.088    19.078     6.210
     8   6 C        3.751    -0.113    22.719     6.797
     9  16 S        2.014    -0.183   148.794    20.530
    10   6 C        3.807     0.045    19.817     6.337
    11  16 S        2.010    -0.155   147.580    20.446
    12  15 P        3.862     0.368   144.917    21.625
    13  16 S        0.927    -0.369   155.174    21.070
    14   8 O        1.653    -0.242    18.025     5.731
    15   6 C        3.867     0.083    19.163     6.225
    16   6 C        3.751    -0.116    22.790     6.808
    17   8 O        1.655    -0.255    18.247     5.767
    18   6 C        3.855     0.082    19.181     6.229
    19   6 C        3.751    -0.119    22.836     6.815
    20   1 H        0.925     0.060     2.202     2.321
    21   1 H        0.925     0.059     2.205     2.322
    22   1 H        0.925     0.061     2.185     2.312
    23   1 H        0.924     0.063     2.159     2.298
    24   1 H        0.924     0.063     2.166     2.302
    25   1 H        0.924     0.053     2.287     2.365
    26   1 H        0.924     0.055     2.256     2.349
    27   1 H        0.925     0.067     2.120     2.277
    28   1 H        0.925     0.071     2.071     2.250
    29   1 H        0.925     0.052     2.290     2.367
    30   1 H        0.925     0.079     1.991     2.207
    31   1 H        0.924     0.088     1.897     2.154
    32   1 H        0.924     0.059     2.205     2.322
    33   1 H        0.924     0.060     2.197     2.318
    34   1 H        0.925     0.067     2.119     2.277
    35   1 H        0.925     0.061     2.184     2.311
    36   1 H        0.925     0.060     2.196     2.317
    37   1 H        0.924     0.064     2.153     2.295
    38   1 H        0.924     0.064     2.151     2.293
    39   1 H        0.925     0.065     2.139     2.287
    40   1 H        0.925     0.062     2.178     2.308
    41   1 H        0.925     0.061     2.182     2.310

 Mol. C6AA /au·bohr⁶  :      26551.327744
 Mol. C8AA /au·bohr⁸  :     863222.607214
 Mol. α(0) /au        :        258.324522


Wiberg/Mayer (AO) data.
largest (>0.10) Wiberg bond orders for each atom

 ---------------------------------------------------------------------------
     #   Z sym  total        # sym  WBO       # sym  WBO       # sym  WBO
 ---------------------------------------------------------------------------
     1   6 C    3.991 --     2 C    1.022    22 H    0.983    21 H    0.981
                            20 H    0.977
     2   6 C    3.911 --     1 C    1.022    24 H    0.970    23 H    0.969
                             3 O    0.909
     3   8 O    2.394 --     4 P    1.292     2 C    0.909
     4  15 P    5.295 --     5 S    1.588     6 O    1.338     3 O    1.292
                             9 S    0.941
     5  16 S    1.923 --     4 P    1.588     9 S    0.143
     6   8 O    2.419 --     4 P    1.338     7 C    0.888
     7   6 C    3.914 --     8 C    1.021    26 H    0.973    25 H    0.965
                             6 O    0.888
     8   6 C    3.986 --     7 C    1.021    27 H    0.983    29 H    0.980
                            28 H    0.980
     9  16 S    2.259 --    10 C    0.981     4 P    0.941     5 S    0.143
    10   6 C    3.957 --    11 S    0.992     9 S    0.981    30 H    0.969
                            31 H    0.943
    11  16 S    2.272 --    10 C    0.992    12 P    0.949    13 S    0.142
    12  15 P    5.295 --    13 S    1.589    14 O    1.324    17 O    1.304
                            11 S    0.949
    13  16 S    1.919 --    12 P    1.589    11 S    0.142
    14   8 O    2.403 --    12 P    1.324    15 C    0.885
    15   6 C    3.912 --    16 C    1.022    32 H    0.973    33 H    0.965
                            14 O    0.885
    16   6 C    3.989 --    15 C    1.022    35 H    0.983    34 H    0.981
                            36 H    0.979
    17   8 O    2.403 --    12 P    1.304    18 C    0.905
    18   6 C    3.908 --    19 C    1.022    37 H    0.970    38 H    0.969
                            17 O    0.905
    19   6 C    3.990 --    18 C    1.022    40 H    0.983    41 H    0.980
                            39 H    0.976
    20   1 H    0.996 --     1 C    0.977
    21   1 H    0.996 --     1 C    0.981
    22   1 H    0.996 --     1 C    0.983
    23   1 H    0.996 --     2 C    0.969
    24   1 H    0.996 --     2 C    0.970
    25   1 H    0.997 --     7 C    0.965
    26   1 H    0.997 --     7 C    0.973
    27   1 H    0.995 --     8 C    0.983
    28   1 H    0.995 --     8 C    0.980
    29   1 H    0.995 --     8 C    0.980
    30   1 H    0.994 --    10 C    0.969
    31   1 H    0.992 --    10 C    0.943
    32   1 H    0.996 --    15 C    0.973
    33   1 H    0.996 --    15 C    0.965
    34   1 H    0.995 --    16 C    0.981
    35   1 H    0.996 --    16 C    0.983
    36   1 H    0.994 --    16 C    0.979
    37   1 H    0.996 --    18 C    0.970
    38   1 H    0.996 --    18 C    0.969
    39   1 H    0.996 --    19 C    0.976
    40   1 H    0.996 --    19 C    0.983
    41   1 H    0.996 --    19 C    0.980
 ---------------------------------------------------------------------------

Topologies differ in total number of bonds
Writing topology from bond orders to xtbtopo.mol

molecular dipole:
                 x           y           z       tot (Debye)
 q only:       -0.229      -1.668       2.127
   full:       -0.134      -1.224       2.494       7.069
molecular quadrupole (traceless):
                xx          xy          yy          xz          yz          zz
 q only:       21.235      -1.180     -15.475       3.975      10.856      -5.759
  q+dip:       24.910       0.185     -15.529       2.749      12.366      -9.380
   full:       25.839      -0.011     -16.366       2.745      12.562      -9.473


           -------------------------------------------------
          | TOTAL ENERGY              -65.010968307210 Eh   |
          | GRADIENT NORM               0.042022369197 Eh/α |
          | HOMO-LUMO GAP               2.844375767483 eV   |
           -------------------------------------------------

------------------------------------------------------------------------
 * finished run on 2025/04/09 at 05:20:42.344     
------------------------------------------------------------------------
 total:
 * wall-time:     0 d,  0 h,  0 min,  0.125 sec
 *  cpu-time:     0 d,  0 h,  0 min,  0.071 sec
 * ratio c/w:     0.565 speedup
 SCF:
 * wall-time:     0 d,  0 h,  0 min,  0.065 sec
 *  cpu-time:     0 d,  0 h,  0 min,  0.057 sec
 * ratio c/w:     0.867 speedup

