      -----------------------------------------------------------      
     |                   =====================                   |     
     |                           x T B                           |     
     |                   =====================                   |     
     |                         S. Grimme                         |     
     |          Mulliken Center for Theoretical Chemistry        |     
     |                    University of Bonn                     |     
      -----------------------------------------------------------      

   * xtb version 6.7.1 (edcfbbe) compiled by 'albert@albert-system' on 2024-07-22

   xtb is free software: you can redistribute it and/or modify it under
   the terms of the GNU Lesser General Public License as published by
   the Free Software Foundation, either version 3 of the License, or
   (at your option) any later version.
   
   xtb is distributed in the hope that it will be useful,
   but WITHOUT ANY WARRANTY; without even the implied warranty of
   MERCHANTABILITY or FITNESS FOR A PARTICULAR PURPOSE.  See the
   GNU Lesser General Public License for more details.
   
   Cite this work as:
   * C. Bannwarth, E. Caldeweyher, S. Ehlert, A. Hansen, P. Pracht,
     J. Seibert, S. Spicher, S. Grimme, WIREs Comput. Mol. Sci., 2020, 11,
     e01493. DOI: 10.1002/wcms.1493
   
   for GFN2-xTB:
   * C. Bannwarth, S. Ehlert and S. Grimme., J. Chem. Theory Comput., 2019,
     15, 1652-1671. DOI: 10.1021/acs.jctc.8b01176
   for GFN1-xTB:
   * S. Grimme, C. Bannwarth, P. Shushkov, J. Chem. Theory Comput., 2017,
     13, 1989-2009. DOI: 10.1021/acs.jctc.7b00118
   for GFN0-xTB:
   * P. Pracht, E. Caldeweyher, S. Ehlert, S. Grimme, ChemRxiv, 2019, preprint.
     DOI: 10.26434/chemrxiv.8326202.v1
   for GFN-FF:
   * S. Spicher and S. Grimme, Angew. Chem. Int. Ed., 2020, 59, 15665-15673.
     DOI: 10.1002/anie.202004239
   
   for ALPB and GBSA implicit solvation:
   * S. Ehlert, M. Stahn, S. Spicher, S. Grimme, J. Chem. Theory Comput.,
     2021, 17, 4250-4261. DOI: 10.1021/acs.jctc.1c00471
   
   for ddCOSMO and CPCM-X implicit solvation:
   * M. Stahn, S. Ehlert, S. Grimme, J. Phys. Chem. A,
     2023, XX, XXXX-XXXX. DOI: 10.1021/acs.jpca.3c04382
   
   for DFT-D4:
   * E. Caldeweyher, C. Bannwarth and S. Grimme, J. Chem. Phys., 2017,
     147, 034112. DOI: 10.1063/1.4993215
   * E. Caldeweyher, S. Ehlert, A. Hansen, H. Neugebauer, S. Spicher,
     C. Bannwarth and S. Grimme, J. Chem. Phys., 2019, 150, 154122.
     DOI: 10.1063/1.5090222
   * E. Caldeweyher, J.-M. Mewes, S. Ehlert and S. Grimme, Phys. Chem. Chem. Phys.
     2020, 22, 8499-8512. DOI: 10.1039/D0CP00502A
   
   for sTDA-xTB:
   * S. Grimme and C. Bannwarth, J. Chem. Phys., 2016, 145, 054103.
     DOI: 10.1063/1.4959605
   
   in the mass-spec context:
   * V. Asgeirsson, C. Bauer and S. Grimme, Chem. Sci., 2017, 8, 4879.
     DOI: 10.1039/c7sc00601b
   * J. Koopman and S. Grimme, ACS Omega 2019, 4, 12, 15120-15133.
     DOI: 10.1021/acsomega.9b02011
   
   for metadynamics refer to:
   * S. Grimme, J. Chem. Theory Comput., 2019, 155, 2847-2862
     DOI: 10.1021/acs.jctc.9b00143
   
   for SPH calculations refer to:
   * S. Spicher and S. Grimme, J. Chem. Theory Comput., 2021, 17, 1701-1714
     DOI: 10.1021/acs.jctc.0c01306
   
   for ONIOM refer to:
   * C. Plett, A. Katbashev, S. Ehlert, S. Grimme, M. Bursch,
     Phys. Chem. Chem. Phys., 2023, 25, 17860-17868. DOI: 10.1039/D3CP02178E
   
   for DIPRO refer to:
   * J. Kohn, N. Gildemeister, S. Grimme, D. Fazzi, A. Hansen,
     J. Chem. Phys., 2023, just accepted.
   
   for PTB refer to:
   * S. Grimme, M. Mueller, A. Hansen, J. Chem. Phys., 2023, 158, 124111.
     DOI: 10.1063/5.0137838
   
   with help from (in alphabetical order)
   P. Atkinson, C. Bannwarth, F. Bohle, G. Brandenburg, E. Caldeweyher
   M. Checinski, S. Dohm, S. Ehlert, S. Ehrlich, I. Gerasimov, C. Hölzer
   A. Katbashev, J. Kohn, J. Koopman, C. Lavigne, S. Lehtola, F. März, M. Müller,
   F. Musil, H. Neugebauer, J. Pisarek, C. Plett, P. Pracht, F. Pultar,
   J. Seibert, P. Shushkov, S. Spicher, M. Stahn, M. Steiner, T. Strunk,
   J. Stückrath, T. Rose, and J. Unsleber
   
 * started run on 2025/04/09 at 05:20:50.861     
   ID    Z sym.   atoms
    1    6 C      1, 2, 7, 8, 10, 15, 16, 18, 19
    2    8 O      3, 6, 14, 17
    3   15 P      4, 12
    4   16 S      5, 9, 11, 13
    5    1 H      20-41

           -------------------------------------------------
          |                Calculation Setup                |
           -------------------------------------------------

          program call               : /srv/scratch/z5358697/.xtb/bin/xtb gas.coord --gfn2 --sp --chrg 0 --norestart --parallel 1
          hostname                   : k163
          coordinate file            : gas.coord
          omp threads                :                     1


           -------------------------------------------------
          |                 G F N 2 - x T B                 |
           -------------------------------------------------

        Reference                      10.1021/acs.jctc.8b01176
      * Hamiltonian:
        H0-scaling (s, p, d)           1.850000    2.230000    2.230000
        zeta-weighting                 0.500000
      * Dispersion:
        s8                             2.700000
        a1                             0.520000
        a2                             5.000000
        s9                             5.000000
      * Repulsion:
        kExp                           1.500000    1.000000
        rExp                           1.000000
      * Coulomb:
        alpha                          2.000000
        third order                    shell-resolved
        anisotropic                    true
        a3                             3.000000
        a5                             4.000000
        cn-shift                       1.200000
        cn-exp                         4.000000
        max-rad                        5.000000


          ...................................................
          :                      SETUP                      :
          :.................................................:
          :  # basis functions                 134          :
          :  # atomic orbitals                 128          :
          :  # shells                           66          :
          :  # electrons                       116          :
          :  max. iterations                   250          :
          :  Hamiltonian                  GFN2-xTB          :
          :  restarted?                      false          :
          :  GBSA solvation                  false          :
          :  PC potential                    false          :
          :  electronic temp.          300.0000000     K    :
          :  accuracy                    1.0000000          :
          :  -> integral cutoff          0.2500000E+02      :
          :  -> integral neglect         0.1000000E-07      :
          :  -> SCF convergence          0.1000000E-05 Eh   :
          :  -> wf. convergence          0.1000000E-03 e    :
          :  Broyden damping             0.4000000          :
          :  net charge                          0          :
          :  unpaired electrons                  0          :
          ...................................................

 iter      E             dE          RMSdq      gap      omega  full diag
   1    -65.3810903 -0.653811E+02  0.641E+00    4.09       0.0  T
   2    -65.5525879 -0.171498E+00  0.408E+00    3.10       1.0  T
   3    -65.5717662 -0.191783E-01  0.136E+00    2.89       1.0  T
   4    -65.5741514 -0.238519E-02  0.557E-01    2.68       1.0  T
   5    -65.5748261 -0.674698E-03  0.245E-01    2.78       1.0  T
   6    -65.5749878 -0.161684E-03  0.128E-01    2.76       1.0  T
   7    -65.5750442 -0.564091E-04  0.488E-02    2.77       1.0  T
   8    -65.5750547 -0.105252E-04  0.219E-02    2.78       1.0  T
   9    -65.5750561 -0.134159E-05  0.519E-03    2.77       3.0  T
  10    -65.5750561 -0.628374E-07  0.253E-03    2.78       6.2  T
  11    -65.5750561 -0.793683E-08  0.483E-04    2.78      32.3  T
  12    -65.5750561 -0.518867E-09  0.232E-04    2.78      67.3  T

   *** convergence criteria satisfied after 12 iterations ***

         #    Occupation            Energy/Eh            Energy/eV
      -------------------------------------------------------------
         1        2.0000           -0.7602285             -20.6869
       ...           ...                  ...                  ...
        52        2.0000           -0.4383926             -11.9293
        53        2.0000           -0.4135686             -11.2538
        54        2.0000           -0.4022081             -10.9446
        55        2.0000           -0.3784353             -10.2977
        56        2.0000           -0.3749299             -10.2024
        57        2.0000           -0.3729782             -10.1493
        58        2.0000           -0.3709373             -10.0937 (HOMO)
        59                         -0.2689504              -7.3185 (LUMO)
        60                         -0.2432673              -6.6196
        61                         -0.2031226              -5.5272
        62                         -0.1838686              -5.0033
        63                         -0.1704425              -4.6380
       ...                                ...                  ...
       128                          1.3068391              35.5609
      -------------------------------------------------------------
                  HL-Gap            0.1019869 Eh            2.7752 eV
             Fermi-level           -0.3199438 Eh           -8.7061 eV

 SCC (total)                   0 d,  0 h,  0 min,  0.053 sec
 SCC setup                      ...        0 min,  0.000 sec (  0.528%)
 Dispersion                     ...        0 min,  0.000 sec (  0.610%)
 classical contributions        ...        0 min,  0.000 sec (  0.114%)
 integral evaluation            ...        0 min,  0.008 sec ( 15.707%)
 iterations                     ...        0 min,  0.022 sec ( 41.827%)
 molecular gradient             ...        0 min,  0.021 sec ( 40.781%)
 printout                       ...        0 min,  0.000 sec (  0.403%)

         :::::::::::::::::::::::::::::::::::::::::::::::::::::
         ::                     SUMMARY                     ::
         :::::::::::::::::::::::::::::::::::::::::::::::::::::
         :: total energy             -65.012892580111 Eh    ::
         :: gradient norm              0.030556485258 Eh/a0 ::
         :: HOMO-LUMO gap              2.775204155643 eV    ::
         ::.................................................::
         :: SCC energy               -65.573608126383 Eh    ::
         :: -> isotropic ES            0.105114750956 Eh    ::
         :: -> anisotropic ES         -0.008496012031 Eh    ::
         :: -> anisotropic XC          0.030986252459 Eh    ::
         :: -> dispersion             -0.054600268772 Eh    ::
         :: repulsion energy           0.560715546272 Eh    ::
         :: add. restraining           0.000000000000 Eh    ::
         :: total charge              -0.000000000000 e     ::
         :::::::::::::::::::::::::::::::::::::::::::::::::::::

           -------------------------------------------------
          |                Property Printout                |
           -------------------------------------------------

    * Orbital Energies and Occupations

         #    Occupation            Energy/Eh            Energy/eV
      -------------------------------------------------------------
         1        2.0000           -0.7602285             -20.6869
       ...           ...                  ...                  ...
        46        2.0000           -0.4703359             -12.7985
        47        2.0000           -0.4695804             -12.7779
        48        2.0000           -0.4657241             -12.6730
        49        2.0000           -0.4583729             -12.4730
        50        2.0000           -0.4542717             -12.3614
        51        2.0000           -0.4446598             -12.0998
        52        2.0000           -0.4383926             -11.9293
        53        2.0000           -0.4135686             -11.2538
        54        2.0000           -0.4022081             -10.9446
        55        2.0000           -0.3784353             -10.2977
        56        2.0000           -0.3749299             -10.2024
        57        2.0000           -0.3729782             -10.1493
        58        2.0000           -0.3709373             -10.0937 (HOMO)
        59                         -0.2689504              -7.3185 (LUMO)
        60                         -0.2432673              -6.6196
        61                         -0.2031226              -5.5272
        62                         -0.1838686              -5.0033
        63                         -0.1704425              -4.6380
        64                         -0.1696239              -4.6157
        65                         -0.1506890              -4.1005
        66                         -0.1355643              -3.6889
        67                         -0.1310697              -3.5666
        68                         -0.1222465              -3.3265
        69                         -0.0441809              -1.2022
       ...                                ...                  ...
       128                          1.3068391              35.5609
      -------------------------------------------------------------
                  HL-Gap            0.1019869 Eh            2.7752 eV
             Fermi-level           -0.3199438 Eh           -8.7061 eV

     #   Z          covCN         q      C6AA      α(0)
     1   6 C        3.751    -0.117    22.793     6.808
     2   6 C        3.813     0.079    19.251     6.245
     3   8 O        1.654    -0.240    17.991     5.726
     4  15 P        3.781     0.373   144.732    21.611
     5  16 S        0.926    -0.379   155.630    21.101
     6   8 O        1.655    -0.247    18.106     5.744
     7   6 C        3.826     0.086    19.137     6.225
     8   6 C        3.751    -0.114    22.737     6.800
     9  16 S        2.026    -0.162   147.900    20.469
    10   6 C        3.823     0.046    19.792     6.331
    11  16 S        2.020    -0.151   147.428    20.436
    12  15 P        3.843     0.377   144.568    21.599
    13  16 S        0.926    -0.407   156.959    21.191
    14   8 O        1.655    -0.249    18.137     5.749
    15   6 C        3.820     0.081    19.226     6.240
    16   6 C        3.752    -0.116    22.790     6.808
    17   8 O        1.655    -0.248    18.130     5.748
    18   6 C        3.870     0.088    19.085     6.212
    19   6 C        3.751    -0.114    22.750     6.802
    20   1 H        0.925     0.058     2.217     2.328
    21   1 H        0.925     0.064     2.155     2.296
    22   1 H        0.925     0.063     2.169     2.303
    23   1 H        0.924     0.060     2.197     2.318
    24   1 H        0.924     0.072     2.060     2.245
    25   1 H        0.924     0.062     2.172     2.304
    26   1 H        0.924     0.060     2.202     2.320
    27   1 H        0.925     0.058     2.222     2.331
    28   1 H        0.925     0.057     2.240     2.340
    29   1 H        0.925     0.062     2.176     2.307
    30   1 H        0.925     0.088     1.895     2.153
    31   1 H        0.925     0.089     1.886     2.147
    32   1 H        0.924     0.068     2.104     2.269
    33   1 H        0.924     0.055     2.253     2.347
    34   1 H        0.925     0.069     2.094     2.263
    35   1 H        0.925     0.059     2.208     2.323
    36   1 H        0.925     0.063     2.168     2.303
    37   1 H        0.924     0.063     2.160     2.299
    38   1 H        0.924     0.060     2.193     2.316
    39   1 H        0.925     0.059     2.208     2.324
    40   1 H        0.925     0.058     2.218     2.329
    41   1 H        0.925     0.064     2.149     2.293

 Mol. C6AA /au·bohr⁶  :      26543.982642
 Mol. C8AA /au·bohr⁸  :     863319.399677
 Mol. α(0) /au        :        258.301114


Wiberg/Mayer (AO) data.
largest (>0.10) Wiberg bond orders for each atom

 ---------------------------------------------------------------------------
     #   Z sym  total        # sym  WBO       # sym  WBO       # sym  WBO
 ---------------------------------------------------------------------------
     1   6 C    3.990 --     2 C    1.023    21 H    0.983    20 H    0.980
                            22 H    0.974
     2   6 C    3.912 --     1 C    1.023    24 H    0.968    23 H    0.968
                             3 O    0.891
     3   8 O    2.411 --     4 P    1.338     2 C    0.891
     4  15 P    5.290 --     5 S    1.588     3 O    1.338     6 O    1.299
                             9 S    0.941
     5  16 S    1.917 --     4 P    1.588     9 S    0.137
     6   8 O    2.413 --     4 P    1.299     7 C    0.903
     7   6 C    3.907 --     8 C    1.018    26 H    0.969    25 H    0.962
                             6 O    0.903
     8   6 C    3.988 --     7 C    1.018    28 H    0.985    29 H    0.984
                            27 H    0.980
     9  16 S    2.276 --    10 C    0.992     4 P    0.941     5 S    0.137
    10   6 C    3.957 --     9 S    0.992    11 S    0.984    30 H    0.958
                            31 H    0.958
    11  16 S    2.295 --    10 C    0.984    12 P    0.979    13 S    0.141
    12  15 P    5.270 --    13 S    1.537    14 O    1.307    17 O    1.302
                            11 S    0.979
    13  16 S    1.873 --    12 P    1.537    11 S    0.141
    14   8 O    2.410 --    12 P    1.307    15 C    0.904
    15   6 C    3.911 --    16 C    1.022    33 H    0.971    32 H    0.969
                            14 O    0.904
    16   6 C    3.989 --    15 C    1.022    34 H    0.982    35 H    0.980
                            36 H    0.975
    17   8 O    2.399 --    12 P    1.302    18 C    0.898
    18   6 C    3.909 --    19 C    1.023    38 H    0.968    37 H    0.966
                            17 O    0.898
    19   6 C    3.991 --    18 C    1.023    40 H    0.984    39 H    0.980
                            41 H    0.975
    20   1 H    0.995 --     1 C    0.980
    21   1 H    0.996 --     1 C    0.983
    22   1 H    0.996 --     1 C    0.974
    23   1 H    0.996 --     2 C    0.968
    24   1 H    0.994 --     2 C    0.968
    25   1 H    0.996 --     7 C    0.962
    26   1 H    0.996 --     7 C    0.969
    27   1 H    0.995 --     8 C    0.980
    28   1 H    0.997 --     8 C    0.985
    29   1 H    0.996 --     8 C    0.984
    30   1 H    0.992 --    10 C    0.958
    31   1 H    0.992 --    10 C    0.958
    32   1 H    0.995 --    15 C    0.969
    33   1 H    0.997 --    15 C    0.971
    34   1 H    0.995 --    16 C    0.982
    35   1 H    0.996 --    16 C    0.980
    36   1 H    0.996 --    16 C    0.975
    37   1 H    0.996 --    18 C    0.966
    38   1 H    0.996 --    18 C    0.968
    39   1 H    0.995 --    19 C    0.980
    40   1 H    0.997 --    19 C    0.984
    41   1 H    0.996 --    19 C    0.975
 ---------------------------------------------------------------------------

Topologies differ in total number of bonds
Writing topology from bond orders to xtbtopo.mol

molecular dipole:
                 x           y           z       tot (Debye)
 q only:       -0.982      -1.739       0.922
   full:       -0.880      -2.085       1.088       6.383
molecular quadrupole (traceless):
                xx          xy          yy          xz          yz          zz
 q only:       -9.151     -18.317       9.447     -17.363       3.424      -0.296
  q+dip:       -6.197     -19.603       8.111     -20.804      -0.859      -1.914
   full:       -6.927     -20.073       8.471     -21.492       0.960      -1.543


           -------------------------------------------------
          | TOTAL ENERGY              -65.012892580111 Eh   |
          | GRADIENT NORM               0.030556485258 Eh/α |
          | HOMO-LUMO GAP               2.775204155643 eV   |
           -------------------------------------------------

------------------------------------------------------------------------
 * finished run on 2025/04/09 at 05:20:50.946     
------------------------------------------------------------------------
 total:
 * wall-time:     0 d,  0 h,  0 min,  0.085 sec
 *  cpu-time:     0 d,  0 h,  0 min,  0.065 sec
 * ratio c/w:     0.766 speedup
 SCF:
 * wall-time:     0 d,  0 h,  0 min,  0.053 sec
 *  cpu-time:     0 d,  0 h,  0 min,  0.052 sec
 * ratio c/w:     0.990 speedup

