      -----------------------------------------------------------      
     |                   =====================                   |     
     |                           x T B                           |     
     |                   =====================                   |     
     |                         S. Grimme                         |     
     |          Mulliken Center for Theoretical Chemistry        |     
     |                    University of Bonn                     |     
      -----------------------------------------------------------      

   * xtb version 6.7.1 (edcfbbe) compiled by 'albert@albert-system' on 2024-07-22

   xtb is free software: you can redistribute it and/or modify it under
   the terms of the GNU Lesser General Public License as published by
   the Free Software Foundation, either version 3 of the License, or
   (at your option) any later version.
   
   xtb is distributed in the hope that it will be useful,
   but WITHOUT ANY WARRANTY; without even the implied warranty of
   MERCHANTABILITY or FITNESS FOR A PARTICULAR PURPOSE.  See the
   GNU Lesser General Public License for more details.
   
   Cite this work as:
   * C. Bannwarth, E. Caldeweyher, S. Ehlert, A. Hansen, P. Pracht,
     J. Seibert, S. Spicher, S. Grimme, WIREs Comput. Mol. Sci., 2020, 11,
     e01493. DOI: 10.1002/wcms.1493
   
   for GFN2-xTB:
   * C. Bannwarth, S. Ehlert and S. Grimme., J. Chem. Theory Comput., 2019,
     15, 1652-1671. DOI: 10.1021/acs.jctc.8b01176
   for GFN1-xTB:
   * S. Grimme, C. Bannwarth, P. Shushkov, J. Chem. Theory Comput., 2017,
     13, 1989-2009. DOI: 10.1021/acs.jctc.7b00118
   for GFN0-xTB:
   * P. Pracht, E. Caldeweyher, S. Ehlert, S. Grimme, ChemRxiv, 2019, preprint.
     DOI: 10.26434/chemrxiv.8326202.v1
   for GFN-FF:
   * S. Spicher and S. Grimme, Angew. Chem. Int. Ed., 2020, 59, 15665-15673.
     DOI: 10.1002/anie.202004239
   
   for ALPB and GBSA implicit solvation:
   * S. Ehlert, M. Stahn, S. Spicher, S. Grimme, J. Chem. Theory Comput.,
     2021, 17, 4250-4261. DOI: 10.1021/acs.jctc.1c00471
   
   for ddCOSMO and CPCM-X implicit solvation:
   * M. Stahn, S. Ehlert, S. Grimme, J. Phys. Chem. A,
     2023, XX, XXXX-XXXX. DOI: 10.1021/acs.jpca.3c04382
   
   for DFT-D4:
   * E. Caldeweyher, C. Bannwarth and S. Grimme, J. Chem. Phys., 2017,
     147, 034112. DOI: 10.1063/1.4993215
   * E. Caldeweyher, S. Ehlert, A. Hansen, H. Neugebauer, S. Spicher,
     C. Bannwarth and S. Grimme, J. Chem. Phys., 2019, 150, 154122.
     DOI: 10.1063/1.5090222
   * E. Caldeweyher, J.-M. Mewes, S. Ehlert and S. Grimme, Phys. Chem. Chem. Phys.
     2020, 22, 8499-8512. DOI: 10.1039/D0CP00502A
   
   for sTDA-xTB:
   * S. Grimme and C. Bannwarth, J. Chem. Phys., 2016, 145, 054103.
     DOI: 10.1063/1.4959605
   
   in the mass-spec context:
   * V. Asgeirsson, C. Bauer and S. Grimme, Chem. Sci., 2017, 8, 4879.
     DOI: 10.1039/c7sc00601b
   * J. Koopman and S. Grimme, ACS Omega 2019, 4, 12, 15120-15133.
     DOI: 10.1021/acsomega.9b02011
   
   for metadynamics refer to:
   * S. Grimme, J. Chem. Theory Comput., 2019, 155, 2847-2862
     DOI: 10.1021/acs.jctc.9b00143
   
   for SPH calculations refer to:
   * S. Spicher and S. Grimme, J. Chem. Theory Comput., 2021, 17, 1701-1714
     DOI: 10.1021/acs.jctc.0c01306
   
   for ONIOM refer to:
   * C. Plett, A. Katbashev, S. Ehlert, S. Grimme, M. Bursch,
     Phys. Chem. Chem. Phys., 2023, 25, 17860-17868. DOI: 10.1039/D3CP02178E
   
   for DIPRO refer to:
   * J. Kohn, N. Gildemeister, S. Grimme, D. Fazzi, A. Hansen,
     J. Chem. Phys., 2023, just accepted.
   
   for PTB refer to:
   * S. Grimme, M. Mueller, A. Hansen, J. Chem. Phys., 2023, 158, 124111.
     DOI: 10.1063/5.0137838
   
   with help from (in alphabetical order)
   P. Atkinson, C. Bannwarth, F. Bohle, G. Brandenburg, E. Caldeweyher
   M. Checinski, S. Dohm, S. Ehlert, S. Ehrlich, I. Gerasimov, C. Hölzer
   A. Katbashev, J. Kohn, J. Koopman, C. Lavigne, S. Lehtola, F. März, M. Müller,
   F. Musil, H. Neugebauer, J. Pisarek, C. Plett, P. Pracht, F. Pultar,
   J. Seibert, P. Shushkov, S. Spicher, M. Stahn, M. Steiner, T. Strunk,
   J. Stückrath, T. Rose, and J. Unsleber
   
 * started run on 2025/04/09 at 05:20:48.491     
   ID    Z sym.   atoms
    1    6 C      1, 2, 7, 8, 10, 15, 16, 18, 19
    2    8 O      3, 6, 14, 17
    3   15 P      4, 12
    4   16 S      5, 9, 11, 13
    5    1 H      20-41

           -------------------------------------------------
          |                Calculation Setup                |
           -------------------------------------------------

          program call               : /srv/scratch/z5358697/.xtb/bin/xtb gas.coord --gfn2 --sp --chrg 0 --norestart --parallel 1
          hostname                   : k163
          coordinate file            : gas.coord
          omp threads                :                     1


           -------------------------------------------------
          |                 G F N 2 - x T B                 |
           -------------------------------------------------

        Reference                      10.1021/acs.jctc.8b01176
      * Hamiltonian:
        H0-scaling (s, p, d)           1.850000    2.230000    2.230000
        zeta-weighting                 0.500000
      * Dispersion:
        s8                             2.700000
        a1                             0.520000
        a2                             5.000000
        s9                             5.000000
      * Repulsion:
        kExp                           1.500000    1.000000
        rExp                           1.000000
      * Coulomb:
        alpha                          2.000000
        third order                    shell-resolved
        anisotropic                    true
        a3                             3.000000
        a5                             4.000000
        cn-shift                       1.200000
        cn-exp                         4.000000
        max-rad                        5.000000


          ...................................................
          :                      SETUP                      :
          :.................................................:
          :  # basis functions                 134          :
          :  # atomic orbitals                 128          :
          :  # shells                           66          :
          :  # electrons                       116          :
          :  max. iterations                   250          :
          :  Hamiltonian                  GFN2-xTB          :
          :  restarted?                      false          :
          :  GBSA solvation                  false          :
          :  PC potential                    false          :
          :  electronic temp.          300.0000000     K    :
          :  accuracy                    1.0000000          :
          :  -> integral cutoff          0.2500000E+02      :
          :  -> integral neglect         0.1000000E-07      :
          :  -> SCF convergence          0.1000000E-05 Eh   :
          :  -> wf. convergence          0.1000000E-03 e    :
          :  Broyden damping             0.4000000          :
          :  net charge                          0          :
          :  unpaired electrons                  0          :
          ...................................................

 iter      E             dE          RMSdq      gap      omega  full diag
   1    -65.3727742 -0.653728E+02  0.613E+00    4.23       0.0  T
   2    -65.5459170 -0.173143E+00  0.374E+00    3.00       1.0  T
   3    -65.5656471 -0.197300E-01  0.139E+00    2.90       1.0  T
   4    -65.5683854 -0.273839E-02  0.619E-01    2.64       1.0  T
   5    -65.5692704 -0.884981E-03  0.259E-01    2.77       1.0  T
   6    -65.5693975 -0.127106E-03  0.136E-01    2.74       1.0  T
   7    -65.5694511 -0.535840E-04  0.516E-02    2.76       1.0  T
   8    -65.5694620 -0.108514E-04  0.232E-02    2.77       1.0  T
   9    -65.5694637 -0.171788E-05  0.560E-03    2.77       2.8  T
  10    -65.5694638 -0.113536E-06  0.259E-03    2.77       6.0  T
  11    -65.5694638 -0.724431E-08  0.591E-04    2.77      26.4  T
  12    -65.5694638 -0.783928E-09  0.261E-04    2.77      59.8  T

   *** convergence criteria satisfied after 12 iterations ***

         #    Occupation            Energy/Eh            Energy/eV
      -------------------------------------------------------------
         1        2.0000           -0.7574306             -20.6107
       ...           ...                  ...                  ...
        52        2.0000           -0.4321127             -11.7584
        53        2.0000           -0.4098410             -11.1523
        54        2.0000           -0.3991793             -10.8622
        55        2.0000           -0.3708558             -10.0915
        56        2.0000           -0.3675149             -10.0006
        57        2.0000           -0.3639665              -9.9040
        58        2.0000           -0.3587248              -9.7614 (HOMO)
        59                         -0.2570831              -6.9956 (LUMO)
        60                         -0.2449391              -6.6651
        61                         -0.2038041              -5.5458
        62                         -0.1763968              -4.8000
        63                         -0.1639166              -4.4604
       ...                                ...                  ...
       128                          1.3272719              36.1169
      -------------------------------------------------------------
                  HL-Gap            0.1016417 Eh            2.7658 eV
             Fermi-level           -0.3079040 Eh           -8.3785 eV

 SCC (total)                   0 d,  0 h,  0 min,  0.063 sec
 SCC setup                      ...        0 min,  0.000 sec (  0.416%)
 Dispersion                     ...        0 min,  0.000 sec (  0.486%)
 classical contributions        ...        0 min,  0.000 sec (  0.091%)
 integral evaluation            ...        0 min,  0.014 sec ( 23.032%)
 iterations                     ...        0 min,  0.025 sec ( 40.372%)
 molecular gradient             ...        0 min,  0.022 sec ( 35.252%)
 printout                       ...        0 min,  0.000 sec (  0.327%)

         :::::::::::::::::::::::::::::::::::::::::::::::::::::
         ::                     SUMMARY                     ::
         :::::::::::::::::::::::::::::::::::::::::::::::::::::
         :: total energy             -65.007149701631 Eh    ::
         :: gradient norm              0.044777038385 Eh/a0 ::
         :: HOMO-LUMO gap              2.765810772168 eV    ::
         ::.................................................::
         :: SCC energy               -65.568458800363 Eh    ::
         :: -> isotropic ES            0.105639846589 Eh    ::
         :: -> anisotropic ES         -0.012968161333 Eh    ::
         :: -> anisotropic XC          0.030909708273 Eh    ::
         :: -> dispersion             -0.054171250992 Eh    ::
         :: repulsion energy           0.561309098732 Eh    ::
         :: add. restraining           0.000000000000 Eh    ::
         :: total charge               0.000000000000 e     ::
         :::::::::::::::::::::::::::::::::::::::::::::::::::::

           -------------------------------------------------
          |                Property Printout                |
           -------------------------------------------------

    * Orbital Energies and Occupations

         #    Occupation            Energy/Eh            Energy/eV
      -------------------------------------------------------------
         1        2.0000           -0.7574306             -20.6107
       ...           ...                  ...                  ...
        46        2.0000           -0.4642276             -12.6323
        47        2.0000           -0.4638577             -12.6222
        48        2.0000           -0.4607085             -12.5365
        49        2.0000           -0.4590747             -12.4921
        50        2.0000           -0.4552496             -12.3880
        51        2.0000           -0.4386680             -11.9368
        52        2.0000           -0.4321127             -11.7584
        53        2.0000           -0.4098410             -11.1523
        54        2.0000           -0.3991793             -10.8622
        55        2.0000           -0.3708558             -10.0915
        56        2.0000           -0.3675149             -10.0006
        57        2.0000           -0.3639665              -9.9040
        58        2.0000           -0.3587248              -9.7614 (HOMO)
        59                         -0.2570831              -6.9956 (LUMO)
        60                         -0.2449391              -6.6651
        61                         -0.2038041              -5.5458
        62                         -0.1763968              -4.8000
        63                         -0.1639166              -4.4604
        64                         -0.1578648              -4.2957
        65                         -0.1497952              -4.0761
        66                         -0.1400401              -3.8107
        67                         -0.1150536              -3.1308
        68                         -0.1088942              -2.9632
        69                         -0.0424617              -1.1554
       ...                                ...                  ...
       128                          1.3272719              36.1169
      -------------------------------------------------------------
                  HL-Gap            0.1016417 Eh            2.7658 eV
             Fermi-level           -0.3079040 Eh           -8.3785 eV

     #   Z          covCN         q      C6AA      α(0)
     1   6 C        3.751    -0.114    22.739     6.800
     2   6 C        3.819     0.081    19.215     6.238
     3   8 O        1.654    -0.220    17.668     5.674
     4  15 P        3.764     0.371   144.802    21.616
     5  16 S        0.927    -0.368   155.105    21.065
     6   8 O        1.655    -0.255    18.240     5.765
     7   6 C        3.818     0.083    19.191     6.235
     8   6 C        3.751    -0.118    22.824     6.813
     9  16 S        2.031    -0.188   149.022    20.546
    10   6 C        3.806     0.047    19.777     6.331
    11  16 S        2.018    -0.168   148.146    20.486
    12  15 P        3.881     0.368   144.931    21.626
    13  16 S        0.928    -0.370   155.206    21.072
    14   8 O        1.655    -0.249    18.134     5.749
    15   6 C        3.882     0.084    19.135     6.219
    16   6 C        3.752    -0.115    22.766     6.804
    17   8 O        1.653    -0.235    17.919     5.714
    18   6 C        3.853     0.081    19.208     6.233
    19   6 C        3.751    -0.117    22.801     6.810
    20   1 H        0.925     0.070     2.091     2.261
    21   1 H        0.925     0.055     2.263     2.352
    22   1 H        0.925     0.056     2.245     2.343
    23   1 H        0.924     0.073     2.049     2.239
    24   1 H        0.924     0.057     2.234     2.337
    25   1 H        0.924     0.052     2.293     2.368
    26   1 H        0.924     0.064     2.157     2.297
    27   1 H        0.925     0.056     2.244     2.342
    28   1 H        0.925     0.067     2.114     2.274
    29   1 H        0.925     0.066     2.134     2.285
    30   1 H        0.924     0.092     1.855     2.130
    31   1 H        0.925     0.078     2.004     2.214
    32   1 H        0.924     0.053     2.284     2.363
    33   1 H        0.924     0.062     2.173     2.305
    34   1 H        0.925     0.060     2.196     2.317
    35   1 H        0.925     0.062     2.178     2.308
    36   1 H        0.925     0.064     2.148     2.292
    37   1 H        0.924     0.065     2.138     2.287
    38   1 H        0.924     0.061     2.192     2.315
    39   1 H        0.925     0.058     2.220     2.330
    40   1 H        0.925     0.067     2.118     2.276
    41   1 H        0.925     0.062     2.181     2.309

 Mol. C6AA /au·bohr⁶  :      26550.883584
 Mol. C8AA /au·bohr⁸  :     863435.490216
 Mol. α(0) /au        :        258.341906


Wiberg/Mayer (AO) data.
largest (>0.10) Wiberg bond orders for each atom

 ---------------------------------------------------------------------------
     #   Z sym  total        # sym  WBO       # sym  WBO       # sym  WBO
 ---------------------------------------------------------------------------
     1   6 C    3.991 --     2 C    1.022    21 H    0.980    20 H    0.979
                            22 H    0.976
     2   6 C    3.913 --     1 C    1.022    24 H    0.973    23 H    0.969
                             3 O    0.891
     3   8 O    2.436 --     4 P    1.354     2 C    0.891
     4  15 P    5.294 --     5 S    1.564     3 O    1.354     6 O    1.296
                             9 S    0.942
     5  16 S    1.921 --     4 P    1.564     9 S    0.150
     6   8 O    2.401 --     4 P    1.296     7 C    0.908
     7   6 C    3.913 --     8 C    1.021    25 H    0.969    26 H    0.969
                             6 O    0.908
     8   6 C    3.989 --     7 C    1.021    28 H    0.983    27 H    0.981
                            29 H    0.976
     9  16 S    2.270 --    10 C    0.985     4 P    0.942     5 S    0.150
    10   6 C    3.954 --    11 S    0.990     9 S    0.985    31 H    0.969
                            30 H    0.939
    11  16 S    2.271 --    10 C    0.990    12 P    0.952    13 S    0.142
    12  15 P    5.304 --    13 S    1.588    17 O    1.338    14 O    1.307
                            11 S    0.952
    13  16 S    1.921 --    12 P    1.588    11 S    0.142
    14   8 O    2.403 --    12 P    1.307    15 C    0.903
    15   6 C    3.910 --    16 C    1.020    32 H    0.972    33 H    0.968
                            14 O    0.903
    16   6 C    3.989 --    15 C    1.020    34 H    0.984    36 H    0.984
                            35 H    0.980
    17   8 O    2.417 --    12 P    1.338    18 C    0.885
    18   6 C    3.910 --    19 C    1.022    37 H    0.971    38 H    0.965
                            17 O    0.885
    19   6 C    3.989 --    18 C    1.022    41 H    0.984    40 H    0.981
                            39 H    0.979
    20   1 H    0.995 --     1 C    0.979
    21   1 H    0.996 --     1 C    0.980
    22   1 H    0.997 --     1 C    0.976
    23   1 H    0.994 --     2 C    0.969
    24   1 H    0.997 --     2 C    0.973
    25   1 H    0.997 --     7 C    0.969
    26   1 H    0.996 --     7 C    0.969
    27   1 H    0.996 --     8 C    0.981
    28   1 H    0.995 --     8 C    0.983
    29   1 H    0.996 --     8 C    0.976
    30   1 H    0.991 --    10 C    0.939
    31   1 H    0.994 --    10 C    0.969
    32   1 H    0.997 --    15 C    0.972
    33   1 H    0.996 --    15 C    0.968
    34   1 H    0.996 --    16 C    0.984
    35   1 H    0.995 --    16 C    0.980
    36   1 H    0.996 --    16 C    0.984
    37   1 H    0.995 --    18 C    0.971
    38   1 H    0.996 --    18 C    0.965
    39   1 H    0.995 --    19 C    0.979
    40   1 H    0.995 --    19 C    0.981
    41   1 H    0.996 --    19 C    0.984
 ---------------------------------------------------------------------------

Topologies differ in total number of bonds
Writing topology from bond orders to xtbtopo.mol

molecular dipole:
                 x           y           z       tot (Debye)
 q only:       -1.359      -2.493      -0.867
   full:       -1.109      -2.538      -1.339       7.820
molecular quadrupole (traceless):
                xx          xy          yy          xz          yz          zz
 q only:       17.331     -19.930     -14.838       1.017       1.391      -2.492
  q+dip:       19.008     -21.124     -16.380      -2.066      -0.881      -2.628
   full:       19.412     -21.552     -16.764      -1.869      -0.563      -2.648


           -------------------------------------------------
          | TOTAL ENERGY              -65.007149701631 Eh   |
          | GRADIENT NORM               0.044777038385 Eh/α |
          | HOMO-LUMO GAP               2.765810772168 eV   |
           -------------------------------------------------

------------------------------------------------------------------------
 * finished run on 2025/04/09 at 05:20:48.613     
------------------------------------------------------------------------
 total:
 * wall-time:     0 d,  0 h,  0 min,  0.122 sec
 *  cpu-time:     0 d,  0 h,  0 min,  0.070 sec
 * ratio c/w:     0.570 speedup
 SCF:
 * wall-time:     0 d,  0 h,  0 min,  0.063 sec
 *  cpu-time:     0 d,  0 h,  0 min,  0.056 sec
 * ratio c/w:     0.890 speedup

