      -----------------------------------------------------------      
     |                   =====================                   |     
     |                           x T B                           |     
     |                   =====================                   |     
     |                         S. Grimme                         |     
     |          Mulliken Center for Theoretical Chemistry        |     
     |                    University of Bonn                     |     
      -----------------------------------------------------------      

   * xtb version 6.7.1 (edcfbbe) compiled by 'albert@albert-system' on 2024-07-22

   xtb is free software: you can redistribute it and/or modify it under
   the terms of the GNU Lesser General Public License as published by
   the Free Software Foundation, either version 3 of the License, or
   (at your option) any later version.
   
   xtb is distributed in the hope that it will be useful,
   but WITHOUT ANY WARRANTY; without even the implied warranty of
   MERCHANTABILITY or FITNESS FOR A PARTICULAR PURPOSE.  See the
   GNU Lesser General Public License for more details.
   
   Cite this work as:
   * C. Bannwarth, E. Caldeweyher, S. Ehlert, A. Hansen, P. Pracht,
     J. Seibert, S. Spicher, S. Grimme, WIREs Comput. Mol. Sci., 2020, 11,
     e01493. DOI: 10.1002/wcms.1493
   
   for GFN2-xTB:
   * C. Bannwarth, S. Ehlert and S. Grimme., J. Chem. Theory Comput., 2019,
     15, 1652-1671. DOI: 10.1021/acs.jctc.8b01176
   for GFN1-xTB:
   * S. Grimme, C. Bannwarth, P. Shushkov, J. Chem. Theory Comput., 2017,
     13, 1989-2009. DOI: 10.1021/acs.jctc.7b00118
   for GFN0-xTB:
   * P. Pracht, E. Caldeweyher, S. Ehlert, S. Grimme, ChemRxiv, 2019, preprint.
     DOI: 10.26434/chemrxiv.8326202.v1
   for GFN-FF:
   * S. Spicher and S. Grimme, Angew. Chem. Int. Ed., 2020, 59, 15665-15673.
     DOI: 10.1002/anie.202004239
   
   for ALPB and GBSA implicit solvation:
   * S. Ehlert, M. Stahn, S. Spicher, S. Grimme, J. Chem. Theory Comput.,
     2021, 17, 4250-4261. DOI: 10.1021/acs.jctc.1c00471
   
   for ddCOSMO and CPCM-X implicit solvation:
   * M. Stahn, S. Ehlert, S. Grimme, J. Phys. Chem. A,
     2023, XX, XXXX-XXXX. DOI: 10.1021/acs.jpca.3c04382
   
   for DFT-D4:
   * E. Caldeweyher, C. Bannwarth and S. Grimme, J. Chem. Phys., 2017,
     147, 034112. DOI: 10.1063/1.4993215
   * E. Caldeweyher, S. Ehlert, A. Hansen, H. Neugebauer, S. Spicher,
     C. Bannwarth and S. Grimme, J. Chem. Phys., 2019, 150, 154122.
     DOI: 10.1063/1.5090222
   * E. Caldeweyher, J.-M. Mewes, S. Ehlert and S. Grimme, Phys. Chem. Chem. Phys.
     2020, 22, 8499-8512. DOI: 10.1039/D0CP00502A
   
   for sTDA-xTB:
   * S. Grimme and C. Bannwarth, J. Chem. Phys., 2016, 145, 054103.
     DOI: 10.1063/1.4959605
   
   in the mass-spec context:
   * V. Asgeirsson, C. Bauer and S. Grimme, Chem. Sci., 2017, 8, 4879.
     DOI: 10.1039/c7sc00601b
   * J. Koopman and S. Grimme, ACS Omega 2019, 4, 12, 15120-15133.
     DOI: 10.1021/acsomega.9b02011
   
   for metadynamics refer to:
   * S. Grimme, J. Chem. Theory Comput., 2019, 155, 2847-2862
     DOI: 10.1021/acs.jctc.9b00143
   
   for SPH calculations refer to:
   * S. Spicher and S. Grimme, J. Chem. Theory Comput., 2021, 17, 1701-1714
     DOI: 10.1021/acs.jctc.0c01306
   
   for ONIOM refer to:
   * C. Plett, A. Katbashev, S. Ehlert, S. Grimme, M. Bursch,
     Phys. Chem. Chem. Phys., 2023, 25, 17860-17868. DOI: 10.1039/D3CP02178E
   
   for DIPRO refer to:
   * J. Kohn, N. Gildemeister, S. Grimme, D. Fazzi, A. Hansen,
     J. Chem. Phys., 2023, just accepted.
   
   for PTB refer to:
   * S. Grimme, M. Mueller, A. Hansen, J. Chem. Phys., 2023, 158, 124111.
     DOI: 10.1063/5.0137838
   
   with help from (in alphabetical order)
   P. Atkinson, C. Bannwarth, F. Bohle, G. Brandenburg, E. Caldeweyher
   M. Checinski, S. Dohm, S. Ehlert, S. Ehrlich, I. Gerasimov, C. Hölzer
   A. Katbashev, J. Kohn, J. Koopman, C. Lavigne, S. Lehtola, F. März, M. Müller,
   F. Musil, H. Neugebauer, J. Pisarek, C. Plett, P. Pracht, F. Pultar,
   J. Seibert, P. Shushkov, S. Spicher, M. Stahn, M. Steiner, T. Strunk,
   J. Stückrath, T. Rose, and J. Unsleber
   
 * started run on 2025/04/09 at 05:20:49.205     
   ID    Z sym.   atoms
    1    6 C      1, 2, 7, 8, 10, 15, 16, 18, 19
    2    8 O      3, 6, 14, 17
    3   15 P      4, 12
    4   16 S      5, 9, 11, 13
    5    1 H      20-41

           -------------------------------------------------
          |                Calculation Setup                |
           -------------------------------------------------

          program call               : /srv/scratch/z5358697/.xtb/bin/xtb gas.coord --gfn2 --sp --chrg 0 --norestart --parallel 1
          hostname                   : k163
          coordinate file            : gas.coord
          omp threads                :                     1


           -------------------------------------------------
          |                 G F N 2 - x T B                 |
           -------------------------------------------------

        Reference                      10.1021/acs.jctc.8b01176
      * Hamiltonian:
        H0-scaling (s, p, d)           1.850000    2.230000    2.230000
        zeta-weighting                 0.500000
      * Dispersion:
        s8                             2.700000
        a1                             0.520000
        a2                             5.000000
        s9                             5.000000
      * Repulsion:
        kExp                           1.500000    1.000000
        rExp                           1.000000
      * Coulomb:
        alpha                          2.000000
        third order                    shell-resolved
        anisotropic                    true
        a3                             3.000000
        a5                             4.000000
        cn-shift                       1.200000
        cn-exp                         4.000000
        max-rad                        5.000000


          ...................................................
          :                      SETUP                      :
          :.................................................:
          :  # basis functions                 134          :
          :  # atomic orbitals                 128          :
          :  # shells                           66          :
          :  # electrons                       116          :
          :  max. iterations                   250          :
          :  Hamiltonian                  GFN2-xTB          :
          :  restarted?                      false          :
          :  GBSA solvation                  false          :
          :  PC potential                    false          :
          :  electronic temp.          300.0000000     K    :
          :  accuracy                    1.0000000          :
          :  -> integral cutoff          0.2500000E+02      :
          :  -> integral neglect         0.1000000E-07      :
          :  -> SCF convergence          0.1000000E-05 Eh   :
          :  -> wf. convergence          0.1000000E-03 e    :
          :  Broyden damping             0.4000000          :
          :  net charge                          0          :
          :  unpaired electrons                  0          :
          ...................................................

 iter      E             dE          RMSdq      gap      omega  full diag
   1    -65.3807793 -0.653808E+02  0.652E+00    4.11       0.0  T
   2    -65.5498264 -0.169047E+00  0.435E+00    3.07       1.0  T
   3    -65.5684019 -0.185755E-01  0.145E+00    2.95       1.0  T
   4    -65.5714021 -0.300027E-02  0.561E-01    2.63       1.0  T
   5    -65.5726228 -0.122071E-02  0.281E-01    2.76       1.0  T
   6    -65.5729773 -0.354415E-03  0.127E-01    2.74       1.0  T
   7    -65.5730255 -0.482509E-04  0.486E-02    2.75       1.0  T
   8    -65.5730337 -0.820605E-05  0.218E-02    2.76       1.0  T
   9    -65.5730347 -0.100709E-05  0.544E-03    2.76       2.9  T
  10    -65.5730348 -0.769704E-07  0.262E-03    2.76       6.0  T
  11    -65.5730348 -0.821277E-08  0.557E-04    2.76      28.0  T
  12    -65.5730348 -0.857156E-09  0.240E-04    2.76      65.1  T

   *** convergence criteria satisfied after 12 iterations ***

         #    Occupation            Energy/Eh            Energy/eV
      -------------------------------------------------------------
         1        2.0000           -0.7596553             -20.6713
       ...           ...                  ...                  ...
        52        2.0000           -0.4416936             -12.0191
        53        2.0000           -0.4087608             -11.1229
        54        2.0000           -0.4006323             -10.9018
        55        2.0000           -0.3758227             -10.2267
        56        2.0000           -0.3727863             -10.1440
        57        2.0000           -0.3696688             -10.0592
        58        2.0000           -0.3670901              -9.9890 (HOMO)
        59                         -0.2657685              -7.2319 (LUMO)
        60                         -0.2355487              -6.4096
        61                         -0.2175999              -5.9212
        62                         -0.1933072              -5.2602
        63                         -0.1568867              -4.2691
       ...                                ...                  ...
       128                          1.3241685              36.0325
      -------------------------------------------------------------
                  HL-Gap            0.1013216 Eh            2.7571 eV
             Fermi-level           -0.3164293 Eh           -8.6105 eV

 SCC (total)                   0 d,  0 h,  0 min,  0.060 sec
 SCC setup                      ...        0 min,  0.000 sec (  0.449%)
 Dispersion                     ...        0 min,  0.000 sec (  0.521%)
 classical contributions        ...        0 min,  0.000 sec (  0.099%)
 integral evaluation            ...        0 min,  0.011 sec ( 18.338%)
 iterations                     ...        0 min,  0.025 sec ( 42.614%)
 molecular gradient             ...        0 min,  0.022 sec ( 37.601%)
 printout                       ...        0 min,  0.000 sec (  0.352%)

         :::::::::::::::::::::::::::::::::::::::::::::::::::::
         ::                     SUMMARY                     ::
         :::::::::::::::::::::::::::::::::::::::::::::::::::::
         :: total energy             -65.012616525970 Eh    ::
         :: gradient norm              0.029244230550 Eh/a0 ::
         :: HOMO-LUMO gap              2.757101400707 eV    ::
         ::.................................................::
         :: SCC energy               -65.571810730620 Eh    ::
         :: -> isotropic ES            0.108528449469 Eh    ::
         :: -> anisotropic ES         -0.010170866395 Eh    ::
         :: -> anisotropic XC          0.031122179872 Eh    ::
         :: -> dispersion             -0.055768706978 Eh    ::
         :: repulsion energy           0.559194204650 Eh    ::
         :: add. restraining           0.000000000000 Eh    ::
         :: total charge              -0.000000000000 e     ::
         :::::::::::::::::::::::::::::::::::::::::::::::::::::

           -------------------------------------------------
          |                Property Printout                |
           -------------------------------------------------

    * Orbital Energies and Occupations

         #    Occupation            Energy/Eh            Energy/eV
      -------------------------------------------------------------
         1        2.0000           -0.7596553             -20.6713
       ...           ...                  ...                  ...
        46        2.0000           -0.4653503             -12.6628
        47        2.0000           -0.4648428             -12.6490
        48        2.0000           -0.4576542             -12.4534
        49        2.0000           -0.4531200             -12.3300
        50        2.0000           -0.4493426             -12.2272
        51        2.0000           -0.4467385             -12.1564
        52        2.0000           -0.4416936             -12.0191
        53        2.0000           -0.4087608             -11.1229
        54        2.0000           -0.4006323             -10.9018
        55        2.0000           -0.3758227             -10.2267
        56        2.0000           -0.3727863             -10.1440
        57        2.0000           -0.3696688             -10.0592
        58        2.0000           -0.3670901              -9.9890 (HOMO)
        59                         -0.2657685              -7.2319 (LUMO)
        60                         -0.2355487              -6.4096
        61                         -0.2175999              -5.9212
        62                         -0.1933072              -5.2602
        63                         -0.1568867              -4.2691
        64                         -0.1527906              -4.1576
        65                         -0.1469403              -3.9984
        66                         -0.1407210              -3.8292
        67                         -0.1224679              -3.3325
        68                         -0.1149139              -3.1270
        69                         -0.0337227              -0.9176
       ...                                ...                  ...
       128                          1.3241685              36.0325
      -------------------------------------------------------------
                  HL-Gap            0.1013216 Eh            2.7571 eV
             Fermi-level           -0.3164293 Eh           -8.6105 eV

     #   Z          covCN         q      C6AA      α(0)
     1   6 C        3.751    -0.118    22.817     6.812
     2   6 C        3.864     0.082    19.181     6.228
     3   8 O        1.655    -0.251    18.170     5.754
     4  15 P        3.934     0.379   144.498    21.593
     5  16 S        0.926    -0.416   157.375    21.219
     6   8 O        1.655    -0.253    18.205     5.760
     7   6 C        3.878     0.088    19.081     6.211
     8   6 C        3.751    -0.112    22.700     6.795
     9  16 S        1.976    -0.128   146.444    20.368
    10   6 C        3.801     0.036    19.970     6.363
    11  16 S        2.043    -0.117   145.939    20.332
    12  15 P        3.858     0.393   143.942    21.552
    13  16 S        0.926    -0.416   157.392    21.220
    14   8 O        1.655    -0.246    18.088     5.741
    15   6 C        3.870     0.092    19.027     6.202
    16   6 C        3.751    -0.114    22.747     6.802
    17   8 O        1.655    -0.263    18.375     5.787
    18   6 C        3.862     0.082    19.174     6.227
    19   6 C        3.751    -0.116    22.787     6.808
    20   1 H        0.925     0.061     2.192     2.315
    21   1 H        0.925     0.061     2.190     2.314
    22   1 H        0.925     0.061     2.182     2.310
    23   1 H        0.924     0.062     2.175     2.306
    24   1 H        0.924     0.063     2.159     2.298
    25   1 H        0.924     0.061     2.189     2.314
    26   1 H        0.924     0.075     2.034     2.230
    27   1 H        0.925     0.056     2.242     2.342
    28   1 H        0.925     0.058     2.227     2.334
    29   1 H        0.925     0.059     2.206     2.323
    30   1 H        0.925     0.083     1.949     2.183
    31   1 H        0.925     0.089     1.888     2.149
    32   1 H        0.924     0.059     2.209     2.324
    33   1 H        0.924     0.050     2.322     2.383
    34   1 H        0.925     0.069     2.092     2.262
    35   1 H        0.925     0.058     2.217     2.329
    36   1 H        0.925     0.065     2.146     2.291
    37   1 H        0.924     0.063     2.163     2.300
    38   1 H        0.924     0.062     2.176     2.307
    39   1 H        0.925     0.058     2.224     2.332
    40   1 H        0.925     0.061     2.183     2.311
    41   1 H        0.924     0.062     2.172     2.305

 Mol. C6AA /au·bohr⁶  :      26557.026955
 Mol. C8AA /au·bohr⁸  :     863159.015553
 Mol. α(0) /au        :        258.331228


Wiberg/Mayer (AO) data.
largest (>0.10) Wiberg bond orders for each atom

 ---------------------------------------------------------------------------
     #   Z sym  total        # sym  WBO       # sym  WBO       # sym  WBO
 ---------------------------------------------------------------------------
     1   6 C    3.991 --     2 C    1.022    21 H    0.983    20 H    0.980
                            22 H    0.976
     2   6 C    3.911 --     1 C    1.022    24 H    0.970    23 H    0.968
                             3 O    0.908
     3   8 O    2.407 --     4 P    1.305     2 C    0.908
     4  15 P    5.281 --     5 S    1.537     3 O    1.305     6 O    1.292
                             9 S    0.997
     5  16 S    1.868 --     4 P    1.537     9 S    0.140
     6   8 O    2.396 --     4 P    1.292     7 C    0.894
     7   6 C    3.905 --     8 C    1.023    25 H    0.966    26 H    0.964
                             6 O    0.894
     8   6 C    3.992 --     7 C    1.023    27 H    0.984    29 H    0.980
                            28 H    0.976
     9  16 S    2.286 --     4 P    0.997    10 C    0.975     5 S    0.140
    10   6 C    3.963 --    11 S    0.989     9 S    0.975    30 H    0.966
                            31 H    0.965
    11  16 S    2.279 --    10 C    0.989    12 P    0.973    13 S    0.104
    12  15 P    5.258 --    13 S    1.561    14 O    1.311    17 O    1.274
                            11 S    0.973
    13  16 S    1.864 --    12 P    1.561    11 S    0.104
    14   8 O    2.398 --    12 P    1.311    15 C    0.889
    15   6 C    3.907 --    16 C    1.020    33 H    0.974    32 H    0.964
                            14 O    0.889
    16   6 C    3.988 --    15 C    1.020    36 H    0.984    34 H    0.982
                            35 H    0.979
    17   8 O    2.392 --    12 P    1.274    18 C    0.911
    18   6 C    3.911 --    19 C    1.021    37 H    0.969    38 H    0.968
                            17 O    0.911
    19   6 C    3.991 --    18 C    1.021    39 H    0.984    40 H    0.981
                            41 H    0.975
    20   1 H    0.996 --     1 C    0.980
    21   1 H    0.996 --     1 C    0.983
    22   1 H    0.996 --     1 C    0.976
    23   1 H    0.996 --     2 C    0.968
    24   1 H    0.996 --     2 C    0.970
    25   1 H    0.996 --     7 C    0.966
    26   1 H    0.994 --     7 C    0.964
    27   1 H    0.997 --     8 C    0.984
    28   1 H    0.996 --     8 C    0.976
    29   1 H    0.995 --     8 C    0.980
    30   1 H    0.993 --    10 C    0.966
    31   1 H    0.989 --    10 C    0.965
    32   1 H    0.996 --    15 C    0.964
    33   1 H    0.997 --    15 C    0.974
    34   1 H    0.995 --    16 C    0.982
    35   1 H    0.995 --    16 C    0.979
    36   1 H    0.996 --    16 C    0.984
    37   1 H    0.996 --    18 C    0.969
    38   1 H    0.996 --    18 C    0.968
    39   1 H    0.997 --    19 C    0.984
    40   1 H    0.996 --    19 C    0.981
    41   1 H    0.996 --    19 C    0.975
 ---------------------------------------------------------------------------

Topologies differ in total number of bonds
Writing topology from bond orders to xtbtopo.mol

molecular dipole:
                 x           y           z       tot (Debye)
 q only:        0.149      -0.812       1.539
   full:       -0.061      -0.924       1.960       5.510
molecular quadrupole (traceless):
                xx          xy          yy          xz          yz          zz
 q only:       12.398      13.434      -2.733      10.734       1.829      -9.665
  q+dip:       12.496      19.778      -1.694       7.853       2.684     -10.802
   full:       13.746      19.412      -2.497       8.959       2.407     -11.249


           -------------------------------------------------
          | TOTAL ENERGY              -65.012616525970 Eh   |
          | GRADIENT NORM               0.029244230550 Eh/α |
          | HOMO-LUMO GAP               2.757101400707 eV   |
           -------------------------------------------------

------------------------------------------------------------------------
 * finished run on 2025/04/09 at 05:20:49.318     
------------------------------------------------------------------------
 total:
 * wall-time:     0 d,  0 h,  0 min,  0.113 sec
 *  cpu-time:     0 d,  0 h,  0 min,  0.071 sec
 * ratio c/w:     0.628 speedup
 SCF:
 * wall-time:     0 d,  0 h,  0 min,  0.060 sec
 *  cpu-time:     0 d,  0 h,  0 min,  0.057 sec
 * ratio c/w:     0.953 speedup

