      -----------------------------------------------------------      
     |                   =====================                   |     
     |                           x T B                           |     
     |                   =====================                   |     
     |                         S. Grimme                         |     
     |          Mulliken Center for Theoretical Chemistry        |     
     |                    University of Bonn                     |     
      -----------------------------------------------------------      

   * xtb version 6.7.1 (edcfbbe) compiled by 'albert@albert-system' on 2024-07-22

   xtb is free software: you can redistribute it and/or modify it under
   the terms of the GNU Lesser General Public License as published by
   the Free Software Foundation, either version 3 of the License, or
   (at your option) any later version.
   
   xtb is distributed in the hope that it will be useful,
   but WITHOUT ANY WARRANTY; without even the implied warranty of
   MERCHANTABILITY or FITNESS FOR A PARTICULAR PURPOSE.  See the
   GNU Lesser General Public License for more details.
   
   Cite this work as:
   * C. Bannwarth, E. Caldeweyher, S. Ehlert, A. Hansen, P. Pracht,
     J. Seibert, S. Spicher, S. Grimme, WIREs Comput. Mol. Sci., 2020, 11,
     e01493. DOI: 10.1002/wcms.1493
   
   for GFN2-xTB:
   * C. Bannwarth, S. Ehlert and S. Grimme., J. Chem. Theory Comput., 2019,
     15, 1652-1671. DOI: 10.1021/acs.jctc.8b01176
   for GFN1-xTB:
   * S. Grimme, C. Bannwarth, P. Shushkov, J. Chem. Theory Comput., 2017,
     13, 1989-2009. DOI: 10.1021/acs.jctc.7b00118
   for GFN0-xTB:
   * P. Pracht, E. Caldeweyher, S. Ehlert, S. Grimme, ChemRxiv, 2019, preprint.
     DOI: 10.26434/chemrxiv.8326202.v1
   for GFN-FF:
   * S. Spicher and S. Grimme, Angew. Chem. Int. Ed., 2020, 59, 15665-15673.
     DOI: 10.1002/anie.202004239
   
   for ALPB and GBSA implicit solvation:
   * S. Ehlert, M. Stahn, S. Spicher, S. Grimme, J. Chem. Theory Comput.,
     2021, 17, 4250-4261. DOI: 10.1021/acs.jctc.1c00471
   
   for ddCOSMO and CPCM-X implicit solvation:
   * M. Stahn, S. Ehlert, S. Grimme, J. Phys. Chem. A,
     2023, XX, XXXX-XXXX. DOI: 10.1021/acs.jpca.3c04382
   
   for DFT-D4:
   * E. Caldeweyher, C. Bannwarth and S. Grimme, J. Chem. Phys., 2017,
     147, 034112. DOI: 10.1063/1.4993215
   * E. Caldeweyher, S. Ehlert, A. Hansen, H. Neugebauer, S. Spicher,
     C. Bannwarth and S. Grimme, J. Chem. Phys., 2019, 150, 154122.
     DOI: 10.1063/1.5090222
   * E. Caldeweyher, J.-M. Mewes, S. Ehlert and S. Grimme, Phys. Chem. Chem. Phys.
     2020, 22, 8499-8512. DOI: 10.1039/D0CP00502A
   
   for sTDA-xTB:
   * S. Grimme and C. Bannwarth, J. Chem. Phys., 2016, 145, 054103.
     DOI: 10.1063/1.4959605
   
   in the mass-spec context:
   * V. Asgeirsson, C. Bauer and S. Grimme, Chem. Sci., 2017, 8, 4879.
     DOI: 10.1039/c7sc00601b
   * J. Koopman and S. Grimme, ACS Omega 2019, 4, 12, 15120-15133.
     DOI: 10.1021/acsomega.9b02011
   
   for metadynamics refer to:
   * S. Grimme, J. Chem. Theory Comput., 2019, 155, 2847-2862
     DOI: 10.1021/acs.jctc.9b00143
   
   for SPH calculations refer to:
   * S. Spicher and S. Grimme, J. Chem. Theory Comput., 2021, 17, 1701-1714
     DOI: 10.1021/acs.jctc.0c01306
   
   for ONIOM refer to:
   * C. Plett, A. Katbashev, S. Ehlert, S. Grimme, M. Bursch,
     Phys. Chem. Chem. Phys., 2023, 25, 17860-17868. DOI: 10.1039/D3CP02178E
   
   for DIPRO refer to:
   * J. Kohn, N. Gildemeister, S. Grimme, D. Fazzi, A. Hansen,
     J. Chem. Phys., 2023, just accepted.
   
   for PTB refer to:
   * S. Grimme, M. Mueller, A. Hansen, J. Chem. Phys., 2023, 158, 124111.
     DOI: 10.1063/5.0137838
   
   with help from (in alphabetical order)
   P. Atkinson, C. Bannwarth, F. Bohle, G. Brandenburg, E. Caldeweyher
   M. Checinski, S. Dohm, S. Ehlert, S. Ehrlich, I. Gerasimov, C. Hölzer
   A. Katbashev, J. Kohn, J. Koopman, C. Lavigne, S. Lehtola, F. März, M. Müller,
   F. Musil, H. Neugebauer, J. Pisarek, C. Plett, P. Pracht, F. Pultar,
   J. Seibert, P. Shushkov, S. Spicher, M. Stahn, M. Steiner, T. Strunk,
   J. Stückrath, T. Rose, and J. Unsleber
   
 * started run on 2025/04/09 at 05:20:51.225     
   ID    Z sym.   atoms
    1    6 C      1, 2, 7, 8, 10, 15, 16, 18, 19
    2    8 O      3, 6, 14, 17
    3   15 P      4, 12
    4   16 S      5, 9, 11, 13
    5    1 H      20-41

           -------------------------------------------------
          |                Calculation Setup                |
           -------------------------------------------------

          program call               : /srv/scratch/z5358697/.xtb/bin/xtb gas.coord --gfn2 --sp --chrg 0 --norestart --parallel 1
          hostname                   : k163
          coordinate file            : gas.coord
          omp threads                :                     1


           -------------------------------------------------
          |                 G F N 2 - x T B                 |
           -------------------------------------------------

        Reference                      10.1021/acs.jctc.8b01176
      * Hamiltonian:
        H0-scaling (s, p, d)           1.850000    2.230000    2.230000
        zeta-weighting                 0.500000
      * Dispersion:
        s8                             2.700000
        a1                             0.520000
        a2                             5.000000
        s9                             5.000000
      * Repulsion:
        kExp                           1.500000    1.000000
        rExp                           1.000000
      * Coulomb:
        alpha                          2.000000
        third order                    shell-resolved
        anisotropic                    true
        a3                             3.000000
        a5                             4.000000
        cn-shift                       1.200000
        cn-exp                         4.000000
        max-rad                        5.000000


          ...................................................
          :                      SETUP                      :
          :.................................................:
          :  # basis functions                 134          :
          :  # atomic orbitals                 128          :
          :  # shells                           66          :
          :  # electrons                       116          :
          :  max. iterations                   250          :
          :  Hamiltonian                  GFN2-xTB          :
          :  restarted?                      false          :
          :  GBSA solvation                  false          :
          :  PC potential                    false          :
          :  electronic temp.          300.0000000     K    :
          :  accuracy                    1.0000000          :
          :  -> integral cutoff          0.2500000E+02      :
          :  -> integral neglect         0.1000000E-07      :
          :  -> SCF convergence          0.1000000E-05 Eh   :
          :  -> wf. convergence          0.1000000E-03 e    :
          :  Broyden damping             0.4000000          :
          :  net charge                          0          :
          :  unpaired electrons                  0          :
          ...................................................

 iter      E             dE          RMSdq      gap      omega  full diag
   1    -65.3855141 -0.653855E+02  0.633E+00    4.09       0.0  T
   2    -65.5529354 -0.167421E+00  0.394E+00    3.07       1.0  T
   3    -65.5714249 -0.184894E-01  0.135E+00    2.85       1.0  T
   4    -65.5737108 -0.228590E-02  0.544E-01    2.62       1.0  T
   5    -65.5745790 -0.868214E-03  0.262E-01    2.73       1.0  T
   6    -65.5748462 -0.267243E-03  0.124E-01    2.72       1.0  T
   7    -65.5749013 -0.550323E-04  0.464E-02    2.73       1.0  T
   8    -65.5749090 -0.769914E-05  0.206E-02    2.73       1.0  T
   9    -65.5749099 -0.966608E-06  0.531E-03    2.73       2.9  T
  10    -65.5749100 -0.872686E-07  0.265E-03    2.73       5.9  T
  11    -65.5749100 -0.727481E-08  0.463E-04    2.73      33.8  T
  12    -65.5749100 -0.483084E-09  0.241E-04    2.73      64.7  T

   *** convergence criteria satisfied after 12 iterations ***

         #    Occupation            Energy/Eh            Energy/eV
      -------------------------------------------------------------
         1        2.0000           -0.7583397             -20.6355
       ...           ...                  ...                  ...
        52        2.0000           -0.4429212             -12.0525
        53        2.0000           -0.4096928             -11.1483
        54        2.0000           -0.4001454             -10.8885
        55        2.0000           -0.3741415             -10.1809
        56        2.0000           -0.3729418             -10.1483
        57        2.0000           -0.3714574             -10.1079
        58        2.0000           -0.3676191             -10.0034 (HOMO)
        59                         -0.2672291              -7.2717 (LUMO)
        60                         -0.2377077              -6.4684
        61                         -0.2119826              -5.7683
        62                         -0.1855342              -5.0486
        63                         -0.1740231              -4.7354
       ...                                ...                  ...
       128                          1.3022491              35.4360
      -------------------------------------------------------------
                  HL-Gap            0.1003900 Eh            2.7318 eV
             Fermi-level           -0.3174241 Eh           -8.6375 eV

 SCC (total)                   0 d,  0 h,  0 min,  0.066 sec
 SCC setup                      ...        0 min,  0.000 sec (  0.427%)
 Dispersion                     ...        0 min,  0.000 sec (  0.486%)
 classical contributions        ...        0 min,  0.000 sec (  0.093%)
 integral evaluation            ...        0 min,  0.018 sec ( 26.884%)
 iterations                     ...        0 min,  0.025 sec ( 38.279%)
 molecular gradient             ...        0 min,  0.022 sec ( 33.485%)
 printout                       ...        0 min,  0.000 sec (  0.326%)

         :::::::::::::::::::::::::::::::::::::::::::::::::::::
         ::                     SUMMARY                     ::
         :::::::::::::::::::::::::::::::::::::::::::::::::::::
         :: total energy             -65.013340921279 Eh    ::
         :: gradient norm              0.027935741234 Eh/a0 ::
         :: HOMO-LUMO gap              2.731750049986 eV    ::
         ::.................................................::
         :: SCC energy               -65.573494357018 Eh    ::
         :: -> isotropic ES            0.106692382960 Eh    ::
         :: -> anisotropic ES         -0.009328871290 Eh    ::
         :: -> anisotropic XC          0.030709722023 Eh    ::
         :: -> dispersion             -0.055655737844 Eh    ::
         :: repulsion energy           0.560153435739 Eh    ::
         :: add. restraining           0.000000000000 Eh    ::
         :: total charge               0.000000000000 e     ::
         :::::::::::::::::::::::::::::::::::::::::::::::::::::

           -------------------------------------------------
          |                Property Printout                |
           -------------------------------------------------

    * Orbital Energies and Occupations

         #    Occupation            Energy/Eh            Energy/eV
      -------------------------------------------------------------
         1        2.0000           -0.7583397             -20.6355
       ...           ...                  ...                  ...
        46        2.0000           -0.4644321             -12.6378
        47        2.0000           -0.4597650             -12.5108
        48        2.0000           -0.4586396             -12.4802
        49        2.0000           -0.4547362             -12.3740
        50        2.0000           -0.4466842             -12.1549
        51        2.0000           -0.4459368             -12.1346
        52        2.0000           -0.4429212             -12.0525
        53        2.0000           -0.4096928             -11.1483
        54        2.0000           -0.4001454             -10.8885
        55        2.0000           -0.3741415             -10.1809
        56        2.0000           -0.3729418             -10.1483
        57        2.0000           -0.3714574             -10.1079
        58        2.0000           -0.3676191             -10.0034 (HOMO)
        59                         -0.2672291              -7.2717 (LUMO)
        60                         -0.2377077              -6.4684
        61                         -0.2119826              -5.7683
        62                         -0.1855342              -5.0486
        63                         -0.1740231              -4.7354
        64                         -0.1528757              -4.1600
        65                         -0.1415496              -3.8518
        66                         -0.1296386              -3.5276
        67                         -0.1242223              -3.3803
        68                         -0.1198637              -3.2617
        69                         -0.0369863              -1.0064
       ...                                ...                  ...
       128                          1.3022491              35.4360
      -------------------------------------------------------------
                  HL-Gap            0.1003900 Eh            2.7318 eV
             Fermi-level           -0.3174241 Eh           -8.6375 eV

     #   Z          covCN         q      C6AA      α(0)
     1   6 C        3.751    -0.113    22.715     6.797
     2   6 C        3.857     0.088    19.094     6.215
     3   8 O        1.656    -0.247    18.110     5.745
     4  15 P        3.823     0.385   144.264    21.576
     5  16 S        0.926    -0.391   156.194    21.139
     6   8 O        1.654    -0.247    18.113     5.745
     7   6 C        3.817     0.082    19.202     6.237
     8   6 C        3.751    -0.118    22.829     6.814
     9  16 S        2.021    -0.149   147.334    20.429
    10   6 C        3.819     0.042    19.847     6.340
    11  16 S        2.004    -0.140   146.961    20.403
    12  15 P        3.896     0.390   144.068    21.561
    13  16 S        0.925    -0.419   157.526    21.229
    14   8 O        1.656    -0.252    18.186     5.757
    15   6 C        3.871     0.083    19.166     6.225
    16   6 C        3.751    -0.116    22.783     6.807
    17   8 O        1.655    -0.249    18.150     5.751
    18   6 C        3.878     0.084    19.136     6.220
    19   6 C        3.751    -0.114    22.747     6.802
    20   1 H        0.925     0.056     2.242     2.341
    21   1 H        0.925     0.057     2.236     2.339
    22   1 H        0.924     0.063     2.168     2.303
    23   1 H        0.924     0.063     2.164     2.301
    24   1 H        0.924     0.059     2.210     2.325
    25   1 H        0.924     0.068     2.111     2.272
    26   1 H        0.924     0.056     2.248     2.344
    27   1 H        0.925     0.080     1.979     2.200
    28   1 H        0.925     0.058     2.224     2.332
    29   1 H        0.925     0.057     2.240     2.340
    30   1 H        0.925     0.091     1.873     2.140
    31   1 H        0.925     0.078     2.005     2.214
    32   1 H        0.924     0.061     2.191     2.315
    33   1 H        0.924     0.065     2.144     2.290
    34   1 H        0.925     0.061     2.188     2.313
    35   1 H        0.925     0.064     2.158     2.297
    36   1 H        0.924     0.057     2.235     2.338
    37   1 H        0.924     0.065     2.147     2.291
    38   1 H        0.924     0.063     2.160     2.298
    39   1 H        0.925     0.062     2.176     2.307
    40   1 H        0.925     0.060     2.201     2.320
    41   1 H        0.925     0.061     2.185     2.312

 Mol. C6AA /au·bohr⁶  :      26553.314733
 Mol. C8AA /au·bohr⁸  :     863250.338149
 Mol. α(0) /au        :        258.324819


Wiberg/Mayer (AO) data.
largest (>0.10) Wiberg bond orders for each atom

 ---------------------------------------------------------------------------
     #   Z sym  total        # sym  WBO       # sym  WBO       # sym  WBO
 ---------------------------------------------------------------------------
     1   6 C    3.992 --     2 C    1.022    20 H    0.984    21 H    0.981
                            22 H    0.975
     2   6 C    3.913 --     1 C    1.022    23 H    0.968    24 H    0.967
                             3 O    0.902
     3   8 O    2.397 --     4 P    1.279     2 C    0.902
     4  15 P    5.292 --     5 S    1.583     6 O    1.321     3 O    1.279
                             9 S    0.975
     5  16 S    1.903 --     4 P    1.583     9 S    0.129
     6   8 O    2.404 --     4 P    1.321     7 C    0.889
     7   6 C    3.912 --     8 C    1.022    25 H    0.969    26 H    0.966
                             6 O    0.889
     8   6 C    3.987 --     7 C    1.022    28 H    0.983    29 H    0.979
                            27 H    0.974
     9  16 S    2.297 --    10 C    0.989     4 P    0.975     5 S    0.129
    10   6 C    3.960 --     9 S    0.989    11 S    0.982    31 H    0.968
                            30 H    0.955
    11  16 S    2.265 --    10 C    0.982    12 P    0.959    13 S    0.138
    12  15 P    5.242 --    13 S    1.530    17 O    1.312    14 O    1.295
                            11 S    0.959
    13  16 S    1.862 --    12 P    1.530    11 S    0.138
    14   8 O    2.402 --    12 P    1.295    15 C    0.911
    15   6 C    3.913 --    16 C    1.021    33 H    0.969    32 H    0.966
                            14 O    0.911
    16   6 C    3.991 --    15 C    1.021    35 H    0.983    34 H    0.981
                            36 H    0.972
    17   8 O    2.399 --    12 P    1.312    18 C    0.895
    18   6 C    3.908 --    19 C    1.023    38 H    0.970    37 H    0.966
                            17 O    0.895
    19   6 C    3.991 --    18 C    1.023    41 H    0.984    40 H    0.980
                            39 H    0.977
    20   1 H    0.997 --     1 C    0.984
    21   1 H    0.996 --     1 C    0.981
    22   1 H    0.996 --     1 C    0.975
    23   1 H    0.996 --     2 C    0.968
    24   1 H    0.996 --     2 C    0.967
    25   1 H    0.995 --     7 C    0.969
    26   1 H    0.997 --     7 C    0.966
    27   1 H    0.994 --     8 C    0.974
    28   1 H    0.997 --     8 C    0.983
    29   1 H    0.995 --     8 C    0.979
    30   1 H    0.992 --    10 C    0.955
    31   1 H    0.994 --    10 C    0.968
    32   1 H    0.996 --    15 C    0.966
    33   1 H    0.995 --    15 C    0.969
    34   1 H    0.995 --    16 C    0.981
    35   1 H    0.996 --    16 C    0.983
    36   1 H    0.997 --    16 C    0.972
    37   1 H    0.996 --    18 C    0.966
    38   1 H    0.995 --    18 C    0.970
    39   1 H    0.996 --    19 C    0.977
    40   1 H    0.995 --    19 C    0.980
    41   1 H    0.996 --    19 C    0.984
 ---------------------------------------------------------------------------

Topologies differ in total number of bonds
Writing topology from bond orders to xtbtopo.mol

molecular dipole:
                 x           y           z       tot (Debye)
 q only:       -1.302      -0.165      -1.309
   full:       -1.583      -0.342      -1.196       5.117
molecular quadrupole (traceless):
                xx          xy          yy          xz          yz          zz
 q only:        0.830      -2.050      14.343     -13.315      -7.410     -15.173
  q+dip:        6.565      -5.811      10.274     -17.883     -10.430     -16.839
   full:        5.465      -4.849      12.397     -17.119     -10.579     -17.862


           -------------------------------------------------
          | TOTAL ENERGY              -65.013340921279 Eh   |
          | GRADIENT NORM               0.027935741234 Eh/α |
          | HOMO-LUMO GAP               2.731750049986 eV   |
           -------------------------------------------------

------------------------------------------------------------------------
 * finished run on 2025/04/09 at 05:20:51.350     
------------------------------------------------------------------------
 total:
 * wall-time:     0 d,  0 h,  0 min,  0.125 sec
 *  cpu-time:     0 d,  0 h,  0 min,  0.070 sec
 * ratio c/w:     0.560 speedup
 SCF:
 * wall-time:     0 d,  0 h,  0 min,  0.066 sec
 *  cpu-time:     0 d,  0 h,  0 min,  0.057 sec
 * ratio c/w:     0.860 speedup

