      -----------------------------------------------------------      
     |                   =====================                   |     
     |                           x T B                           |     
     |                   =====================                   |     
     |                         S. Grimme                         |     
     |          Mulliken Center for Theoretical Chemistry        |     
     |                    University of Bonn                     |     
      -----------------------------------------------------------      

   * xtb version 6.7.1 (edcfbbe) compiled by 'albert@albert-system' on 2024-07-22

   xtb is free software: you can redistribute it and/or modify it under
   the terms of the GNU Lesser General Public License as published by
   the Free Software Foundation, either version 3 of the License, or
   (at your option) any later version.
   
   xtb is distributed in the hope that it will be useful,
   but WITHOUT ANY WARRANTY; without even the implied warranty of
   MERCHANTABILITY or FITNESS FOR A PARTICULAR PURPOSE.  See the
   GNU Lesser General Public License for more details.
   
   Cite this work as:
   * C. Bannwarth, E. Caldeweyher, S. Ehlert, A. Hansen, P. Pracht,
     J. Seibert, S. Spicher, S. Grimme, WIREs Comput. Mol. Sci., 2020, 11,
     e01493. DOI: 10.1002/wcms.1493
   
   for GFN2-xTB:
   * C. Bannwarth, S. Ehlert and S. Grimme., J. Chem. Theory Comput., 2019,
     15, 1652-1671. DOI: 10.1021/acs.jctc.8b01176
   for GFN1-xTB:
   * S. Grimme, C. Bannwarth, P. Shushkov, J. Chem. Theory Comput., 2017,
     13, 1989-2009. DOI: 10.1021/acs.jctc.7b00118
   for GFN0-xTB:
   * P. Pracht, E. Caldeweyher, S. Ehlert, S. Grimme, ChemRxiv, 2019, preprint.
     DOI: 10.26434/chemrxiv.8326202.v1
   for GFN-FF:
   * S. Spicher and S. Grimme, Angew. Chem. Int. Ed., 2020, 59, 15665-15673.
     DOI: 10.1002/anie.202004239
   
   for ALPB and GBSA implicit solvation:
   * S. Ehlert, M. Stahn, S. Spicher, S. Grimme, J. Chem. Theory Comput.,
     2021, 17, 4250-4261. DOI: 10.1021/acs.jctc.1c00471
   
   for ddCOSMO and CPCM-X implicit solvation:
   * M. Stahn, S. Ehlert, S. Grimme, J. Phys. Chem. A,
     2023, XX, XXXX-XXXX. DOI: 10.1021/acs.jpca.3c04382
   
   for DFT-D4:
   * E. Caldeweyher, C. Bannwarth and S. Grimme, J. Chem. Phys., 2017,
     147, 034112. DOI: 10.1063/1.4993215
   * E. Caldeweyher, S. Ehlert, A. Hansen, H. Neugebauer, S. Spicher,
     C. Bannwarth and S. Grimme, J. Chem. Phys., 2019, 150, 154122.
     DOI: 10.1063/1.5090222
   * E. Caldeweyher, J.-M. Mewes, S. Ehlert and S. Grimme, Phys. Chem. Chem. Phys.
     2020, 22, 8499-8512. DOI: 10.1039/D0CP00502A
   
   for sTDA-xTB:
   * S. Grimme and C. Bannwarth, J. Chem. Phys., 2016, 145, 054103.
     DOI: 10.1063/1.4959605
   
   in the mass-spec context:
   * V. Asgeirsson, C. Bauer and S. Grimme, Chem. Sci., 2017, 8, 4879.
     DOI: 10.1039/c7sc00601b
   * J. Koopman and S. Grimme, ACS Omega 2019, 4, 12, 15120-15133.
     DOI: 10.1021/acsomega.9b02011
   
   for metadynamics refer to:
   * S. Grimme, J. Chem. Theory Comput., 2019, 155, 2847-2862
     DOI: 10.1021/acs.jctc.9b00143
   
   for SPH calculations refer to:
   * S. Spicher and S. Grimme, J. Chem. Theory Comput., 2021, 17, 1701-1714
     DOI: 10.1021/acs.jctc.0c01306
   
   for ONIOM refer to:
   * C. Plett, A. Katbashev, S. Ehlert, S. Grimme, M. Bursch,
     Phys. Chem. Chem. Phys., 2023, 25, 17860-17868. DOI: 10.1039/D3CP02178E
   
   for DIPRO refer to:
   * J. Kohn, N. Gildemeister, S. Grimme, D. Fazzi, A. Hansen,
     J. Chem. Phys., 2023, just accepted.
   
   for PTB refer to:
   * S. Grimme, M. Mueller, A. Hansen, J. Chem. Phys., 2023, 158, 124111.
     DOI: 10.1063/5.0137838
   
   with help from (in alphabetical order)
   P. Atkinson, C. Bannwarth, F. Bohle, G. Brandenburg, E. Caldeweyher
   M. Checinski, S. Dohm, S. Ehlert, S. Ehrlich, I. Gerasimov, C. Hölzer
   A. Katbashev, J. Kohn, J. Koopman, C. Lavigne, S. Lehtola, F. März, M. Müller,
   F. Musil, H. Neugebauer, J. Pisarek, C. Plett, P. Pracht, F. Pultar,
   J. Seibert, P. Shushkov, S. Spicher, M. Stahn, M. Steiner, T. Strunk,
   J. Stückrath, T. Rose, and J. Unsleber
   
 * started run on 2025/04/09 at 05:20:48.282     
   ID    Z sym.   atoms
    1    6 C      1, 2, 7, 8, 10, 15, 16, 18, 19
    2    8 O      3, 6, 14, 17
    3   15 P      4, 12
    4   16 S      5, 9, 11, 13
    5    1 H      20-41

           -------------------------------------------------
          |                Calculation Setup                |
           -------------------------------------------------

          program call               : /srv/scratch/z5358697/.xtb/bin/xtb gas.coord --gfn2 --sp --chrg 0 --norestart --parallel 1
          hostname                   : k163
          coordinate file            : gas.coord
          omp threads                :                     1


           -------------------------------------------------
          |                 G F N 2 - x T B                 |
           -------------------------------------------------

        Reference                      10.1021/acs.jctc.8b01176
      * Hamiltonian:
        H0-scaling (s, p, d)           1.850000    2.230000    2.230000
        zeta-weighting                 0.500000
      * Dispersion:
        s8                             2.700000
        a1                             0.520000
        a2                             5.000000
        s9                             5.000000
      * Repulsion:
        kExp                           1.500000    1.000000
        rExp                           1.000000
      * Coulomb:
        alpha                          2.000000
        third order                    shell-resolved
        anisotropic                    true
        a3                             3.000000
        a5                             4.000000
        cn-shift                       1.200000
        cn-exp                         4.000000
        max-rad                        5.000000


          ...................................................
          :                      SETUP                      :
          :.................................................:
          :  # basis functions                 134          :
          :  # atomic orbitals                 128          :
          :  # shells                           66          :
          :  # electrons                       116          :
          :  max. iterations                   250          :
          :  Hamiltonian                  GFN2-xTB          :
          :  restarted?                      false          :
          :  GBSA solvation                  false          :
          :  PC potential                    false          :
          :  electronic temp.          300.0000000     K    :
          :  accuracy                    1.0000000          :
          :  -> integral cutoff          0.2500000E+02      :
          :  -> integral neglect         0.1000000E-07      :
          :  -> SCF convergence          0.1000000E-05 Eh   :
          :  -> wf. convergence          0.1000000E-03 e    :
          :  Broyden damping             0.4000000          :
          :  net charge                          0          :
          :  unpaired electrons                  0          :
          ...................................................

 iter      E             dE          RMSdq      gap      omega  full diag
   1    -65.3832550 -0.653833E+02  0.636E+00    4.19       0.0  T
   2    -65.5534839 -0.170229E+00  0.400E+00    3.10       1.0  T
   3    -65.5723141 -0.188302E-01  0.140E+00    2.90       1.0  T
   4    -65.5745410 -0.222694E-02  0.566E-01    2.67       1.0  T
   5    -65.5752306 -0.689559E-03  0.242E-01    2.78       1.0  T
   6    -65.5753996 -0.169016E-03  0.125E-01    2.75       1.0  T
   7    -65.5754567 -0.571417E-04  0.487E-02    2.77       1.0  T
   8    -65.5754664 -0.966318E-05  0.215E-02    2.77       1.0  T
   9    -65.5754677 -0.134414E-05  0.536E-03    2.77       2.9  T
  10    -65.5754678 -0.919312E-07  0.254E-03    2.77       6.2  T
  11    -65.5754678 -0.495758E-08  0.517E-04    2.77      30.2  T
  12    -65.5754678 -0.692054E-09  0.253E-04    2.77      61.7  T

   *** convergence criteria satisfied after 12 iterations ***

         #    Occupation            Energy/Eh            Energy/eV
      -------------------------------------------------------------
         1        2.0000           -0.7618274             -20.7304
       ...           ...                  ...                  ...
        52        2.0000           -0.4390213             -11.9464
        53        2.0000           -0.4118257             -11.2063
        54        2.0000           -0.4030751             -10.9682
        55        2.0000           -0.3799359             -10.3386
        56        2.0000           -0.3767428             -10.2517
        57        2.0000           -0.3728801             -10.1466
        58        2.0000           -0.3679174             -10.0115 (HOMO)
        59                         -0.2660334              -7.2391 (LUMO)
        60                         -0.2440517              -6.6410
        61                         -0.2072103              -5.6385
        62                         -0.1791473              -4.8748
        63                         -0.1657816              -4.5111
       ...                                ...                  ...
       128                          1.2839604              34.9383
      -------------------------------------------------------------
                  HL-Gap            0.1018840 Eh            2.7724 eV
             Fermi-level           -0.3169754 Eh           -8.6253 eV

 SCC (total)                   0 d,  0 h,  0 min,  0.058 sec
 SCC setup                      ...        0 min,  0.000 sec (  0.459%)
 Dispersion                     ...        0 min,  0.000 sec (  0.535%)
 classical contributions        ...        0 min,  0.000 sec (  0.103%)
 integral evaluation            ...        0 min,  0.010 sec ( 16.856%)
 iterations                     ...        0 min,  0.026 sec ( 43.873%)
 molecular gradient             ...        0 min,  0.022 sec ( 37.787%)
 printout                       ...        0 min,  0.000 sec (  0.358%)

         :::::::::::::::::::::::::::::::::::::::::::::::::::::
         ::                     SUMMARY                     ::
         :::::::::::::::::::::::::::::::::::::::::::::::::::::
         :: total energy             -65.013671225746 Eh    ::
         :: gradient norm              0.031353957230 Eh/a0 ::
         :: HOMO-LUMO gap              2.772406110470 eV    ::
         ::.................................................::
         :: SCC energy               -65.574238701793 Eh    ::
         :: -> isotropic ES            0.104171134338 Eh    ::
         :: -> anisotropic ES         -0.008553635495 Eh    ::
         :: -> anisotropic XC          0.031137387206 Eh    ::
         :: -> dispersion             -0.053697595177 Eh    ::
         :: repulsion energy           0.560567476047 Eh    ::
         :: add. restraining           0.000000000000 Eh    ::
         :: total charge              -0.000000000000 e     ::
         :::::::::::::::::::::::::::::::::::::::::::::::::::::

           -------------------------------------------------
          |                Property Printout                |
           -------------------------------------------------

    * Orbital Energies and Occupations

         #    Occupation            Energy/Eh            Energy/eV
      -------------------------------------------------------------
         1        2.0000           -0.7618274             -20.7304
       ...           ...                  ...                  ...
        46        2.0000           -0.4727174             -12.8633
        47        2.0000           -0.4663539             -12.6901
        48        2.0000           -0.4608575             -12.5406
        49        2.0000           -0.4596025             -12.5064
        50        2.0000           -0.4538014             -12.3486
        51        2.0000           -0.4481775             -12.1955
        52        2.0000           -0.4390213             -11.9464
        53        2.0000           -0.4118257             -11.2063
        54        2.0000           -0.4030751             -10.9682
        55        2.0000           -0.3799359             -10.3386
        56        2.0000           -0.3767428             -10.2517
        57        2.0000           -0.3728801             -10.1466
        58        2.0000           -0.3679174             -10.0115 (HOMO)
        59                         -0.2660334              -7.2391 (LUMO)
        60                         -0.2440517              -6.6410
        61                         -0.2072103              -5.6385
        62                         -0.1791473              -4.8748
        63                         -0.1657816              -4.5111
        64                         -0.1642236              -4.4688
        65                         -0.1538160              -4.1855
        66                         -0.1427915              -3.8856
        67                         -0.1296238              -3.5272
        68                         -0.1183533              -3.2206
        69                         -0.0414311              -1.1274
       ...                                ...                  ...
       128                          1.2839604              34.9383
      -------------------------------------------------------------
                  HL-Gap            0.1018840 Eh            2.7724 eV
             Fermi-level           -0.3169754 Eh           -8.6253 eV

     #   Z          covCN         q      C6AA      α(0)
     1   6 C        3.751    -0.114    22.740     6.801
     2   6 C        3.869     0.085    19.129     6.219
     3   8 O        1.655    -0.250    18.167     5.754
     4  15 P        3.884     0.373   144.724    21.610
     5  16 S        0.926    -0.418   157.496    21.227
     6   8 O        1.655    -0.245    18.081     5.740
     7   6 C        3.866     0.082    19.180     6.228
     8   6 C        3.751    -0.117    22.808     6.811
     9  16 S        2.010    -0.133   146.627    20.380
    10   6 C        3.821     0.041    19.873     6.344
    11  16 S        2.016    -0.175   148.473    20.508
    12  15 P        3.747     0.373   144.734    21.611
    13  16 S        0.926    -0.373   155.377    21.083
    14   8 O        1.655    -0.244    18.067     5.738
    15   6 C        3.808     0.085    19.170     6.233
    16   6 C        3.751    -0.118    22.816     6.812
    17   8 O        1.654    -0.235    17.911     5.713
    18   6 C        3.809     0.078    19.278     6.250
    19   6 C        3.751    -0.117    22.796     6.809
    20   1 H        0.925     0.060     2.203     2.321
    21   1 H        0.925     0.061     2.183     2.311
    22   1 H        0.925     0.060     2.196     2.317
    23   1 H        0.924     0.061     2.185     2.312
    24   1 H        0.924     0.065     2.147     2.291
    25   1 H        0.924     0.065     2.141     2.288
    26   1 H        0.924     0.062     2.181     2.310
    27   1 H        0.925     0.063     2.165     2.301
    28   1 H        0.925     0.062     2.178     2.308
    29   1 H        0.925     0.061     2.183     2.311
    30   1 H        0.925     0.087     1.905     2.158
    31   1 H        0.925     0.094     1.837     2.120
    32   1 H        0.924     0.060     2.204     2.321
    33   1 H        0.924     0.055     2.257     2.349
    34   1 H        0.925     0.055     2.257     2.349
    35   1 H        0.925     0.070     2.080     2.255
    36   1 H        0.925     0.063     2.169     2.303
    37   1 H        0.924     0.073     2.054     2.241
    38   1 H        0.924     0.061     2.192     2.316
    39   1 H        0.925     0.060     2.204     2.322
    40   1 H        0.925     0.061     2.191     2.315
    41   1 H        0.925     0.066     2.126     2.280

 Mol. C6AA /au·bohr⁶  :      26537.591012
 Mol. C8AA /au·bohr⁸  :     863310.979128
 Mol. α(0) /au        :        258.270902


Wiberg/Mayer (AO) data.
largest (>0.10) Wiberg bond orders for each atom

 ---------------------------------------------------------------------------
     #   Z sym  total        # sym  WBO       # sym  WBO       # sym  WBO
 ---------------------------------------------------------------------------
     1   6 C    3.991 --     2 C    1.023    22 H    0.984    20 H    0.980
                            21 H    0.976
     2   6 C    3.910 --     1 C    1.023    23 H    0.970    24 H    0.967
                             3 O    0.896
     3   8 O    2.396 --     4 P    1.300     2 C    0.896
     4  15 P    5.279 --     5 S    1.540     6 O    1.310     3 O    1.300
                             9 S    0.986
     5  16 S    1.873 --     4 P    1.540     9 S    0.138
     6   8 O    2.414 --     4 P    1.310     7 C    0.906
     7   6 C    3.910 --     8 C    1.022    25 H    0.970    26 H    0.968
                             6 O    0.906
     8   6 C    3.990 --     7 C    1.022    27 H    0.983    28 H    0.980
                            29 H    0.976
     9  16 S    2.294 --     4 P    0.986    10 C    0.983     5 S    0.138
    10   6 C    3.953 --    11 S    0.994     9 S    0.983    30 H    0.957
                            31 H    0.948
    11  16 S    2.277 --    10 C    0.994    12 P    0.934    13 S    0.147
    12  15 P    5.277 --    13 S    1.572    17 O    1.352    14 O    1.300
                            11 S    0.934
    13  16 S    1.917 --    12 P    1.572    11 S    0.147
    14   8 O    2.418 --    12 P    1.300    15 C    0.906
    15   6 C    3.910 --    16 C    1.020    32 H    0.969    33 H    0.964
                            14 O    0.906
    16   6 C    3.988 --    15 C    1.020    36 H    0.984    34 H    0.981
                            35 H    0.976
    17   8 O    2.420 --    12 P    1.352    18 C    0.889
    18   6 C    3.912 --    19 C    1.024    38 H    0.971    37 H    0.969
                            17 O    0.889
    19   6 C    3.989 --    18 C    1.024    41 H    0.982    39 H    0.979
                            40 H    0.975
    20   1 H    0.995 --     1 C    0.980
    21   1 H    0.996 --     1 C    0.976
    22   1 H    0.996 --     1 C    0.984
    23   1 H    0.996 --     2 C    0.970
    24   1 H    0.996 --     2 C    0.967
    25   1 H    0.996 --     7 C    0.970
    26   1 H    0.996 --     7 C    0.968
    27   1 H    0.996 --     8 C    0.983
    28   1 H    0.995 --     8 C    0.980
    29   1 H    0.996 --     8 C    0.976
    30   1 H    0.992 --    10 C    0.957
    31   1 H    0.991 --    10 C    0.948
    32   1 H    0.996 --    15 C    0.969
    33   1 H    0.997 --    15 C    0.964
    34   1 H    0.996 --    16 C    0.981
    35   1 H    0.995 --    16 C    0.976
    36   1 H    0.996 --    16 C    0.984
    37   1 H    0.994 --    18 C    0.969
    38   1 H    0.996 --    18 C    0.971
    39   1 H    0.995 --    19 C    0.979
    40   1 H    0.996 --    19 C    0.975
    41   1 H    0.996 --    19 C    0.982
 ---------------------------------------------------------------------------

Topologies differ in total number of bonds
Writing topology from bond orders to xtbtopo.mol

molecular dipole:
                 x           y           z       tot (Debye)
 q only:        0.885      -1.113       1.891
   full:        0.749      -1.410       2.239       6.990
molecular quadrupole (traceless):
                xx          xy          yy          xz          yz          zz
 q only:        0.267      26.978       1.978       3.142      -3.213      -2.245
  q+dip:        3.799      28.734      -5.611       2.956      -1.969       1.812
   full:        4.366      29.361      -4.122       4.073      -2.419      -0.244


           -------------------------------------------------
          | TOTAL ENERGY              -65.013671225746 Eh   |
          | GRADIENT NORM               0.031353957230 Eh/α |
          | HOMO-LUMO GAP               2.772406110470 eV   |
           -------------------------------------------------

------------------------------------------------------------------------
 * finished run on 2025/04/09 at 05:20:48.396     
------------------------------------------------------------------------
 total:
 * wall-time:     0 d,  0 h,  0 min,  0.114 sec
 *  cpu-time:     0 d,  0 h,  0 min,  0.070 sec
 * ratio c/w:     0.611 speedup
 SCF:
 * wall-time:     0 d,  0 h,  0 min,  0.059 sec
 *  cpu-time:     0 d,  0 h,  0 min,  0.057 sec
 * ratio c/w:     0.966 speedup

