      -----------------------------------------------------------      
     |                   =====================                   |     
     |                           x T B                           |     
     |                   =====================                   |     
     |                         S. Grimme                         |     
     |          Mulliken Center for Theoretical Chemistry        |     
     |                    University of Bonn                     |     
      -----------------------------------------------------------      

   * xtb version 6.7.1 (edcfbbe) compiled by 'albert@albert-system' on 2024-07-22

   xtb is free software: you can redistribute it and/or modify it under
   the terms of the GNU Lesser General Public License as published by
   the Free Software Foundation, either version 3 of the License, or
   (at your option) any later version.
   
   xtb is distributed in the hope that it will be useful,
   but WITHOUT ANY WARRANTY; without even the implied warranty of
   MERCHANTABILITY or FITNESS FOR A PARTICULAR PURPOSE.  See the
   GNU Lesser General Public License for more details.
   
   Cite this work as:
   * C. Bannwarth, E. Caldeweyher, S. Ehlert, A. Hansen, P. Pracht,
     J. Seibert, S. Spicher, S. Grimme, WIREs Comput. Mol. Sci., 2020, 11,
     e01493. DOI: 10.1002/wcms.1493
   
   for GFN2-xTB:
   * C. Bannwarth, S. Ehlert and S. Grimme., J. Chem. Theory Comput., 2019,
     15, 1652-1671. DOI: 10.1021/acs.jctc.8b01176
   for GFN1-xTB:
   * S. Grimme, C. Bannwarth, P. Shushkov, J. Chem. Theory Comput., 2017,
     13, 1989-2009. DOI: 10.1021/acs.jctc.7b00118
   for GFN0-xTB:
   * P. Pracht, E. Caldeweyher, S. Ehlert, S. Grimme, ChemRxiv, 2019, preprint.
     DOI: 10.26434/chemrxiv.8326202.v1
   for GFN-FF:
   * S. Spicher and S. Grimme, Angew. Chem. Int. Ed., 2020, 59, 15665-15673.
     DOI: 10.1002/anie.202004239
   
   for ALPB and GBSA implicit solvation:
   * S. Ehlert, M. Stahn, S. Spicher, S. Grimme, J. Chem. Theory Comput.,
     2021, 17, 4250-4261. DOI: 10.1021/acs.jctc.1c00471
   
   for ddCOSMO and CPCM-X implicit solvation:
   * M. Stahn, S. Ehlert, S. Grimme, J. Phys. Chem. A,
     2023, XX, XXXX-XXXX. DOI: 10.1021/acs.jpca.3c04382
   
   for DFT-D4:
   * E. Caldeweyher, C. Bannwarth and S. Grimme, J. Chem. Phys., 2017,
     147, 034112. DOI: 10.1063/1.4993215
   * E. Caldeweyher, S. Ehlert, A. Hansen, H. Neugebauer, S. Spicher,
     C. Bannwarth and S. Grimme, J. Chem. Phys., 2019, 150, 154122.
     DOI: 10.1063/1.5090222
   * E. Caldeweyher, J.-M. Mewes, S. Ehlert and S. Grimme, Phys. Chem. Chem. Phys.
     2020, 22, 8499-8512. DOI: 10.1039/D0CP00502A
   
   for sTDA-xTB:
   * S. Grimme and C. Bannwarth, J. Chem. Phys., 2016, 145, 054103.
     DOI: 10.1063/1.4959605
   
   in the mass-spec context:
   * V. Asgeirsson, C. Bauer and S. Grimme, Chem. Sci., 2017, 8, 4879.
     DOI: 10.1039/c7sc00601b
   * J. Koopman and S. Grimme, ACS Omega 2019, 4, 12, 15120-15133.
     DOI: 10.1021/acsomega.9b02011
   
   for metadynamics refer to:
   * S. Grimme, J. Chem. Theory Comput., 2019, 155, 2847-2862
     DOI: 10.1021/acs.jctc.9b00143
   
   for SPH calculations refer to:
   * S. Spicher and S. Grimme, J. Chem. Theory Comput., 2021, 17, 1701-1714
     DOI: 10.1021/acs.jctc.0c01306
   
   for ONIOM refer to:
   * C. Plett, A. Katbashev, S. Ehlert, S. Grimme, M. Bursch,
     Phys. Chem. Chem. Phys., 2023, 25, 17860-17868. DOI: 10.1039/D3CP02178E
   
   for DIPRO refer to:
   * J. Kohn, N. Gildemeister, S. Grimme, D. Fazzi, A. Hansen,
     J. Chem. Phys., 2023, just accepted.
   
   for PTB refer to:
   * S. Grimme, M. Mueller, A. Hansen, J. Chem. Phys., 2023, 158, 124111.
     DOI: 10.1063/5.0137838
   
   with help from (in alphabetical order)
   P. Atkinson, C. Bannwarth, F. Bohle, G. Brandenburg, E. Caldeweyher
   M. Checinski, S. Dohm, S. Ehlert, S. Ehrlich, I. Gerasimov, C. Hölzer
   A. Katbashev, J. Kohn, J. Koopman, C. Lavigne, S. Lehtola, F. März, M. Müller,
   F. Musil, H. Neugebauer, J. Pisarek, C. Plett, P. Pracht, F. Pultar,
   J. Seibert, P. Shushkov, S. Spicher, M. Stahn, M. Steiner, T. Strunk,
   J. Stückrath, T. Rose, and J. Unsleber
   
 * started run on 2025/04/09 at 05:21:18.597     
   ID    Z sym.   atoms
    1    6 C      1, 2, 7, 8, 10, 15, 16, 18, 19
    2    8 O      3, 6, 14, 17
    3   15 P      4, 12
    4   16 S      5, 9, 11, 13
    5    1 H      20-41

           -------------------------------------------------
          |                Calculation Setup                |
           -------------------------------------------------

          program call               : /srv/scratch/z5358697/.xtb/bin/xtb gas.coord --gfn2 --sp --chrg 0 --norestart --parallel 1
          hostname                   : k163
          coordinate file            : gas.coord
          omp threads                :                     1


           -------------------------------------------------
          |                 G F N 2 - x T B                 |
           -------------------------------------------------

        Reference                      10.1021/acs.jctc.8b01176
      * Hamiltonian:
        H0-scaling (s, p, d)           1.850000    2.230000    2.230000
        zeta-weighting                 0.500000
      * Dispersion:
        s8                             2.700000
        a1                             0.520000
        a2                             5.000000
        s9                             5.000000
      * Repulsion:
        kExp                           1.500000    1.000000
        rExp                           1.000000
      * Coulomb:
        alpha                          2.000000
        third order                    shell-resolved
        anisotropic                    true
        a3                             3.000000
        a5                             4.000000
        cn-shift                       1.200000
        cn-exp                         4.000000
        max-rad                        5.000000


          ...................................................
          :                      SETUP                      :
          :.................................................:
          :  # basis functions                 134          :
          :  # atomic orbitals                 128          :
          :  # shells                           66          :
          :  # electrons                       116          :
          :  max. iterations                   250          :
          :  Hamiltonian                  GFN2-xTB          :
          :  restarted?                      false          :
          :  GBSA solvation                  false          :
          :  PC potential                    false          :
          :  electronic temp.          300.0000000     K    :
          :  accuracy                    1.0000000          :
          :  -> integral cutoff          0.2500000E+02      :
          :  -> integral neglect         0.1000000E-07      :
          :  -> SCF convergence          0.1000000E-05 Eh   :
          :  -> wf. convergence          0.1000000E-03 e    :
          :  Broyden damping             0.4000000          :
          :  net charge                          0          :
          :  unpaired electrons                  0          :
          ...................................................

 iter      E             dE          RMSdq      gap      omega  full diag
   1    -65.3739327 -0.653739E+02  0.627E+00    3.82       0.0  T
   2    -65.5420073 -0.168075E+00  0.382E+00    2.74       1.0  T
   3    -65.5612431 -0.192358E-01  0.145E+00    2.62       1.0  T
   4    -65.5640118 -0.276872E-02  0.597E-01    2.35       1.0  T
   5    -65.5653167 -0.130484E-02  0.281E-01    2.48       1.0  T
   6    -65.5656023 -0.285597E-03  0.127E-01    2.46       1.0  T
   7    -65.5656547 -0.524061E-04  0.488E-02    2.47       1.0  T
   8    -65.5656636 -0.895999E-05  0.222E-02    2.47       1.0  T
   9    -65.5656649 -0.131569E-05  0.587E-03    2.47       2.7  T
  10    -65.5656650 -0.948612E-07  0.272E-03    2.47       5.7  T
  11    -65.5656650 -0.779440E-08  0.507E-04    2.47      30.8  T
  12    -65.5656650 -0.612701E-09  0.252E-04    2.47      61.9  T

   *** convergence criteria satisfied after 12 iterations ***

         #    Occupation            Energy/Eh            Energy/eV
      -------------------------------------------------------------
         1        2.0000           -0.7502525             -20.4154
       ...           ...                  ...                  ...
        52        2.0000           -0.4345548             -11.8248
        53        2.0000           -0.4068408             -11.0707
        54        2.0000           -0.3982289             -10.8364
        55        2.0000           -0.3705611             -10.0835
        56        2.0000           -0.3695098             -10.0549
        57        2.0000           -0.3613787              -9.8336
        58        2.0000           -0.3584045              -9.7527 (HOMO)
        59                         -0.2676096              -7.2820 (LUMO)
        60                         -0.2415060              -6.5717
        61                         -0.2071511              -5.6369
        62                         -0.1832802              -4.9873
        63                         -0.1673413              -4.5536
       ...                                ...                  ...
       128                          1.4430038              39.2661
      -------------------------------------------------------------
                  HL-Gap            0.0907950 Eh            2.4707 eV
             Fermi-level           -0.3130071 Eh           -8.5174 eV

 SCC (total)                   0 d,  0 h,  0 min,  0.062 sec
 SCC setup                      ...        0 min,  0.000 sec (  0.411%)
 Dispersion                     ...        0 min,  0.000 sec (  0.485%)
 classical contributions        ...        0 min,  0.000 sec (  0.092%)
 integral evaluation            ...        0 min,  0.015 sec ( 23.471%)
 iterations                     ...        0 min,  0.025 sec ( 40.352%)
 molecular gradient             ...        0 min,  0.022 sec ( 34.867%)
 printout                       ...        0 min,  0.000 sec (  0.296%)

         :::::::::::::::::::::::::::::::::::::::::::::::::::::
         ::                     SUMMARY                     ::
         :::::::::::::::::::::::::::::::::::::::::::::::::::::
         :: total energy             -65.005203753220 Eh    ::
         :: gradient norm              0.037196410435 Eh/a0 ::
         :: HOMO-LUMO gap              2.470657366548 eV    ::
         ::.................................................::
         :: SCC energy               -65.564848313465 Eh    ::
         :: -> isotropic ES            0.106668724158 Eh    ::
         :: -> anisotropic ES         -0.010018173579 Eh    ::
         :: -> anisotropic XC          0.030138577983 Eh    ::
         :: -> dispersion             -0.055261016749 Eh    ::
         :: repulsion energy           0.559644560245 Eh    ::
         :: add. restraining           0.000000000000 Eh    ::
         :: total charge              -0.000000000000 e     ::
         :::::::::::::::::::::::::::::::::::::::::::::::::::::

           -------------------------------------------------
          |                Property Printout                |
           -------------------------------------------------

    * Orbital Energies and Occupations

         #    Occupation            Energy/Eh            Energy/eV
      -------------------------------------------------------------
         1        2.0000           -0.7502525             -20.4154
       ...           ...                  ...                  ...
        46        2.0000           -0.4652350             -12.6597
        47        2.0000           -0.4580289             -12.4636
        48        2.0000           -0.4536271             -12.3438
        49        2.0000           -0.4490293             -12.2187
        50        2.0000           -0.4457409             -12.1292
        51        2.0000           -0.4427574             -12.0480
        52        2.0000           -0.4345548             -11.8248
        53        2.0000           -0.4068408             -11.0707
        54        2.0000           -0.3982289             -10.8364
        55        2.0000           -0.3705611             -10.0835
        56        2.0000           -0.3695098             -10.0549
        57        2.0000           -0.3613787              -9.8336
        58        2.0000           -0.3584045              -9.7527 (HOMO)
        59                         -0.2676096              -7.2820 (LUMO)
        60                         -0.2415060              -6.5717
        61                         -0.2071511              -5.6369
        62                         -0.1832802              -4.9873
        63                         -0.1673413              -4.5536
        64                         -0.1550812              -4.2200
        65                         -0.1293681              -3.5203
        66                         -0.1262731              -3.4361
        67                         -0.1142789              -3.1097
        68                         -0.1074261              -2.9232
        69                         -0.0359045              -0.9770
       ...                                ...                  ...
       128                          1.4430038              39.2661
      -------------------------------------------------------------
                  HL-Gap            0.0907950 Eh            2.4707 eV
             Fermi-level           -0.3130071 Eh           -8.5174 eV

     #   Z          covCN         q      C6AA      α(0)
     1   6 C        3.751    -0.119    22.834     6.815
     2   6 C        3.861     0.084    19.150     6.223
     3   8 O        1.656    -0.251    18.179     5.756
     4  15 P        3.908     0.370   144.838    21.619
     5  16 S        0.950    -0.373   155.361    21.082
     6   8 O        1.653    -0.236    17.931     5.716
     7   6 C        3.836     0.081    19.217     6.237
     8   6 C        3.751    -0.116    22.792     6.808
     9  16 S        1.981    -0.158   147.709    20.455
    10   6 C        3.804     0.040    19.904     6.351
    11  16 S        2.077    -0.137   146.834    20.395
    12  15 P        3.870     0.375   144.645    21.604
    13  16 S        0.928    -0.365   154.993    21.057
    14   8 O        1.654    -0.230    17.825     5.699
    15   6 C        3.862     0.086    19.116     6.218
    16   6 C        3.751    -0.114    22.743     6.801
    17   8 O        1.657    -0.279    18.641     5.828
    18   6 C        3.853     0.085    19.135     6.222
    19   6 C        3.751    -0.112    22.703     6.795
    20   1 H        0.925     0.060     2.204     2.322
    21   1 H        0.924     0.075     2.035     2.231
    22   1 H        0.925     0.060     2.204     2.322
    23   1 H        0.924     0.064     2.148     2.292
    24   1 H        0.924     0.060     2.198     2.318
    25   1 H        0.924     0.062     2.171     2.304
    26   1 H        0.924     0.056     2.241     2.341
    27   1 H        0.925     0.064     2.157     2.297
    28   1 H        0.925     0.057     2.233     2.337
    29   1 H        0.925     0.066     2.135     2.285
    30   1 H        0.925     0.076     2.021     2.223
    31   1 H        0.925     0.080     1.984     2.202
    32   1 H        0.924     0.050     2.320     2.382
    33   1 H        0.924     0.064     2.156     2.296
    34   1 H        0.925     0.058     2.221     2.331
    35   1 H        0.925     0.071     2.074     2.252
    36   1 H        0.925     0.058     2.220     2.330
    37   1 H        0.924     0.060     2.195     2.317
    38   1 H        0.924     0.058     2.223     2.332
    39   1 H        0.925     0.063     2.164     2.301
    40   1 H        0.925     0.056     2.246     2.343
    41   1 H        0.925     0.052     2.298     2.371

 Mol. C6AA /au·bohr⁶  :      26572.070560
 Mol. C8AA /au·bohr⁸  :     863191.344629
 Mol. α(0) /au        :        258.410539


Wiberg/Mayer (AO) data.
largest (>0.10) Wiberg bond orders for each atom

 ---------------------------------------------------------------------------
     #   Z sym  total        # sym  WBO       # sym  WBO       # sym  WBO
 ---------------------------------------------------------------------------
     1   6 C    3.989 --     2 C    1.022    20 H    0.982    22 H    0.980
                            21 H    0.972
     2   6 C    3.908 --     1 C    1.022    24 H    0.970    23 H    0.968
                             3 O    0.903
     3   8 O    2.405 --     4 P    1.312     2 C    0.903
     4  15 P    5.289 --     5 S    1.551     6 O    1.341     3 O    1.312
                             9 S    0.944
     5  16 S    1.897 --     4 P    1.551     9 S    0.147
     6   8 O    2.418 --     4 P    1.341     7 C    0.889
     7   6 C    3.913 --     8 C    1.021    25 H    0.972    26 H    0.966
                             6 O    0.889
     8   6 C    3.989 --     7 C    1.021    27 H    0.984    29 H    0.981
                            28 H    0.980
     9  16 S    2.255 --    10 C    0.968     4 P    0.944     5 S    0.147
    10   6 C    3.966 --    11 S    0.999    30 H    0.969     9 S    0.968
                            31 H    0.965
    11  16 S    2.296 --    10 C    0.999    12 P    0.952    13 S    0.136
    12  15 P    5.290 --    13 S    1.596    14 O    1.333    17 O    1.253
                            11 S    0.952
    13  16 S    1.915 --    12 P    1.596    11 S    0.136
    14   8 O    2.415 --    12 P    1.333    15 C    0.891
    15   6 C    3.915 --    16 C    1.019    33 H    0.971    32 H    0.969
                            14 O    0.891
    16   6 C    3.989 --    15 C    1.019    36 H    0.984    35 H    0.983
                            34 H    0.980
    17   8 O    2.362 --    12 P    1.253    18 C    0.906
    18   6 C    3.916 --    19 C    1.021    38 H    0.970    37 H    0.966
                            17 O    0.906
    19   6 C    3.993 --    18 C    1.021    41 H    0.985    40 H    0.981
                            39 H    0.977
    20   1 H    0.996 --     1 C    0.982
    21   1 H    0.994 --     1 C    0.972
    22   1 H    0.996 --     1 C    0.980
    23   1 H    0.996 --     2 C    0.968
    24   1 H    0.996 --     2 C    0.970
    25   1 H    0.996 --     7 C    0.972
    26   1 H    0.997 --     7 C    0.966
    27   1 H    0.996 --     8 C    0.984
    28   1 H    0.995 --     8 C    0.980
    29   1 H    0.996 --     8 C    0.981
    30   1 H    0.994 --    10 C    0.969
    31   1 H    0.994 --    10 C    0.965
    32   1 H    0.997 --    15 C    0.969
    33   1 H    0.996 --    15 C    0.971
    34   1 H    0.995 --    16 C    0.980
    35   1 H    0.995 --    16 C    0.983
    36   1 H    0.997 --    16 C    0.984
    37   1 H    0.996 --    18 C    0.966
    38   1 H    0.997 --    18 C    0.970
    39   1 H    0.996 --    19 C    0.977
    40   1 H    0.996 --    19 C    0.981
    41   1 H    0.997 --    19 C    0.985
 ---------------------------------------------------------------------------

Topologies differ in total number of bonds
Writing topology from bond orders to xtbtopo.mol

molecular dipole:
                 x           y           z       tot (Debye)
 q only:       -0.140      -1.082       0.943
   full:       -0.322      -1.243       1.338       4.714
molecular quadrupole (traceless):
                xx          xy          yy          xz          yz          zz
 q only:       24.477      -8.322     -12.512      -0.261      -1.890     -11.965
  q+dip:       28.886      -5.281     -12.809      -0.059      -3.107     -16.078
   full:       29.091      -5.719     -13.198       0.374      -3.024     -15.893


           -------------------------------------------------
          | TOTAL ENERGY              -65.005203753220 Eh   |
          | GRADIENT NORM               0.037196410435 Eh/α |
          | HOMO-LUMO GAP               2.470657366548 eV   |
           -------------------------------------------------

------------------------------------------------------------------------
 * finished run on 2025/04/09 at 05:21:18.694     
------------------------------------------------------------------------
 total:
 * wall-time:     0 d,  0 h,  0 min,  0.096 sec
 *  cpu-time:     0 d,  0 h,  0 min,  0.067 sec
 * ratio c/w:     0.697 speedup
 SCF:
 * wall-time:     0 d,  0 h,  0 min,  0.062 sec
 *  cpu-time:     0 d,  0 h,  0 min,  0.055 sec
 * ratio c/w:     0.890 speedup

