      -----------------------------------------------------------      
     |                   =====================                   |     
     |                           x T B                           |     
     |                   =====================                   |     
     |                         S. Grimme                         |     
     |          Mulliken Center for Theoretical Chemistry        |     
     |                    University of Bonn                     |     
      -----------------------------------------------------------      

   * xtb version 6.7.1 (edcfbbe) compiled by 'albert@albert-system' on 2024-07-22

   xtb is free software: you can redistribute it and/or modify it under
   the terms of the GNU Lesser General Public License as published by
   the Free Software Foundation, either version 3 of the License, or
   (at your option) any later version.
   
   xtb is distributed in the hope that it will be useful,
   but WITHOUT ANY WARRANTY; without even the implied warranty of
   MERCHANTABILITY or FITNESS FOR A PARTICULAR PURPOSE.  See the
   GNU Lesser General Public License for more details.
   
   Cite this work as:
   * C. Bannwarth, E. Caldeweyher, S. Ehlert, A. Hansen, P. Pracht,
     J. Seibert, S. Spicher, S. Grimme, WIREs Comput. Mol. Sci., 2020, 11,
     e01493. DOI: 10.1002/wcms.1493
   
   for GFN2-xTB:
   * C. Bannwarth, S. Ehlert and S. Grimme., J. Chem. Theory Comput., 2019,
     15, 1652-1671. DOI: 10.1021/acs.jctc.8b01176
   for GFN1-xTB:
   * S. Grimme, C. Bannwarth, P. Shushkov, J. Chem. Theory Comput., 2017,
     13, 1989-2009. DOI: 10.1021/acs.jctc.7b00118
   for GFN0-xTB:
   * P. Pracht, E. Caldeweyher, S. Ehlert, S. Grimme, ChemRxiv, 2019, preprint.
     DOI: 10.26434/chemrxiv.8326202.v1
   for GFN-FF:
   * S. Spicher and S. Grimme, Angew. Chem. Int. Ed., 2020, 59, 15665-15673.
     DOI: 10.1002/anie.202004239
   
   for ALPB and GBSA implicit solvation:
   * S. Ehlert, M. Stahn, S. Spicher, S. Grimme, J. Chem. Theory Comput.,
     2021, 17, 4250-4261. DOI: 10.1021/acs.jctc.1c00471
   
   for ddCOSMO and CPCM-X implicit solvation:
   * M. Stahn, S. Ehlert, S. Grimme, J. Phys. Chem. A,
     2023, XX, XXXX-XXXX. DOI: 10.1021/acs.jpca.3c04382
   
   for DFT-D4:
   * E. Caldeweyher, C. Bannwarth and S. Grimme, J. Chem. Phys., 2017,
     147, 034112. DOI: 10.1063/1.4993215
   * E. Caldeweyher, S. Ehlert, A. Hansen, H. Neugebauer, S. Spicher,
     C. Bannwarth and S. Grimme, J. Chem. Phys., 2019, 150, 154122.
     DOI: 10.1063/1.5090222
   * E. Caldeweyher, J.-M. Mewes, S. Ehlert and S. Grimme, Phys. Chem. Chem. Phys.
     2020, 22, 8499-8512. DOI: 10.1039/D0CP00502A
   
   for sTDA-xTB:
   * S. Grimme and C. Bannwarth, J. Chem. Phys., 2016, 145, 054103.
     DOI: 10.1063/1.4959605
   
   in the mass-spec context:
   * V. Asgeirsson, C. Bauer and S. Grimme, Chem. Sci., 2017, 8, 4879.
     DOI: 10.1039/c7sc00601b
   * J. Koopman and S. Grimme, ACS Omega 2019, 4, 12, 15120-15133.
     DOI: 10.1021/acsomega.9b02011
   
   for metadynamics refer to:
   * S. Grimme, J. Chem. Theory Comput., 2019, 155, 2847-2862
     DOI: 10.1021/acs.jctc.9b00143
   
   for SPH calculations refer to:
   * S. Spicher and S. Grimme, J. Chem. Theory Comput., 2021, 17, 1701-1714
     DOI: 10.1021/acs.jctc.0c01306
   
   for ONIOM refer to:
   * C. Plett, A. Katbashev, S. Ehlert, S. Grimme, M. Bursch,
     Phys. Chem. Chem. Phys., 2023, 25, 17860-17868. DOI: 10.1039/D3CP02178E
   
   for DIPRO refer to:
   * J. Kohn, N. Gildemeister, S. Grimme, D. Fazzi, A. Hansen,
     J. Chem. Phys., 2023, just accepted.
   
   for PTB refer to:
   * S. Grimme, M. Mueller, A. Hansen, J. Chem. Phys., 2023, 158, 124111.
     DOI: 10.1063/5.0137838
   
   with help from (in alphabetical order)
   P. Atkinson, C. Bannwarth, F. Bohle, G. Brandenburg, E. Caldeweyher
   M. Checinski, S. Dohm, S. Ehlert, S. Ehrlich, I. Gerasimov, C. Hölzer
   A. Katbashev, J. Kohn, J. Koopman, C. Lavigne, S. Lehtola, F. März, M. Müller,
   F. Musil, H. Neugebauer, J. Pisarek, C. Plett, P. Pracht, F. Pultar,
   J. Seibert, P. Shushkov, S. Spicher, M. Stahn, M. Steiner, T. Strunk,
   J. Stückrath, T. Rose, and J. Unsleber
   
 * started run on 2025/04/09 at 05:20:43.508     
   ID    Z sym.   atoms
    1    6 C      1, 2, 7, 8, 10, 15, 16, 18, 19
    2    8 O      3, 6, 14, 17
    3   15 P      4, 12
    4   16 S      5, 9, 11, 13
    5    1 H      20-41

           -------------------------------------------------
          |                Calculation Setup                |
           -------------------------------------------------

          program call               : /srv/scratch/z5358697/.xtb/bin/xtb gas.coord --gfn2 --sp --chrg 0 --norestart --parallel 1
          hostname                   : k163
          coordinate file            : gas.coord
          omp threads                :                     1


           -------------------------------------------------
          |                 G F N 2 - x T B                 |
           -------------------------------------------------

        Reference                      10.1021/acs.jctc.8b01176
      * Hamiltonian:
        H0-scaling (s, p, d)           1.850000    2.230000    2.230000
        zeta-weighting                 0.500000
      * Dispersion:
        s8                             2.700000
        a1                             0.520000
        a2                             5.000000
        s9                             5.000000
      * Repulsion:
        kExp                           1.500000    1.000000
        rExp                           1.000000
      * Coulomb:
        alpha                          2.000000
        third order                    shell-resolved
        anisotropic                    true
        a3                             3.000000
        a5                             4.000000
        cn-shift                       1.200000
        cn-exp                         4.000000
        max-rad                        5.000000


          ...................................................
          :                      SETUP                      :
          :.................................................:
          :  # basis functions                 134          :
          :  # atomic orbitals                 128          :
          :  # shells                           66          :
          :  # electrons                       116          :
          :  max. iterations                   250          :
          :  Hamiltonian                  GFN2-xTB          :
          :  restarted?                      false          :
          :  GBSA solvation                  false          :
          :  PC potential                    false          :
          :  electronic temp.          300.0000000     K    :
          :  accuracy                    1.0000000          :
          :  -> integral cutoff          0.2500000E+02      :
          :  -> integral neglect         0.1000000E-07      :
          :  -> SCF convergence          0.1000000E-05 Eh   :
          :  -> wf. convergence          0.1000000E-03 e    :
          :  Broyden damping             0.4000000          :
          :  net charge                          0          :
          :  unpaired electrons                  0          :
          ...................................................

 iter      E             dE          RMSdq      gap      omega  full diag
   1    -65.3792325 -0.653792E+02  0.624E+00    4.21       0.0  T
   2    -65.5479269 -0.168694E+00  0.391E+00    3.04       1.0  T
   3    -65.5674358 -0.195089E-01  0.146E+00    2.95       1.0  T
   4    -65.5699539 -0.251813E-02  0.610E-01    2.71       1.0  T
   5    -65.5708251 -0.871216E-03  0.262E-01    2.83       1.0  T
   6    -65.5709693 -0.144140E-03  0.133E-01    2.81       1.0  T
   7    -65.5710337 -0.643891E-04  0.511E-02    2.82       1.0  T
   8    -65.5710438 -0.101777E-04  0.232E-02    2.83       1.0  T
   9    -65.5710453 -0.141891E-05  0.572E-03    2.83       2.7  T
  10    -65.5710454 -0.115433E-06  0.268E-03    2.83       5.8  T
  11    -65.5710454 -0.675573E-08  0.572E-04    2.83      27.3  T
  12    -65.5710454 -0.124263E-08  0.254E-04    2.83      61.5  T

   *** convergence criteria satisfied after 12 iterations ***

         #    Occupation            Energy/Eh            Energy/eV
      -------------------------------------------------------------
         1        2.0000           -0.7559378             -20.5701
       ...           ...                  ...                  ...
        52        2.0000           -0.4319746             -11.7546
        53        2.0000           -0.4070940             -11.0776
        54        2.0000           -0.3976463             -10.8205
        55        2.0000           -0.3725619             -10.1379
        56        2.0000           -0.3686977             -10.0328
        57        2.0000           -0.3657564              -9.9527
        58        2.0000           -0.3604291              -9.8078 (HOMO)
        59                         -0.2565194              -6.9802 (LUMO)
        60                         -0.2446354              -6.6569
        61                         -0.2042074              -5.5568
        62                         -0.1769785              -4.8158
        63                         -0.1647215              -4.4823
       ...                                ...                  ...
       128                          1.3269823              36.1090
      -------------------------------------------------------------
                  HL-Gap            0.1039097 Eh            2.8275 eV
             Fermi-level           -0.3084742 Eh           -8.3940 eV

 SCC (total)                   0 d,  0 h,  0 min,  0.059 sec
 SCC setup                      ...        0 min,  0.000 sec (  0.460%)
 Dispersion                     ...        0 min,  0.000 sec (  0.546%)
 classical contributions        ...        0 min,  0.000 sec (  0.111%)
 integral evaluation            ...        0 min,  0.014 sec ( 24.040%)
 iterations                     ...        0 min,  0.023 sec ( 39.887%)
 molecular gradient             ...        0 min,  0.020 sec ( 34.132%)
 printout                       ...        0 min,  0.000 sec (  0.795%)

         :::::::::::::::::::::::::::::::::::::::::::::::::::::
         ::                     SUMMARY                     ::
         :::::::::::::::::::::::::::::::::::::::::::::::::::::
         :: total energy             -65.009145432330 Eh    ::
         :: gradient norm              0.043320148449 Eh/a0 ::
         :: HOMO-LUMO gap              2.827527576920 eV    ::
         ::.................................................::
         :: SCC energy               -65.569891075793 Eh    ::
         :: -> isotropic ES            0.106689458267 Eh    ::
         :: -> anisotropic ES         -0.013911679078 Eh    ::
         :: -> anisotropic XC          0.030628545296 Eh    ::
         :: -> dispersion             -0.055019240843 Eh    ::
         :: repulsion energy           0.560745643463 Eh    ::
         :: add. restraining           0.000000000000 Eh    ::
         :: total charge              -0.000000000000 e     ::
         :::::::::::::::::::::::::::::::::::::::::::::::::::::

           -------------------------------------------------
          |                Property Printout                |
           -------------------------------------------------

    * Orbital Energies and Occupations

         #    Occupation            Energy/Eh            Energy/eV
      -------------------------------------------------------------
         1        2.0000           -0.7559378             -20.5701
       ...           ...                  ...                  ...
        46        2.0000           -0.4707997             -12.8111
        47        2.0000           -0.4654746             -12.6662
        48        2.0000           -0.4590472             -12.4913
        49        2.0000           -0.4544138             -12.3652
        50        2.0000           -0.4524152             -12.3108
        51        2.0000           -0.4392518             -11.9527
        52        2.0000           -0.4319746             -11.7546
        53        2.0000           -0.4070940             -11.0776
        54        2.0000           -0.3976463             -10.8205
        55        2.0000           -0.3725619             -10.1379
        56        2.0000           -0.3686977             -10.0328
        57        2.0000           -0.3657564              -9.9527
        58        2.0000           -0.3604291              -9.8078 (HOMO)
        59                         -0.2565194              -6.9802 (LUMO)
        60                         -0.2446354              -6.6569
        61                         -0.2042074              -5.5568
        62                         -0.1769785              -4.8158
        63                         -0.1647215              -4.4823
        64                         -0.1614154              -4.3923
        65                         -0.1422275              -3.8702
        66                         -0.1382322              -3.7615
        67                         -0.1178162              -3.2059
        68                         -0.1063767              -2.8947
        69                         -0.0393100              -1.0697
       ...                                ...                  ...
       128                          1.3269823              36.1090
      -------------------------------------------------------------
                  HL-Gap            0.1039097 Eh            2.8275 eV
             Fermi-level           -0.3084742 Eh           -8.3940 eV

     #   Z          covCN         q      C6AA      α(0)
     1   6 C        3.751    -0.118    22.828     6.814
     2   6 C        3.854     0.083    19.172     6.227
     3   8 O        1.655    -0.256    18.265     5.769
     4  15 P        3.857     0.372   144.751    21.612
     5  16 S        0.931    -0.374   155.403    21.085
     6   8 O        1.652    -0.242    18.025     5.731
     7   6 C        3.855     0.081    19.205     6.233
     8   6 C        3.751    -0.118    22.828     6.814
     9  16 S        2.012    -0.153   147.509    20.442
    10   6 C        3.805     0.043    19.845     6.342
    11  16 S        2.025    -0.181   148.734    20.526
    12  15 P        3.837     0.369   144.857    21.620
    13  16 S        0.927    -0.375   155.475    21.090
    14   8 O        1.653    -0.219    17.656     5.672
    15   6 C        3.825     0.082    19.202     6.236
    16   6 C        3.751    -0.114    22.746     6.802
    17   8 O        1.655    -0.257    18.270     5.770
    18   6 C        3.882     0.086    19.106     6.214
    19   6 C        3.752    -0.115    22.755     6.803
    20   1 H        0.925     0.061     2.187     2.313
    21   1 H        0.925     0.061     2.182     2.310
    22   1 H        0.925     0.065     2.139     2.287
    23   1 H        0.924     0.064     2.149     2.293
    24   1 H        0.924     0.064     2.158     2.298
    25   1 H        0.924     0.061     2.190     2.314
    26   1 H        0.924     0.064     2.156     2.296
    27   1 H        0.925     0.063     2.160     2.298
    28   1 H        0.925     0.068     2.112     2.273
    29   1 H        0.925     0.059     2.209     2.324
    30   1 H        0.925     0.078     1.995     2.209
    31   1 H        0.924     0.091     1.872     2.140
    32   1 H        0.924     0.073     2.053     2.241
    33   1 H        0.924     0.058     2.217     2.329
    34   1 H        0.925     0.070     2.083     2.257
    35   1 H        0.925     0.055     2.263     2.353
    36   1 H        0.925     0.059     2.210     2.325
    37   1 H        0.924     0.060     2.203     2.321
    38   1 H        0.924     0.048     2.341     2.393
    39   1 H        0.925     0.064     2.151     2.294
    40   1 H        0.925     0.060     2.201     2.320
    41   1 H        0.925     0.060     2.200     2.319

 Mol. C6AA /au·bohr⁶  :      26546.543354
 Mol. C8AA /au·bohr⁸  :     863275.974780
 Mol. α(0) /au        :        258.307260


Wiberg/Mayer (AO) data.
largest (>0.10) Wiberg bond orders for each atom

 ---------------------------------------------------------------------------
     #   Z sym  total        # sym  WBO       # sym  WBO       # sym  WBO
 ---------------------------------------------------------------------------
     1   6 C    3.990 --     2 C    1.022    21 H    0.983    20 H    0.980
                            22 H    0.976
     2   6 C    3.908 --     1 C    1.022    24 H    0.970    23 H    0.969
                             3 O    0.905
     3   8 O    2.401 --     4 P    1.302     2 C    0.905
     4  15 P    5.292 --     5 S    1.582     6 O    1.327     3 O    1.302
                             9 S    0.950
     5  16 S    1.916 --     4 P    1.582     9 S    0.141
     6   8 O    2.405 --     4 P    1.327     7 C    0.884
     7   6 C    3.912 --     8 C    1.022    26 H    0.971    25 H    0.969
                             6 O    0.884
     8   6 C    3.988 --     7 C    1.022    27 H    0.983    28 H    0.979
                            29 H    0.979
     9  16 S    2.266 --    10 C    0.990     4 P    0.950     5 S    0.141
    10   6 C    3.956 --     9 S    0.990    11 S    0.983    30 H    0.969
                            31 H    0.941
    11  16 S    2.270 --    10 C    0.983    12 P    0.946    13 S    0.147
    12  15 P    5.299 --    13 S    1.570    14 O    1.354    17 O    1.291
                            11 S    0.946
    13  16 S    1.917 --    12 P    1.570    11 S    0.147
    14   8 O    2.433 --    12 P    1.354    15 C    0.888
    15   6 C    3.911 --    16 C    1.023    33 H    0.973    32 H    0.969
                            14 O    0.888
    16   6 C    3.991 --    15 C    1.023    35 H    0.980    34 H    0.979
                            36 H    0.975
    17   8 O    2.391 --    12 P    1.291    18 C    0.908
    18   6 C    3.913 --    19 C    1.019    38 H    0.972    37 H    0.967
                            17 O    0.908
    19   6 C    3.990 --    18 C    1.019    41 H    0.985    39 H    0.984
                            40 H    0.980
    20   1 H    0.996 --     1 C    0.980
    21   1 H    0.996 --     1 C    0.983
    22   1 H    0.996 --     1 C    0.976
    23   1 H    0.996 --     2 C    0.969
    24   1 H    0.996 --     2 C    0.970
    25   1 H    0.996 --     7 C    0.969
    26   1 H    0.996 --     7 C    0.971
    27   1 H    0.996 --     8 C    0.983
    28   1 H    0.995 --     8 C    0.979
    29   1 H    0.995 --     8 C    0.979
    30   1 H    0.994 --    10 C    0.969
    31   1 H    0.992 --    10 C    0.941
    32   1 H    0.994 --    15 C    0.969
    33   1 H    0.996 --    15 C    0.973
    34   1 H    0.995 --    16 C    0.979
    35   1 H    0.996 --    16 C    0.980
    36   1 H    0.997 --    16 C    0.975
    37   1 H    0.996 --    18 C    0.967
    38   1 H    0.998 --    18 C    0.972
    39   1 H    0.996 --    19 C    0.984
    40   1 H    0.995 --    19 C    0.980
    41   1 H    0.996 --    19 C    0.985
 ---------------------------------------------------------------------------

Topologies differ in total number of bonds
Writing topology from bond orders to xtbtopo.mol

molecular dipole:
                 x           y           z       tot (Debye)
 q only:        0.449      -1.417       2.322
   full:        0.375      -0.899       2.625       7.117
molecular quadrupole (traceless):
                xx          xy          yy          xz          yz          zz
 q only:       22.287       5.270     -13.139     -11.785       7.094      -9.148
  q+dip:       24.794       5.916     -11.909     -10.375       9.140     -12.884
   full:       25.492       6.184     -12.304     -10.748       9.264     -13.188


           -------------------------------------------------
          | TOTAL ENERGY              -65.009145432330 Eh   |
          | GRADIENT NORM               0.043320148449 Eh/α |
          | HOMO-LUMO GAP               2.827527576920 eV   |
           -------------------------------------------------

------------------------------------------------------------------------
 * finished run on 2025/04/09 at 05:20:43.622     
------------------------------------------------------------------------
 total:
 * wall-time:     0 d,  0 h,  0 min,  0.114 sec
 *  cpu-time:     0 d,  0 h,  0 min,  0.066 sec
 * ratio c/w:     0.581 speedup
 SCF:
 * wall-time:     0 d,  0 h,  0 min,  0.059 sec
 *  cpu-time:     0 d,  0 h,  0 min,  0.053 sec
 * ratio c/w:     0.895 speedup

