      -----------------------------------------------------------      
     |                   =====================                   |     
     |                           x T B                           |     
     |                   =====================                   |     
     |                         S. Grimme                         |     
     |          Mulliken Center for Theoretical Chemistry        |     
     |                    University of Bonn                     |     
      -----------------------------------------------------------      

   * xtb version 6.7.1 (edcfbbe) compiled by 'albert@albert-system' on 2024-07-22

   xtb is free software: you can redistribute it and/or modify it under
   the terms of the GNU Lesser General Public License as published by
   the Free Software Foundation, either version 3 of the License, or
   (at your option) any later version.
   
   xtb is distributed in the hope that it will be useful,
   but WITHOUT ANY WARRANTY; without even the implied warranty of
   MERCHANTABILITY or FITNESS FOR A PARTICULAR PURPOSE.  See the
   GNU Lesser General Public License for more details.
   
   Cite this work as:
   * C. Bannwarth, E. Caldeweyher, S. Ehlert, A. Hansen, P. Pracht,
     J. Seibert, S. Spicher, S. Grimme, WIREs Comput. Mol. Sci., 2020, 11,
     e01493. DOI: 10.1002/wcms.1493
   
   for GFN2-xTB:
   * C. Bannwarth, S. Ehlert and S. Grimme., J. Chem. Theory Comput., 2019,
     15, 1652-1671. DOI: 10.1021/acs.jctc.8b01176
   for GFN1-xTB:
   * S. Grimme, C. Bannwarth, P. Shushkov, J. Chem. Theory Comput., 2017,
     13, 1989-2009. DOI: 10.1021/acs.jctc.7b00118
   for GFN0-xTB:
   * P. Pracht, E. Caldeweyher, S. Ehlert, S. Grimme, ChemRxiv, 2019, preprint.
     DOI: 10.26434/chemrxiv.8326202.v1
   for GFN-FF:
   * S. Spicher and S. Grimme, Angew. Chem. Int. Ed., 2020, 59, 15665-15673.
     DOI: 10.1002/anie.202004239
   
   for ALPB and GBSA implicit solvation:
   * S. Ehlert, M. Stahn, S. Spicher, S. Grimme, J. Chem. Theory Comput.,
     2021, 17, 4250-4261. DOI: 10.1021/acs.jctc.1c00471
   
   for ddCOSMO and CPCM-X implicit solvation:
   * M. Stahn, S. Ehlert, S. Grimme, J. Phys. Chem. A,
     2023, XX, XXXX-XXXX. DOI: 10.1021/acs.jpca.3c04382
   
   for DFT-D4:
   * E. Caldeweyher, C. Bannwarth and S. Grimme, J. Chem. Phys., 2017,
     147, 034112. DOI: 10.1063/1.4993215
   * E. Caldeweyher, S. Ehlert, A. Hansen, H. Neugebauer, S. Spicher,
     C. Bannwarth and S. Grimme, J. Chem. Phys., 2019, 150, 154122.
     DOI: 10.1063/1.5090222
   * E. Caldeweyher, J.-M. Mewes, S. Ehlert and S. Grimme, Phys. Chem. Chem. Phys.
     2020, 22, 8499-8512. DOI: 10.1039/D0CP00502A
   
   for sTDA-xTB:
   * S. Grimme and C. Bannwarth, J. Chem. Phys., 2016, 145, 054103.
     DOI: 10.1063/1.4959605
   
   in the mass-spec context:
   * V. Asgeirsson, C. Bauer and S. Grimme, Chem. Sci., 2017, 8, 4879.
     DOI: 10.1039/c7sc00601b
   * J. Koopman and S. Grimme, ACS Omega 2019, 4, 12, 15120-15133.
     DOI: 10.1021/acsomega.9b02011
   
   for metadynamics refer to:
   * S. Grimme, J. Chem. Theory Comput., 2019, 155, 2847-2862
     DOI: 10.1021/acs.jctc.9b00143
   
   for SPH calculations refer to:
   * S. Spicher and S. Grimme, J. Chem. Theory Comput., 2021, 17, 1701-1714
     DOI: 10.1021/acs.jctc.0c01306
   
   for ONIOM refer to:
   * C. Plett, A. Katbashev, S. Ehlert, S. Grimme, M. Bursch,
     Phys. Chem. Chem. Phys., 2023, 25, 17860-17868. DOI: 10.1039/D3CP02178E
   
   for DIPRO refer to:
   * J. Kohn, N. Gildemeister, S. Grimme, D. Fazzi, A. Hansen,
     J. Chem. Phys., 2023, just accepted.
   
   for PTB refer to:
   * S. Grimme, M. Mueller, A. Hansen, J. Chem. Phys., 2023, 158, 124111.
     DOI: 10.1063/5.0137838
   
   with help from (in alphabetical order)
   P. Atkinson, C. Bannwarth, F. Bohle, G. Brandenburg, E. Caldeweyher
   M. Checinski, S. Dohm, S. Ehlert, S. Ehrlich, I. Gerasimov, C. Hölzer
   A. Katbashev, J. Kohn, J. Koopman, C. Lavigne, S. Lehtola, F. März, M. Müller,
   F. Musil, H. Neugebauer, J. Pisarek, C. Plett, P. Pracht, F. Pultar,
   J. Seibert, P. Shushkov, S. Spicher, M. Stahn, M. Steiner, T. Strunk,
   J. Stückrath, T. Rose, and J. Unsleber
   
 * started run on 2025/04/09 at 05:20:53.445     
   ID    Z sym.   atoms
    1    6 C      1, 2, 7, 8, 10, 15, 16, 18, 19
    2    8 O      3, 6, 14, 17
    3   15 P      4, 12
    4   16 S      5, 9, 11, 13
    5    1 H      20-41

           -------------------------------------------------
          |                Calculation Setup                |
           -------------------------------------------------

          program call               : /srv/scratch/z5358697/.xtb/bin/xtb gas.coord --gfn2 --sp --chrg 0 --norestart --parallel 1
          hostname                   : k163
          coordinate file            : gas.coord
          omp threads                :                     1


           -------------------------------------------------
          |                 G F N 2 - x T B                 |
           -------------------------------------------------

        Reference                      10.1021/acs.jctc.8b01176
      * Hamiltonian:
        H0-scaling (s, p, d)           1.850000    2.230000    2.230000
        zeta-weighting                 0.500000
      * Dispersion:
        s8                             2.700000
        a1                             0.520000
        a2                             5.000000
        s9                             5.000000
      * Repulsion:
        kExp                           1.500000    1.000000
        rExp                           1.000000
      * Coulomb:
        alpha                          2.000000
        third order                    shell-resolved
        anisotropic                    true
        a3                             3.000000
        a5                             4.000000
        cn-shift                       1.200000
        cn-exp                         4.000000
        max-rad                        5.000000


          ...................................................
          :                      SETUP                      :
          :.................................................:
          :  # basis functions                 134          :
          :  # atomic orbitals                 128          :
          :  # shells                           66          :
          :  # electrons                       116          :
          :  max. iterations                   250          :
          :  Hamiltonian                  GFN2-xTB          :
          :  restarted?                      false          :
          :  GBSA solvation                  false          :
          :  PC potential                    false          :
          :  electronic temp.          300.0000000     K    :
          :  accuracy                    1.0000000          :
          :  -> integral cutoff          0.2500000E+02      :
          :  -> integral neglect         0.1000000E-07      :
          :  -> SCF convergence          0.1000000E-05 Eh   :
          :  -> wf. convergence          0.1000000E-03 e    :
          :  Broyden damping             0.4000000          :
          :  net charge                          0          :
          :  unpaired electrons                  0          :
          ...................................................

 iter      E             dE          RMSdq      gap      omega  full diag
   1    -65.3807677 -0.653808E+02  0.632E+00    4.25       0.0  T
   2    -65.5496169 -0.168849E+00  0.398E+00    3.11       1.0  T
   3    -65.5687279 -0.191111E-01  0.140E+00    2.99       1.0  T
   4    -65.5712160 -0.248808E-02  0.589E-01    2.75       1.0  T
   5    -65.5720123 -0.796340E-03  0.276E-01    2.87       1.0  T
   6    -65.5722040 -0.191611E-03  0.134E-01    2.85       1.0  T
   7    -65.5722648 -0.608072E-04  0.510E-02    2.86       1.0  T
   8    -65.5722749 -0.101059E-04  0.245E-02    2.86       1.0  T
   9    -65.5722763 -0.144837E-05  0.654E-03    2.86       2.4  T
  10    -65.5722764 -0.126648E-06  0.350E-03    2.86       4.5  T
  11    -65.5722765 -0.120377E-07  0.810E-04    2.86      19.3  T
  12    -65.5722765 -0.112966E-08  0.457E-04    2.86      34.2  T

   *** convergence criteria satisfied after 12 iterations ***

         #    Occupation            Energy/Eh            Energy/eV
      -------------------------------------------------------------
         1        2.0000           -0.7596691             -20.6716
       ...           ...                  ...                  ...
        52        2.0000           -0.4328009             -11.7771
        53        2.0000           -0.4115421             -11.1986
        54        2.0000           -0.3978019             -10.8247
        55        2.0000           -0.3744794             -10.1901
        56        2.0000           -0.3714412             -10.1074
        57        2.0000           -0.3691890             -10.0461
        58        2.0000           -0.3653453              -9.9416 (HOMO)
        59                         -0.2600767              -7.0770 (LUMO)
        60                         -0.2481614              -6.7528
        61                         -0.2084411              -5.6720
        62                         -0.1777270              -4.8362
        63                         -0.1639345              -4.4609
       ...                                ...                  ...
       128                          1.3040615              35.4853
      -------------------------------------------------------------
                  HL-Gap            0.1052686 Eh            2.8645 eV
             Fermi-level           -0.3127110 Eh           -8.5093 eV

 SCC (total)                   0 d,  0 h,  0 min,  0.067 sec
 SCC setup                      ...        0 min,  0.000 sec (  0.419%)
 Dispersion                     ...        0 min,  0.000 sec (  0.464%)
 classical contributions        ...        0 min,  0.000 sec (  0.089%)
 integral evaluation            ...        0 min,  0.020 sec ( 30.228%)
 iterations                     ...        0 min,  0.025 sec ( 36.696%)
 molecular gradient             ...        0 min,  0.021 sec ( 31.760%)
 printout                       ...        0 min,  0.000 sec (  0.317%)

         :::::::::::::::::::::::::::::::::::::::::::::::::::::
         ::                     SUMMARY                     ::
         :::::::::::::::::::::::::::::::::::::::::::::::::::::
         :: total energy             -65.010910953421 Eh    ::
         :: gradient norm              0.035808207613 Eh/a0 ::
         :: HOMO-LUMO gap              2.864504522230 eV    ::
         ::.................................................::
         :: SCC energy               -65.571319695016 Eh    ::
         :: -> isotropic ES            0.103318144782 Eh    ::
         :: -> anisotropic ES         -0.010022262331 Eh    ::
         :: -> anisotropic XC          0.031427024652 Eh    ::
         :: -> dispersion             -0.054591784831 Eh    ::
         :: repulsion energy           0.560408741595 Eh    ::
         :: add. restraining           0.000000000000 Eh    ::
         :: total charge              -0.000000000000 e     ::
         :::::::::::::::::::::::::::::::::::::::::::::::::::::

           -------------------------------------------------
          |                Property Printout                |
           -------------------------------------------------

    * Orbital Energies and Occupations

         #    Occupation            Energy/Eh            Energy/eV
      -------------------------------------------------------------
         1        2.0000           -0.7596691             -20.6716
       ...           ...                  ...                  ...
        46        2.0000           -0.4648289             -12.6486
        47        2.0000           -0.4637176             -12.6184
        48        2.0000           -0.4624365             -12.5835
        49        2.0000           -0.4541448             -12.3579
        50        2.0000           -0.4462536             -12.1432
        51        2.0000           -0.4415798             -12.0160
        52        2.0000           -0.4328009             -11.7771
        53        2.0000           -0.4115421             -11.1986
        54        2.0000           -0.3978019             -10.8247
        55        2.0000           -0.3744794             -10.1901
        56        2.0000           -0.3714412             -10.1074
        57        2.0000           -0.3691890             -10.0461
        58        2.0000           -0.3653453              -9.9416 (HOMO)
        59                         -0.2600767              -7.0770 (LUMO)
        60                         -0.2481614              -6.7528
        61                         -0.2084411              -5.6720
        62                         -0.1777270              -4.8362
        63                         -0.1639345              -4.4609
        64                         -0.1556073              -4.2343
        65                         -0.1496895              -4.0733
        66                         -0.1435514              -3.9062
        67                         -0.1209851              -3.2922
        68                         -0.1152863              -3.1371
        69                         -0.0455074              -1.2383
       ...                                ...                  ...
       128                          1.3040615              35.4853
      -------------------------------------------------------------
                  HL-Gap            0.1052686 Eh            2.8645 eV
             Fermi-level           -0.3127110 Eh           -8.5093 eV

     #   Z          covCN         q      C6AA      α(0)
     1   6 C        3.751    -0.117    22.805     6.810
     2   6 C        3.827     0.081    19.224     6.239
     3   8 O        1.655    -0.248    18.121     5.747
     4  15 P        3.821     0.370   144.848    21.619
     5  16 S        0.926    -0.380   155.679    21.104
     6   8 O        1.654    -0.236    17.923     5.715
     7   6 C        3.850     0.081    19.203     6.233
     8   6 C        3.751    -0.117    22.796     6.809
     9  16 S        2.024    -0.163   147.938    20.471
    10   6 C        3.808     0.045    19.821     6.338
    11  16 S        2.031    -0.164   147.978    20.474
    12  15 P        3.830     0.366   144.975    21.629
    13  16 S        0.926    -0.397   156.471    21.158
    14   8 O        1.655    -0.229    17.821     5.699
    15   6 C        3.837     0.084    19.155     6.226
    16   6 C        3.751    -0.114    22.736     6.800
    17   8 O        1.655    -0.239    17.982     5.724
    18   6 C        3.868     0.082    19.180     6.228
    19   6 C        3.751    -0.114    22.738     6.800
    20   1 H        0.925     0.066     2.130     2.282
    21   1 H        0.925     0.070     2.090     2.261
    22   1 H        0.925     0.059     2.210     2.325
    23   1 H        0.924     0.067     2.119     2.276
    24   1 H        0.924     0.056     2.241     2.341
    25   1 H        0.924     0.067     2.118     2.276
    26   1 H        0.924     0.056     2.248     2.344
    27   1 H        0.925     0.064     2.154     2.295
    28   1 H        0.925     0.064     2.157     2.297
    29   1 H        0.925     0.058     2.220     2.330
    30   1 H        0.925     0.073     2.056     2.242
    31   1 H        0.924     0.093     1.846     2.125
    32   1 H        0.924     0.070     2.080     2.256
    33   1 H        0.924     0.061     2.188     2.313
    34   1 H        0.925     0.058     2.222     2.331
    35   1 H        0.925     0.056     2.248     2.344
    36   1 H        0.925     0.064     2.152     2.294
    37   1 H        0.924     0.067     2.115     2.274
    38   1 H        0.924     0.063     2.160     2.298
    39   1 H        0.925     0.054     2.274     2.358
    40   1 H        0.925     0.061     2.184     2.311
    41   1 H        0.925     0.060     2.199     2.319

 Mol. C6AA /au·bohr⁶  :      26544.694964
 Mol. C8AA /au·bohr⁸  :     863463.227154
 Mol. α(0) /au        :        258.316847


Wiberg/Mayer (AO) data.
largest (>0.10) Wiberg bond orders for each atom

 ---------------------------------------------------------------------------
     #   Z sym  total        # sym  WBO       # sym  WBO       # sym  WBO
 ---------------------------------------------------------------------------
     1   6 C    3.989 --     2 C    1.022    21 H    0.982    22 H    0.980
                            20 H    0.974
     2   6 C    3.911 --     1 C    1.022    24 H    0.970    23 H    0.969
                             3 O    0.903
     3   8 O    2.410 --     4 P    1.309     2 C    0.903
     4  15 P    5.296 --     5 S    1.569     6 O    1.335     3 O    1.309
                             9 S    0.947
     5  16 S    1.905 --     4 P    1.569     9 S    0.143
     6   8 O    2.419 --     4 P    1.335     7 C    0.890
     7   6 C    3.913 --     8 C    1.021    25 H    0.971    26 H    0.966
                             6 O    0.890
     8   6 C    3.989 --     7 C    1.021    28 H    0.984    27 H    0.982
                            29 H    0.980
     9  16 S    2.274 --    10 C    0.995     4 P    0.947     5 S    0.143
    10   6 C    3.956 --     9 S    0.995    11 S    0.979    30 H    0.968
                            31 H    0.943
    11  16 S    2.256 --    10 C    0.979    12 P    0.952    13 S    0.152
    12  15 P    5.267 --    13 S    1.541    14 O    1.337    17 O    1.304
                            11 S    0.952
    13  16 S    1.897 --    12 P    1.541    11 S    0.152
    14   8 O    2.433 --    12 P    1.337    15 C    0.900
    15   6 C    3.902 --    16 C    1.020    33 H    0.970    32 H    0.963
                            14 O    0.900
    16   6 C    3.990 --    15 C    1.020    35 H    0.985    34 H    0.980
                            36 H    0.977
    17   8 O    2.410 --    12 P    1.304    18 C    0.910
    18   6 C    3.910 --    19 C    1.021    37 H    0.969    38 H    0.969
                            17 O    0.910
    19   6 C    3.992 --    18 C    1.021    40 H    0.983    41 H    0.981
                            39 H    0.975
    20   1 H    0.996 --     1 C    0.974
    21   1 H    0.995 --     1 C    0.982
    22   1 H    0.996 --     1 C    0.980
    23   1 H    0.995 --     2 C    0.969
    24   1 H    0.997 --     2 C    0.970
    25   1 H    0.995 --     7 C    0.971
    26   1 H    0.997 --     7 C    0.966
    27   1 H    0.996 --     8 C    0.982
    28   1 H    0.996 --     8 C    0.984
    29   1 H    0.995 --     8 C    0.980
    30   1 H    0.995 --    10 C    0.968
    31   1 H    0.991 --    10 C    0.943
    32   1 H    0.995 --    15 C    0.963
    33   1 H    0.995 --    15 C    0.970
    34   1 H    0.996 --    16 C    0.980
    35   1 H    0.997 --    16 C    0.985
    36   1 H    0.996 --    16 C    0.977
    37   1 H    0.995 --    18 C    0.969
    38   1 H    0.996 --    18 C    0.969
    39   1 H    0.997 --    19 C    0.975
    40   1 H    0.996 --    19 C    0.983
    41   1 H    0.996 --    19 C    0.981
 ---------------------------------------------------------------------------

Topologies differ in total number of bonds
Writing topology from bond orders to xtbtopo.mol

molecular dipole:
                 x           y           z       tot (Debye)
 q only:        1.339      -1.660       1.107
   full:        1.083      -1.540       1.447       6.035
molecular quadrupole (traceless):
                xx          xy          yy          xz          yz          zz
 q only:       15.613       4.309      -9.153       0.681      10.259      -6.459
  q+dip:       20.057       4.884     -10.591      -1.021      11.112      -9.466
   full:       20.825       4.919     -10.743       0.037      11.783     -10.082


           -------------------------------------------------
          | TOTAL ENERGY              -65.010910953421 Eh   |
          | GRADIENT NORM               0.035808207613 Eh/α |
          | HOMO-LUMO GAP               2.864504522230 eV   |
           -------------------------------------------------

------------------------------------------------------------------------
 * finished run on 2025/04/09 at 05:20:53.557     
------------------------------------------------------------------------
 total:
 * wall-time:     0 d,  0 h,  0 min,  0.111 sec
 *  cpu-time:     0 d,  0 h,  0 min,  0.069 sec
 * ratio c/w:     0.621 speedup
 SCF:
 * wall-time:     0 d,  0 h,  0 min,  0.068 sec
 *  cpu-time:     0 d,  0 h,  0 min,  0.055 sec
 * ratio c/w:     0.812 speedup

