      -----------------------------------------------------------      
     |                   =====================                   |     
     |                           x T B                           |     
     |                   =====================                   |     
     |                         S. Grimme                         |     
     |          Mulliken Center for Theoretical Chemistry        |     
     |                    University of Bonn                     |     
      -----------------------------------------------------------      

   * xtb version 6.7.1 (edcfbbe) compiled by 'albert@albert-system' on 2024-07-22

   xtb is free software: you can redistribute it and/or modify it under
   the terms of the GNU Lesser General Public License as published by
   the Free Software Foundation, either version 3 of the License, or
   (at your option) any later version.
   
   xtb is distributed in the hope that it will be useful,
   but WITHOUT ANY WARRANTY; without even the implied warranty of
   MERCHANTABILITY or FITNESS FOR A PARTICULAR PURPOSE.  See the
   GNU Lesser General Public License for more details.
   
   Cite this work as:
   * C. Bannwarth, E. Caldeweyher, S. Ehlert, A. Hansen, P. Pracht,
     J. Seibert, S. Spicher, S. Grimme, WIREs Comput. Mol. Sci., 2020, 11,
     e01493. DOI: 10.1002/wcms.1493
   
   for GFN2-xTB:
   * C. Bannwarth, S. Ehlert and S. Grimme., J. Chem. Theory Comput., 2019,
     15, 1652-1671. DOI: 10.1021/acs.jctc.8b01176
   for GFN1-xTB:
   * S. Grimme, C. Bannwarth, P. Shushkov, J. Chem. Theory Comput., 2017,
     13, 1989-2009. DOI: 10.1021/acs.jctc.7b00118
   for GFN0-xTB:
   * P. Pracht, E. Caldeweyher, S. Ehlert, S. Grimme, ChemRxiv, 2019, preprint.
     DOI: 10.26434/chemrxiv.8326202.v1
   for GFN-FF:
   * S. Spicher and S. Grimme, Angew. Chem. Int. Ed., 2020, 59, 15665-15673.
     DOI: 10.1002/anie.202004239
   
   for ALPB and GBSA implicit solvation:
   * S. Ehlert, M. Stahn, S. Spicher, S. Grimme, J. Chem. Theory Comput.,
     2021, 17, 4250-4261. DOI: 10.1021/acs.jctc.1c00471
   
   for ddCOSMO and CPCM-X implicit solvation:
   * M. Stahn, S. Ehlert, S. Grimme, J. Phys. Chem. A,
     2023, XX, XXXX-XXXX. DOI: 10.1021/acs.jpca.3c04382
   
   for DFT-D4:
   * E. Caldeweyher, C. Bannwarth and S. Grimme, J. Chem. Phys., 2017,
     147, 034112. DOI: 10.1063/1.4993215
   * E. Caldeweyher, S. Ehlert, A. Hansen, H. Neugebauer, S. Spicher,
     C. Bannwarth and S. Grimme, J. Chem. Phys., 2019, 150, 154122.
     DOI: 10.1063/1.5090222
   * E. Caldeweyher, J.-M. Mewes, S. Ehlert and S. Grimme, Phys. Chem. Chem. Phys.
     2020, 22, 8499-8512. DOI: 10.1039/D0CP00502A
   
   for sTDA-xTB:
   * S. Grimme and C. Bannwarth, J. Chem. Phys., 2016, 145, 054103.
     DOI: 10.1063/1.4959605
   
   in the mass-spec context:
   * V. Asgeirsson, C. Bauer and S. Grimme, Chem. Sci., 2017, 8, 4879.
     DOI: 10.1039/c7sc00601b
   * J. Koopman and S. Grimme, ACS Omega 2019, 4, 12, 15120-15133.
     DOI: 10.1021/acsomega.9b02011
   
   for metadynamics refer to:
   * S. Grimme, J. Chem. Theory Comput., 2019, 155, 2847-2862
     DOI: 10.1021/acs.jctc.9b00143
   
   for SPH calculations refer to:
   * S. Spicher and S. Grimme, J. Chem. Theory Comput., 2021, 17, 1701-1714
     DOI: 10.1021/acs.jctc.0c01306
   
   for ONIOM refer to:
   * C. Plett, A. Katbashev, S. Ehlert, S. Grimme, M. Bursch,
     Phys. Chem. Chem. Phys., 2023, 25, 17860-17868. DOI: 10.1039/D3CP02178E
   
   for DIPRO refer to:
   * J. Kohn, N. Gildemeister, S. Grimme, D. Fazzi, A. Hansen,
     J. Chem. Phys., 2023, just accepted.
   
   for PTB refer to:
   * S. Grimme, M. Mueller, A. Hansen, J. Chem. Phys., 2023, 158, 124111.
     DOI: 10.1063/5.0137838
   
   with help from (in alphabetical order)
   P. Atkinson, C. Bannwarth, F. Bohle, G. Brandenburg, E. Caldeweyher
   M. Checinski, S. Dohm, S. Ehlert, S. Ehrlich, I. Gerasimov, C. Hölzer
   A. Katbashev, J. Kohn, J. Koopman, C. Lavigne, S. Lehtola, F. März, M. Müller,
   F. Musil, H. Neugebauer, J. Pisarek, C. Plett, P. Pracht, F. Pultar,
   J. Seibert, P. Shushkov, S. Spicher, M. Stahn, M. Steiner, T. Strunk,
   J. Stückrath, T. Rose, and J. Unsleber
   
 * started run on 2025/04/09 at 05:21:20.042     
   ID    Z sym.   atoms
    1    6 C      1, 2, 7, 8, 10, 15, 16, 18, 19
    2    8 O      3, 6, 14, 17
    3   15 P      4, 12
    4   16 S      5, 9, 11, 13
    5    1 H      20-41

           -------------------------------------------------
          |                Calculation Setup                |
           -------------------------------------------------

          program call               : /srv/scratch/z5358697/.xtb/bin/xtb gas.coord --gfn2 --sp --chrg 0 --norestart --parallel 1
          hostname                   : k163
          coordinate file            : gas.coord
          omp threads                :                     1


           -------------------------------------------------
          |                 G F N 2 - x T B                 |
           -------------------------------------------------

        Reference                      10.1021/acs.jctc.8b01176
      * Hamiltonian:
        H0-scaling (s, p, d)           1.850000    2.230000    2.230000
        zeta-weighting                 0.500000
      * Dispersion:
        s8                             2.700000
        a1                             0.520000
        a2                             5.000000
        s9                             5.000000
      * Repulsion:
        kExp                           1.500000    1.000000
        rExp                           1.000000
      * Coulomb:
        alpha                          2.000000
        third order                    shell-resolved
        anisotropic                    true
        a3                             3.000000
        a5                             4.000000
        cn-shift                       1.200000
        cn-exp                         4.000000
        max-rad                        5.000000


          ...................................................
          :                      SETUP                      :
          :.................................................:
          :  # basis functions                 134          :
          :  # atomic orbitals                 128          :
          :  # shells                           66          :
          :  # electrons                       116          :
          :  max. iterations                   250          :
          :  Hamiltonian                  GFN2-xTB          :
          :  restarted?                      false          :
          :  GBSA solvation                  false          :
          :  PC potential                    false          :
          :  electronic temp.          300.0000000     K    :
          :  accuracy                    1.0000000          :
          :  -> integral cutoff          0.2500000E+02      :
          :  -> integral neglect         0.1000000E-07      :
          :  -> SCF convergence          0.1000000E-05 Eh   :
          :  -> wf. convergence          0.1000000E-03 e    :
          :  Broyden damping             0.4000000          :
          :  net charge                          0          :
          :  unpaired electrons                  0          :
          ...................................................

 iter      E             dE          RMSdq      gap      omega  full diag
   1    -65.3819441 -0.653819E+02  0.660E+00    4.25       0.0  T
   2    -65.5483541 -0.166410E+00  0.418E+00    3.17       1.0  T
   3    -65.5668921 -0.185381E-01  0.131E+00    3.04       1.0  T
   4    -65.5693065 -0.241434E-02  0.554E-01    2.83       1.0  T
   5    -65.5699698 -0.663326E-03  0.266E-01    2.94       1.0  T
   6    -65.5701719 -0.202144E-03  0.127E-01    2.92       1.0  T
   7    -65.5702343 -0.623808E-04  0.454E-02    2.93       1.0  T
   8    -65.5702420 -0.766407E-05  0.213E-02    2.94       1.0  T
   9    -65.5702430 -0.102073E-05  0.547E-03    2.94       2.9  T
  10    -65.5702431 -0.956851E-07  0.272E-03    2.94       5.7  T
  11    -65.5702431 -0.704478E-08  0.535E-04    2.94      29.2  T
  12    -65.5702431 -0.137376E-08  0.236E-04    2.94      66.2  T

   *** convergence criteria satisfied after 12 iterations ***

         #    Occupation            Energy/Eh            Energy/eV
      -------------------------------------------------------------
         1        2.0000           -0.7571603             -20.6034
       ...           ...                  ...                  ...
        52        2.0000           -0.4340542             -11.8112
        53        2.0000           -0.4097543             -11.1500
        54        2.0000           -0.3983227             -10.8389
        55        2.0000           -0.3772662             -10.2659
        56        2.0000           -0.3736942             -10.1687
        57        2.0000           -0.3709833             -10.0950
        58        2.0000           -0.3671397              -9.9904 (HOMO)
        59                         -0.2592390              -7.0543 (LUMO)
        60                         -0.2487947              -6.7700
        61                         -0.2076278              -5.6498
        62                         -0.1777752              -4.8375
        63                         -0.1581918              -4.3046
       ...                                ...                  ...
       128                          1.2602489              34.2931
      -------------------------------------------------------------
                  HL-Gap            0.1079007 Eh            2.9361 eV
             Fermi-level           -0.3131894 Eh           -8.5223 eV

 SCC (total)                   0 d,  0 h,  0 min,  0.063 sec
 SCC setup                      ...        0 min,  0.000 sec (  0.416%)
 Dispersion                     ...        0 min,  0.000 sec (  0.485%)
 classical contributions        ...        0 min,  0.000 sec (  0.092%)
 integral evaluation            ...        0 min,  0.015 sec ( 24.145%)
 iterations                     ...        0 min,  0.025 sec ( 39.479%)
 molecular gradient             ...        0 min,  0.022 sec ( 35.049%)
 printout                       ...        0 min,  0.000 sec (  0.313%)

         :::::::::::::::::::::::::::::::::::::::::::::::::::::
         ::                     SUMMARY                     ::
         :::::::::::::::::::::::::::::::::::::::::::::::::::::
         :: total energy             -65.010127304580 Eh    ::
         :: gradient norm              0.029489487502 Eh/a0 ::
         :: HOMO-LUMO gap              2.936126172896 eV    ::
         ::.................................................::
         :: SCC energy               -65.569181764449 Eh    ::
         :: -> isotropic ES            0.104016145955 Eh    ::
         :: -> anisotropic ES         -0.007196410031 Eh    ::
         :: -> anisotropic XC          0.031274423181 Eh    ::
         :: -> dispersion             -0.054513748525 Eh    ::
         :: repulsion energy           0.559054459869 Eh    ::
         :: add. restraining           0.000000000000 Eh    ::
         :: total charge               0.000000000000 e     ::
         :::::::::::::::::::::::::::::::::::::::::::::::::::::

           -------------------------------------------------
          |                Property Printout                |
           -------------------------------------------------

    * Orbital Energies and Occupations

         #    Occupation            Energy/Eh            Energy/eV
      -------------------------------------------------------------
         1        2.0000           -0.7571603             -20.6034
       ...           ...                  ...                  ...
        46        2.0000           -0.4651498             -12.6574
        47        2.0000           -0.4633842             -12.6093
        48        2.0000           -0.4581735             -12.4675
        49        2.0000           -0.4561234             -12.4118
        50        2.0000           -0.4511271             -12.2758
        51        2.0000           -0.4428222             -12.0498
        52        2.0000           -0.4340542             -11.8112
        53        2.0000           -0.4097543             -11.1500
        54        2.0000           -0.3983227             -10.8389
        55        2.0000           -0.3772662             -10.2659
        56        2.0000           -0.3736942             -10.1687
        57        2.0000           -0.3709833             -10.0950
        58        2.0000           -0.3671397              -9.9904 (HOMO)
        59                         -0.2592390              -7.0543 (LUMO)
        60                         -0.2487947              -6.7700
        61                         -0.2076278              -5.6498
        62                         -0.1777752              -4.8375
        63                         -0.1581918              -4.3046
        64                         -0.1575299              -4.2866
        65                         -0.1493273              -4.0634
        66                         -0.1416866              -3.8555
        67                         -0.1240793              -3.3764
        68                         -0.1201548              -3.2696
        69                         -0.0369948              -1.0067
       ...                                ...                  ...
       128                          1.2602489              34.2931
      -------------------------------------------------------------
                  HL-Gap            0.1079007 Eh            2.9361 eV
             Fermi-level           -0.3131894 Eh           -8.5223 eV

     #   Z          covCN         q      C6AA      α(0)
     1   6 C        3.751    -0.116    22.776     6.806
     2   6 C        3.837     0.089    19.091     6.216
     3   8 O        1.655    -0.229    17.810     5.697
     4  15 P        3.835     0.366   144.983    21.630
     5  16 S        0.926    -0.393   156.274    21.144
     6   8 O        1.655    -0.237    17.944     5.718
     7   6 C        3.874     0.081    19.189     6.229
     8   6 C        3.751    -0.114    22.748     6.802
     9  16 S        2.021    -0.161   147.838    20.464
    10   6 C        3.807     0.037    19.944     6.357
    11  16 S        2.015    -0.107   145.509    20.302
    12  15 P        3.869     0.370   144.838    21.619
    13  16 S        0.925    -0.423   157.693    21.240
    14   8 O        1.655    -0.250    18.163     5.753
    15   6 C        3.861     0.083    19.171     6.227
    16   6 C        3.751    -0.117    22.807     6.811
    17   8 O        1.655    -0.243    18.037     5.733
    18   6 C        3.863     0.089    19.076     6.211
    19   6 C        3.751    -0.117    22.793     6.808
    20   1 H        0.925     0.078     1.999     2.211
    21   1 H        0.925     0.059     2.212     2.326
    22   1 H        0.925     0.056     2.246     2.344
    23   1 H        0.924     0.058     2.224     2.332
    24   1 H        0.924     0.052     2.292     2.368
    25   1 H        0.924     0.067     2.116     2.275
    26   1 H        0.924     0.064     2.155     2.296
    27   1 H        0.925     0.054     2.276     2.359
    28   1 H        0.925     0.061     2.182     2.310
    29   1 H        0.925     0.060     2.194     2.316
    30   1 H        0.924     0.096     1.826     2.113
    31   1 H        0.925     0.077     2.012     2.218
    32   1 H        0.924     0.063     2.166     2.301
    33   1 H        0.924     0.064     2.152     2.294
    34   1 H        0.925     0.062     2.181     2.309
    35   1 H        0.925     0.062     2.172     2.305
    36   1 H        0.925     0.062     2.173     2.305
    37   1 H        0.924     0.054     2.274     2.358
    38   1 H        0.924     0.052     2.297     2.370
    39   1 H        0.925     0.059     2.207     2.323
    40   1 H        0.925     0.063     2.164     2.301
    41   1 H        0.925     0.067     2.114     2.274

 Mol. C6AA /au·bohr⁶  :      26559.086812
 Mol. C8AA /au·bohr⁸  :     863522.944961
 Mol. α(0) /au        :        258.376586


Wiberg/Mayer (AO) data.
largest (>0.10) Wiberg bond orders for each atom

 ---------------------------------------------------------------------------
     #   Z sym  total        # sym  WBO       # sym  WBO       # sym  WBO
 ---------------------------------------------------------------------------
     1   6 C    3.987 --     2 C    1.019    21 H    0.984    22 H    0.981
                            20 H    0.977
     2   6 C    3.907 --     1 C    1.019    23 H    0.970    24 H    0.962
                             3 O    0.904
     3   8 O    2.432 --     4 P    1.330     2 C    0.904
     4  15 P    5.260 --     5 S    1.535     3 O    1.330     6 O    1.308
                             9 S    0.953
     5  16 S    1.900 --     4 P    1.535     9 S    0.156
     6   8 O    2.415 --     4 P    1.308     7 C    0.911
     7   6 C    3.910 --     8 C    1.021    25 H    0.969    26 H    0.967
                             6 O    0.911
     8   6 C    3.991 --     7 C    1.021    28 H    0.983    29 H    0.981
                            27 H    0.975
     9  16 S    2.266 --    10 C    0.982     4 P    0.953     5 S    0.156
    10   6 C    3.956 --    11 S    0.992     9 S    0.982    31 H    0.968
                            30 H    0.942
    11  16 S    2.296 --    12 P    0.999    10 C    0.992    13 S    0.139
    12  15 P    5.285 --    13 S    1.528    17 O    1.313    14 O    1.309
                            11 S    0.999
    13  16 S    1.873 --    12 P    1.528    11 S    0.139
    14   8 O    2.410 --    12 P    1.309    15 C    0.907
    15   6 C    3.909 --    16 C    1.022    33 H    0.970    32 H    0.968
                            14 O    0.907
    16   6 C    3.990 --    15 C    1.022    35 H    0.983    34 H    0.980
                            36 H    0.975
    17   8 O    2.401 --    12 P    1.313    18 C    0.895
    18   6 C    3.913 --    19 C    1.020    37 H    0.973    38 H    0.964
                            17 O    0.895
    19   6 C    3.988 --    18 C    1.020    41 H    0.983    40 H    0.983
                            39 H    0.980
    20   1 H    0.994 --     1 C    0.977
    21   1 H    0.996 --     1 C    0.984
    22   1 H    0.996 --     1 C    0.981
    23   1 H    0.996 --     2 C    0.970
    24   1 H    0.997 --     2 C    0.962
    25   1 H    0.995 --     7 C    0.969
    26   1 H    0.996 --     7 C    0.967
    27   1 H    0.997 --     8 C    0.975
    28   1 H    0.996 --     8 C    0.983
    29   1 H    0.996 --     8 C    0.981
    30   1 H    0.991 --    10 C    0.942
    31   1 H    0.994 --    10 C    0.968
    32   1 H    0.996 --    15 C    0.968
    33   1 H    0.996 --    15 C    0.970
    34   1 H    0.996 --    16 C    0.980
    35   1 H    0.996 --    16 C    0.983
    36   1 H    0.996 --    16 C    0.975
    37   1 H    0.997 --    18 C    0.973
    38   1 H    0.997 --    18 C    0.964
    39   1 H    0.995 --    19 C    0.980
    40   1 H    0.996 --    19 C    0.983
    41   1 H    0.995 --    19 C    0.983
 ---------------------------------------------------------------------------

Topologies differ in total number of bonds
Writing topology from bond orders to xtbtopo.mol

molecular dipole:
                 x           y           z       tot (Debye)
 q only:       -0.951      -0.868       0.071
   full:       -0.990      -1.141      -0.262       3.896
molecular quadrupole (traceless):
                xx          xy          yy          xz          yz          zz
 q only:        1.187     -15.028     -11.341       9.893       5.237      10.155
  q+dip:        7.015     -17.261     -13.275      11.002       4.329       6.260
   full:        6.926     -17.973     -14.698      12.013       4.725       7.772


           -------------------------------------------------
          | TOTAL ENERGY              -65.010127304580 Eh   |
          | GRADIENT NORM               0.029489487502 Eh/α |
          | HOMO-LUMO GAP               2.936126172896 eV   |
           -------------------------------------------------

------------------------------------------------------------------------
 * finished run on 2025/04/09 at 05:21:20.169     
------------------------------------------------------------------------
 total:
 * wall-time:     0 d,  0 h,  0 min,  0.126 sec
 *  cpu-time:     0 d,  0 h,  0 min,  0.069 sec
 * ratio c/w:     0.545 speedup
 SCF:
 * wall-time:     0 d,  0 h,  0 min,  0.063 sec
 *  cpu-time:     0 d,  0 h,  0 min,  0.056 sec
 * ratio c/w:     0.883 speedup

