      -----------------------------------------------------------      
     |                   =====================                   |     
     |                           x T B                           |     
     |                   =====================                   |     
     |                         S. Grimme                         |     
     |          Mulliken Center for Theoretical Chemistry        |     
     |                    University of Bonn                     |     
      -----------------------------------------------------------      

   * xtb version 6.7.1 (edcfbbe) compiled by 'albert@albert-system' on 2024-07-22

   xtb is free software: you can redistribute it and/or modify it under
   the terms of the GNU Lesser General Public License as published by
   the Free Software Foundation, either version 3 of the License, or
   (at your option) any later version.
   
   xtb is distributed in the hope that it will be useful,
   but WITHOUT ANY WARRANTY; without even the implied warranty of
   MERCHANTABILITY or FITNESS FOR A PARTICULAR PURPOSE.  See the
   GNU Lesser General Public License for more details.
   
   Cite this work as:
   * C. Bannwarth, E. Caldeweyher, S. Ehlert, A. Hansen, P. Pracht,
     J. Seibert, S. Spicher, S. Grimme, WIREs Comput. Mol. Sci., 2020, 11,
     e01493. DOI: 10.1002/wcms.1493
   
   for GFN2-xTB:
   * C. Bannwarth, S. Ehlert and S. Grimme., J. Chem. Theory Comput., 2019,
     15, 1652-1671. DOI: 10.1021/acs.jctc.8b01176
   for GFN1-xTB:
   * S. Grimme, C. Bannwarth, P. Shushkov, J. Chem. Theory Comput., 2017,
     13, 1989-2009. DOI: 10.1021/acs.jctc.7b00118
   for GFN0-xTB:
   * P. Pracht, E. Caldeweyher, S. Ehlert, S. Grimme, ChemRxiv, 2019, preprint.
     DOI: 10.26434/chemrxiv.8326202.v1
   for GFN-FF:
   * S. Spicher and S. Grimme, Angew. Chem. Int. Ed., 2020, 59, 15665-15673.
     DOI: 10.1002/anie.202004239
   
   for ALPB and GBSA implicit solvation:
   * S. Ehlert, M. Stahn, S. Spicher, S. Grimme, J. Chem. Theory Comput.,
     2021, 17, 4250-4261. DOI: 10.1021/acs.jctc.1c00471
   
   for ddCOSMO and CPCM-X implicit solvation:
   * M. Stahn, S. Ehlert, S. Grimme, J. Phys. Chem. A,
     2023, XX, XXXX-XXXX. DOI: 10.1021/acs.jpca.3c04382
   
   for DFT-D4:
   * E. Caldeweyher, C. Bannwarth and S. Grimme, J. Chem. Phys., 2017,
     147, 034112. DOI: 10.1063/1.4993215
   * E. Caldeweyher, S. Ehlert, A. Hansen, H. Neugebauer, S. Spicher,
     C. Bannwarth and S. Grimme, J. Chem. Phys., 2019, 150, 154122.
     DOI: 10.1063/1.5090222
   * E. Caldeweyher, J.-M. Mewes, S. Ehlert and S. Grimme, Phys. Chem. Chem. Phys.
     2020, 22, 8499-8512. DOI: 10.1039/D0CP00502A
   
   for sTDA-xTB:
   * S. Grimme and C. Bannwarth, J. Chem. Phys., 2016, 145, 054103.
     DOI: 10.1063/1.4959605
   
   in the mass-spec context:
   * V. Asgeirsson, C. Bauer and S. Grimme, Chem. Sci., 2017, 8, 4879.
     DOI: 10.1039/c7sc00601b
   * J. Koopman and S. Grimme, ACS Omega 2019, 4, 12, 15120-15133.
     DOI: 10.1021/acsomega.9b02011
   
   for metadynamics refer to:
   * S. Grimme, J. Chem. Theory Comput., 2019, 155, 2847-2862
     DOI: 10.1021/acs.jctc.9b00143
   
   for SPH calculations refer to:
   * S. Spicher and S. Grimme, J. Chem. Theory Comput., 2021, 17, 1701-1714
     DOI: 10.1021/acs.jctc.0c01306
   
   for ONIOM refer to:
   * C. Plett, A. Katbashev, S. Ehlert, S. Grimme, M. Bursch,
     Phys. Chem. Chem. Phys., 2023, 25, 17860-17868. DOI: 10.1039/D3CP02178E
   
   for DIPRO refer to:
   * J. Kohn, N. Gildemeister, S. Grimme, D. Fazzi, A. Hansen,
     J. Chem. Phys., 2023, just accepted.
   
   for PTB refer to:
   * S. Grimme, M. Mueller, A. Hansen, J. Chem. Phys., 2023, 158, 124111.
     DOI: 10.1063/5.0137838
   
   with help from (in alphabetical order)
   P. Atkinson, C. Bannwarth, F. Bohle, G. Brandenburg, E. Caldeweyher
   M. Checinski, S. Dohm, S. Ehlert, S. Ehrlich, I. Gerasimov, C. Hölzer
   A. Katbashev, J. Kohn, J. Koopman, C. Lavigne, S. Lehtola, F. März, M. Müller,
   F. Musil, H. Neugebauer, J. Pisarek, C. Plett, P. Pracht, F. Pultar,
   J. Seibert, P. Shushkov, S. Spicher, M. Stahn, M. Steiner, T. Strunk,
   J. Stückrath, T. Rose, and J. Unsleber
   
 * started run on 2025/04/09 at 05:20:51.867     
   ID    Z sym.   atoms
    1    6 C      1, 2, 7, 8, 10, 15, 16, 18, 19
    2    8 O      3, 6, 14, 17
    3   15 P      4, 12
    4   16 S      5, 9, 11, 13
    5    1 H      20-41

           -------------------------------------------------
          |                Calculation Setup                |
           -------------------------------------------------

          program call               : /srv/scratch/z5358697/.xtb/bin/xtb gas.coord --gfn2 --sp --chrg 0 --norestart --parallel 1
          hostname                   : k163
          coordinate file            : gas.coord
          omp threads                :                     1


           -------------------------------------------------
          |                 G F N 2 - x T B                 |
           -------------------------------------------------

        Reference                      10.1021/acs.jctc.8b01176
      * Hamiltonian:
        H0-scaling (s, p, d)           1.850000    2.230000    2.230000
        zeta-weighting                 0.500000
      * Dispersion:
        s8                             2.700000
        a1                             0.520000
        a2                             5.000000
        s9                             5.000000
      * Repulsion:
        kExp                           1.500000    1.000000
        rExp                           1.000000
      * Coulomb:
        alpha                          2.000000
        third order                    shell-resolved
        anisotropic                    true
        a3                             3.000000
        a5                             4.000000
        cn-shift                       1.200000
        cn-exp                         4.000000
        max-rad                        5.000000


          ...................................................
          :                      SETUP                      :
          :.................................................:
          :  # basis functions                 134          :
          :  # atomic orbitals                 128          :
          :  # shells                           66          :
          :  # electrons                       116          :
          :  max. iterations                   250          :
          :  Hamiltonian                  GFN2-xTB          :
          :  restarted?                      false          :
          :  GBSA solvation                  false          :
          :  PC potential                    false          :
          :  electronic temp.          300.0000000     K    :
          :  accuracy                    1.0000000          :
          :  -> integral cutoff          0.2500000E+02      :
          :  -> integral neglect         0.1000000E-07      :
          :  -> SCF convergence          0.1000000E-05 Eh   :
          :  -> wf. convergence          0.1000000E-03 e    :
          :  Broyden damping             0.4000000          :
          :  net charge                          0          :
          :  unpaired electrons                  0          :
          ...................................................

 iter      E             dE          RMSdq      gap      omega  full diag
   1    -65.3790464 -0.653790E+02  0.656E+00    4.07       0.0  T
   2    -65.5514956 -0.172449E+00  0.429E+00    3.19       1.0  T
   3    -65.5703612 -0.188656E-01  0.134E+00    2.97       1.0  T
   4    -65.5726421 -0.228096E-02  0.513E-01    2.76       1.0  T
   5    -65.5732161 -0.573935E-03  0.242E-01    2.86       1.0  T
   6    -65.5734268 -0.210742E-03  0.121E-01    2.84       1.0  T
   7    -65.5734738 -0.470040E-04  0.471E-02    2.85       1.0  T
   8    -65.5734837 -0.984513E-05  0.220E-02    2.86       1.0  T
   9    -65.5734851 -0.140752E-05  0.545E-03    2.85       2.9  T
  10    -65.5734852 -0.884630E-07  0.252E-03    2.85       6.2  T
  11    -65.5734852 -0.615456E-08  0.543E-04    2.86      28.7  T
  12    -65.5734852 -0.526285E-09  0.215E-04    2.86      72.6  T

   *** convergence criteria satisfied after 12 iterations ***

         #    Occupation            Energy/Eh            Energy/eV
      -------------------------------------------------------------
         1        2.0000           -0.7579352             -20.6245
       ...           ...                  ...                  ...
        52        2.0000           -0.4359035             -11.8615
        53        2.0000           -0.4077038             -11.0942
        54        2.0000           -0.3969210             -10.8008
        55        2.0000           -0.3745271             -10.1914
        56        2.0000           -0.3723070             -10.1310
        57        2.0000           -0.3699155             -10.0659
        58        2.0000           -0.3690323             -10.0419 (HOMO)
        59                         -0.2641122              -7.1869 (LUMO)
        60                         -0.2374862              -6.4623
        61                         -0.1971433              -5.3645
        62                         -0.1765711              -4.8047
        63                         -0.1621224              -4.4116
       ...                                ...                  ...
       128                          1.2731925              34.6453
      -------------------------------------------------------------
                  HL-Gap            0.1049202 Eh            2.8550 eV
             Fermi-level           -0.3165722 Eh           -8.6144 eV

 SCC (total)                   0 d,  0 h,  0 min,  0.058 sec
 SCC setup                      ...        0 min,  0.000 sec (  0.482%)
 Dispersion                     ...        0 min,  0.000 sec (  0.555%)
 classical contributions        ...        0 min,  0.000 sec (  0.103%)
 integral evaluation            ...        0 min,  0.010 sec ( 16.516%)
 iterations                     ...        0 min,  0.025 sec ( 43.940%)
 molecular gradient             ...        0 min,  0.022 sec ( 38.011%)
 printout                       ...        0 min,  0.000 sec (  0.360%)

         :::::::::::::::::::::::::::::::::::::::::::::::::::::
         ::                     SUMMARY                     ::
         :::::::::::::::::::::::::::::::::::::::::::::::::::::
         :: total energy             -65.012418695144 Eh    ::
         :: gradient norm              0.028898005858 Eh/a0 ::
         :: HOMO-LUMO gap              2.855022908151 eV    ::
         ::.................................................::
         :: SCC energy               -65.572550858141 Eh    ::
         :: -> isotropic ES            0.106832213634 Eh    ::
         :: -> anisotropic ES         -0.008262910390 Eh    ::
         :: -> anisotropic XC          0.031005344576 Eh    ::
         :: -> dispersion             -0.052843891608 Eh    ::
         :: repulsion energy           0.560132162997 Eh    ::
         :: add. restraining           0.000000000000 Eh    ::
         :: total charge              -0.000000000000 e     ::
         :::::::::::::::::::::::::::::::::::::::::::::::::::::

           -------------------------------------------------
          |                Property Printout                |
           -------------------------------------------------

    * Orbital Energies and Occupations

         #    Occupation            Energy/Eh            Energy/eV
      -------------------------------------------------------------
         1        2.0000           -0.7579352             -20.6245
       ...           ...                  ...                  ...
        46        2.0000           -0.4675160             -12.7218
        47        2.0000           -0.4636003             -12.6152
        48        2.0000           -0.4609370             -12.5427
        49        2.0000           -0.4583472             -12.4723
        50        2.0000           -0.4564773             -12.4214
        51        2.0000           -0.4410654             -12.0020
        52        2.0000           -0.4359035             -11.8615
        53        2.0000           -0.4077038             -11.0942
        54        2.0000           -0.3969210             -10.8008
        55        2.0000           -0.3745271             -10.1914
        56        2.0000           -0.3723070             -10.1310
        57        2.0000           -0.3699155             -10.0659
        58        2.0000           -0.3690323             -10.0419 (HOMO)
        59                         -0.2641122              -7.1869 (LUMO)
        60                         -0.2374862              -6.4623
        61                         -0.1971433              -5.3645
        62                         -0.1765711              -4.8047
        63                         -0.1621224              -4.4116
        64                         -0.1566187              -4.2618
        65                         -0.1540738              -4.1926
        66                         -0.1382259              -3.7613
        67                         -0.1261450              -3.4326
        68                         -0.1126459              -3.0653
        69                         -0.0353211              -0.9611
       ...                                ...                  ...
       128                          1.2731925              34.6453
      -------------------------------------------------------------
                  HL-Gap            0.1049202 Eh            2.8550 eV
             Fermi-level           -0.3165722 Eh           -8.6144 eV

     #   Z          covCN         q      C6AA      α(0)
     1   6 C        3.751    -0.118    22.817     6.812
     2   6 C        3.870     0.082    19.173     6.226
     3   8 O        1.655    -0.253    18.214     5.761
     4  15 P        3.847     0.385   144.237    21.574
     5  16 S        0.926    -0.414   157.291    21.213
     6   8 O        1.655    -0.245    18.081     5.740
     7   6 C        3.826     0.086    19.133     6.224
     8   6 C        3.751    -0.114    22.739     6.800
     9  16 S        2.029    -0.135   146.735    20.388
    10   6 C        3.828     0.039    19.891     6.346
    11  16 S        2.023    -0.132   146.578    20.377
    12  15 P        3.913     0.374   144.672    21.606
    13  16 S        0.926    -0.420   157.586    21.233
    14   8 O        1.655    -0.246    18.097     5.743
    15   6 C        3.880     0.086    19.114     6.216
    16   6 C        3.752    -0.115    22.769     6.805
    17   8 O        1.655    -0.237    17.949     5.719
    18   6 C        3.877     0.087    19.097     6.213
    19   6 C        3.751    -0.114    22.736     6.800
    20   1 H        0.925     0.062     2.172     2.305
    21   1 H        0.925     0.063     2.167     2.302
    22   1 H        0.925     0.062     2.181     2.309
    23   1 H        0.924     0.064     2.157     2.297
    24   1 H        0.924     0.063     2.170     2.303
    25   1 H        0.924     0.067     2.116     2.275
    26   1 H        0.924     0.051     2.308     2.376
    27   1 H        0.925     0.055     2.259     2.350
    28   1 H        0.925     0.062     2.173     2.305
    29   1 H        0.925     0.068     2.103     2.268
    30   1 H        0.925     0.091     1.870     2.138
    31   1 H        0.925     0.090     1.874     2.141
    32   1 H        0.924     0.051     2.310     2.377
    33   1 H        0.924     0.060     2.204     2.321
    34   1 H        0.925     0.063     2.168     2.303
    35   1 H        0.925     0.064     2.155     2.296
    36   1 H        0.925     0.061     2.188     2.313
    37   1 H        0.924     0.065     2.145     2.291
    38   1 H        0.924     0.062     2.173     2.305
    39   1 H        0.925     0.063     2.162     2.299
    40   1 H        0.925     0.059     2.214     2.327
    41   1 H        0.925     0.059     2.214     2.327

 Mol. C6AA /au·bohr⁶  :      26551.654268
 Mol. C8AA /au·bohr⁸  :     863362.641934
 Mol. α(0) /au        :        258.325611


Wiberg/Mayer (AO) data.
largest (>0.10) Wiberg bond orders for each atom

 ---------------------------------------------------------------------------
     #   Z sym  total        # sym  WBO       # sym  WBO       # sym  WBO
 ---------------------------------------------------------------------------
     1   6 C    3.990 --     2 C    1.022    20 H    0.983    22 H    0.980
                            21 H    0.976
     2   6 C    3.909 --     1 C    1.022    24 H    0.970    23 H    0.967
                             3 O    0.906
     3   8 O    2.409 --     4 P    1.309     2 C    0.906
     4  15 P    5.262 --     5 S    1.532     6 O    1.311     3 O    1.309
                             9 S    0.973
     5  16 S    1.875 --     4 P    1.532     9 S    0.145
     6   8 O    2.401 --     4 P    1.311     7 C    0.893
     7   6 C    3.912 --     8 C    1.022    26 H    0.973    25 H    0.969
                             6 O    0.893
     8   6 C    3.990 --     7 C    1.022    29 H    0.982    27 H    0.980
                            28 H    0.976
     9  16 S    2.286 --    10 C    0.988     4 P    0.973     5 S    0.145
    10   6 C    3.957 --     9 S    0.988    11 S    0.987    30 H    0.958
                            31 H    0.957
    11  16 S    2.295 --    12 P    0.987    10 C    0.987    13 S    0.137
    12  15 P    5.282 --    13 S    1.537    17 O    1.318    14 O    1.308
                            11 S    0.987
    13  16 S    1.869 --    12 P    1.537    11 S    0.137
    14   8 O    2.407 --    12 P    1.308    15 C    0.904
    15   6 C    3.911 --    16 C    1.019    32 H    0.973    33 H    0.967
                            14 O    0.904
    16   6 C    3.989 --    15 C    1.019    34 H    0.985    35 H    0.984
                            36 H    0.980
    17   8 O    2.412 --    12 P    1.318    18 C    0.896
    18   6 C    3.908 --    19 C    1.023    38 H    0.970    37 H    0.966
                            17 O    0.896
    19   6 C    3.991 --    18 C    1.023    41 H    0.984    40 H    0.980
                            39 H    0.976
    20   1 H    0.996 --     1 C    0.983
    21   1 H    0.996 --     1 C    0.976
    22   1 H    0.996 --     1 C    0.980
    23   1 H    0.996 --     2 C    0.967
    24   1 H    0.996 --     2 C    0.970
    25   1 H    0.995 --     7 C    0.969
    26   1 H    0.997 --     7 C    0.973
    27   1 H    0.996 --     8 C    0.980
    28   1 H    0.996 --     8 C    0.976
    29   1 H    0.995 --     8 C    0.982
    30   1 H    0.991 --    10 C    0.958
    31   1 H    0.992 --    10 C    0.957
    32   1 H    0.997 --    15 C    0.973
    33   1 H    0.996 --    15 C    0.967
    34   1 H    0.996 --    16 C    0.985
    35   1 H    0.996 --    16 C    0.984
    36   1 H    0.995 --    16 C    0.980
    37   1 H    0.996 --    18 C    0.966
    38   1 H    0.995 --    18 C    0.970
    39   1 H    0.996 --    19 C    0.976
    40   1 H    0.995 --    19 C    0.980
    41   1 H    0.996 --    19 C    0.984
 ---------------------------------------------------------------------------

Topologies differ in total number of bonds
Writing topology from bond orders to xtbtopo.mol

molecular dipole:
                 x           y           z       tot (Debye)
 q only:       -0.180      -1.286       1.135
   full:       -0.158      -1.700       1.594       5.937
molecular quadrupole (traceless):
                xx          xy          yy          xz          yz          zz
 q only:        6.246     -17.731      -0.394     -17.038      -2.190      -5.852
  q+dip:        4.297     -20.467       1.844     -17.253      -4.679      -6.141
   full:        4.797     -21.175       1.820     -17.697      -4.378      -6.617


           -------------------------------------------------
          | TOTAL ENERGY              -65.012418695144 Eh   |
          | GRADIENT NORM               0.028898005858 Eh/α |
          | HOMO-LUMO GAP               2.855022908151 eV   |
           -------------------------------------------------

------------------------------------------------------------------------
 * finished run on 2025/04/09 at 05:20:52.006     
------------------------------------------------------------------------
 total:
 * wall-time:     0 d,  0 h,  0 min,  0.139 sec
 *  cpu-time:     0 d,  0 h,  0 min,  0.069 sec
 * ratio c/w:     0.500 speedup
 SCF:
 * wall-time:     0 d,  0 h,  0 min,  0.058 sec
 *  cpu-time:     0 d,  0 h,  0 min,  0.056 sec
 * ratio c/w:     0.973 speedup

