      -----------------------------------------------------------      
     |                   =====================                   |     
     |                           x T B                           |     
     |                   =====================                   |     
     |                         S. Grimme                         |     
     |          Mulliken Center for Theoretical Chemistry        |     
     |                    University of Bonn                     |     
      -----------------------------------------------------------      

   * xtb version 6.7.1 (edcfbbe) compiled by 'albert@albert-system' on 2024-07-22

   xtb is free software: you can redistribute it and/or modify it under
   the terms of the GNU Lesser General Public License as published by
   the Free Software Foundation, either version 3 of the License, or
   (at your option) any later version.
   
   xtb is distributed in the hope that it will be useful,
   but WITHOUT ANY WARRANTY; without even the implied warranty of
   MERCHANTABILITY or FITNESS FOR A PARTICULAR PURPOSE.  See the
   GNU Lesser General Public License for more details.
   
   Cite this work as:
   * C. Bannwarth, E. Caldeweyher, S. Ehlert, A. Hansen, P. Pracht,
     J. Seibert, S. Spicher, S. Grimme, WIREs Comput. Mol. Sci., 2020, 11,
     e01493. DOI: 10.1002/wcms.1493
   
   for GFN2-xTB:
   * C. Bannwarth, S. Ehlert and S. Grimme., J. Chem. Theory Comput., 2019,
     15, 1652-1671. DOI: 10.1021/acs.jctc.8b01176
   for GFN1-xTB:
   * S. Grimme, C. Bannwarth, P. Shushkov, J. Chem. Theory Comput., 2017,
     13, 1989-2009. DOI: 10.1021/acs.jctc.7b00118
   for GFN0-xTB:
   * P. Pracht, E. Caldeweyher, S. Ehlert, S. Grimme, ChemRxiv, 2019, preprint.
     DOI: 10.26434/chemrxiv.8326202.v1
   for GFN-FF:
   * S. Spicher and S. Grimme, Angew. Chem. Int. Ed., 2020, 59, 15665-15673.
     DOI: 10.1002/anie.202004239
   
   for ALPB and GBSA implicit solvation:
   * S. Ehlert, M. Stahn, S. Spicher, S. Grimme, J. Chem. Theory Comput.,
     2021, 17, 4250-4261. DOI: 10.1021/acs.jctc.1c00471
   
   for ddCOSMO and CPCM-X implicit solvation:
   * M. Stahn, S. Ehlert, S. Grimme, J. Phys. Chem. A,
     2023, XX, XXXX-XXXX. DOI: 10.1021/acs.jpca.3c04382
   
   for DFT-D4:
   * E. Caldeweyher, C. Bannwarth and S. Grimme, J. Chem. Phys., 2017,
     147, 034112. DOI: 10.1063/1.4993215
   * E. Caldeweyher, S. Ehlert, A. Hansen, H. Neugebauer, S. Spicher,
     C. Bannwarth and S. Grimme, J. Chem. Phys., 2019, 150, 154122.
     DOI: 10.1063/1.5090222
   * E. Caldeweyher, J.-M. Mewes, S. Ehlert and S. Grimme, Phys. Chem. Chem. Phys.
     2020, 22, 8499-8512. DOI: 10.1039/D0CP00502A
   
   for sTDA-xTB:
   * S. Grimme and C. Bannwarth, J. Chem. Phys., 2016, 145, 054103.
     DOI: 10.1063/1.4959605
   
   in the mass-spec context:
   * V. Asgeirsson, C. Bauer and S. Grimme, Chem. Sci., 2017, 8, 4879.
     DOI: 10.1039/c7sc00601b
   * J. Koopman and S. Grimme, ACS Omega 2019, 4, 12, 15120-15133.
     DOI: 10.1021/acsomega.9b02011
   
   for metadynamics refer to:
   * S. Grimme, J. Chem. Theory Comput., 2019, 155, 2847-2862
     DOI: 10.1021/acs.jctc.9b00143
   
   for SPH calculations refer to:
   * S. Spicher and S. Grimme, J. Chem. Theory Comput., 2021, 17, 1701-1714
     DOI: 10.1021/acs.jctc.0c01306
   
   for ONIOM refer to:
   * C. Plett, A. Katbashev, S. Ehlert, S. Grimme, M. Bursch,
     Phys. Chem. Chem. Phys., 2023, 25, 17860-17868. DOI: 10.1039/D3CP02178E
   
   for DIPRO refer to:
   * J. Kohn, N. Gildemeister, S. Grimme, D. Fazzi, A. Hansen,
     J. Chem. Phys., 2023, just accepted.
   
   for PTB refer to:
   * S. Grimme, M. Mueller, A. Hansen, J. Chem. Phys., 2023, 158, 124111.
     DOI: 10.1063/5.0137838
   
   with help from (in alphabetical order)
   P. Atkinson, C. Bannwarth, F. Bohle, G. Brandenburg, E. Caldeweyher
   M. Checinski, S. Dohm, S. Ehlert, S. Ehrlich, I. Gerasimov, C. Hölzer
   A. Katbashev, J. Kohn, J. Koopman, C. Lavigne, S. Lehtola, F. März, M. Müller,
   F. Musil, H. Neugebauer, J. Pisarek, C. Plett, P. Pracht, F. Pultar,
   J. Seibert, P. Shushkov, S. Spicher, M. Stahn, M. Steiner, T. Strunk,
   J. Stückrath, T. Rose, and J. Unsleber
   
 * started run on 2025/04/09 at 05:20:50.765     
   ID    Z sym.   atoms
    1    6 C      1, 2, 7, 8, 10, 15, 16, 18, 19
    2    8 O      3, 6, 14, 17
    3   15 P      4, 12
    4   16 S      5, 9, 11, 13
    5    1 H      20-41

           -------------------------------------------------
          |                Calculation Setup                |
           -------------------------------------------------

          program call               : /srv/scratch/z5358697/.xtb/bin/xtb gas.coord --gfn2 --sp --chrg 0 --norestart --parallel 1
          hostname                   : k163
          coordinate file            : gas.coord
          omp threads                :                     1


           -------------------------------------------------
          |                 G F N 2 - x T B                 |
           -------------------------------------------------

        Reference                      10.1021/acs.jctc.8b01176
      * Hamiltonian:
        H0-scaling (s, p, d)           1.850000    2.230000    2.230000
        zeta-weighting                 0.500000
      * Dispersion:
        s8                             2.700000
        a1                             0.520000
        a2                             5.000000
        s9                             5.000000
      * Repulsion:
        kExp                           1.500000    1.000000
        rExp                           1.000000
      * Coulomb:
        alpha                          2.000000
        third order                    shell-resolved
        anisotropic                    true
        a3                             3.000000
        a5                             4.000000
        cn-shift                       1.200000
        cn-exp                         4.000000
        max-rad                        5.000000


          ...................................................
          :                      SETUP                      :
          :.................................................:
          :  # basis functions                 134          :
          :  # atomic orbitals                 128          :
          :  # shells                           66          :
          :  # electrons                       116          :
          :  max. iterations                   250          :
          :  Hamiltonian                  GFN2-xTB          :
          :  restarted?                      false          :
          :  GBSA solvation                  false          :
          :  PC potential                    false          :
          :  electronic temp.          300.0000000     K    :
          :  accuracy                    1.0000000          :
          :  -> integral cutoff          0.2500000E+02      :
          :  -> integral neglect         0.1000000E-07      :
          :  -> SCF convergence          0.1000000E-05 Eh   :
          :  -> wf. convergence          0.1000000E-03 e    :
          :  Broyden damping             0.4000000          :
          :  net charge                          0          :
          :  unpaired electrons                  0          :
          ...................................................

 iter      E             dE          RMSdq      gap      omega  full diag
   1    -65.3787087 -0.653787E+02  0.623E+00    4.27       0.0  T
   2    -65.5471332 -0.168424E+00  0.393E+00    3.04       1.0  T
   3    -65.5670511 -0.199179E-01  0.147E+00    2.94       1.0  T
   4    -65.5697498 -0.269863E-02  0.623E-01    2.67       1.0  T
   5    -65.5706954 -0.945620E-03  0.267E-01    2.81       1.0  T
   6    -65.5708407 -0.145331E-03  0.137E-01    2.78       1.0  T
   7    -65.5708942 -0.534993E-04  0.517E-02    2.79       1.0  T
   8    -65.5709053 -0.111195E-04  0.246E-02    2.80       1.0  T
   9    -65.5709073 -0.195259E-05  0.566E-03    2.80       2.8  T
  10    -65.5709074 -0.125982E-06  0.265E-03    2.80       5.9  T
  11    -65.5709074 -0.759842E-08  0.541E-04    2.80      28.9  T
  12    -65.5709074 -0.586127E-09  0.239E-04    2.80      65.4  T

   *** convergence criteria satisfied after 12 iterations ***

         #    Occupation            Energy/Eh            Energy/eV
      -------------------------------------------------------------
         1        2.0000           -0.7593852             -20.6639
       ...           ...                  ...                  ...
        52        2.0000           -0.4355500             -11.8519
        53        2.0000           -0.4121650             -11.2156
        54        2.0000           -0.4016577             -10.9297
        55        2.0000           -0.3733883             -10.1604
        56        2.0000           -0.3704499             -10.0805
        57        2.0000           -0.3680707             -10.0157
        58        2.0000           -0.3613529              -9.8329 (HOMO)
        59                         -0.2585422              -7.0353 (LUMO)
        60                         -0.2460847              -6.6963
        61                         -0.2056601              -5.5963
        62                         -0.1769243              -4.8144
        63                         -0.1663901              -4.5277
       ...                                ...                  ...
       128                          1.3409465              36.4890
      -------------------------------------------------------------
                  HL-Gap            0.1028107 Eh            2.7976 eV
             Fermi-level           -0.3099476 Eh           -8.4341 eV

 SCC (total)                   0 d,  0 h,  0 min,  0.053 sec
 SCC setup                      ...        0 min,  0.000 sec (  0.486%)
 Dispersion                     ...        0 min,  0.000 sec (  0.558%)
 classical contributions        ...        0 min,  0.000 sec (  0.116%)
 integral evaluation            ...        0 min,  0.008 sec ( 15.365%)
 iterations                     ...        0 min,  0.024 sec ( 45.877%)
 molecular gradient             ...        0 min,  0.020 sec ( 37.172%)
 printout                       ...        0 min,  0.000 sec (  0.398%)

         :::::::::::::::::::::::::::::::::::::::::::::::::::::
         ::                     SUMMARY                     ::
         :::::::::::::::::::::::::::::::::::::::::::::::::::::
         :: total energy             -65.007874118970 Eh    ::
         :: gradient norm              0.043215870053 Eh/a0 ::
         :: HOMO-LUMO gap              2.797622511656 eV    ::
         ::.................................................::
         :: SCC energy               -65.569853018367 Eh    ::
         :: -> isotropic ES            0.104538850195 Eh    ::
         :: -> anisotropic ES         -0.012833947749 Eh    ::
         :: -> anisotropic XC          0.030822332915 Eh    ::
         :: -> dispersion             -0.054215020233 Eh    ::
         :: repulsion energy           0.561978899397 Eh    ::
         :: add. restraining           0.000000000000 Eh    ::
         :: total charge               0.000000000000 e     ::
         :::::::::::::::::::::::::::::::::::::::::::::::::::::

           -------------------------------------------------
          |                Property Printout                |
           -------------------------------------------------

    * Orbital Energies and Occupations

         #    Occupation            Energy/Eh            Energy/eV
      -------------------------------------------------------------
         1        2.0000           -0.7593852             -20.6639
       ...           ...                  ...                  ...
        46        2.0000           -0.4728850             -12.8679
        47        2.0000           -0.4684483             -12.7471
        48        2.0000           -0.4590280             -12.4908
        49        2.0000           -0.4585884             -12.4788
        50        2.0000           -0.4501476             -12.2491
        51        2.0000           -0.4406228             -11.9900
        52        2.0000           -0.4355500             -11.8519
        53        2.0000           -0.4121650             -11.2156
        54        2.0000           -0.4016577             -10.9297
        55        2.0000           -0.3733883             -10.1604
        56        2.0000           -0.3704499             -10.0805
        57        2.0000           -0.3680707             -10.0157
        58        2.0000           -0.3613529              -9.8329 (HOMO)
        59                         -0.2585422              -7.0353 (LUMO)
        60                         -0.2460847              -6.6963
        61                         -0.2056601              -5.5963
        62                         -0.1769243              -4.8144
        63                         -0.1663901              -4.5277
        64                         -0.1627083              -4.4275
        65                         -0.1490673              -4.0563
        66                         -0.1428802              -3.8880
        67                         -0.1161488              -3.1606
        68                         -0.1077537              -2.9321
        69                         -0.0450663              -1.2263
       ...                                ...                  ...
       128                          1.3409465              36.4890
      -------------------------------------------------------------
                  HL-Gap            0.1028107 Eh            2.7976 eV
             Fermi-level           -0.3099476 Eh           -8.4341 eV

     #   Z          covCN         q      C6AA      α(0)
     1   6 C        3.751    -0.120    22.855     6.818
     2   6 C        3.837     0.086    19.135     6.223
     3   8 O        1.655    -0.257    18.273     5.771
     4  15 P        3.836     0.367   144.937    21.626
     5  16 S        0.927    -0.358   154.657    21.035
     6   8 O        1.653    -0.219    17.648     5.671
     7   6 C        3.872     0.088    19.087     6.212
     8   6 C        3.751    -0.113    22.724     6.798
     9  16 S        2.023    -0.193   149.237    20.561
    10   6 C        3.807     0.049    19.753     6.327
    11  16 S        2.017    -0.162   147.901    20.469
    12  15 P        3.882     0.363   145.091    21.638
    13  16 S        0.928    -0.366   155.055    21.062
    14   8 O        1.652    -0.236    17.929     5.716
    15   6 C        3.865     0.082    19.174     6.227
    16   6 C        3.751    -0.116    22.791     6.808
    17   8 O        1.655    -0.252    18.198     5.759
    18   6 C        3.875     0.085    19.130     6.219
    19   6 C        3.752    -0.116    22.778     6.806
    20   1 H        0.925     0.056     2.244     2.342
    21   1 H        0.925     0.074     2.040     2.234
    22   1 H        0.925     0.061     2.186     2.312
    23   1 H        0.924     0.060     2.196     2.318
    24   1 H        0.924     0.049     2.337     2.391
    25   1 H        0.924     0.052     2.293     2.368
    26   1 H        0.924     0.057     2.239     2.340
    27   1 H        0.925     0.072     2.066     2.248
    28   1 H        0.925     0.053     2.286     2.364
    29   1 H        0.925     0.068     2.112     2.273
    30   1 H        0.925     0.079     1.988     2.205
    31   1 H        0.924     0.091     1.869     2.138
    32   1 H        0.924     0.062     2.181     2.309
    33   1 H        0.924     0.061     2.185     2.311
    34   1 H        0.925     0.067     2.117     2.275
    35   1 H        0.925     0.061     2.183     2.311
    36   1 H        0.925     0.061     2.188     2.313
    37   1 H        0.924     0.062     2.171     2.304
    38   1 H        0.924     0.053     2.284     2.364
    39   1 H        0.925     0.062     2.181     2.309
    40   1 H        0.925     0.065     2.144     2.290
    41   1 H        0.925     0.062     2.173     2.305

 Mol. C6AA /au·bohr⁶  :      26557.679190
 Mol. C8AA /au·bohr⁸  :     863418.889577
 Mol. α(0) /au        :        258.367625


Wiberg/Mayer (AO) data.
largest (>0.10) Wiberg bond orders for each atom

 ---------------------------------------------------------------------------
     #   Z sym  total        # sym  WBO       # sym  WBO       # sym  WBO
 ---------------------------------------------------------------------------
     1   6 C    3.988 --     2 C    1.020    22 H    0.985    20 H    0.981
                            21 H    0.978
     2   6 C    3.912 --     1 C    1.020    23 H    0.971    24 H    0.969
                             3 O    0.907
     3   8 O    2.398 --     4 P    1.296     2 C    0.907
     4  15 P    5.303 --     5 S    1.584     6 O    1.350     3 O    1.296
                             9 S    0.945
     5  16 S    1.929 --     4 P    1.584     9 S    0.147
     6   8 O    2.429 --     4 P    1.350     7 C    0.887
     7   6 C    3.913 --     8 C    1.021    26 H    0.973    25 H    0.965
                             6 O    0.887
     8   6 C    3.985 --     7 C    1.021    29 H    0.983    28 H    0.980
                            27 H    0.980
     9  16 S    2.270 --    10 C    0.982     4 P    0.945     5 S    0.147
    10   6 C    3.955 --    11 S    0.992     9 S    0.982    30 H    0.969
                            31 H    0.941
    11  16 S    2.275 --    10 C    0.992    12 P    0.953    13 S    0.143
    12  15 P    5.304 --    13 S    1.589    14 O    1.337    17 O    1.307
                            11 S    0.953
    13  16 S    1.923 --    12 P    1.589    11 S    0.143
    14   8 O    2.413 --    12 P    1.337    15 C    0.882
    15   6 C    3.910 --    16 C    1.022    32 H    0.973    33 H    0.965
                            14 O    0.882
    16   6 C    3.989 --    15 C    1.022    35 H    0.983    34 H    0.981
                            36 H    0.979
    17   8 O    2.401 --    12 P    1.307    18 C    0.902
    18   6 C    3.909 --    19 C    1.020    38 H    0.972    37 H    0.968
                            17 O    0.902
    19   6 C    3.989 --    18 C    1.020    39 H    0.984    40 H    0.984
                            41 H    0.980
    20   1 H    0.996 --     1 C    0.981
    21   1 H    0.994 --     1 C    0.978
    22   1 H    0.996 --     1 C    0.985
    23   1 H    0.996 --     2 C    0.971
    24   1 H    0.997 --     2 C    0.969
    25   1 H    0.997 --     7 C    0.965
    26   1 H    0.997 --     7 C    0.973
    27   1 H    0.995 --     8 C    0.980
    28   1 H    0.995 --     8 C    0.980
    29   1 H    0.995 --     8 C    0.983
    30   1 H    0.994 --    10 C    0.969
    31   1 H    0.992 --    10 C    0.941
    32   1 H    0.996 --    15 C    0.973
    33   1 H    0.996 --    15 C    0.965
    34   1 H    0.995 --    16 C    0.981
    35   1 H    0.996 --    16 C    0.983
    36   1 H    0.994 --    16 C    0.979
    37   1 H    0.996 --    18 C    0.968
    38   1 H    0.997 --    18 C    0.972
    39   1 H    0.996 --    19 C    0.984
    40   1 H    0.996 --    19 C    0.984
    41   1 H    0.995 --    19 C    0.980
 ---------------------------------------------------------------------------

Topologies differ in total number of bonds
Writing topology from bond orders to xtbtopo.mol

molecular dipole:
                 x           y           z       tot (Debye)
 q only:       -0.442      -1.501       2.397
   full:       -0.349      -1.207       2.731       7.641
molecular quadrupole (traceless):
                xx          xy          yy          xz          yz          zz
 q only:       24.476      -1.201     -16.536       3.239       9.737      -7.940
  q+dip:       25.486      -0.057     -14.345       4.406      12.082     -11.142
   full:       26.638      -0.334     -15.502       4.368      12.092     -11.137


           -------------------------------------------------
          | TOTAL ENERGY              -65.007874118970 Eh   |
          | GRADIENT NORM               0.043215870053 Eh/α |
          | HOMO-LUMO GAP               2.797622511656 eV   |
           -------------------------------------------------

------------------------------------------------------------------------
 * finished run on 2025/04/09 at 05:20:50.859     
------------------------------------------------------------------------
 total:
 * wall-time:     0 d,  0 h,  0 min,  0.093 sec
 *  cpu-time:     0 d,  0 h,  0 min,  0.066 sec
 * ratio c/w:     0.702 speedup
 SCF:
 * wall-time:     0 d,  0 h,  0 min,  0.053 sec
 *  cpu-time:     0 d,  0 h,  0 min,  0.053 sec
 * ratio c/w:     0.986 speedup

