      -----------------------------------------------------------      
     |                   =====================                   |     
     |                           x T B                           |     
     |                   =====================                   |     
     |                         S. Grimme                         |     
     |          Mulliken Center for Theoretical Chemistry        |     
     |                    University of Bonn                     |     
      -----------------------------------------------------------      

   * xtb version 6.7.1 (edcfbbe) compiled by 'albert@albert-system' on 2024-07-22

   xtb is free software: you can redistribute it and/or modify it under
   the terms of the GNU Lesser General Public License as published by
   the Free Software Foundation, either version 3 of the License, or
   (at your option) any later version.
   
   xtb is distributed in the hope that it will be useful,
   but WITHOUT ANY WARRANTY; without even the implied warranty of
   MERCHANTABILITY or FITNESS FOR A PARTICULAR PURPOSE.  See the
   GNU Lesser General Public License for more details.
   
   Cite this work as:
   * C. Bannwarth, E. Caldeweyher, S. Ehlert, A. Hansen, P. Pracht,
     J. Seibert, S. Spicher, S. Grimme, WIREs Comput. Mol. Sci., 2020, 11,
     e01493. DOI: 10.1002/wcms.1493
   
   for GFN2-xTB:
   * C. Bannwarth, S. Ehlert and S. Grimme., J. Chem. Theory Comput., 2019,
     15, 1652-1671. DOI: 10.1021/acs.jctc.8b01176
   for GFN1-xTB:
   * S. Grimme, C. Bannwarth, P. Shushkov, J. Chem. Theory Comput., 2017,
     13, 1989-2009. DOI: 10.1021/acs.jctc.7b00118
   for GFN0-xTB:
   * P. Pracht, E. Caldeweyher, S. Ehlert, S. Grimme, ChemRxiv, 2019, preprint.
     DOI: 10.26434/chemrxiv.8326202.v1
   for GFN-FF:
   * S. Spicher and S. Grimme, Angew. Chem. Int. Ed., 2020, 59, 15665-15673.
     DOI: 10.1002/anie.202004239
   
   for ALPB and GBSA implicit solvation:
   * S. Ehlert, M. Stahn, S. Spicher, S. Grimme, J. Chem. Theory Comput.,
     2021, 17, 4250-4261. DOI: 10.1021/acs.jctc.1c00471
   
   for ddCOSMO and CPCM-X implicit solvation:
   * M. Stahn, S. Ehlert, S. Grimme, J. Phys. Chem. A,
     2023, XX, XXXX-XXXX. DOI: 10.1021/acs.jpca.3c04382
   
   for DFT-D4:
   * E. Caldeweyher, C. Bannwarth and S. Grimme, J. Chem. Phys., 2017,
     147, 034112. DOI: 10.1063/1.4993215
   * E. Caldeweyher, S. Ehlert, A. Hansen, H. Neugebauer, S. Spicher,
     C. Bannwarth and S. Grimme, J. Chem. Phys., 2019, 150, 154122.
     DOI: 10.1063/1.5090222
   * E. Caldeweyher, J.-M. Mewes, S. Ehlert and S. Grimme, Phys. Chem. Chem. Phys.
     2020, 22, 8499-8512. DOI: 10.1039/D0CP00502A
   
   for sTDA-xTB:
   * S. Grimme and C. Bannwarth, J. Chem. Phys., 2016, 145, 054103.
     DOI: 10.1063/1.4959605
   
   in the mass-spec context:
   * V. Asgeirsson, C. Bauer and S. Grimme, Chem. Sci., 2017, 8, 4879.
     DOI: 10.1039/c7sc00601b
   * J. Koopman and S. Grimme, ACS Omega 2019, 4, 12, 15120-15133.
     DOI: 10.1021/acsomega.9b02011
   
   for metadynamics refer to:
   * S. Grimme, J. Chem. Theory Comput., 2019, 155, 2847-2862
     DOI: 10.1021/acs.jctc.9b00143
   
   for SPH calculations refer to:
   * S. Spicher and S. Grimme, J. Chem. Theory Comput., 2021, 17, 1701-1714
     DOI: 10.1021/acs.jctc.0c01306
   
   for ONIOM refer to:
   * C. Plett, A. Katbashev, S. Ehlert, S. Grimme, M. Bursch,
     Phys. Chem. Chem. Phys., 2023, 25, 17860-17868. DOI: 10.1039/D3CP02178E
   
   for DIPRO refer to:
   * J. Kohn, N. Gildemeister, S. Grimme, D. Fazzi, A. Hansen,
     J. Chem. Phys., 2023, just accepted.
   
   for PTB refer to:
   * S. Grimme, M. Mueller, A. Hansen, J. Chem. Phys., 2023, 158, 124111.
     DOI: 10.1063/5.0137838
   
   with help from (in alphabetical order)
   P. Atkinson, C. Bannwarth, F. Bohle, G. Brandenburg, E. Caldeweyher
   M. Checinski, S. Dohm, S. Ehlert, S. Ehrlich, I. Gerasimov, C. Hölzer
   A. Katbashev, J. Kohn, J. Koopman, C. Lavigne, S. Lehtola, F. März, M. Müller,
   F. Musil, H. Neugebauer, J. Pisarek, C. Plett, P. Pracht, F. Pultar,
   J. Seibert, P. Shushkov, S. Spicher, M. Stahn, M. Steiner, T. Strunk,
   J. Stückrath, T. Rose, and J. Unsleber
   
 * started run on 2025/04/09 at 05:20:48.532     
   ID    Z sym.   atoms
    1    6 C      1, 2, 7, 8, 10, 15, 16, 18, 19
    2    8 O      3, 6, 14, 17
    3   15 P      4, 12
    4   16 S      5, 9, 11, 13
    5    1 H      20-41

           -------------------------------------------------
          |                Calculation Setup                |
           -------------------------------------------------

          program call               : /srv/scratch/z5358697/.xtb/bin/xtb gas.coord --gfn2 --sp --chrg 0 --norestart --parallel 1
          hostname                   : k163
          coordinate file            : gas.coord
          omp threads                :                     1


           -------------------------------------------------
          |                 G F N 2 - x T B                 |
           -------------------------------------------------

        Reference                      10.1021/acs.jctc.8b01176
      * Hamiltonian:
        H0-scaling (s, p, d)           1.850000    2.230000    2.230000
        zeta-weighting                 0.500000
      * Dispersion:
        s8                             2.700000
        a1                             0.520000
        a2                             5.000000
        s9                             5.000000
      * Repulsion:
        kExp                           1.500000    1.000000
        rExp                           1.000000
      * Coulomb:
        alpha                          2.000000
        third order                    shell-resolved
        anisotropic                    true
        a3                             3.000000
        a5                             4.000000
        cn-shift                       1.200000
        cn-exp                         4.000000
        max-rad                        5.000000


          ...................................................
          :                      SETUP                      :
          :.................................................:
          :  # basis functions                 134          :
          :  # atomic orbitals                 128          :
          :  # shells                           66          :
          :  # electrons                       116          :
          :  max. iterations                   250          :
          :  Hamiltonian                  GFN2-xTB          :
          :  restarted?                      false          :
          :  GBSA solvation                  false          :
          :  PC potential                    false          :
          :  electronic temp.          300.0000000     K    :
          :  accuracy                    1.0000000          :
          :  -> integral cutoff          0.2500000E+02      :
          :  -> integral neglect         0.1000000E-07      :
          :  -> SCF convergence          0.1000000E-05 Eh   :
          :  -> wf. convergence          0.1000000E-03 e    :
          :  Broyden damping             0.4000000          :
          :  net charge                          0          :
          :  unpaired electrons                  0          :
          ...................................................

 iter      E             dE          RMSdq      gap      omega  full diag
   1    -65.3832395 -0.653832E+02  0.639E+00    4.19       0.0  T
   2    -65.5534009 -0.170161E+00  0.411E+00    3.10       1.0  T
   3    -65.5721846 -0.187837E-01  0.139E+00    2.90       1.0  T
   4    -65.5744332 -0.224860E-02  0.558E-01    2.68       1.0  T
   5    -65.5750962 -0.663003E-03  0.248E-01    2.79       1.0  T
   6    -65.5752613 -0.165111E-03  0.127E-01    2.76       1.0  T
   7    -65.5753183 -0.570070E-04  0.483E-02    2.77       1.0  T
   8    -65.5753279 -0.959063E-05  0.216E-02    2.78       1.0  T
   9    -65.5753291 -0.124809E-05  0.545E-03    2.78       2.9  T
  10    -65.5753292 -0.889255E-07  0.268E-03    2.78       5.8  T
  11    -65.5753292 -0.513283E-08  0.501E-04    2.78      31.2  T
  12    -65.5753292 -0.717378E-09  0.258E-04    2.78      60.4  T

   *** convergence criteria satisfied after 12 iterations ***

         #    Occupation            Energy/Eh            Energy/eV
      -------------------------------------------------------------
         1        2.0000           -0.7614963             -20.7214
       ...           ...                  ...                  ...
        52        2.0000           -0.4390250             -11.9465
        53        2.0000           -0.4116294             -11.2010
        54        2.0000           -0.4029623             -10.9652
        55        2.0000           -0.3799206             -10.3382
        56        2.0000           -0.3766237             -10.2485
        57        2.0000           -0.3727871             -10.1441
        58        2.0000           -0.3679197             -10.0116 (HOMO)
        59                         -0.2658301              -7.2336 (LUMO)
        60                         -0.2441026              -6.6424
        61                         -0.2069666              -5.6318
        62                         -0.1790132              -4.8712
        63                         -0.1657609              -4.5106
       ...                                ...                  ...
       128                          1.2847944              34.9610
      -------------------------------------------------------------
                  HL-Gap            0.1020896 Eh            2.7780 eV
             Fermi-level           -0.3168749 Eh           -8.6226 eV

 SCC (total)                   0 d,  0 h,  0 min,  0.062 sec
 SCC setup                      ...        0 min,  0.000 sec (  0.455%)
 Dispersion                     ...        0 min,  0.000 sec (  0.503%)
 classical contributions        ...        0 min,  0.000 sec (  0.097%)
 integral evaluation            ...        0 min,  0.014 sec ( 22.235%)
 iterations                     ...        0 min,  0.025 sec ( 40.665%)
 molecular gradient             ...        0 min,  0.022 sec ( 35.693%)
 printout                       ...        0 min,  0.000 sec (  0.329%)

         :::::::::::::::::::::::::::::::::::::::::::::::::::::
         ::                     SUMMARY                     ::
         :::::::::::::::::::::::::::::::::::::::::::::::::::::
         :: total energy             -65.013644968755 Eh    ::
         :: gradient norm              0.031254965456 Eh/a0 ::
         :: HOMO-LUMO gap              2.777998493013 eV    ::
         ::.................................................::
         :: SCC energy               -65.574118017050 Eh    ::
         :: -> isotropic ES            0.104187193741 Eh    ::
         :: -> anisotropic ES         -0.008512005331 Eh    ::
         :: -> anisotropic XC          0.031142194892 Eh    ::
         :: -> dispersion             -0.053658896127 Eh    ::
         :: repulsion energy           0.560473048295 Eh    ::
         :: add. restraining           0.000000000000 Eh    ::
         :: total charge              -0.000000000000 e     ::
         :::::::::::::::::::::::::::::::::::::::::::::::::::::

           -------------------------------------------------
          |                Property Printout                |
           -------------------------------------------------

    * Orbital Energies and Occupations

         #    Occupation            Energy/Eh            Energy/eV
      -------------------------------------------------------------
         1        2.0000           -0.7614963             -20.7214
       ...           ...                  ...                  ...
        46        2.0000           -0.4726311             -12.8609
        47        2.0000           -0.4662340             -12.6869
        48        2.0000           -0.4607395             -12.5374
        49        2.0000           -0.4594464             -12.5022
        50        2.0000           -0.4537721             -12.3478
        51        2.0000           -0.4479357             -12.1890
        52        2.0000           -0.4390250             -11.9465
        53        2.0000           -0.4116294             -11.2010
        54        2.0000           -0.4029623             -10.9652
        55        2.0000           -0.3799206             -10.3382
        56        2.0000           -0.3766237             -10.2485
        57        2.0000           -0.3727871             -10.1441
        58        2.0000           -0.3679197             -10.0116 (HOMO)
        59                         -0.2658301              -7.2336 (LUMO)
        60                         -0.2441026              -6.6424
        61                         -0.2069666              -5.6318
        62                         -0.1790132              -4.8712
        63                         -0.1657609              -4.5106
        64                         -0.1638487              -4.4585
        65                         -0.1538288              -4.1859
        66                         -0.1429681              -3.8904
        67                         -0.1289000              -3.5075
        68                         -0.1180043              -3.2111
        69                         -0.0412095              -1.1214
       ...                                ...                  ...
       128                          1.2847944              34.9610
      -------------------------------------------------------------
                  HL-Gap            0.1020896 Eh            2.7780 eV
             Fermi-level           -0.3168749 Eh           -8.6226 eV

     #   Z          covCN         q      C6AA      α(0)
     1   6 C        3.751    -0.117    22.797     6.809
     2   6 C        3.809     0.078    19.279     6.250
     3   8 O        1.654    -0.235    17.911     5.713
     4  15 P        3.750     0.373   144.738    21.611
     5  16 S        0.926    -0.373   155.372    21.083
     6   8 O        1.655    -0.245    18.069     5.738
     7   6 C        3.812     0.085    19.165     6.231
     8   6 C        3.751    -0.117    22.813     6.812
     9  16 S        2.017    -0.175   148.449    20.507
    10   6 C        3.820     0.041    19.876     6.345
    11  16 S        2.010    -0.132   146.590    20.378
    12  15 P        3.886     0.373   144.723    21.610
    13  16 S        0.926    -0.419   157.502    21.227
    14   8 O        1.655    -0.246    18.086     5.741
    15   6 C        3.868     0.082    19.178     6.227
    16   6 C        3.751    -0.117    22.804     6.810
    17   8 O        1.655    -0.251    18.169     5.754
    18   6 C        3.868     0.085    19.131     6.220
    19   6 C        3.751    -0.114    22.740     6.801
    20   1 H        0.925     0.061     2.188     2.313
    21   1 H        0.925     0.060     2.202     2.321
    22   1 H        0.925     0.066     2.127     2.281
    23   1 H        0.924     0.061     2.192     2.315
    24   1 H        0.924     0.073     2.054     2.241
    25   1 H        0.924     0.055     2.262     2.352
    26   1 H        0.924     0.059     2.206     2.322
    27   1 H        0.925     0.055     2.256     2.349
    28   1 H        0.925     0.063     2.170     2.304
    29   1 H        0.925     0.070     2.081     2.256
    30   1 H        0.925     0.087     1.907     2.159
    31   1 H        0.925     0.094     1.837     2.120
    32   1 H        0.924     0.062     2.181     2.310
    33   1 H        0.924     0.065     2.142     2.289
    34   1 H        0.925     0.061     2.184     2.311
    35   1 H        0.925     0.062     2.179     2.309
    36   1 H        0.925     0.063     2.165     2.301
    37   1 H        0.924     0.064     2.148     2.292
    38   1 H        0.924     0.061     2.186     2.312
    39   1 H        0.925     0.060     2.194     2.316
    40   1 H        0.925     0.061     2.184     2.311
    41   1 H        0.925     0.060     2.204     2.321

 Mol. C6AA /au·bohr⁶  :      26538.118922
 Mol. C8AA /au·bohr⁸  :     863305.202139
 Mol. α(0) /au        :        258.272519


Wiberg/Mayer (AO) data.
largest (>0.10) Wiberg bond orders for each atom

 ---------------------------------------------------------------------------
     #   Z sym  total        # sym  WBO       # sym  WBO       # sym  WBO
 ---------------------------------------------------------------------------
     1   6 C    3.989 --     2 C    1.024    22 H    0.982    21 H    0.979
                            20 H    0.975
     2   6 C    3.912 --     1 C    1.024    23 H    0.971    24 H    0.969
                             3 O    0.889
     3   8 O    2.420 --     4 P    1.352     2 C    0.889
     4  15 P    5.276 --     5 S    1.571     3 O    1.352     6 O    1.300
                             9 S    0.934
     5  16 S    1.917 --     4 P    1.571     9 S    0.147
     6   8 O    2.417 --     4 P    1.300     7 C    0.906
     7   6 C    3.911 --     8 C    1.020    26 H    0.969    25 H    0.965
                             6 O    0.906
     8   6 C    3.989 --     7 C    1.020    28 H    0.984    27 H    0.981
                            29 H    0.976
     9  16 S    2.278 --    10 C    0.994     4 P    0.934     5 S    0.147
    10   6 C    3.953 --     9 S    0.994    11 S    0.983    30 H    0.957
                            31 H    0.948
    11  16 S    2.293 --    12 P    0.987    10 C    0.983    13 S    0.138
    12  15 P    5.278 --    13 S    1.540    14 O    1.309    17 O    1.300
                            11 S    0.987
    13  16 S    1.873 --    12 P    1.540    11 S    0.138
    14   8 O    2.413 --    12 P    1.309    15 C    0.906
    15   6 C    3.910 --    16 C    1.022    33 H    0.970    32 H    0.968
                            14 O    0.906
    16   6 C    3.990 --    15 C    1.022    36 H    0.983    35 H    0.980
                            34 H    0.976
    17   8 O    2.396 --    12 P    1.300    18 C    0.896
    18   6 C    3.911 --    19 C    1.023    38 H    0.970    37 H    0.968
                            17 O    0.896
    19   6 C    3.991 --    18 C    1.023    39 H    0.984    41 H    0.980
                            40 H    0.976
    20   1 H    0.996 --     1 C    0.975
    21   1 H    0.995 --     1 C    0.979
    22   1 H    0.996 --     1 C    0.982
    23   1 H    0.996 --     2 C    0.971
    24   1 H    0.994 --     2 C    0.969
    25   1 H    0.997 --     7 C    0.965
    26   1 H    0.996 --     7 C    0.969
    27   1 H    0.996 --     8 C    0.981
    28   1 H    0.996 --     8 C    0.984
    29   1 H    0.995 --     8 C    0.976
    30   1 H    0.992 --    10 C    0.957
    31   1 H    0.991 --    10 C    0.948
    32   1 H    0.996 --    15 C    0.968
    33   1 H    0.996 --    15 C    0.970
    34   1 H    0.996 --    16 C    0.976
    35   1 H    0.995 --    16 C    0.980
    36   1 H    0.996 --    16 C    0.983
    37   1 H    0.996 --    18 C    0.968
    38   1 H    0.996 --    18 C    0.970
    39   1 H    0.996 --    19 C    0.984
    40   1 H    0.996 --    19 C    0.976
    41   1 H    0.995 --    19 C    0.980
 ---------------------------------------------------------------------------

Topologies differ in total number of bonds
Writing topology from bond orders to xtbtopo.mol

molecular dipole:
                 x           y           z       tot (Debye)
 q only:       -1.231      -1.921       0.474
   full:       -1.169      -2.386       0.508       6.875
molecular quadrupole (traceless):
                xx          xy          yy          xz          yz          zz
 q only:       -3.806     -15.758       8.393     -20.759       4.428      -4.587
  q+dip:       -0.743     -18.033       6.029     -22.878      -1.094      -5.286
   full:       -0.047     -17.761       6.115     -23.749       0.757      -6.068


           -------------------------------------------------
          | TOTAL ENERGY              -65.013644968755 Eh   |
          | GRADIENT NORM               0.031254965456 Eh/α |
          | HOMO-LUMO GAP               2.777998493013 eV   |
           -------------------------------------------------

------------------------------------------------------------------------
 * finished run on 2025/04/09 at 05:20:48.641     
------------------------------------------------------------------------
 total:
 * wall-time:     0 d,  0 h,  0 min,  0.109 sec
 *  cpu-time:     0 d,  0 h,  0 min,  0.070 sec
 * ratio c/w:     0.648 speedup
 SCF:
 * wall-time:     0 d,  0 h,  0 min,  0.062 sec
 *  cpu-time:     0 d,  0 h,  0 min,  0.057 sec
 * ratio c/w:     0.906 speedup

