      -----------------------------------------------------------      
     |                   =====================                   |     
     |                           x T B                           |     
     |                   =====================                   |     
     |                         S. Grimme                         |     
     |          Mulliken Center for Theoretical Chemistry        |     
     |                    University of Bonn                     |     
      -----------------------------------------------------------      

   * xtb version 6.7.1 (edcfbbe) compiled by 'albert@albert-system' on 2024-07-22

   xtb is free software: you can redistribute it and/or modify it under
   the terms of the GNU Lesser General Public License as published by
   the Free Software Foundation, either version 3 of the License, or
   (at your option) any later version.
   
   xtb is distributed in the hope that it will be useful,
   but WITHOUT ANY WARRANTY; without even the implied warranty of
   MERCHANTABILITY or FITNESS FOR A PARTICULAR PURPOSE.  See the
   GNU Lesser General Public License for more details.
   
   Cite this work as:
   * C. Bannwarth, E. Caldeweyher, S. Ehlert, A. Hansen, P. Pracht,
     J. Seibert, S. Spicher, S. Grimme, WIREs Comput. Mol. Sci., 2020, 11,
     e01493. DOI: 10.1002/wcms.1493
   
   for GFN2-xTB:
   * C. Bannwarth, S. Ehlert and S. Grimme., J. Chem. Theory Comput., 2019,
     15, 1652-1671. DOI: 10.1021/acs.jctc.8b01176
   for GFN1-xTB:
   * S. Grimme, C. Bannwarth, P. Shushkov, J. Chem. Theory Comput., 2017,
     13, 1989-2009. DOI: 10.1021/acs.jctc.7b00118
   for GFN0-xTB:
   * P. Pracht, E. Caldeweyher, S. Ehlert, S. Grimme, ChemRxiv, 2019, preprint.
     DOI: 10.26434/chemrxiv.8326202.v1
   for GFN-FF:
   * S. Spicher and S. Grimme, Angew. Chem. Int. Ed., 2020, 59, 15665-15673.
     DOI: 10.1002/anie.202004239
   
   for ALPB and GBSA implicit solvation:
   * S. Ehlert, M. Stahn, S. Spicher, S. Grimme, J. Chem. Theory Comput.,
     2021, 17, 4250-4261. DOI: 10.1021/acs.jctc.1c00471
   
   for ddCOSMO and CPCM-X implicit solvation:
   * M. Stahn, S. Ehlert, S. Grimme, J. Phys. Chem. A,
     2023, XX, XXXX-XXXX. DOI: 10.1021/acs.jpca.3c04382
   
   for DFT-D4:
   * E. Caldeweyher, C. Bannwarth and S. Grimme, J. Chem. Phys., 2017,
     147, 034112. DOI: 10.1063/1.4993215
   * E. Caldeweyher, S. Ehlert, A. Hansen, H. Neugebauer, S. Spicher,
     C. Bannwarth and S. Grimme, J. Chem. Phys., 2019, 150, 154122.
     DOI: 10.1063/1.5090222
   * E. Caldeweyher, J.-M. Mewes, S. Ehlert and S. Grimme, Phys. Chem. Chem. Phys.
     2020, 22, 8499-8512. DOI: 10.1039/D0CP00502A
   
   for sTDA-xTB:
   * S. Grimme and C. Bannwarth, J. Chem. Phys., 2016, 145, 054103.
     DOI: 10.1063/1.4959605
   
   in the mass-spec context:
   * V. Asgeirsson, C. Bauer and S. Grimme, Chem. Sci., 2017, 8, 4879.
     DOI: 10.1039/c7sc00601b
   * J. Koopman and S. Grimme, ACS Omega 2019, 4, 12, 15120-15133.
     DOI: 10.1021/acsomega.9b02011
   
   for metadynamics refer to:
   * S. Grimme, J. Chem. Theory Comput., 2019, 155, 2847-2862
     DOI: 10.1021/acs.jctc.9b00143
   
   for SPH calculations refer to:
   * S. Spicher and S. Grimme, J. Chem. Theory Comput., 2021, 17, 1701-1714
     DOI: 10.1021/acs.jctc.0c01306
   
   for ONIOM refer to:
   * C. Plett, A. Katbashev, S. Ehlert, S. Grimme, M. Bursch,
     Phys. Chem. Chem. Phys., 2023, 25, 17860-17868. DOI: 10.1039/D3CP02178E
   
   for DIPRO refer to:
   * J. Kohn, N. Gildemeister, S. Grimme, D. Fazzi, A. Hansen,
     J. Chem. Phys., 2023, just accepted.
   
   for PTB refer to:
   * S. Grimme, M. Mueller, A. Hansen, J. Chem. Phys., 2023, 158, 124111.
     DOI: 10.1063/5.0137838
   
   with help from (in alphabetical order)
   P. Atkinson, C. Bannwarth, F. Bohle, G. Brandenburg, E. Caldeweyher
   M. Checinski, S. Dohm, S. Ehlert, S. Ehrlich, I. Gerasimov, C. Hölzer
   A. Katbashev, J. Kohn, J. Koopman, C. Lavigne, S. Lehtola, F. März, M. Müller,
   F. Musil, H. Neugebauer, J. Pisarek, C. Plett, P. Pracht, F. Pultar,
   J. Seibert, P. Shushkov, S. Spicher, M. Stahn, M. Steiner, T. Strunk,
   J. Stückrath, T. Rose, and J. Unsleber
   
 * started run on 2025/04/09 at 05:20:49.077     
   ID    Z sym.   atoms
    1    6 C      1, 2, 7, 8, 10, 15, 16, 18, 19
    2    8 O      3, 6, 14, 17
    3   15 P      4, 12
    4   16 S      5, 9, 11, 13
    5    1 H      20-41

           -------------------------------------------------
          |                Calculation Setup                |
           -------------------------------------------------

          program call               : /srv/scratch/z5358697/.xtb/bin/xtb gas.coord --gfn2 --sp --chrg 0 --norestart --parallel 1
          hostname                   : k163
          coordinate file            : gas.coord
          omp threads                :                     1


           -------------------------------------------------
          |                 G F N 2 - x T B                 |
           -------------------------------------------------

        Reference                      10.1021/acs.jctc.8b01176
      * Hamiltonian:
        H0-scaling (s, p, d)           1.850000    2.230000    2.230000
        zeta-weighting                 0.500000
      * Dispersion:
        s8                             2.700000
        a1                             0.520000
        a2                             5.000000
        s9                             5.000000
      * Repulsion:
        kExp                           1.500000    1.000000
        rExp                           1.000000
      * Coulomb:
        alpha                          2.000000
        third order                    shell-resolved
        anisotropic                    true
        a3                             3.000000
        a5                             4.000000
        cn-shift                       1.200000
        cn-exp                         4.000000
        max-rad                        5.000000


          ...................................................
          :                      SETUP                      :
          :.................................................:
          :  # basis functions                 134          :
          :  # atomic orbitals                 128          :
          :  # shells                           66          :
          :  # electrons                       116          :
          :  max. iterations                   250          :
          :  Hamiltonian                  GFN2-xTB          :
          :  restarted?                      false          :
          :  GBSA solvation                  false          :
          :  PC potential                    false          :
          :  electronic temp.          300.0000000     K    :
          :  accuracy                    1.0000000          :
          :  -> integral cutoff          0.2500000E+02      :
          :  -> integral neglect         0.1000000E-07      :
          :  -> SCF convergence          0.1000000E-05 Eh   :
          :  -> wf. convergence          0.1000000E-03 e    :
          :  Broyden damping             0.4000000          :
          :  net charge                          0          :
          :  unpaired electrons                  0          :
          ...................................................

 iter      E             dE          RMSdq      gap      omega  full diag
   1    -65.3830124 -0.653830E+02  0.633E+00    4.19       0.0  T
   2    -65.5516577 -0.168645E+00  0.403E+00    3.11       1.0  T
   3    -65.5706000 -0.189423E-01  0.145E+00    2.99       1.0  T
   4    -65.5729309 -0.233092E-02  0.571E-01    2.76       1.0  T
   5    -65.5736915 -0.760567E-03  0.269E-01    2.88       1.0  T
   6    -65.5739058 -0.214332E-03  0.130E-01    2.86       1.0  T
   7    -65.5739603 -0.544448E-04  0.502E-02    2.87       1.0  T
   8    -65.5739706 -0.103085E-04  0.239E-02    2.88       1.0  T
   9    -65.5739720 -0.136908E-05  0.618E-03    2.87       2.5  T
  10    -65.5739721 -0.137662E-06  0.326E-03    2.88       4.8  T
  11    -65.5739721 -0.111128E-07  0.749E-04    2.88      20.8  T
  12    -65.5739721 -0.103539E-08  0.377E-04    2.88      41.4  T

   *** convergence criteria satisfied after 12 iterations ***

         #    Occupation            Energy/Eh            Energy/eV
      -------------------------------------------------------------
         1        2.0000           -0.7571892             -20.6042
       ...           ...                  ...                  ...
        52        2.0000           -0.4364243             -11.8757
        53        2.0000           -0.4077517             -11.0955
        54        2.0000           -0.3964935             -10.7891
        55        2.0000           -0.3756018             -10.2206
        56        2.0000           -0.3725410             -10.1374
        57        2.0000           -0.3685997             -10.0301
        58        2.0000           -0.3642595              -9.9120 (HOMO)
        59                         -0.2585994              -7.0368 (LUMO)
        60                         -0.2451640              -6.6713
        61                         -0.2044616              -5.5637
        62                         -0.1765378              -4.8038
        63                         -0.1655184              -4.5040
       ...                                ...                  ...
       128                          1.3276473              36.1271
      -------------------------------------------------------------
                  HL-Gap            0.1056600 Eh            2.8752 eV
             Fermi-level           -0.3114294 Eh           -8.4744 eV

 SCC (total)                   0 d,  0 h,  0 min,  0.058 sec
 SCC setup                      ...        0 min,  0.000 sec (  0.476%)
 Dispersion                     ...        0 min,  0.000 sec (  0.557%)
 classical contributions        ...        0 min,  0.000 sec (  0.107%)
 integral evaluation            ...        0 min,  0.008 sec ( 14.602%)
 iterations                     ...        0 min,  0.026 sec ( 45.452%)
 molecular gradient             ...        0 min,  0.022 sec ( 38.413%)
 printout                       ...        0 min,  0.000 sec (  0.363%)

         :::::::::::::::::::::::::::::::::::::::::::::::::::::
         ::                     SUMMARY                     ::
         :::::::::::::::::::::::::::::::::::::::::::::::::::::
         :: total energy             -65.012544520518 Eh    ::
         :: gradient norm              0.033462846327 Eh/a0 ::
         :: HOMO-LUMO gap              2.875155843387 eV    ::
         ::.................................................::
         :: SCC energy               -65.573096012892 Eh    ::
         :: -> isotropic ES            0.103756741665 Eh    ::
         :: -> anisotropic ES         -0.010316694313 Eh    ::
         :: -> anisotropic XC          0.031136592605 Eh    ::
         :: -> dispersion             -0.053961325926 Eh    ::
         :: repulsion energy           0.560551492374 Eh    ::
         :: add. restraining           0.000000000000 Eh    ::
         :: total charge              -0.000000000000 e     ::
         :::::::::::::::::::::::::::::::::::::::::::::::::::::

           -------------------------------------------------
          |                Property Printout                |
           -------------------------------------------------

    * Orbital Energies and Occupations

         #    Occupation            Energy/Eh            Energy/eV
      -------------------------------------------------------------
         1        2.0000           -0.7571892             -20.6042
       ...           ...                  ...                  ...
        46        2.0000           -0.4631456             -12.6028
        47        2.0000           -0.4605212             -12.5314
        48        2.0000           -0.4563515             -12.4180
        49        2.0000           -0.4540599             -12.3556
        50        2.0000           -0.4457491             -12.1294
        51        2.0000           -0.4420019             -12.0275
        52        2.0000           -0.4364243             -11.8757
        53        2.0000           -0.4077517             -11.0955
        54        2.0000           -0.3964935             -10.7891
        55        2.0000           -0.3756018             -10.2206
        56        2.0000           -0.3725410             -10.1374
        57        2.0000           -0.3685997             -10.0301
        58        2.0000           -0.3642595              -9.9120 (HOMO)
        59                         -0.2585994              -7.0368 (LUMO)
        60                         -0.2451640              -6.6713
        61                         -0.2044616              -5.5637
        62                         -0.1765378              -4.8038
        63                         -0.1655184              -4.5040
        64                         -0.1564894              -4.2583
        65                         -0.1425332              -3.8785
        66                         -0.1378352              -3.7507
        67                         -0.1199874              -3.2650
        68                         -0.1171884              -3.1889
        69                         -0.0422834              -1.1506
       ...                                ...                  ...
       128                          1.3276473              36.1271
      -------------------------------------------------------------
                  HL-Gap            0.1056600 Eh            2.8752 eV
             Fermi-level           -0.3114294 Eh           -8.4744 eV

     #   Z          covCN         q      C6AA      α(0)
     1   6 C        3.751    -0.114    22.741     6.801
     2   6 C        3.868     0.083    19.159     6.224
     3   8 O        1.656    -0.250    18.151     5.751
     4  15 P        3.838     0.374   144.672    21.606
     5  16 S        0.925    -0.402   156.719    21.174
     6   8 O        1.655    -0.240    18.001     5.727
     7   6 C        3.840     0.084    19.153     6.226
     8   6 C        3.751    -0.113    22.732     6.799
     9  16 S        2.039    -0.145   147.142    20.416
    10   6 C        3.810     0.042    19.866     6.345
    11  16 S        2.024    -0.152   147.444    20.437
    12  15 P        3.850     0.368   144.923    21.625
    13  16 S        0.926    -0.383   155.847    21.115
    14   8 O        1.654    -0.237    17.944     5.718
    15   6 C        3.843     0.079    19.234     6.239
    16   6 C        3.751    -0.117    22.801     6.810
    17   8 O        1.655    -0.248    18.122     5.747
    18   6 C        3.858     0.082    19.180     6.228
    19   6 C        3.751    -0.119    22.839     6.815
    20   1 H        0.925     0.061     2.183     2.311
    21   1 H        0.925     0.061     2.192     2.315
    22   1 H        0.925     0.058     2.224     2.332
    23   1 H        0.924     0.064     2.154     2.295
    24   1 H        0.924     0.061     2.182     2.310
    25   1 H        0.924     0.058     2.224     2.332
    26   1 H        0.924     0.069     2.095     2.263
    27   1 H        0.925     0.055     2.261     2.351
    28   1 H        0.925     0.058     2.225     2.332
    29   1 H        0.925     0.065     2.141     2.288
    30   1 H        0.925     0.077     2.015     2.220
    31   1 H        0.924     0.092     1.861     2.134
    32   1 H        0.924     0.059     2.207     2.323
    33   1 H        0.924     0.068     2.112     2.273
    34   1 H        0.925     0.064     2.148     2.292
    35   1 H        0.925     0.058     2.218     2.329
    36   1 H        0.925     0.063     2.168     2.302
    37   1 H        0.924     0.063     2.160     2.299
    38   1 H        0.924     0.064     2.156     2.296
    39   1 H        0.925     0.063     2.167     2.302
    40   1 H        0.925     0.061     2.185     2.311
    41   1 H        0.925     0.065     2.144     2.290

 Mol. C6AA /au·bohr⁶  :      26546.419898
 Mol. C8AA /au·bohr⁸  :     863274.915353
 Mol. α(0) /au        :        258.306353


Wiberg/Mayer (AO) data.
largest (>0.10) Wiberg bond orders for each atom

 ---------------------------------------------------------------------------
     #   Z sym  total        # sym  WBO       # sym  WBO       # sym  WBO
 ---------------------------------------------------------------------------
     1   6 C    3.991 --     2 C    1.023    21 H    0.984    22 H    0.980
                            20 H    0.977
     2   6 C    3.910 --     1 C    1.023    23 H    0.970    24 H    0.968
                             3 O    0.899
     3   8 O    2.396 --     4 P    1.307     2 C    0.899
     4  15 P    5.278 --     5 S    1.538     6 O    1.319     3 O    1.307
                             9 S    0.983
     5  16 S    1.893 --     4 P    1.538     9 S    0.143
     6   8 O    2.422 --     4 P    1.319     7 C    0.902
     7   6 C    3.905 --     8 C    1.020    25 H    0.971    26 H    0.965
                             6 O    0.902
     8   6 C    3.990 --     7 C    1.020    27 H    0.985    28 H    0.981
                            29 H    0.977
     9  16 S    2.276 --     4 P    0.983    10 C    0.977     5 S    0.143
    10   6 C    3.956 --    11 S    0.995     9 S    0.977    30 H    0.970
                            31 H    0.944
    11  16 S    2.263 --    10 C    0.995    12 P    0.939    13 S    0.141
    12  15 P    5.295 --    13 S    1.581    14 O    1.334    17 O    1.308
                            11 S    0.939
    13  16 S    1.907 --    12 P    1.581    11 S    0.141
    14   8 O    2.415 --    12 P    1.334    15 C    0.888
    15   6 C    3.910 --    16 C    1.021    33 H    0.971    32 H    0.965
                            14 O    0.888
    16   6 C    3.990 --    15 C    1.021    36 H    0.984    34 H    0.981
                            35 H    0.980
    17   8 O    2.410 --    12 P    1.308    18 C    0.905
    18   6 C    3.909 --    19 C    1.022    37 H    0.970    38 H    0.969
                            17 O    0.905
    19   6 C    3.990 --    18 C    1.022    39 H    0.982    40 H    0.980
                            41 H    0.976
    20   1 H    0.996 --     1 C    0.977
    21   1 H    0.996 --     1 C    0.984
    22   1 H    0.996 --     1 C    0.980
    23   1 H    0.995 --     2 C    0.970
    24   1 H    0.996 --     2 C    0.968
    25   1 H    0.996 --     7 C    0.971
    26   1 H    0.995 --     7 C    0.965
    27   1 H    0.997 --     8 C    0.985
    28   1 H    0.996 --     8 C    0.981
    29   1 H    0.996 --     8 C    0.977
    30   1 H    0.994 --    10 C    0.970
    31   1 H    0.992 --    10 C    0.944
    32   1 H    0.996 --    15 C    0.965
    33   1 H    0.995 --    15 C    0.971
    34   1 H    0.996 --    16 C    0.981
    35   1 H    0.995 --    16 C    0.980
    36   1 H    0.996 --    16 C    0.984
    37   1 H    0.996 --    18 C    0.970
    38   1 H    0.996 --    18 C    0.969
    39   1 H    0.996 --    19 C    0.982
    40   1 H    0.996 --    19 C    0.980
    41   1 H    0.996 --    19 C    0.976
 ---------------------------------------------------------------------------

Topologies differ in total number of bonds
Writing topology from bond orders to xtbtopo.mol

molecular dipole:
                 x           y           z       tot (Debye)
 q only:       -0.767      -0.504       1.433
   full:       -0.433      -0.417       1.690       4.558
molecular quadrupole (traceless):
                xx          xy          yy          xz          yz          zz
 q only:       24.116       3.711     -11.459      -2.975       7.424     -12.658
  q+dip:       26.799       1.548     -11.188      -1.281       8.910     -15.611
   full:       27.930       1.214     -11.618      -2.495       9.128     -16.312


           -------------------------------------------------
          | TOTAL ENERGY              -65.012544520518 Eh   |
          | GRADIENT NORM               0.033462846327 Eh/α |
          | HOMO-LUMO GAP               2.875155843387 eV   |
           -------------------------------------------------

------------------------------------------------------------------------
 * finished run on 2025/04/09 at 05:20:49.171     
------------------------------------------------------------------------
 total:
 * wall-time:     0 d,  0 h,  0 min,  0.094 sec
 *  cpu-time:     0 d,  0 h,  0 min,  0.070 sec
 * ratio c/w:     0.748 speedup
 SCF:
 * wall-time:     0 d,  0 h,  0 min,  0.058 sec
 *  cpu-time:     0 d,  0 h,  0 min,  0.056 sec
 * ratio c/w:     0.974 speedup

