      -----------------------------------------------------------      
     |                   =====================                   |     
     |                           x T B                           |     
     |                   =====================                   |     
     |                         S. Grimme                         |     
     |          Mulliken Center for Theoretical Chemistry        |     
     |                    University of Bonn                     |     
      -----------------------------------------------------------      

   * xtb version 6.7.1 (edcfbbe) compiled by 'albert@albert-system' on 2024-07-22

   xtb is free software: you can redistribute it and/or modify it under
   the terms of the GNU Lesser General Public License as published by
   the Free Software Foundation, either version 3 of the License, or
   (at your option) any later version.
   
   xtb is distributed in the hope that it will be useful,
   but WITHOUT ANY WARRANTY; without even the implied warranty of
   MERCHANTABILITY or FITNESS FOR A PARTICULAR PURPOSE.  See the
   GNU Lesser General Public License for more details.
   
   Cite this work as:
   * C. Bannwarth, E. Caldeweyher, S. Ehlert, A. Hansen, P. Pracht,
     J. Seibert, S. Spicher, S. Grimme, WIREs Comput. Mol. Sci., 2020, 11,
     e01493. DOI: 10.1002/wcms.1493
   
   for GFN2-xTB:
   * C. Bannwarth, S. Ehlert and S. Grimme., J. Chem. Theory Comput., 2019,
     15, 1652-1671. DOI: 10.1021/acs.jctc.8b01176
   for GFN1-xTB:
   * S. Grimme, C. Bannwarth, P. Shushkov, J. Chem. Theory Comput., 2017,
     13, 1989-2009. DOI: 10.1021/acs.jctc.7b00118
   for GFN0-xTB:
   * P. Pracht, E. Caldeweyher, S. Ehlert, S. Grimme, ChemRxiv, 2019, preprint.
     DOI: 10.26434/chemrxiv.8326202.v1
   for GFN-FF:
   * S. Spicher and S. Grimme, Angew. Chem. Int. Ed., 2020, 59, 15665-15673.
     DOI: 10.1002/anie.202004239
   
   for ALPB and GBSA implicit solvation:
   * S. Ehlert, M. Stahn, S. Spicher, S. Grimme, J. Chem. Theory Comput.,
     2021, 17, 4250-4261. DOI: 10.1021/acs.jctc.1c00471
   
   for ddCOSMO and CPCM-X implicit solvation:
   * M. Stahn, S. Ehlert, S. Grimme, J. Phys. Chem. A,
     2023, XX, XXXX-XXXX. DOI: 10.1021/acs.jpca.3c04382
   
   for DFT-D4:
   * E. Caldeweyher, C. Bannwarth and S. Grimme, J. Chem. Phys., 2017,
     147, 034112. DOI: 10.1063/1.4993215
   * E. Caldeweyher, S. Ehlert, A. Hansen, H. Neugebauer, S. Spicher,
     C. Bannwarth and S. Grimme, J. Chem. Phys., 2019, 150, 154122.
     DOI: 10.1063/1.5090222
   * E. Caldeweyher, J.-M. Mewes, S. Ehlert and S. Grimme, Phys. Chem. Chem. Phys.
     2020, 22, 8499-8512. DOI: 10.1039/D0CP00502A
   
   for sTDA-xTB:
   * S. Grimme and C. Bannwarth, J. Chem. Phys., 2016, 145, 054103.
     DOI: 10.1063/1.4959605
   
   in the mass-spec context:
   * V. Asgeirsson, C. Bauer and S. Grimme, Chem. Sci., 2017, 8, 4879.
     DOI: 10.1039/c7sc00601b
   * J. Koopman and S. Grimme, ACS Omega 2019, 4, 12, 15120-15133.
     DOI: 10.1021/acsomega.9b02011
   
   for metadynamics refer to:
   * S. Grimme, J. Chem. Theory Comput., 2019, 155, 2847-2862
     DOI: 10.1021/acs.jctc.9b00143
   
   for SPH calculations refer to:
   * S. Spicher and S. Grimme, J. Chem. Theory Comput., 2021, 17, 1701-1714
     DOI: 10.1021/acs.jctc.0c01306
   
   for ONIOM refer to:
   * C. Plett, A. Katbashev, S. Ehlert, S. Grimme, M. Bursch,
     Phys. Chem. Chem. Phys., 2023, 25, 17860-17868. DOI: 10.1039/D3CP02178E
   
   for DIPRO refer to:
   * J. Kohn, N. Gildemeister, S. Grimme, D. Fazzi, A. Hansen,
     J. Chem. Phys., 2023, just accepted.
   
   for PTB refer to:
   * S. Grimme, M. Mueller, A. Hansen, J. Chem. Phys., 2023, 158, 124111.
     DOI: 10.1063/5.0137838
   
   with help from (in alphabetical order)
   P. Atkinson, C. Bannwarth, F. Bohle, G. Brandenburg, E. Caldeweyher
   M. Checinski, S. Dohm, S. Ehlert, S. Ehrlich, I. Gerasimov, C. Hölzer
   A. Katbashev, J. Kohn, J. Koopman, C. Lavigne, S. Lehtola, F. März, M. Müller,
   F. Musil, H. Neugebauer, J. Pisarek, C. Plett, P. Pracht, F. Pultar,
   J. Seibert, P. Shushkov, S. Spicher, M. Stahn, M. Steiner, T. Strunk,
   J. Stückrath, T. Rose, and J. Unsleber
   
 * started run on 2025/04/09 at 05:20:50.240     
   ID    Z sym.   atoms
    1    6 C      1, 2, 7, 8, 10, 15, 16, 18, 19
    2    8 O      3, 6, 14, 17
    3   15 P      4, 12
    4   16 S      5, 9, 11, 13
    5    1 H      20-41

           -------------------------------------------------
          |                Calculation Setup                |
           -------------------------------------------------

          program call               : /srv/scratch/z5358697/.xtb/bin/xtb gas.coord --gfn2 --sp --chrg 0 --norestart --parallel 1
          hostname                   : k163
          coordinate file            : gas.coord
          omp threads                :                     1


           -------------------------------------------------
          |                 G F N 2 - x T B                 |
           -------------------------------------------------

        Reference                      10.1021/acs.jctc.8b01176
      * Hamiltonian:
        H0-scaling (s, p, d)           1.850000    2.230000    2.230000
        zeta-weighting                 0.500000
      * Dispersion:
        s8                             2.700000
        a1                             0.520000
        a2                             5.000000
        s9                             5.000000
      * Repulsion:
        kExp                           1.500000    1.000000
        rExp                           1.000000
      * Coulomb:
        alpha                          2.000000
        third order                    shell-resolved
        anisotropic                    true
        a3                             3.000000
        a5                             4.000000
        cn-shift                       1.200000
        cn-exp                         4.000000
        max-rad                        5.000000


          ...................................................
          :                      SETUP                      :
          :.................................................:
          :  # basis functions                 134          :
          :  # atomic orbitals                 128          :
          :  # shells                           66          :
          :  # electrons                       116          :
          :  max. iterations                   250          :
          :  Hamiltonian                  GFN2-xTB          :
          :  restarted?                      false          :
          :  GBSA solvation                  false          :
          :  PC potential                    false          :
          :  electronic temp.          300.0000000     K    :
          :  accuracy                    1.0000000          :
          :  -> integral cutoff          0.2500000E+02      :
          :  -> integral neglect         0.1000000E-07      :
          :  -> SCF convergence          0.1000000E-05 Eh   :
          :  -> wf. convergence          0.1000000E-03 e    :
          :  Broyden damping             0.4000000          :
          :  net charge                          0          :
          :  unpaired electrons                  0          :
          ...................................................

 iter      E             dE          RMSdq      gap      omega  full diag
   1    -65.3887042 -0.653887E+02  0.633E+00    4.52       0.0  T
   2    -65.5508016 -0.162097E+00  0.391E+00    3.33       1.0  T
   3    -65.5690889 -0.182873E-01  0.138E+00    3.12       1.0  T
   4    -65.5720118 -0.292289E-02  0.585E-01    2.79       1.0  T
   5    -65.5732939 -0.128207E-02  0.288E-01    2.92       1.0  T
   6    -65.5735768 -0.282962E-03  0.133E-01    2.90       1.0  T
   7    -65.5736355 -0.586260E-04  0.494E-02    2.92       1.0  T
   8    -65.5736440 -0.855756E-05  0.224E-02    2.92       1.0  T
   9    -65.5736451 -0.105213E-05  0.611E-03    2.92       2.6  T
  10    -65.5736452 -0.845821E-07  0.326E-03    2.92       4.8  T
  11    -65.5736452 -0.117924E-07  0.795E-04    2.92      19.6  T
  12    -65.5736452 -0.116654E-08  0.437E-04    2.92      35.8  T

   *** convergence criteria satisfied after 12 iterations ***

         #    Occupation            Energy/Eh            Energy/eV
      -------------------------------------------------------------
         1        2.0000           -0.7617095             -20.7272
       ...           ...                  ...                  ...
        52        2.0000           -0.4403669             -11.9830
        53        2.0000           -0.4111459             -11.1878
        54        2.0000           -0.4038633             -10.9897
        55        2.0000           -0.3841049             -10.4520
        56        2.0000           -0.3789685             -10.3123
        57        2.0000           -0.3679340             -10.0120
        58        2.0000           -0.3646402              -9.9224 (HOMO)
        59                         -0.2572920              -7.0013 (LUMO)
        60                         -0.2393544              -6.5132
        61                         -0.2234645              -6.0808
        62                         -0.1894413              -5.1550
        63                         -0.1772767              -4.8239
       ...                                ...                  ...
       128                          1.3806976              37.5707
      -------------------------------------------------------------
                  HL-Gap            0.1073482 Eh            2.9211 eV
             Fermi-level           -0.3109661 Eh           -8.4618 eV

 SCC (total)                   0 d,  0 h,  0 min,  0.058 sec
 SCC setup                      ...        0 min,  0.000 sec (  0.403%)
 Dispersion                     ...        0 min,  0.000 sec (  0.505%)
 classical contributions        ...        0 min,  0.000 sec (  0.088%)
 integral evaluation            ...        0 min,  0.010 sec ( 17.392%)
 iterations                     ...        0 min,  0.025 sec ( 42.222%)
 molecular gradient             ...        0 min,  0.023 sec ( 39.014%)
 printout                       ...        0 min,  0.000 sec (  0.349%)

         :::::::::::::::::::::::::::::::::::::::::::::::::::::
         ::                     SUMMARY                     ::
         :::::::::::::::::::::::::::::::::::::::::::::::::::::
         :: total energy             -65.012470263551 Eh    ::
         :: gradient norm              0.030198848899 Eh/a0 ::
         :: HOMO-LUMO gap              2.921091969621 eV    ::
         ::.................................................::
         :: SCC energy               -65.572478551248 Eh    ::
         :: -> isotropic ES            0.107860828299 Eh    ::
         :: -> anisotropic ES         -0.011476075862 Eh    ::
         :: -> anisotropic XC          0.030741398167 Eh    ::
         :: -> dispersion             -0.055014734035 Eh    ::
         :: repulsion energy           0.560008287697 Eh    ::
         :: add. restraining           0.000000000000 Eh    ::
         :: total charge               0.000000000000 e     ::
         :::::::::::::::::::::::::::::::::::::::::::::::::::::

           -------------------------------------------------
          |                Property Printout                |
           -------------------------------------------------

    * Orbital Energies and Occupations

         #    Occupation            Energy/Eh            Energy/eV
      -------------------------------------------------------------
         1        2.0000           -0.7617095             -20.7272
       ...           ...                  ...                  ...
        46        2.0000           -0.4660466             -12.6818
        47        2.0000           -0.4635001             -12.6125
        48        2.0000           -0.4616831             -12.5630
        49        2.0000           -0.4577593             -12.4563
        50        2.0000           -0.4524799             -12.3126
        51        2.0000           -0.4456420             -12.1265
        52        2.0000           -0.4403669             -11.9830
        53        2.0000           -0.4111459             -11.1878
        54        2.0000           -0.4038633             -10.9897
        55        2.0000           -0.3841049             -10.4520
        56        2.0000           -0.3789685             -10.3123
        57        2.0000           -0.3679340             -10.0120
        58        2.0000           -0.3646402              -9.9224 (HOMO)
        59                         -0.2572920              -7.0013 (LUMO)
        60                         -0.2393544              -6.5132
        61                         -0.2234645              -6.0808
        62                         -0.1894413              -5.1550
        63                         -0.1772767              -4.8239
        64                         -0.1516205              -4.1258
        65                         -0.1466952              -3.9918
        66                         -0.1420617              -3.8657
        67                         -0.1201189              -3.2686
        68                         -0.1127228              -3.0673
        69                         -0.0431390              -1.1739
       ...                                ...                  ...
       128                          1.3806976              37.5707
      -------------------------------------------------------------
                  HL-Gap            0.1073482 Eh            2.9211 eV
             Fermi-level           -0.3109661 Eh           -8.4618 eV

     #   Z          covCN         q      C6AA      α(0)
     1   6 C        3.751    -0.118    22.815     6.812
     2   6 C        3.854     0.082    19.183     6.229
     3   8 O        1.655    -0.259    18.310     5.776
     4  15 P        3.843     0.392   143.997    21.556
     5  16 S        0.926    -0.389   156.107    21.133
     6   8 O        1.654    -0.241    18.013     5.729
     7   6 C        3.863     0.085    19.130     6.220
     8   6 C        3.751    -0.117    22.806     6.810
     9  16 S        1.997    -0.157   147.697    20.455
    10   6 C        3.801     0.035    19.981     6.364
    11  16 S        1.998    -0.118   146.016    20.338
    12  15 P        3.905     0.378   144.528    21.596
    13  16 S        0.926    -0.410   157.094    21.200
    14   8 O        1.655    -0.250    18.158     5.752
    15   6 C        3.868     0.082    19.180     6.228
    16   6 C        3.751    -0.115    22.761     6.804
    17   8 O        1.655    -0.254    18.225     5.763
    18   6 C        3.908     0.094    18.969     6.191
    19   6 C        3.751    -0.114    22.736     6.800
    20   1 H        0.925     0.061     2.191     2.314
    21   1 H        0.925     0.063     2.160     2.299
    22   1 H        0.925     0.058     2.225     2.332
    23   1 H        0.924     0.062     2.177     2.307
    24   1 H        0.924     0.064     2.156     2.296
    25   1 H        0.924     0.063     2.161     2.299
    26   1 H        0.924     0.057     2.230     2.335
    27   1 H        0.925     0.063     2.169     2.303
    28   1 H        0.925     0.059     2.209     2.324
    29   1 H        0.925     0.064     2.149     2.293
    30   1 H        0.925     0.082     1.957     2.188
    31   1 H        0.924     0.091     1.870     2.139
    32   1 H        0.924     0.064     2.152     2.294
    33   1 H        0.924     0.068     2.113     2.273
    34   1 H        0.925     0.062     2.178     2.308
    35   1 H        0.925     0.061     2.190     2.314
    36   1 H        0.925     0.054     2.271     2.356
    37   1 H        0.924     0.068     2.106     2.269
    38   1 H        0.924     0.051     2.311     2.377
    39   1 H        0.925     0.056     2.244     2.342
    40   1 H        0.925     0.071     2.078     2.255
    41   1 H        0.925     0.052     2.289     2.366

 Mol. C6AA /au·bohr⁶  :      26558.577572
 Mol. C8AA /au·bohr⁸  :     863165.225702
 Mol. α(0) /au        :        258.339002


Wiberg/Mayer (AO) data.
largest (>0.10) Wiberg bond orders for each atom

 ---------------------------------------------------------------------------
     #   Z sym  total        # sym  WBO       # sym  WBO       # sym  WBO
 ---------------------------------------------------------------------------
     1   6 C    3.991 --     2 C    1.021    21 H    0.983    20 H    0.980
                            22 H    0.977
     2   6 C    3.911 --     1 C    1.021    24 H    0.970    23 H    0.969
                             3 O    0.910
     3   8 O    2.393 --     4 P    1.287     2 C    0.910
     4  15 P    5.260 --     5 S    1.566     6 O    1.317     3 O    1.287
                             9 S    0.947
     5  16 S    1.906 --     4 P    1.566     9 S    0.142
     6   8 O    2.401 --     4 P    1.317     7 C    0.892
     7   6 C    3.912 --     8 C    1.021    25 H    0.970    26 H    0.965
                             6 O    0.892
     8   6 C    3.990 --     7 C    1.021    27 H    0.984    29 H    0.982
                            28 H    0.980
     9  16 S    2.269 --    10 C    0.992     4 P    0.947     5 S    0.142
    10   6 C    3.960 --     9 S    0.992    11 S    0.977    30 H    0.969
                            31 H    0.942
    11  16 S    2.280 --    12 P    1.015    10 C    0.977    13 S    0.102
    12  15 P    5.297 --    13 S    1.569    14 O    1.292    17 O    1.287
                            11 S    1.015
    13  16 S    1.864 --    12 P    1.569    11 S    0.102
    14   8 O    2.411 --    12 P    1.292    15 C    0.908
    15   6 C    3.909 --    16 C    1.021    33 H    0.969    32 H    0.966
                            14 O    0.908
    16   6 C    3.992 --    15 C    1.021    36 H    0.985    35 H    0.981
                            34 H    0.976
    17   8 O    2.391 --    12 P    1.287    18 C    0.891
    18   6 C    3.909 --    19 C    1.022    38 H    0.968    37 H    0.966
                            17 O    0.891
    19   6 C    3.990 --    18 C    1.022    41 H    0.984    39 H    0.980
                            40 H    0.979
    20   1 H    0.996 --     1 C    0.980
    21   1 H    0.996 --     1 C    0.983
    22   1 H    0.997 --     1 C    0.977
    23   1 H    0.996 --     2 C    0.969
    24   1 H    0.996 --     2 C    0.970
    25   1 H    0.996 --     7 C    0.970
    26   1 H    0.997 --     7 C    0.965
    27   1 H    0.996 --     8 C    0.984
    28   1 H    0.995 --     8 C    0.980
    29   1 H    0.996 --     8 C    0.982
    30   1 H    0.992 --    10 C    0.969
    31   1 H    0.992 --    10 C    0.942
    32   1 H    0.996 --    15 C    0.966
    33   1 H    0.995 --    15 C    0.969
    34   1 H    0.996 --    16 C    0.976
    35   1 H    0.996 --    16 C    0.981
    36   1 H    0.997 --    16 C    0.985
    37   1 H    0.995 --    18 C    0.966
    38   1 H    0.997 --    18 C    0.968
    39   1 H    0.996 --    19 C    0.980
    40   1 H    0.995 --    19 C    0.979
    41   1 H    0.997 --    19 C    0.984
 ---------------------------------------------------------------------------

Topologies differ in total number of bonds
Writing topology from bond orders to xtbtopo.mol

molecular dipole:
                 x           y           z       tot (Debye)
 q only:        2.249      -0.038      -0.102
   full:        2.662       0.079       0.327       6.820
molecular quadrupole (traceless):
                xx          xy          yy          xz          yz          zz
 q only:       -6.329     -13.101       1.819      -0.878     -17.381       4.510
  q+dip:       -9.238     -14.405       3.866      -0.850     -18.307       5.372
   full:       -9.586     -14.723       3.492      -0.467     -18.470       6.094


           -------------------------------------------------
          | TOTAL ENERGY              -65.012470263551 Eh   |
          | GRADIENT NORM               0.030198848899 Eh/α |
          | HOMO-LUMO GAP               2.921091969621 eV   |
           -------------------------------------------------

------------------------------------------------------------------------
 * finished run on 2025/04/09 at 05:20:50.356     
------------------------------------------------------------------------
 total:
 * wall-time:     0 d,  0 h,  0 min,  0.116 sec
 *  cpu-time:     0 d,  0 h,  0 min,  0.069 sec
 * ratio c/w:     0.594 speedup
 SCF:
 * wall-time:     0 d,  0 h,  0 min,  0.058 sec
 *  cpu-time:     0 d,  0 h,  0 min,  0.055 sec
 * ratio c/w:     0.948 speedup

