      -----------------------------------------------------------      
     |                   =====================                   |     
     |                           x T B                           |     
     |                   =====================                   |     
     |                         S. Grimme                         |     
     |          Mulliken Center for Theoretical Chemistry        |     
     |                    University of Bonn                     |     
      -----------------------------------------------------------      

   * xtb version 6.7.1 (edcfbbe) compiled by 'albert@albert-system' on 2024-07-22

   xtb is free software: you can redistribute it and/or modify it under
   the terms of the GNU Lesser General Public License as published by
   the Free Software Foundation, either version 3 of the License, or
   (at your option) any later version.
   
   xtb is distributed in the hope that it will be useful,
   but WITHOUT ANY WARRANTY; without even the implied warranty of
   MERCHANTABILITY or FITNESS FOR A PARTICULAR PURPOSE.  See the
   GNU Lesser General Public License for more details.
   
   Cite this work as:
   * C. Bannwarth, E. Caldeweyher, S. Ehlert, A. Hansen, P. Pracht,
     J. Seibert, S. Spicher, S. Grimme, WIREs Comput. Mol. Sci., 2020, 11,
     e01493. DOI: 10.1002/wcms.1493
   
   for GFN2-xTB:
   * C. Bannwarth, S. Ehlert and S. Grimme., J. Chem. Theory Comput., 2019,
     15, 1652-1671. DOI: 10.1021/acs.jctc.8b01176
   for GFN1-xTB:
   * S. Grimme, C. Bannwarth, P. Shushkov, J. Chem. Theory Comput., 2017,
     13, 1989-2009. DOI: 10.1021/acs.jctc.7b00118
   for GFN0-xTB:
   * P. Pracht, E. Caldeweyher, S. Ehlert, S. Grimme, ChemRxiv, 2019, preprint.
     DOI: 10.26434/chemrxiv.8326202.v1
   for GFN-FF:
   * S. Spicher and S. Grimme, Angew. Chem. Int. Ed., 2020, 59, 15665-15673.
     DOI: 10.1002/anie.202004239
   
   for ALPB and GBSA implicit solvation:
   * S. Ehlert, M. Stahn, S. Spicher, S. Grimme, J. Chem. Theory Comput.,
     2021, 17, 4250-4261. DOI: 10.1021/acs.jctc.1c00471
   
   for ddCOSMO and CPCM-X implicit solvation:
   * M. Stahn, S. Ehlert, S. Grimme, J. Phys. Chem. A,
     2023, XX, XXXX-XXXX. DOI: 10.1021/acs.jpca.3c04382
   
   for DFT-D4:
   * E. Caldeweyher, C. Bannwarth and S. Grimme, J. Chem. Phys., 2017,
     147, 034112. DOI: 10.1063/1.4993215
   * E. Caldeweyher, S. Ehlert, A. Hansen, H. Neugebauer, S. Spicher,
     C. Bannwarth and S. Grimme, J. Chem. Phys., 2019, 150, 154122.
     DOI: 10.1063/1.5090222
   * E. Caldeweyher, J.-M. Mewes, S. Ehlert and S. Grimme, Phys. Chem. Chem. Phys.
     2020, 22, 8499-8512. DOI: 10.1039/D0CP00502A
   
   for sTDA-xTB:
   * S. Grimme and C. Bannwarth, J. Chem. Phys., 2016, 145, 054103.
     DOI: 10.1063/1.4959605
   
   in the mass-spec context:
   * V. Asgeirsson, C. Bauer and S. Grimme, Chem. Sci., 2017, 8, 4879.
     DOI: 10.1039/c7sc00601b
   * J. Koopman and S. Grimme, ACS Omega 2019, 4, 12, 15120-15133.
     DOI: 10.1021/acsomega.9b02011
   
   for metadynamics refer to:
   * S. Grimme, J. Chem. Theory Comput., 2019, 155, 2847-2862
     DOI: 10.1021/acs.jctc.9b00143
   
   for SPH calculations refer to:
   * S. Spicher and S. Grimme, J. Chem. Theory Comput., 2021, 17, 1701-1714
     DOI: 10.1021/acs.jctc.0c01306
   
   for ONIOM refer to:
   * C. Plett, A. Katbashev, S. Ehlert, S. Grimme, M. Bursch,
     Phys. Chem. Chem. Phys., 2023, 25, 17860-17868. DOI: 10.1039/D3CP02178E
   
   for DIPRO refer to:
   * J. Kohn, N. Gildemeister, S. Grimme, D. Fazzi, A. Hansen,
     J. Chem. Phys., 2023, just accepted.
   
   for PTB refer to:
   * S. Grimme, M. Mueller, A. Hansen, J. Chem. Phys., 2023, 158, 124111.
     DOI: 10.1063/5.0137838
   
   with help from (in alphabetical order)
   P. Atkinson, C. Bannwarth, F. Bohle, G. Brandenburg, E. Caldeweyher
   M. Checinski, S. Dohm, S. Ehlert, S. Ehrlich, I. Gerasimov, C. Hölzer
   A. Katbashev, J. Kohn, J. Koopman, C. Lavigne, S. Lehtola, F. März, M. Müller,
   F. Musil, H. Neugebauer, J. Pisarek, C. Plett, P. Pracht, F. Pultar,
   J. Seibert, P. Shushkov, S. Spicher, M. Stahn, M. Steiner, T. Strunk,
   J. Stückrath, T. Rose, and J. Unsleber
   
 * started run on 2025/04/09 at 05:21:11.696     
   ID    Z sym.   atoms
    1    6 C      1, 2, 7, 8, 10, 15, 16, 18, 19
    2    8 O      3, 6, 14, 17
    3   15 P      4, 12
    4   16 S      5, 9, 11, 13
    5    1 H      20-41

           -------------------------------------------------
          |                Calculation Setup                |
           -------------------------------------------------

          program call               : /srv/scratch/z5358697/.xtb/bin/xtb gas.coord --gfn2 --sp --chrg 0 --norestart --parallel 1
          hostname                   : k163
          coordinate file            : gas.coord
          omp threads                :                     1


           -------------------------------------------------
          |                 G F N 2 - x T B                 |
           -------------------------------------------------

        Reference                      10.1021/acs.jctc.8b01176
      * Hamiltonian:
        H0-scaling (s, p, d)           1.850000    2.230000    2.230000
        zeta-weighting                 0.500000
      * Dispersion:
        s8                             2.700000
        a1                             0.520000
        a2                             5.000000
        s9                             5.000000
      * Repulsion:
        kExp                           1.500000    1.000000
        rExp                           1.000000
      * Coulomb:
        alpha                          2.000000
        third order                    shell-resolved
        anisotropic                    true
        a3                             3.000000
        a5                             4.000000
        cn-shift                       1.200000
        cn-exp                         4.000000
        max-rad                        5.000000


          ...................................................
          :                      SETUP                      :
          :.................................................:
          :  # basis functions                 134          :
          :  # atomic orbitals                 128          :
          :  # shells                           66          :
          :  # electrons                       116          :
          :  max. iterations                   250          :
          :  Hamiltonian                  GFN2-xTB          :
          :  restarted?                      false          :
          :  GBSA solvation                  false          :
          :  PC potential                    false          :
          :  electronic temp.          300.0000000     K    :
          :  accuracy                    1.0000000          :
          :  -> integral cutoff          0.2500000E+02      :
          :  -> integral neglect         0.1000000E-07      :
          :  -> SCF convergence          0.1000000E-05 Eh   :
          :  -> wf. convergence          0.1000000E-03 e    :
          :  Broyden damping             0.4000000          :
          :  net charge                          0          :
          :  unpaired electrons                  0          :
          ...................................................

 iter      E             dE          RMSdq      gap      omega  full diag
   1    -65.3804754 -0.653805E+02  0.628E+00    4.27       0.0  T
   2    -65.5479195 -0.167444E+00  0.385E+00    3.21       1.0  T
   3    -65.5666521 -0.187326E-01  0.127E+00    3.07       1.0  T
   4    -65.5687787 -0.212661E-02  0.515E-01    2.87       1.0  T
   5    -65.5693552 -0.576522E-03  0.241E-01    2.98       1.0  T
   6    -65.5695730 -0.217815E-03  0.117E-01    2.96       1.0  T
   7    -65.5696198 -0.467598E-04  0.441E-02    2.97       1.0  T
   8    -65.5696279 -0.810384E-05  0.200E-02    2.97       1.0  T
   9    -65.5696289 -0.102048E-05  0.525E-03    2.97       3.0  T
  10    -65.5696290 -0.853761E-07  0.243E-03    2.97       6.4  T
  11    -65.5696290 -0.617707E-08  0.500E-04    2.97      31.2  T
  12    -65.5696290 -0.487759E-09  0.226E-04    2.97      69.1  T

   *** convergence criteria satisfied after 12 iterations ***

         #    Occupation            Energy/Eh            Energy/eV
      -------------------------------------------------------------
         1        2.0000           -0.7551782             -20.5494
       ...           ...                  ...                  ...
        52        2.0000           -0.4342012             -11.8152
        53        2.0000           -0.4071381             -11.0788
        54        2.0000           -0.3952438             -10.7551
        55        2.0000           -0.3759917             -10.2313
        56        2.0000           -0.3724761             -10.1356
        57        2.0000           -0.3689019             -10.0383
        58        2.0000           -0.3652076              -9.9378 (HOMO)
        59                         -0.2560453              -6.9673 (LUMO)
        60                         -0.2453524              -6.6764
        61                         -0.2043270              -5.5600
        62                         -0.1746147              -4.7515
        63                         -0.1606905              -4.3726
       ...                                ...                  ...
       128                          1.2641493              34.3993
      -------------------------------------------------------------
                  HL-Gap            0.1091624 Eh            2.9705 eV
             Fermi-level           -0.3106264 Eh           -8.4526 eV

 SCC (total)                   0 d,  0 h,  0 min,  0.061 sec
 SCC setup                      ...        0 min,  0.000 sec (  0.443%)
 Dispersion                     ...        0 min,  0.000 sec (  0.523%)
 classical contributions        ...        0 min,  0.000 sec (  0.097%)
 integral evaluation            ...        0 min,  0.012 sec ( 20.604%)
 iterations                     ...        0 min,  0.025 sec ( 41.749%)
 molecular gradient             ...        0 min,  0.022 sec ( 36.212%)
 printout                       ...        0 min,  0.000 sec (  0.343%)

         :::::::::::::::::::::::::::::::::::::::::::::::::::::
         ::                     SUMMARY                     ::
         :::::::::::::::::::::::::::::::::::::::::::::::::::::
         :: total energy             -65.009964098818 Eh    ::
         :: gradient norm              0.032385073925 Eh/a0 ::
         :: HOMO-LUMO gap              2.970458764397 eV    ::
         ::.................................................::
         :: SCC energy               -65.568668815399 Eh    ::
         :: -> isotropic ES            0.106191777423 Eh    ::
         :: -> anisotropic ES         -0.008789057841 Eh    ::
         :: -> anisotropic XC          0.030800839165 Eh    ::
         :: -> dispersion             -0.054784915579 Eh    ::
         :: repulsion energy           0.558704716582 Eh    ::
         :: add. restraining           0.000000000000 Eh    ::
         :: total charge               0.000000000000 e     ::
         :::::::::::::::::::::::::::::::::::::::::::::::::::::

           -------------------------------------------------
          |                Property Printout                |
           -------------------------------------------------

    * Orbital Energies and Occupations

         #    Occupation            Energy/Eh            Energy/eV
      -------------------------------------------------------------
         1        2.0000           -0.7551782             -20.5494
       ...           ...                  ...                  ...
        46        2.0000           -0.4663049             -12.6888
        47        2.0000           -0.4609990             -12.5444
        48        2.0000           -0.4596865             -12.5087
        49        2.0000           -0.4574067             -12.4467
        50        2.0000           -0.4492806             -12.2255
        51        2.0000           -0.4410094             -12.0005
        52        2.0000           -0.4342012             -11.8152
        53        2.0000           -0.4071381             -11.0788
        54        2.0000           -0.3952438             -10.7551
        55        2.0000           -0.3759917             -10.2313
        56        2.0000           -0.3724761             -10.1356
        57        2.0000           -0.3689019             -10.0383
        58        2.0000           -0.3652076              -9.9378 (HOMO)
        59                         -0.2560453              -6.9673 (LUMO)
        60                         -0.2453524              -6.6764
        61                         -0.2043270              -5.5600
        62                         -0.1746147              -4.7515
        63                         -0.1606905              -4.3726
        64                         -0.1559669              -4.2441
        65                         -0.1544812              -4.2036
        66                         -0.1443073              -3.9268
        67                         -0.1191918              -3.2434
        68                         -0.1138329              -3.0976
        69                         -0.0328970              -0.8952
       ...                                ...                  ...
       128                          1.2641493              34.3993
      -------------------------------------------------------------
                  HL-Gap            0.1091624 Eh            2.9705 eV
             Fermi-level           -0.3106264 Eh           -8.4526 eV

     #   Z          covCN         q      C6AA      α(0)
     1   6 C        3.751    -0.113    22.732     6.799
     2   6 C        3.818     0.085    19.155     6.229
     3   8 O        1.655    -0.250    18.161     5.753
     4  15 P        3.802     0.387   144.187    21.570
     5  16 S        0.928    -0.418   157.476    21.225
     6   8 O        1.657    -0.248    18.123     5.747
     7   6 C        3.848     0.083    19.168     6.227
     8   6 C        3.751    -0.113    22.732     6.799
     9  16 S        2.010    -0.115   145.877    20.328
    10   6 C        3.805     0.036    19.963     6.361
    11  16 S        2.010    -0.155   147.595    20.448
    12  15 P        3.858     0.368   144.921    21.625
    13  16 S        0.925    -0.399   156.571    21.164
    14   8 O        1.655    -0.248    18.124     5.747
    15   6 C        3.861     0.081    19.195     6.231
    16   6 C        3.751    -0.115    22.769     6.805
    17   8 O        1.655    -0.239    17.981     5.724
    18   6 C        3.868     0.085    19.137     6.221
    19   6 C        3.751    -0.114    22.736     6.800
    20   1 H        0.925     0.059     2.209     2.324
    21   1 H        0.925     0.056     2.247     2.344
    22   1 H        0.925     0.060     2.202     2.321
    23   1 H        0.924     0.060     2.204     2.322
    24   1 H        0.924     0.063     2.159     2.298
    25   1 H        0.924     0.068     2.108     2.270
    26   1 H        0.924     0.056     2.245     2.343
    27   1 H        0.925     0.061     2.192     2.316
    28   1 H        0.925     0.067     2.117     2.276
    29   1 H        0.925     0.055     2.253     2.347
    30   1 H        0.924     0.095     1.828     2.115
    31   1 H        0.925     0.084     1.943     2.180
    32   1 H        0.924     0.062     2.180     2.309
    33   1 H        0.924     0.064     2.151     2.294
    34   1 H        0.925     0.060     2.203     2.321
    35   1 H        0.925     0.062     2.175     2.306
    36   1 H        0.925     0.057     2.238     2.339
    37   1 H        0.924     0.074     2.045     2.236
    38   1 H        0.924     0.063     2.165     2.301
    39   1 H        0.925     0.058     2.220     2.330
    40   1 H        0.925     0.061     2.185     2.312
    41   1 H        0.925     0.059     2.213     2.327

 Mol. C6AA /au·bohr⁶  :      26552.373186
 Mol. C8AA /au·bohr⁸  :     863325.559966
 Mol. α(0) /au        :        258.332363


Wiberg/Mayer (AO) data.
largest (>0.10) Wiberg bond orders for each atom

 ---------------------------------------------------------------------------
     #   Z sym  total        # sym  WBO       # sym  WBO       # sym  WBO
 ---------------------------------------------------------------------------
     1   6 C    3.988 --     2 C    1.018    21 H    0.985    22 H    0.985
                            20 H    0.980
     2   6 C    3.907 --     1 C    1.018    23 H    0.972    24 H    0.960
                             3 O    0.904
     3   8 O    2.417 --     4 P    1.305     2 C    0.904
     4  15 P    5.255 --     5 S    1.522     6 O    1.310     3 O    1.305
                             9 S    0.985
     5  16 S    1.879 --     4 P    1.522     9 S    0.142
     6   8 O    2.396 --     4 P    1.310     7 C    0.896
     7   6 C    3.909 --     8 C    1.022    26 H    0.972    25 H    0.970
                             6 O    0.896
     8   6 C    3.990 --     7 C    1.022    28 H    0.983    29 H    0.981
                            27 H    0.974
     9  16 S    2.291 --    10 C    0.996     4 P    0.985     5 S    0.142
    10   6 C    3.954 --     9 S    0.996    11 S    0.976    31 H    0.968
                            30 H    0.942
    11  16 S    2.266 --    10 C    0.976    12 P    0.973    13 S    0.141
    12  15 P    5.283 --    13 S    1.542    17 O    1.314    14 O    1.296
                            11 S    0.973
    13  16 S    1.893 --    12 P    1.542    11 S    0.141
    14   8 O    2.406 --    12 P    1.296    15 C    0.911
    15   6 C    3.913 --    16 C    1.021    33 H    0.970    32 H    0.968
                            14 O    0.911
    16   6 C    3.991 --    15 C    1.021    35 H    0.983    34 H    0.981
                            36 H    0.976
    17   8 O    2.408 --    12 P    1.314    18 C    0.894
    18   6 C    3.906 --    19 C    1.023    38 H    0.969    37 H    0.966
                            17 O    0.894
    19   6 C    3.992 --    18 C    1.023    39 H    0.984    41 H    0.980
                            40 H    0.975
    20   1 H    0.995 --     1 C    0.980
    21   1 H    0.997 --     1 C    0.985
    22   1 H    0.996 --     1 C    0.985
    23   1 H    0.996 --     2 C    0.972
    24   1 H    0.996 --     2 C    0.960
    25   1 H    0.995 --     7 C    0.970
    26   1 H    0.997 --     7 C    0.972
    27   1 H    0.996 --     8 C    0.974
    28   1 H    0.995 --     8 C    0.983
    29   1 H    0.996 --     8 C    0.981
    30   1 H    0.991 --    10 C    0.942
    31   1 H    0.992 --    10 C    0.968
    32   1 H    0.996 --    15 C    0.968
    33   1 H    0.996 --    15 C    0.970
    34   1 H    0.996 --    16 C    0.981
    35   1 H    0.996 --    16 C    0.983
    36   1 H    0.997 --    16 C    0.976
    37   1 H    0.994 --    18 C    0.966
    38   1 H    0.996 --    18 C    0.969
    39   1 H    0.996 --    19 C    0.984
    40   1 H    0.996 --    19 C    0.975
    41   1 H    0.996 --    19 C    0.980
 ---------------------------------------------------------------------------

Topologies differ in total number of bonds
Writing topology from bond orders to xtbtopo.mol

molecular dipole:
                 x           y           z       tot (Debye)
 q only:        0.361       1.019       1.629
   full:        0.470       0.997       1.960       5.716
molecular quadrupole (traceless):
                xx          xy          yy          xz          yz          zz
 q only:       11.066     -17.490      -9.927       4.817     -12.340      -1.139
  q+dip:       12.377     -19.667      -9.671       4.815      -8.752      -2.705
   full:       13.545     -20.618     -10.911       4.477     -10.447      -2.634


           -------------------------------------------------
          | TOTAL ENERGY              -65.009964098818 Eh   |
          | GRADIENT NORM               0.032385073925 Eh/α |
          | HOMO-LUMO GAP               2.970458764397 eV   |
           -------------------------------------------------

------------------------------------------------------------------------
 * finished run on 2025/04/09 at 05:21:11.834     
------------------------------------------------------------------------
 total:
 * wall-time:     0 d,  0 h,  0 min,  0.138 sec
 *  cpu-time:     0 d,  0 h,  0 min,  0.070 sec
 * ratio c/w:     0.505 speedup
 SCF:
 * wall-time:     0 d,  0 h,  0 min,  0.061 sec
 *  cpu-time:     0 d,  0 h,  0 min,  0.056 sec
 * ratio c/w:     0.923 speedup

