      -----------------------------------------------------------      
     |                   =====================                   |     
     |                           x T B                           |     
     |                   =====================                   |     
     |                         S. Grimme                         |     
     |          Mulliken Center for Theoretical Chemistry        |     
     |                    University of Bonn                     |     
      -----------------------------------------------------------      

   * xtb version 6.7.1 (edcfbbe) compiled by 'albert@albert-system' on 2024-07-22

   xtb is free software: you can redistribute it and/or modify it under
   the terms of the GNU Lesser General Public License as published by
   the Free Software Foundation, either version 3 of the License, or
   (at your option) any later version.
   
   xtb is distributed in the hope that it will be useful,
   but WITHOUT ANY WARRANTY; without even the implied warranty of
   MERCHANTABILITY or FITNESS FOR A PARTICULAR PURPOSE.  See the
   GNU Lesser General Public License for more details.
   
   Cite this work as:
   * C. Bannwarth, E. Caldeweyher, S. Ehlert, A. Hansen, P. Pracht,
     J. Seibert, S. Spicher, S. Grimme, WIREs Comput. Mol. Sci., 2020, 11,
     e01493. DOI: 10.1002/wcms.1493
   
   for GFN2-xTB:
   * C. Bannwarth, S. Ehlert and S. Grimme., J. Chem. Theory Comput., 2019,
     15, 1652-1671. DOI: 10.1021/acs.jctc.8b01176
   for GFN1-xTB:
   * S. Grimme, C. Bannwarth, P. Shushkov, J. Chem. Theory Comput., 2017,
     13, 1989-2009. DOI: 10.1021/acs.jctc.7b00118
   for GFN0-xTB:
   * P. Pracht, E. Caldeweyher, S. Ehlert, S. Grimme, ChemRxiv, 2019, preprint.
     DOI: 10.26434/chemrxiv.8326202.v1
   for GFN-FF:
   * S. Spicher and S. Grimme, Angew. Chem. Int. Ed., 2020, 59, 15665-15673.
     DOI: 10.1002/anie.202004239
   
   for ALPB and GBSA implicit solvation:
   * S. Ehlert, M. Stahn, S. Spicher, S. Grimme, J. Chem. Theory Comput.,
     2021, 17, 4250-4261. DOI: 10.1021/acs.jctc.1c00471
   
   for ddCOSMO and CPCM-X implicit solvation:
   * M. Stahn, S. Ehlert, S. Grimme, J. Phys. Chem. A,
     2023, XX, XXXX-XXXX. DOI: 10.1021/acs.jpca.3c04382
   
   for DFT-D4:
   * E. Caldeweyher, C. Bannwarth and S. Grimme, J. Chem. Phys., 2017,
     147, 034112. DOI: 10.1063/1.4993215
   * E. Caldeweyher, S. Ehlert, A. Hansen, H. Neugebauer, S. Spicher,
     C. Bannwarth and S. Grimme, J. Chem. Phys., 2019, 150, 154122.
     DOI: 10.1063/1.5090222
   * E. Caldeweyher, J.-M. Mewes, S. Ehlert and S. Grimme, Phys. Chem. Chem. Phys.
     2020, 22, 8499-8512. DOI: 10.1039/D0CP00502A
   
   for sTDA-xTB:
   * S. Grimme and C. Bannwarth, J. Chem. Phys., 2016, 145, 054103.
     DOI: 10.1063/1.4959605
   
   in the mass-spec context:
   * V. Asgeirsson, C. Bauer and S. Grimme, Chem. Sci., 2017, 8, 4879.
     DOI: 10.1039/c7sc00601b
   * J. Koopman and S. Grimme, ACS Omega 2019, 4, 12, 15120-15133.
     DOI: 10.1021/acsomega.9b02011
   
   for metadynamics refer to:
   * S. Grimme, J. Chem. Theory Comput., 2019, 155, 2847-2862
     DOI: 10.1021/acs.jctc.9b00143
   
   for SPH calculations refer to:
   * S. Spicher and S. Grimme, J. Chem. Theory Comput., 2021, 17, 1701-1714
     DOI: 10.1021/acs.jctc.0c01306
   
   for ONIOM refer to:
   * C. Plett, A. Katbashev, S. Ehlert, S. Grimme, M. Bursch,
     Phys. Chem. Chem. Phys., 2023, 25, 17860-17868. DOI: 10.1039/D3CP02178E
   
   for DIPRO refer to:
   * J. Kohn, N. Gildemeister, S. Grimme, D. Fazzi, A. Hansen,
     J. Chem. Phys., 2023, just accepted.
   
   for PTB refer to:
   * S. Grimme, M. Mueller, A. Hansen, J. Chem. Phys., 2023, 158, 124111.
     DOI: 10.1063/5.0137838
   
   with help from (in alphabetical order)
   P. Atkinson, C. Bannwarth, F. Bohle, G. Brandenburg, E. Caldeweyher
   M. Checinski, S. Dohm, S. Ehlert, S. Ehrlich, I. Gerasimov, C. Hölzer
   A. Katbashev, J. Kohn, J. Koopman, C. Lavigne, S. Lehtola, F. März, M. Müller,
   F. Musil, H. Neugebauer, J. Pisarek, C. Plett, P. Pracht, F. Pultar,
   J. Seibert, P. Shushkov, S. Spicher, M. Stahn, M. Steiner, T. Strunk,
   J. Stückrath, T. Rose, and J. Unsleber
   
 * started run on 2025/04/09 at 05:20:41.262     
   ID    Z sym.   atoms
    1    6 C      1, 2, 7, 8, 10, 15, 16, 18, 19
    2    8 O      3, 6, 14, 17
    3   15 P      4, 12
    4   16 S      5, 9, 11, 13
    5    1 H      20-41

           -------------------------------------------------
          |                Calculation Setup                |
           -------------------------------------------------

          program call               : /srv/scratch/z5358697/.xtb/bin/xtb gas.coord --gfn2 --sp --chrg 0 --norestart --parallel 1
          hostname                   : k163
          coordinate file            : gas.coord
          omp threads                :                     1


           -------------------------------------------------
          |                 G F N 2 - x T B                 |
           -------------------------------------------------

        Reference                      10.1021/acs.jctc.8b01176
      * Hamiltonian:
        H0-scaling (s, p, d)           1.850000    2.230000    2.230000
        zeta-weighting                 0.500000
      * Dispersion:
        s8                             2.700000
        a1                             0.520000
        a2                             5.000000
        s9                             5.000000
      * Repulsion:
        kExp                           1.500000    1.000000
        rExp                           1.000000
      * Coulomb:
        alpha                          2.000000
        third order                    shell-resolved
        anisotropic                    true
        a3                             3.000000
        a5                             4.000000
        cn-shift                       1.200000
        cn-exp                         4.000000
        max-rad                        5.000000


          ...................................................
          :                      SETUP                      :
          :.................................................:
          :  # basis functions                 134          :
          :  # atomic orbitals                 128          :
          :  # shells                           66          :
          :  # electrons                       116          :
          :  max. iterations                   250          :
          :  Hamiltonian                  GFN2-xTB          :
          :  restarted?                      false          :
          :  GBSA solvation                  false          :
          :  PC potential                    false          :
          :  electronic temp.          300.0000000     K    :
          :  accuracy                    1.0000000          :
          :  -> integral cutoff          0.2500000E+02      :
          :  -> integral neglect         0.1000000E-07      :
          :  -> SCF convergence          0.1000000E-05 Eh   :
          :  -> wf. convergence          0.1000000E-03 e    :
          :  Broyden damping             0.4000000          :
          :  net charge                          0          :
          :  unpaired electrons                  0          :
          ...................................................

 iter      E             dE          RMSdq      gap      omega  full diag
   1    -65.3766730 -0.653767E+02  0.643E+00    4.31       0.0  T
   2    -65.5517070 -0.175034E+00  0.414E+00    3.06       1.0  T
   3    -65.5709278 -0.192208E-01  0.144E+00    2.94       1.0  T
   4    -65.5735174 -0.258962E-02  0.578E-01    2.69       1.0  T
   5    -65.5742950 -0.777593E-03  0.270E-01    2.81       1.0  T
   6    -65.5745033 -0.208251E-03  0.135E-01    2.79       1.0  T
   7    -65.5745616 -0.583906E-04  0.516E-02    2.80       1.0  T
   8    -65.5745727 -0.110225E-04  0.243E-02    2.81       1.0  T
   9    -65.5745743 -0.158390E-05  0.618E-03    2.80       2.5  T
  10    -65.5745744 -0.128344E-06  0.323E-03    2.81       4.8  T
  11    -65.5745744 -0.106657E-07  0.784E-04    2.81      19.9  T
  12    -65.5745744 -0.115148E-08  0.395E-04    2.81      39.5  T

   *** convergence criteria satisfied after 12 iterations ***

         #    Occupation            Energy/Eh            Energy/eV
      -------------------------------------------------------------
         1        2.0000           -0.7581896             -20.6314
       ...           ...                  ...                  ...
        52        2.0000           -0.4345519             -11.8248
        53        2.0000           -0.4089688             -11.1286
        54        2.0000           -0.3988073             -10.8521
        55        2.0000           -0.3712878             -10.1033
        56        2.0000           -0.3682931             -10.0218
        57        2.0000           -0.3660095              -9.9596
        58        2.0000           -0.3602119              -9.8019 (HOMO)
        59                         -0.2571234              -6.9967 (LUMO)
        60                         -0.2432019              -6.6179
        61                         -0.2054164              -5.5897
        62                         -0.1754761              -4.7749
        63                         -0.1600098              -4.3541
       ...                                ...                  ...
       128                          1.3115655              35.6895
      -------------------------------------------------------------
                  HL-Gap            0.1030885 Eh            2.8052 eV
             Fermi-level           -0.3086676 Eh           -8.3993 eV

 SCC (total)                   0 d,  0 h,  0 min,  0.066 sec
 SCC setup                      ...        0 min,  0.000 sec (  0.420%)
 Dispersion                     ...        0 min,  0.000 sec (  0.469%)
 classical contributions        ...        0 min,  0.000 sec (  0.089%)
 integral evaluation            ...        0 min,  0.024 sec ( 36.470%)
 iterations                     ...        0 min,  0.021 sec ( 32.565%)
 molecular gradient             ...        0 min,  0.019 sec ( 29.682%)
 printout                       ...        0 min,  0.000 sec (  0.281%)

         :::::::::::::::::::::::::::::::::::::::::::::::::::::
         ::                     SUMMARY                     ::
         :::::::::::::::::::::::::::::::::::::::::::::::::::::
         :: total energy             -65.013000475609 Eh    ::
         :: gradient norm              0.038340357924 Eh/a0 ::
         :: HOMO-LUMO gap              2.805179701213 eV    ::
         ::.................................................::
         :: SCC energy               -65.573571610120 Eh    ::
         :: -> isotropic ES            0.107416622699 Eh    ::
         :: -> anisotropic ES         -0.012433842835 Eh    ::
         :: -> anisotropic XC          0.030865307797 Eh    ::
         :: -> dispersion             -0.056088858485 Eh    ::
         :: repulsion energy           0.560571134511 Eh    ::
         :: add. restraining           0.000000000000 Eh    ::
         :: total charge              -0.000000000000 e     ::
         :::::::::::::::::::::::::::::::::::::::::::::::::::::

           -------------------------------------------------
          |                Property Printout                |
           -------------------------------------------------

    * Orbital Energies and Occupations

         #    Occupation            Energy/Eh            Energy/eV
      -------------------------------------------------------------
         1        2.0000           -0.7581896             -20.6314
       ...           ...                  ...                  ...
        46        2.0000           -0.4630225             -12.5995
        47        2.0000           -0.4617800             -12.5657
        48        2.0000           -0.4609840             -12.5440
        49        2.0000           -0.4537356             -12.3468
        50        2.0000           -0.4451582             -12.1134
        51        2.0000           -0.4393135             -11.9543
        52        2.0000           -0.4345519             -11.8248
        53        2.0000           -0.4089688             -11.1286
        54        2.0000           -0.3988073             -10.8521
        55        2.0000           -0.3712878             -10.1033
        56        2.0000           -0.3682931             -10.0218
        57        2.0000           -0.3660095              -9.9596
        58        2.0000           -0.3602119              -9.8019 (HOMO)
        59                         -0.2571234              -6.9967 (LUMO)
        60                         -0.2432019              -6.6179
        61                         -0.2054164              -5.5897
        62                         -0.1754761              -4.7749
        63                         -0.1600098              -4.3541
        64                         -0.1550301              -4.2186
        65                         -0.1521826              -4.1411
        66                         -0.1398228              -3.8048
        67                         -0.1163711              -3.1666
        68                         -0.1121343              -3.0513
        69                         -0.0416631              -1.1337
       ...                                ...                  ...
       128                          1.3115655              35.6895
      -------------------------------------------------------------
                  HL-Gap            0.1030885 Eh            2.8052 eV
             Fermi-level           -0.3086676 Eh           -8.3993 eV

     #   Z          covCN         q      C6AA      α(0)
     1   6 C        3.751    -0.118    22.830     6.814
     2   6 C        3.831     0.082    19.204     6.235
     3   8 O        1.655    -0.253    18.207     5.760
     4  15 P        3.780     0.381   144.396    21.586
     5  16 S        0.928    -0.395   156.382    21.152
     6   8 O        1.654    -0.236    17.933     5.717
     7   6 C        3.811     0.082    19.212     6.239
     8   6 C        3.751    -0.117    22.799     6.810
     9  16 S        2.013    -0.155   147.607    20.448
    10   6 C        3.810     0.042    19.858     6.343
    11  16 S        2.014    -0.146   147.183    20.419
    12  15 P        3.856     0.370   144.837    21.619
    13  16 S        0.926    -0.405   156.870    21.185
    14   8 O        1.655    -0.237    17.942     5.718
    15   6 C        3.868     0.088    19.090     6.213
    16   6 C        3.751    -0.112    22.703     6.795
    17   8 O        1.655    -0.252    18.192     5.758
    18   6 C        3.860     0.083    19.174     6.227
    19   6 C        3.751    -0.116    22.777     6.806
    20   1 H        0.925     0.059     2.208     2.324
    21   1 H        0.925     0.068     2.107     2.270
    22   1 H        0.925     0.069     2.097     2.265
    23   1 H        0.924     0.067     2.123     2.278
    24   1 H        0.924     0.056     2.246     2.344
    25   1 H        0.924     0.057     2.232     2.336
    26   1 H        0.924     0.070     2.087     2.259
    27   1 H        0.925     0.061     2.193     2.316
    28   1 H        0.925     0.057     2.232     2.336
    29   1 H        0.925     0.069     2.093     2.263
    30   1 H        0.925     0.082     1.956     2.187
    31   1 H        0.924     0.090     1.878     2.143
    32   1 H        0.924     0.063     2.162     2.299
    33   1 H        0.924     0.073     2.054     2.241
    34   1 H        0.925     0.058     2.224     2.332
    35   1 H        0.925     0.057     2.237     2.339
    36   1 H        0.925     0.057     2.235     2.338
    37   1 H        0.924     0.062     2.173     2.305
    38   1 H        0.924     0.061     2.187     2.313
    39   1 H        0.925     0.059     2.212     2.326
    40   1 H        0.925     0.059     2.214     2.327
    41   1 H        0.925     0.061     2.191     2.315

 Mol. C6AA /au·bohr⁶  :      26543.714565
 Mol. C8AA /au·bohr⁸  :     863336.455100
 Mol. α(0) /au        :        258.298410


Wiberg/Mayer (AO) data.
largest (>0.10) Wiberg bond orders for each atom

 ---------------------------------------------------------------------------
     #   Z sym  total        # sym  WBO       # sym  WBO       # sym  WBO
 ---------------------------------------------------------------------------
     1   6 C    3.988 --     2 C    1.022    22 H    0.982    20 H    0.980
                            21 H    0.974
     2   6 C    3.910 --     1 C    1.022    24 H    0.970    23 H    0.969
                             3 O    0.903
     3   8 O    2.405 --     4 P    1.308     2 C    0.903
     4  15 P    5.283 --     5 S    1.549     6 O    1.344     3 O    1.308
                             9 S    0.952
     5  16 S    1.887 --     4 P    1.549     9 S    0.142
     6   8 O    2.424 --     4 P    1.344     7 C    0.887
     7   6 C    3.911 --     8 C    1.022    25 H    0.973    26 H    0.969
                             6 O    0.887
     8   6 C    3.990 --     7 C    1.022    29 H    0.980    28 H    0.979
                            27 H    0.978
     9  16 S    2.277 --    10 C    0.993     4 P    0.952     5 S    0.142
    10   6 C    3.957 --     9 S    0.993    11 S    0.979    30 H    0.969
                            31 H    0.943
    11  16 S    2.281 --    12 P    0.994    10 C    0.979    13 S    0.139
    12  15 P    5.297 --    13 S    1.544    14 O    1.318    17 O    1.296
                            11 S    0.994
    13  16 S    1.887 --    12 P    1.544    11 S    0.139
    14   8 O    2.414 --    12 P    1.318    15 C    0.896
    15   6 C    3.906 --    16 C    1.022    32 H    0.969    33 H    0.965
                            14 O    0.896
    16   6 C    3.993 --    15 C    1.022    35 H    0.984    36 H    0.981
                            34 H    0.976
    17   8 O    2.402 --    12 P    1.296    18 C    0.911
    18   6 C    3.913 --    19 C    1.021    37 H    0.970    38 H    0.968
                            17 O    0.911
    19   6 C    3.991 --    18 C    1.021    41 H    0.983    39 H    0.981
                            40 H    0.977
    20   1 H    0.996 --     1 C    0.980
    21   1 H    0.995 --     1 C    0.974
    22   1 H    0.995 --     1 C    0.982
    23   1 H    0.995 --     2 C    0.969
    24   1 H    0.997 --     2 C    0.970
    25   1 H    0.997 --     7 C    0.973
    26   1 H    0.995 --     7 C    0.969
    27   1 H    0.996 --     8 C    0.978
    28   1 H    0.995 --     8 C    0.979
    29   1 H    0.995 --     8 C    0.980
    30   1 H    0.993 --    10 C    0.969
    31   1 H    0.992 --    10 C    0.943
    32   1 H    0.995 --    15 C    0.969
    33   1 H    0.995 --    15 C    0.965
    34   1 H    0.997 --    16 C    0.976
    35   1 H    0.997 --    16 C    0.984
    36   1 H    0.996 --    16 C    0.981
    37   1 H    0.996 --    18 C    0.970
    38   1 H    0.996 --    18 C    0.968
    39   1 H    0.996 --    19 C    0.981
    40   1 H    0.997 --    19 C    0.977
    41   1 H    0.996 --    19 C    0.983
 ---------------------------------------------------------------------------

Topologies differ in total number of bonds
Writing topology from bond orders to xtbtopo.mol

molecular dipole:
                 x           y           z       tot (Debye)
 q only:        0.795      -1.277       1.485
   full:        0.750      -0.935       2.068       6.074
molecular quadrupole (traceless):
                xx          xy          yy          xz          yz          zz
 q only:       22.103       0.324      -9.413      -5.483       7.723     -12.690
  q+dip:       24.174       2.775     -12.827      -4.868      10.535     -11.347
   full:       25.291       2.309     -12.397      -5.099      10.930     -12.895


           -------------------------------------------------
          | TOTAL ENERGY              -65.013000475609 Eh   |
          | GRADIENT NORM               0.038340357924 Eh/α |
          | HOMO-LUMO GAP               2.805179701213 eV   |
           -------------------------------------------------

------------------------------------------------------------------------
 * finished run on 2025/04/09 at 05:20:41.372     
------------------------------------------------------------------------
 total:
 * wall-time:     0 d,  0 h,  0 min,  0.110 sec
 *  cpu-time:     0 d,  0 h,  0 min,  0.063 sec
 * ratio c/w:     0.573 speedup
 SCF:
 * wall-time:     0 d,  0 h,  0 min,  0.066 sec
 *  cpu-time:     0 d,  0 h,  0 min,  0.050 sec
 * ratio c/w:     0.760 speedup

