      -----------------------------------------------------------      
     |                   =====================                   |     
     |                           x T B                           |     
     |                   =====================                   |     
     |                         S. Grimme                         |     
     |          Mulliken Center for Theoretical Chemistry        |     
     |                    University of Bonn                     |     
      -----------------------------------------------------------      

   * xtb version 6.7.1 (edcfbbe) compiled by 'albert@albert-system' on 2024-07-22

   xtb is free software: you can redistribute it and/or modify it under
   the terms of the GNU Lesser General Public License as published by
   the Free Software Foundation, either version 3 of the License, or
   (at your option) any later version.
   
   xtb is distributed in the hope that it will be useful,
   but WITHOUT ANY WARRANTY; without even the implied warranty of
   MERCHANTABILITY or FITNESS FOR A PARTICULAR PURPOSE.  See the
   GNU Lesser General Public License for more details.
   
   Cite this work as:
   * C. Bannwarth, E. Caldeweyher, S. Ehlert, A. Hansen, P. Pracht,
     J. Seibert, S. Spicher, S. Grimme, WIREs Comput. Mol. Sci., 2020, 11,
     e01493. DOI: 10.1002/wcms.1493
   
   for GFN2-xTB:
   * C. Bannwarth, S. Ehlert and S. Grimme., J. Chem. Theory Comput., 2019,
     15, 1652-1671. DOI: 10.1021/acs.jctc.8b01176
   for GFN1-xTB:
   * S. Grimme, C. Bannwarth, P. Shushkov, J. Chem. Theory Comput., 2017,
     13, 1989-2009. DOI: 10.1021/acs.jctc.7b00118
   for GFN0-xTB:
   * P. Pracht, E. Caldeweyher, S. Ehlert, S. Grimme, ChemRxiv, 2019, preprint.
     DOI: 10.26434/chemrxiv.8326202.v1
   for GFN-FF:
   * S. Spicher and S. Grimme, Angew. Chem. Int. Ed., 2020, 59, 15665-15673.
     DOI: 10.1002/anie.202004239
   
   for ALPB and GBSA implicit solvation:
   * S. Ehlert, M. Stahn, S. Spicher, S. Grimme, J. Chem. Theory Comput.,
     2021, 17, 4250-4261. DOI: 10.1021/acs.jctc.1c00471
   
   for ddCOSMO and CPCM-X implicit solvation:
   * M. Stahn, S. Ehlert, S. Grimme, J. Phys. Chem. A,
     2023, XX, XXXX-XXXX. DOI: 10.1021/acs.jpca.3c04382
   
   for DFT-D4:
   * E. Caldeweyher, C. Bannwarth and S. Grimme, J. Chem. Phys., 2017,
     147, 034112. DOI: 10.1063/1.4993215
   * E. Caldeweyher, S. Ehlert, A. Hansen, H. Neugebauer, S. Spicher,
     C. Bannwarth and S. Grimme, J. Chem. Phys., 2019, 150, 154122.
     DOI: 10.1063/1.5090222
   * E. Caldeweyher, J.-M. Mewes, S. Ehlert and S. Grimme, Phys. Chem. Chem. Phys.
     2020, 22, 8499-8512. DOI: 10.1039/D0CP00502A
   
   for sTDA-xTB:
   * S. Grimme and C. Bannwarth, J. Chem. Phys., 2016, 145, 054103.
     DOI: 10.1063/1.4959605
   
   in the mass-spec context:
   * V. Asgeirsson, C. Bauer and S. Grimme, Chem. Sci., 2017, 8, 4879.
     DOI: 10.1039/c7sc00601b
   * J. Koopman and S. Grimme, ACS Omega 2019, 4, 12, 15120-15133.
     DOI: 10.1021/acsomega.9b02011
   
   for metadynamics refer to:
   * S. Grimme, J. Chem. Theory Comput., 2019, 155, 2847-2862
     DOI: 10.1021/acs.jctc.9b00143
   
   for SPH calculations refer to:
   * S. Spicher and S. Grimme, J. Chem. Theory Comput., 2021, 17, 1701-1714
     DOI: 10.1021/acs.jctc.0c01306
   
   for ONIOM refer to:
   * C. Plett, A. Katbashev, S. Ehlert, S. Grimme, M. Bursch,
     Phys. Chem. Chem. Phys., 2023, 25, 17860-17868. DOI: 10.1039/D3CP02178E
   
   for DIPRO refer to:
   * J. Kohn, N. Gildemeister, S. Grimme, D. Fazzi, A. Hansen,
     J. Chem. Phys., 2023, just accepted.
   
   for PTB refer to:
   * S. Grimme, M. Mueller, A. Hansen, J. Chem. Phys., 2023, 158, 124111.
     DOI: 10.1063/5.0137838
   
   with help from (in alphabetical order)
   P. Atkinson, C. Bannwarth, F. Bohle, G. Brandenburg, E. Caldeweyher
   M. Checinski, S. Dohm, S. Ehlert, S. Ehrlich, I. Gerasimov, C. Hölzer
   A. Katbashev, J. Kohn, J. Koopman, C. Lavigne, S. Lehtola, F. März, M. Müller,
   F. Musil, H. Neugebauer, J. Pisarek, C. Plett, P. Pracht, F. Pultar,
   J. Seibert, P. Shushkov, S. Spicher, M. Stahn, M. Steiner, T. Strunk,
   J. Stückrath, T. Rose, and J. Unsleber
   
 * started run on 2025/04/09 at 05:20:44.340     
   ID    Z sym.   atoms
    1    6 C      1, 2, 7, 8, 10, 15, 16, 18, 19
    2    8 O      3, 6, 14, 17
    3   15 P      4, 12
    4   16 S      5, 9, 11, 13
    5    1 H      20-41

           -------------------------------------------------
          |                Calculation Setup                |
           -------------------------------------------------

          program call               : /srv/scratch/z5358697/.xtb/bin/xtb gas.coord --gfn2 --sp --chrg 0 --norestart --parallel 1
          hostname                   : k163
          coordinate file            : gas.coord
          omp threads                :                     1


           -------------------------------------------------
          |                 G F N 2 - x T B                 |
           -------------------------------------------------

        Reference                      10.1021/acs.jctc.8b01176
      * Hamiltonian:
        H0-scaling (s, p, d)           1.850000    2.230000    2.230000
        zeta-weighting                 0.500000
      * Dispersion:
        s8                             2.700000
        a1                             0.520000
        a2                             5.000000
        s9                             5.000000
      * Repulsion:
        kExp                           1.500000    1.000000
        rExp                           1.000000
      * Coulomb:
        alpha                          2.000000
        third order                    shell-resolved
        anisotropic                    true
        a3                             3.000000
        a5                             4.000000
        cn-shift                       1.200000
        cn-exp                         4.000000
        max-rad                        5.000000


          ...................................................
          :                      SETUP                      :
          :.................................................:
          :  # basis functions                 134          :
          :  # atomic orbitals                 128          :
          :  # shells                           66          :
          :  # electrons                       116          :
          :  max. iterations                   250          :
          :  Hamiltonian                  GFN2-xTB          :
          :  restarted?                      false          :
          :  GBSA solvation                  false          :
          :  PC potential                    false          :
          :  electronic temp.          300.0000000     K    :
          :  accuracy                    1.0000000          :
          :  -> integral cutoff          0.2500000E+02      :
          :  -> integral neglect         0.1000000E-07      :
          :  -> SCF convergence          0.1000000E-05 Eh   :
          :  -> wf. convergence          0.1000000E-03 e    :
          :  Broyden damping             0.4000000          :
          :  net charge                          0          :
          :  unpaired electrons                  0          :
          ...................................................

 iter      E             dE          RMSdq      gap      omega  full diag
   1    -65.3881320 -0.653881E+02  0.621E+00    4.17       0.0  T
   2    -65.5539367 -0.165805E+00  0.384E+00    3.28       1.0  T
   3    -65.5729551 -0.190185E-01  0.144E+00    3.08       1.0  T
   4    -65.5751974 -0.224223E-02  0.581E-01    2.84       1.0  T
   5    -65.5762280 -0.103065E-02  0.270E-01    2.96       1.0  T
   6    -65.5764715 -0.243535E-03  0.135E-01    2.93       1.0  T
   7    -65.5765335 -0.619466E-04  0.490E-02    2.94       1.0  T
   8    -65.5765418 -0.830863E-05  0.218E-02    2.95       1.0  T
   9    -65.5765430 -0.119450E-05  0.521E-03    2.95       3.0  T
  10    -65.5765431 -0.566478E-07  0.246E-03    2.95       6.3  T
  11    -65.5765431 -0.694294E-08  0.531E-04    2.95      29.4  T
  12    -65.5765431 -0.630763E-09  0.255E-04    2.95      61.4  T

   *** convergence criteria satisfied after 12 iterations ***

         #    Occupation            Energy/Eh            Energy/eV
      -------------------------------------------------------------
         1        2.0000           -0.7566371             -20.5891
       ...           ...                  ...                  ...
        52        2.0000           -0.4359712             -11.8634
        53        2.0000           -0.4099041             -11.1541
        54        2.0000           -0.4009113             -10.9094
        55        2.0000           -0.3767900             -10.2530
        56        2.0000           -0.3746627             -10.1951
        57        2.0000           -0.3716263             -10.1125
        58        2.0000           -0.3691719             -10.0457 (HOMO)
        59                         -0.2608426              -7.0979 (LUMO)
        60                         -0.2461377              -6.6977
        61                         -0.2099906              -5.7141
        62                         -0.1860595              -5.0629
        63                         -0.1647665              -4.4835
       ...                                ...                  ...
       128                          1.4076794              38.3049
      -------------------------------------------------------------
                  HL-Gap            0.1083293 Eh            2.9478 eV
             Fermi-level           -0.3150072 Eh           -8.5718 eV

 SCC (total)                   0 d,  0 h,  0 min,  0.056 sec
 SCC setup                      ...        0 min,  0.000 sec (  0.462%)
 Dispersion                     ...        0 min,  0.000 sec (  0.541%)
 classical contributions        ...        0 min,  0.000 sec (  0.100%)
 integral evaluation            ...        0 min,  0.008 sec ( 14.988%)
 iterations                     ...        0 min,  0.024 sec ( 43.637%)
 molecular gradient             ...        0 min,  0.022 sec ( 39.867%)
 printout                       ...        0 min,  0.000 sec (  0.371%)

         :::::::::::::::::::::::::::::::::::::::::::::::::::::
         ::                     SUMMARY                     ::
         :::::::::::::::::::::::::::::::::::::::::::::::::::::
         :: total energy             -65.014281032811 Eh    ::
         :: gradient norm              0.030151709360 Eh/a0 ::
         :: HOMO-LUMO gap              2.947791459422 eV    ::
         ::.................................................::
         :: SCC energy               -65.575399485490 Eh    ::
         :: -> isotropic ES            0.105781304942 Eh    ::
         :: -> anisotropic ES         -0.014329517444 Eh    ::
         :: -> anisotropic XC          0.031166626971 Eh    ::
         :: -> dispersion             -0.055831145790 Eh    ::
         :: repulsion energy           0.561118452679 Eh    ::
         :: add. restraining           0.000000000000 Eh    ::
         :: total charge               0.000000000000 e     ::
         :::::::::::::::::::::::::::::::::::::::::::::::::::::

           -------------------------------------------------
          |                Property Printout                |
           -------------------------------------------------

    * Orbital Energies and Occupations

         #    Occupation            Energy/Eh            Energy/eV
      -------------------------------------------------------------
         1        2.0000           -0.7566371             -20.5891
       ...           ...                  ...                  ...
        46        2.0000           -0.4703398             -12.7986
        47        2.0000           -0.4632740             -12.6063
        48        2.0000           -0.4582708             -12.4702
        49        2.0000           -0.4522455             -12.3062
        50        2.0000           -0.4476635             -12.1815
        51        2.0000           -0.4389762             -11.9451
        52        2.0000           -0.4359712             -11.8634
        53        2.0000           -0.4099041             -11.1541
        54        2.0000           -0.4009113             -10.9094
        55        2.0000           -0.3767900             -10.2530
        56        2.0000           -0.3746627             -10.1951
        57        2.0000           -0.3716263             -10.1125
        58        2.0000           -0.3691719             -10.0457 (HOMO)
        59                         -0.2608426              -7.0979 (LUMO)
        60                         -0.2461377              -6.6977
        61                         -0.2099906              -5.7141
        62                         -0.1860595              -5.0629
        63                         -0.1647665              -4.4835
        64                         -0.1608911              -4.3781
        65                         -0.1568896              -4.2692
        66                         -0.1331725              -3.6238
        67                         -0.1181635              -3.2154
        68                         -0.1118947              -3.0448
        69                         -0.0411574              -1.1199
       ...                                ...                  ...
       128                          1.4076794              38.3049
      -------------------------------------------------------------
                  HL-Gap            0.1083293 Eh            2.9478 eV
             Fermi-level           -0.3150072 Eh           -8.5718 eV

     #   Z          covCN         q      C6AA      α(0)
     1   6 C        3.751    -0.118    22.827     6.814
     2   6 C        3.870     0.084    19.146     6.222
     3   8 O        1.655    -0.256    18.266     5.769
     4  15 P        3.875     0.390   144.080    21.562
     5  16 S        0.927    -0.395   156.369    21.151
     6   8 O        1.653    -0.242    18.034     5.733
     7   6 C        3.865     0.083    19.169     6.226
     8   6 C        3.751    -0.113    22.731     6.799
     9  16 S        1.986    -0.164   147.996    20.475
    10   6 C        3.800     0.040    19.902     6.352
    11  16 S        2.002    -0.160   147.791    20.461
    12  15 P        3.784     0.382   144.369    21.584
    13  16 S        0.926    -0.398   156.552    21.163
    14   8 O        1.655    -0.259    18.306     5.776
    15   6 C        3.815     0.082    19.207     6.238
    16   6 C        3.751    -0.116    22.777     6.806
    17   8 O        1.654    -0.227    17.774     5.691
    18   6 C        3.842     0.086    19.126     6.221
    19   6 C        3.752    -0.113    22.720     6.797
    20   1 H        0.925     0.065     2.141     2.288
    21   1 H        0.925     0.061     2.183     2.310
    22   1 H        0.925     0.062     2.179     2.309
    23   1 H        0.924     0.063     2.169     2.303
    24   1 H        0.924     0.062     2.171     2.304
    25   1 H        0.924     0.082     1.963     2.191
    26   1 H        0.924     0.053     2.279     2.361
    27   1 H        0.925     0.059     2.216     2.328
    28   1 H        0.925     0.064     2.148     2.292
    29   1 H        0.925     0.058     2.222     2.331
    30   1 H        0.924     0.081     1.970     2.195
    31   1 H        0.925     0.082     1.955     2.186
    32   1 H        0.924     0.067     2.119     2.276
    33   1 H        0.924     0.056     2.244     2.342
    34   1 H        0.925     0.069     2.098     2.265
    35   1 H        0.925     0.058     2.220     2.330
    36   1 H        0.925     0.060     2.201     2.320
    37   1 H        0.924     0.068     2.106     2.270
    38   1 H        0.924     0.052     2.297     2.370
    39   1 H        0.925     0.073     2.050     2.239
    40   1 H        0.925     0.059     2.207     2.323
    41   1 H        0.925     0.060     2.201     2.320

 Mol. C6AA /au·bohr⁶  :      26544.413578
 Mol. C8AA /au·bohr⁸  :     863299.508761
 Mol. α(0) /au        :        258.294115


Wiberg/Mayer (AO) data.
largest (>0.10) Wiberg bond orders for each atom

 ---------------------------------------------------------------------------
     #   Z sym  total        # sym  WBO       # sym  WBO       # sym  WBO
 ---------------------------------------------------------------------------
     1   6 C    3.990 --     2 C    1.022    22 H    0.983    21 H    0.980
                            20 H    0.974
     2   6 C    3.910 --     1 C    1.022    24 H    0.970    23 H    0.968
                             3 O    0.906
     3   8 O    2.399 --     4 P    1.301     2 C    0.906
     4  15 P    5.273 --     5 S    1.568     6 O    1.332     3 O    1.301
                             9 S    0.942
     5  16 S    1.886 --     4 P    1.568     9 S    0.139
     6   8 O    2.414 --     4 P    1.332     7 C    0.880
     7   6 C    3.903 --     8 C    1.022    26 H    0.969    25 H    0.963
                             6 O    0.880
     8   6 C    3.990 --     7 C    1.022    28 H    0.984    27 H    0.982
                            29 H    0.979
     9  16 S    2.254 --    10 C    0.983     4 P    0.942     5 S    0.139
    10   6 C    3.959 --    11 S    0.992     9 S    0.983    31 H    0.967
                            30 H    0.941
    11  16 S    2.283 --    10 C    0.992    12 P    0.946    13 S    0.147
    12  15 P    5.277 --    13 S    1.536    17 O    1.355    14 O    1.297
                            11 S    0.946
    13  16 S    1.897 --    12 P    1.536    11 S    0.147
    14   8 O    2.397 --    12 P    1.297    15 C    0.906
    15   6 C    3.911 --    16 C    1.022    33 H    0.970    32 H    0.969
                            14 O    0.906
    16   6 C    3.990 --    15 C    1.022    34 H    0.982    35 H    0.980
                            36 H    0.976
    17   8 O    2.429 --    12 P    1.355    18 C    0.881
    18   6 C    3.904 --    19 C    1.020    38 H    0.973    37 H    0.967
                            17 O    0.881
    19   6 C    3.988 --    18 C    1.020    41 H    0.984    39 H    0.981
                            40 H    0.979
    20   1 H    0.996 --     1 C    0.974
    21   1 H    0.995 --     1 C    0.980
    22   1 H    0.996 --     1 C    0.983
    23   1 H    0.996 --     2 C    0.968
    24   1 H    0.996 --     2 C    0.970
    25   1 H    0.993 --     7 C    0.963
    26   1 H    0.997 --     7 C    0.969
    27   1 H    0.996 --     8 C    0.982
    28   1 H    0.996 --     8 C    0.984
    29   1 H    0.995 --     8 C    0.979
    30   1 H    0.993 --    10 C    0.941
    31   1 H    0.993 --    10 C    0.967
    32   1 H    0.995 --    15 C    0.969
    33   1 H    0.997 --    15 C    0.970
    34   1 H    0.995 --    16 C    0.982
    35   1 H    0.996 --    16 C    0.980
    36   1 H    0.996 --    16 C    0.976
    37   1 H    0.995 --    18 C    0.967
    38   1 H    0.997 --    18 C    0.973
    39   1 H    0.994 --    19 C    0.981
    40   1 H    0.994 --    19 C    0.979
    41   1 H    0.996 --    19 C    0.984
 ---------------------------------------------------------------------------

Topologies differ in total number of bonds
Writing topology from bond orders to xtbtopo.mol

molecular dipole:
                 x           y           z       tot (Debye)
 q only:        0.348      -0.178      -0.339
   full:        0.137      -0.089      -0.003       0.416
molecular quadrupole (traceless):
                xx          xy          yy          xz          yz          zz
 q only:       21.075      -5.478     -10.832      10.991       8.237     -10.243
  q+dip:       26.743      -8.923     -16.199      11.996      10.253     -10.544
   full:       27.081      -8.379     -15.946      12.288      10.608     -11.134


           -------------------------------------------------
          | TOTAL ENERGY              -65.014281032811 Eh   |
          | GRADIENT NORM               0.030151709360 Eh/α |
          | HOMO-LUMO GAP               2.947791459422 eV   |
           -------------------------------------------------

------------------------------------------------------------------------
 * finished run on 2025/04/09 at 05:20:44.440     
------------------------------------------------------------------------
 total:
 * wall-time:     0 d,  0 h,  0 min,  0.099 sec
 *  cpu-time:     0 d,  0 h,  0 min,  0.069 sec
 * ratio c/w:     0.703 speedup
 SCF:
 * wall-time:     0 d,  0 h,  0 min,  0.056 sec
 *  cpu-time:     0 d,  0 h,  0 min,  0.056 sec
 * ratio c/w:     0.989 speedup

