      -----------------------------------------------------------      
     |                   =====================                   |     
     |                           x T B                           |     
     |                   =====================                   |     
     |                         S. Grimme                         |     
     |          Mulliken Center for Theoretical Chemistry        |     
     |                    University of Bonn                     |     
      -----------------------------------------------------------      

   * xtb version 6.7.1 (edcfbbe) compiled by 'albert@albert-system' on 2024-07-22

   xtb is free software: you can redistribute it and/or modify it under
   the terms of the GNU Lesser General Public License as published by
   the Free Software Foundation, either version 3 of the License, or
   (at your option) any later version.
   
   xtb is distributed in the hope that it will be useful,
   but WITHOUT ANY WARRANTY; without even the implied warranty of
   MERCHANTABILITY or FITNESS FOR A PARTICULAR PURPOSE.  See the
   GNU Lesser General Public License for more details.
   
   Cite this work as:
   * C. Bannwarth, E. Caldeweyher, S. Ehlert, A. Hansen, P. Pracht,
     J. Seibert, S. Spicher, S. Grimme, WIREs Comput. Mol. Sci., 2020, 11,
     e01493. DOI: 10.1002/wcms.1493
   
   for GFN2-xTB:
   * C. Bannwarth, S. Ehlert and S. Grimme., J. Chem. Theory Comput., 2019,
     15, 1652-1671. DOI: 10.1021/acs.jctc.8b01176
   for GFN1-xTB:
   * S. Grimme, C. Bannwarth, P. Shushkov, J. Chem. Theory Comput., 2017,
     13, 1989-2009. DOI: 10.1021/acs.jctc.7b00118
   for GFN0-xTB:
   * P. Pracht, E. Caldeweyher, S. Ehlert, S. Grimme, ChemRxiv, 2019, preprint.
     DOI: 10.26434/chemrxiv.8326202.v1
   for GFN-FF:
   * S. Spicher and S. Grimme, Angew. Chem. Int. Ed., 2020, 59, 15665-15673.
     DOI: 10.1002/anie.202004239
   
   for ALPB and GBSA implicit solvation:
   * S. Ehlert, M. Stahn, S. Spicher, S. Grimme, J. Chem. Theory Comput.,
     2021, 17, 4250-4261. DOI: 10.1021/acs.jctc.1c00471
   
   for ddCOSMO and CPCM-X implicit solvation:
   * M. Stahn, S. Ehlert, S. Grimme, J. Phys. Chem. A,
     2023, XX, XXXX-XXXX. DOI: 10.1021/acs.jpca.3c04382
   
   for DFT-D4:
   * E. Caldeweyher, C. Bannwarth and S. Grimme, J. Chem. Phys., 2017,
     147, 034112. DOI: 10.1063/1.4993215
   * E. Caldeweyher, S. Ehlert, A. Hansen, H. Neugebauer, S. Spicher,
     C. Bannwarth and S. Grimme, J. Chem. Phys., 2019, 150, 154122.
     DOI: 10.1063/1.5090222
   * E. Caldeweyher, J.-M. Mewes, S. Ehlert and S. Grimme, Phys. Chem. Chem. Phys.
     2020, 22, 8499-8512. DOI: 10.1039/D0CP00502A
   
   for sTDA-xTB:
   * S. Grimme and C. Bannwarth, J. Chem. Phys., 2016, 145, 054103.
     DOI: 10.1063/1.4959605
   
   in the mass-spec context:
   * V. Asgeirsson, C. Bauer and S. Grimme, Chem. Sci., 2017, 8, 4879.
     DOI: 10.1039/c7sc00601b
   * J. Koopman and S. Grimme, ACS Omega 2019, 4, 12, 15120-15133.
     DOI: 10.1021/acsomega.9b02011
   
   for metadynamics refer to:
   * S. Grimme, J. Chem. Theory Comput., 2019, 155, 2847-2862
     DOI: 10.1021/acs.jctc.9b00143
   
   for SPH calculations refer to:
   * S. Spicher and S. Grimme, J. Chem. Theory Comput., 2021, 17, 1701-1714
     DOI: 10.1021/acs.jctc.0c01306
   
   for ONIOM refer to:
   * C. Plett, A. Katbashev, S. Ehlert, S. Grimme, M. Bursch,
     Phys. Chem. Chem. Phys., 2023, 25, 17860-17868. DOI: 10.1039/D3CP02178E
   
   for DIPRO refer to:
   * J. Kohn, N. Gildemeister, S. Grimme, D. Fazzi, A. Hansen,
     J. Chem. Phys., 2023, just accepted.
   
   for PTB refer to:
   * S. Grimme, M. Mueller, A. Hansen, J. Chem. Phys., 2023, 158, 124111.
     DOI: 10.1063/5.0137838
   
   with help from (in alphabetical order)
   P. Atkinson, C. Bannwarth, F. Bohle, G. Brandenburg, E. Caldeweyher
   M. Checinski, S. Dohm, S. Ehlert, S. Ehrlich, I. Gerasimov, C. Hölzer
   A. Katbashev, J. Kohn, J. Koopman, C. Lavigne, S. Lehtola, F. März, M. Müller,
   F. Musil, H. Neugebauer, J. Pisarek, C. Plett, P. Pracht, F. Pultar,
   J. Seibert, P. Shushkov, S. Spicher, M. Stahn, M. Steiner, T. Strunk,
   J. Stückrath, T. Rose, and J. Unsleber
   
 * started run on 2025/04/09 at 05:20:48.768     
   ID    Z sym.   atoms
    1    6 C      1, 2, 7, 8, 10, 15, 16, 18, 19
    2    8 O      3, 6, 14, 17
    3   15 P      4, 12
    4   16 S      5, 9, 11, 13
    5    1 H      20-41

           -------------------------------------------------
          |                Calculation Setup                |
           -------------------------------------------------

          program call               : /srv/scratch/z5358697/.xtb/bin/xtb gas.coord --gfn2 --sp --chrg 0 --norestart --parallel 1
          hostname                   : k163
          coordinate file            : gas.coord
          omp threads                :                     1


           -------------------------------------------------
          |                 G F N 2 - x T B                 |
           -------------------------------------------------

        Reference                      10.1021/acs.jctc.8b01176
      * Hamiltonian:
        H0-scaling (s, p, d)           1.850000    2.230000    2.230000
        zeta-weighting                 0.500000
      * Dispersion:
        s8                             2.700000
        a1                             0.520000
        a2                             5.000000
        s9                             5.000000
      * Repulsion:
        kExp                           1.500000    1.000000
        rExp                           1.000000
      * Coulomb:
        alpha                          2.000000
        third order                    shell-resolved
        anisotropic                    true
        a3                             3.000000
        a5                             4.000000
        cn-shift                       1.200000
        cn-exp                         4.000000
        max-rad                        5.000000


          ...................................................
          :                      SETUP                      :
          :.................................................:
          :  # basis functions                 134          :
          :  # atomic orbitals                 128          :
          :  # shells                           66          :
          :  # electrons                       116          :
          :  max. iterations                   250          :
          :  Hamiltonian                  GFN2-xTB          :
          :  restarted?                      false          :
          :  GBSA solvation                  false          :
          :  PC potential                    false          :
          :  electronic temp.          300.0000000     K    :
          :  accuracy                    1.0000000          :
          :  -> integral cutoff          0.2500000E+02      :
          :  -> integral neglect         0.1000000E-07      :
          :  -> SCF convergence          0.1000000E-05 Eh   :
          :  -> wf. convergence          0.1000000E-03 e    :
          :  Broyden damping             0.4000000          :
          :  net charge                          0          :
          :  unpaired electrons                  0          :
          ...................................................

 iter      E             dE          RMSdq      gap      omega  full diag
   1    -65.3815773 -0.653816E+02  0.609E+00    4.20       0.0  T
   2    -65.5472224 -0.165645E+00  0.358E+00    3.14       1.0  T
   3    -65.5662189 -0.189965E-01  0.134E+00    2.96       1.0  T
   4    -65.5689720 -0.275313E-02  0.607E-01    2.70       1.0  T
   5    -65.5700797 -0.110775E-02  0.279E-01    2.82       1.0  T
   6    -65.5702639 -0.184147E-03  0.137E-01    2.79       1.0  T
   7    -65.5703378 -0.739017E-04  0.486E-02    2.80       1.0  T
   8    -65.5703453 -0.746164E-05  0.212E-02    2.81       1.0  T
   9    -65.5703464 -0.116180E-05  0.578E-03    2.81       2.7  T
  10    -65.5703465 -0.741829E-07  0.255E-03    2.81       6.1  T
  11    -65.5703465 -0.770125E-08  0.505E-04    2.81      30.9  T
  12    -65.5703465 -0.433303E-09  0.246E-04    2.81      63.5  T

   *** convergence criteria satisfied after 12 iterations ***

         #    Occupation            Energy/Eh            Energy/eV
      -------------------------------------------------------------
         1        2.0000           -0.7530304             -20.4910
       ...           ...                  ...                  ...
        52        2.0000           -0.4319273             -11.7533
        53        2.0000           -0.4095549             -11.1446
        54        2.0000           -0.4008358             -10.9073
        55        2.0000           -0.3726488             -10.1403
        56        2.0000           -0.3682745             -10.0213
        57        2.0000           -0.3620944              -9.8531
        58        2.0000           -0.3601195              -9.7994 (HOMO)
        59                         -0.2569069              -6.9908 (LUMO)
        60                         -0.2446932              -6.6584
        61                         -0.2098257              -5.7096
        62                         -0.1825439              -4.9673
        63                         -0.1607124              -4.3732
       ...                                ...                  ...
       128                          1.3215735              35.9618
      -------------------------------------------------------------
                  HL-Gap            0.1032127 Eh            2.8086 eV
             Fermi-level           -0.3085132 Eh           -8.3951 eV

 SCC (total)                   0 d,  0 h,  0 min,  0.059 sec
 SCC setup                      ...        0 min,  0.000 sec (  0.460%)
 Dispersion                     ...        0 min,  0.000 sec (  0.529%)
 classical contributions        ...        0 min,  0.000 sec (  0.100%)
 integral evaluation            ...        0 min,  0.011 sec ( 18.872%)
 iterations                     ...        0 min,  0.025 sec ( 42.338%)
 molecular gradient             ...        0 min,  0.022 sec ( 37.292%)
 printout                       ...        0 min,  0.000 sec (  0.382%)

         :::::::::::::::::::::::::::::::::::::::::::::::::::::
         ::                     SUMMARY                     ::
         :::::::::::::::::::::::::::::::::::::::::::::::::::::
         :: total energy             -65.007870544141 Eh    ::
         :: gradient norm              0.040023644556 Eh/a0 ::
         :: HOMO-LUMO gap              2.808559537334 eV    ::
         ::.................................................::
         :: SCC energy               -65.569335492346 Eh    ::
         :: -> isotropic ES            0.106085543494 Eh    ::
         :: -> anisotropic ES         -0.014782476216 Eh    ::
         :: -> anisotropic XC          0.030518608849 Eh    ::
         :: -> dispersion             -0.055184571804 Eh    ::
         :: repulsion energy           0.561464948205 Eh    ::
         :: add. restraining           0.000000000000 Eh    ::
         :: total charge              -0.000000000000 e     ::
         :::::::::::::::::::::::::::::::::::::::::::::::::::::

           -------------------------------------------------
          |                Property Printout                |
           -------------------------------------------------

    * Orbital Energies and Occupations

         #    Occupation            Energy/Eh            Energy/eV
      -------------------------------------------------------------
         1        2.0000           -0.7530304             -20.4910
       ...           ...                  ...                  ...
        46        2.0000           -0.4632052             -12.6045
        47        2.0000           -0.4610467             -12.5457
        48        2.0000           -0.4603094             -12.5257
        49        2.0000           -0.4584066             -12.4739
        50        2.0000           -0.4438960             -12.0790
        51        2.0000           -0.4383901             -11.9292
        52        2.0000           -0.4319273             -11.7533
        53        2.0000           -0.4095549             -11.1446
        54        2.0000           -0.4008358             -10.9073
        55        2.0000           -0.3726488             -10.1403
        56        2.0000           -0.3682745             -10.0213
        57        2.0000           -0.3620944              -9.8531
        58        2.0000           -0.3601195              -9.7994 (HOMO)
        59                         -0.2569069              -6.9908 (LUMO)
        60                         -0.2446932              -6.6584
        61                         -0.2098257              -5.7096
        62                         -0.1825439              -4.9673
        63                         -0.1607124              -4.3732
        64                         -0.1537325              -4.1833
        65                         -0.1483697              -4.0373
        66                         -0.1441865              -3.9235
        67                         -0.1130642              -3.0766
        68                         -0.1084841              -2.9520
        69                         -0.0387216              -1.0537
       ...                                ...                  ...
       128                          1.3215735              35.9618
      -------------------------------------------------------------
                  HL-Gap            0.1032127 Eh            2.8086 eV
             Fermi-level           -0.3085132 Eh           -8.3951 eV

     #   Z          covCN         q      C6AA      α(0)
     1   6 C        3.752    -0.117    22.807     6.810
     2   6 C        3.826     0.083    19.181     6.232
     3   8 O        1.655    -0.256    18.263     5.769
     4  15 P        3.773     0.378   144.541    21.597
     5  16 S        0.930    -0.385   155.920    21.120
     6   8 O        1.654    -0.225    17.745     5.687
     7   6 C        3.819     0.081    19.229     6.241
     8   6 C        3.751    -0.117    22.812     6.811
     9  16 S        1.989    -0.166   148.067    20.480
    10   6 C        3.802     0.043    19.848     6.343
    11  16 S        1.989    -0.169   148.204    20.490
    12  15 P        3.806     0.370   144.845    21.619
    13  16 S        0.926    -0.379   155.621    21.100
    14   8 O        1.655    -0.260    18.324     5.779
    15   6 C        3.813     0.082    19.207     6.238
    16   6 C        3.751    -0.116    22.785     6.807
    17   8 O        1.654    -0.212    17.541     5.654
    18   6 C        3.863     0.086    19.117     6.218
    19   6 C        3.751    -0.117    22.805     6.810
    20   1 H        0.925     0.066     2.127     2.280
    21   1 H        0.925     0.070     2.088     2.259
    22   1 H        0.925     0.058     2.225     2.333
    23   1 H        0.924     0.066     2.129     2.282
    24   1 H        0.924     0.054     2.265     2.354
    25   1 H        0.924     0.054     2.265     2.354
    26   1 H        0.924     0.071     2.069     2.250
    27   1 H        0.925     0.054     2.273     2.358
    28   1 H        0.925     0.057     2.230     2.335
    29   1 H        0.925     0.073     2.051     2.240
    30   1 H        0.924     0.082     1.961     2.190
    31   1 H        0.925     0.076     2.021     2.223
    32   1 H        0.924     0.066     2.133     2.284
    33   1 H        0.924     0.051     2.305     2.374
    34   1 H        0.925     0.056     2.247     2.344
    35   1 H        0.925     0.058     2.224     2.332
    36   1 H        0.925     0.068     2.105     2.269
    37   1 H        0.924     0.058     2.223     2.332
    38   1 H        0.924     0.054     2.273     2.358
    39   1 H        0.925     0.058     2.225     2.333
    40   1 H        0.925     0.065     2.144     2.290
    41   1 H        0.925     0.081     1.967     2.193

 Mol. C6AA /au·bohr⁶  :      26555.944010
 Mol. C8AA /au·bohr⁸  :     863543.606768
 Mol. α(0) /au        :        258.369950


Wiberg/Mayer (AO) data.
largest (>0.10) Wiberg bond orders for each atom

 ---------------------------------------------------------------------------
     #   Z sym  total        # sym  WBO       # sym  WBO       # sym  WBO
 ---------------------------------------------------------------------------
     1   6 C    3.989 --     2 C    1.022    21 H    0.982    22 H    0.980
                            20 H    0.974
     2   6 C    3.912 --     1 C    1.022    24 H    0.970    23 H    0.969
                             3 O    0.905
     3   8 O    2.400 --     4 P    1.302     2 C    0.905
     4  15 P    5.287 --     5 S    1.559     6 O    1.358     3 O    1.302
                             9 S    0.945
     5  16 S    1.895 --     4 P    1.559     9 S    0.144
     6   8 O    2.437 --     4 P    1.358     7 C    0.889
     7   6 C    3.912 --     8 C    1.021    25 H    0.972    26 H    0.969
                             6 O    0.889
     8   6 C    3.989 --     7 C    1.021    27 H    0.982    29 H    0.980
                            28 H    0.980
     9  16 S    2.274 --    10 C    0.989     4 P    0.945     5 S    0.144
    10   6 C    3.960 --     9 S    0.989    11 S    0.985    31 H    0.969
                            30 H    0.936
    11  16 S    2.278 --    10 C    0.985    12 P    0.950    13 S    0.146
    12  15 P    5.296 --    13 S    1.557    17 O    1.368    14 O    1.282
                            11 S    0.950
    13  16 S    1.924 --    12 P    1.557    11 S    0.146
    14   8 O    2.394 --    12 P    1.282    15 C    0.912
    15   6 C    3.916 --    16 C    1.021    33 H    0.969    32 H    0.969
                            14 O    0.912
    16   6 C    3.990 --    15 C    1.021    36 H    0.983    34 H    0.981
                            35 H    0.977
    17   8 O    2.440 --    12 P    1.368    18 C    0.885
    18   6 C    3.910 --    19 C    1.021    38 H    0.973    37 H    0.966
                            17 O    0.885
    19   6 C    3.985 --    18 C    1.021    40 H    0.983    39 H    0.979
                            41 H    0.979
    20   1 H    0.996 --     1 C    0.974
    21   1 H    0.995 --     1 C    0.982
    22   1 H    0.996 --     1 C    0.980
    23   1 H    0.996 --     2 C    0.969
    24   1 H    0.997 --     2 C    0.970
    25   1 H    0.997 --     7 C    0.972
    26   1 H    0.995 --     7 C    0.969
    27   1 H    0.997 --     8 C    0.982
    28   1 H    0.995 --     8 C    0.980
    29   1 H    0.995 --     8 C    0.980
    30   1 H    0.993 --    10 C    0.936
    31   1 H    0.994 --    10 C    0.969
    32   1 H    0.996 --    15 C    0.969
    33   1 H    0.997 --    15 C    0.969
    34   1 H    0.996 --    16 C    0.981
    35   1 H    0.997 --    16 C    0.977
    36   1 H    0.995 --    16 C    0.983
    37   1 H    0.997 --    18 C    0.966
    38   1 H    0.997 --    18 C    0.973
    39   1 H    0.995 --    19 C    0.979
    40   1 H    0.995 --    19 C    0.983
    41   1 H    0.993 --    19 C    0.979
 ---------------------------------------------------------------------------

Topologies differ in total number of bonds
Writing topology from bond orders to xtbtopo.mol

molecular dipole:
                 x           y           z       tot (Debye)
 q only:        0.424      -1.762       0.779
   full:        0.351      -1.413       0.829       4.260
molecular quadrupole (traceless):
                xx          xy          yy          xz          yz          zz
 q only:       18.350       4.758     -21.758       0.955       2.383       3.408
  q+dip:       26.308       5.938     -22.382      -1.145      -0.272      -3.926
   full:       26.260       6.003     -23.032      -0.922      -0.102      -3.228


           -------------------------------------------------
          | TOTAL ENERGY              -65.007870544141 Eh   |
          | GRADIENT NORM               0.040023644556 Eh/α |
          | HOMO-LUMO GAP               2.808559537334 eV   |
           -------------------------------------------------

------------------------------------------------------------------------
 * finished run on 2025/04/09 at 05:20:48.878     
------------------------------------------------------------------------
 total:
 * wall-time:     0 d,  0 h,  0 min,  0.109 sec
 *  cpu-time:     0 d,  0 h,  0 min,  0.069 sec
 * ratio c/w:     0.629 speedup
 SCF:
 * wall-time:     0 d,  0 h,  0 min,  0.059 sec
 *  cpu-time:     0 d,  0 h,  0 min,  0.056 sec
 * ratio c/w:     0.947 speedup

