      -----------------------------------------------------------      
     |                   =====================                   |     
     |                           x T B                           |     
     |                   =====================                   |     
     |                         S. Grimme                         |     
     |          Mulliken Center for Theoretical Chemistry        |     
     |                    University of Bonn                     |     
      -----------------------------------------------------------      

   * xtb version 6.7.1 (edcfbbe) compiled by 'albert@albert-system' on 2024-07-22

   xtb is free software: you can redistribute it and/or modify it under
   the terms of the GNU Lesser General Public License as published by
   the Free Software Foundation, either version 3 of the License, or
   (at your option) any later version.
   
   xtb is distributed in the hope that it will be useful,
   but WITHOUT ANY WARRANTY; without even the implied warranty of
   MERCHANTABILITY or FITNESS FOR A PARTICULAR PURPOSE.  See the
   GNU Lesser General Public License for more details.
   
   Cite this work as:
   * C. Bannwarth, E. Caldeweyher, S. Ehlert, A. Hansen, P. Pracht,
     J. Seibert, S. Spicher, S. Grimme, WIREs Comput. Mol. Sci., 2020, 11,
     e01493. DOI: 10.1002/wcms.1493
   
   for GFN2-xTB:
   * C. Bannwarth, S. Ehlert and S. Grimme., J. Chem. Theory Comput., 2019,
     15, 1652-1671. DOI: 10.1021/acs.jctc.8b01176
   for GFN1-xTB:
   * S. Grimme, C. Bannwarth, P. Shushkov, J. Chem. Theory Comput., 2017,
     13, 1989-2009. DOI: 10.1021/acs.jctc.7b00118
   for GFN0-xTB:
   * P. Pracht, E. Caldeweyher, S. Ehlert, S. Grimme, ChemRxiv, 2019, preprint.
     DOI: 10.26434/chemrxiv.8326202.v1
   for GFN-FF:
   * S. Spicher and S. Grimme, Angew. Chem. Int. Ed., 2020, 59, 15665-15673.
     DOI: 10.1002/anie.202004239
   
   for ALPB and GBSA implicit solvation:
   * S. Ehlert, M. Stahn, S. Spicher, S. Grimme, J. Chem. Theory Comput.,
     2021, 17, 4250-4261. DOI: 10.1021/acs.jctc.1c00471
   
   for ddCOSMO and CPCM-X implicit solvation:
   * M. Stahn, S. Ehlert, S. Grimme, J. Phys. Chem. A,
     2023, XX, XXXX-XXXX. DOI: 10.1021/acs.jpca.3c04382
   
   for DFT-D4:
   * E. Caldeweyher, C. Bannwarth and S. Grimme, J. Chem. Phys., 2017,
     147, 034112. DOI: 10.1063/1.4993215
   * E. Caldeweyher, S. Ehlert, A. Hansen, H. Neugebauer, S. Spicher,
     C. Bannwarth and S. Grimme, J. Chem. Phys., 2019, 150, 154122.
     DOI: 10.1063/1.5090222
   * E. Caldeweyher, J.-M. Mewes, S. Ehlert and S. Grimme, Phys. Chem. Chem. Phys.
     2020, 22, 8499-8512. DOI: 10.1039/D0CP00502A
   
   for sTDA-xTB:
   * S. Grimme and C. Bannwarth, J. Chem. Phys., 2016, 145, 054103.
     DOI: 10.1063/1.4959605
   
   in the mass-spec context:
   * V. Asgeirsson, C. Bauer and S. Grimme, Chem. Sci., 2017, 8, 4879.
     DOI: 10.1039/c7sc00601b
   * J. Koopman and S. Grimme, ACS Omega 2019, 4, 12, 15120-15133.
     DOI: 10.1021/acsomega.9b02011
   
   for metadynamics refer to:
   * S. Grimme, J. Chem. Theory Comput., 2019, 155, 2847-2862
     DOI: 10.1021/acs.jctc.9b00143
   
   for SPH calculations refer to:
   * S. Spicher and S. Grimme, J. Chem. Theory Comput., 2021, 17, 1701-1714
     DOI: 10.1021/acs.jctc.0c01306
   
   for ONIOM refer to:
   * C. Plett, A. Katbashev, S. Ehlert, S. Grimme, M. Bursch,
     Phys. Chem. Chem. Phys., 2023, 25, 17860-17868. DOI: 10.1039/D3CP02178E
   
   for DIPRO refer to:
   * J. Kohn, N. Gildemeister, S. Grimme, D. Fazzi, A. Hansen,
     J. Chem. Phys., 2023, just accepted.
   
   for PTB refer to:
   * S. Grimme, M. Mueller, A. Hansen, J. Chem. Phys., 2023, 158, 124111.
     DOI: 10.1063/5.0137838
   
   with help from (in alphabetical order)
   P. Atkinson, C. Bannwarth, F. Bohle, G. Brandenburg, E. Caldeweyher
   M. Checinski, S. Dohm, S. Ehlert, S. Ehrlich, I. Gerasimov, C. Hölzer
   A. Katbashev, J. Kohn, J. Koopman, C. Lavigne, S. Lehtola, F. März, M. Müller,
   F. Musil, H. Neugebauer, J. Pisarek, C. Plett, P. Pracht, F. Pultar,
   J. Seibert, P. Shushkov, S. Spicher, M. Stahn, M. Steiner, T. Strunk,
   J. Stückrath, T. Rose, and J. Unsleber
   
 * started run on 2025/04/09 at 05:21:16.614     
   ID    Z sym.   atoms
    1    6 C      1, 2, 7, 8, 10, 15, 16, 18, 19
    2    8 O      3, 6, 14, 17
    3   15 P      4, 12
    4   16 S      5, 9, 11, 13
    5    1 H      20-41

           -------------------------------------------------
          |                Calculation Setup                |
           -------------------------------------------------

          program call               : /srv/scratch/z5358697/.xtb/bin/xtb gas.coord --gfn2 --sp --chrg 0 --norestart --parallel 1
          hostname                   : k163
          coordinate file            : gas.coord
          omp threads                :                     1


           -------------------------------------------------
          |                 G F N 2 - x T B                 |
           -------------------------------------------------

        Reference                      10.1021/acs.jctc.8b01176
      * Hamiltonian:
        H0-scaling (s, p, d)           1.850000    2.230000    2.230000
        zeta-weighting                 0.500000
      * Dispersion:
        s8                             2.700000
        a1                             0.520000
        a2                             5.000000
        s9                             5.000000
      * Repulsion:
        kExp                           1.500000    1.000000
        rExp                           1.000000
      * Coulomb:
        alpha                          2.000000
        third order                    shell-resolved
        anisotropic                    true
        a3                             3.000000
        a5                             4.000000
        cn-shift                       1.200000
        cn-exp                         4.000000
        max-rad                        5.000000


          ...................................................
          :                      SETUP                      :
          :.................................................:
          :  # basis functions                 134          :
          :  # atomic orbitals                 128          :
          :  # shells                           66          :
          :  # electrons                       116          :
          :  max. iterations                   250          :
          :  Hamiltonian                  GFN2-xTB          :
          :  restarted?                      false          :
          :  GBSA solvation                  false          :
          :  PC potential                    false          :
          :  electronic temp.          300.0000000     K    :
          :  accuracy                    1.0000000          :
          :  -> integral cutoff          0.2500000E+02      :
          :  -> integral neglect         0.1000000E-07      :
          :  -> SCF convergence          0.1000000E-05 Eh   :
          :  -> wf. convergence          0.1000000E-03 e    :
          :  Broyden damping             0.4000000          :
          :  net charge                          0          :
          :  unpaired electrons                  0          :
          ...................................................

 iter      E             dE          RMSdq      gap      omega  full diag
   1    -65.3827801 -0.653828E+02  0.630E+00    4.11       0.0  T
   2    -65.5492843 -0.166504E+00  0.390E+00    3.08       1.0  T
   3    -65.5682945 -0.190102E-01  0.135E+00    2.87       1.0  T
   4    -65.5706763 -0.238176E-02  0.568E-01    2.63       1.0  T
   5    -65.5715576 -0.881280E-03  0.260E-01    2.75       1.0  T
   6    -65.5717917 -0.234172E-03  0.127E-01    2.73       1.0  T
   7    -65.5718567 -0.649301E-04  0.472E-02    2.74       1.0  T
   8    -65.5718645 -0.782488E-05  0.210E-02    2.75       1.0  T
   9    -65.5718655 -0.975220E-06  0.527E-03    2.75       3.0  T
  10    -65.5718655 -0.858427E-07  0.258E-03    2.75       6.0  T
  11    -65.5718656 -0.554661E-08  0.527E-04    2.75      29.6  T
  12    -65.5718656 -0.923748E-09  0.245E-04    2.75      63.7  T

   *** convergence criteria satisfied after 12 iterations ***

         #    Occupation            Energy/Eh            Energy/eV
      -------------------------------------------------------------
         1        2.0000           -0.7587954             -20.6479
       ...           ...                  ...                  ...
        52        2.0000           -0.4356449             -11.8545
        53        2.0000           -0.4118130             -11.2060
        54        2.0000           -0.4017683             -10.9327
        55        2.0000           -0.3746387             -10.1944
        56        2.0000           -0.3730649             -10.1516
        57        2.0000           -0.3710224             -10.0960
        58        2.0000           -0.3682125             -10.0196 (HOMO)
        59                         -0.2672781              -7.2730 (LUMO)
        60                         -0.2414956              -6.5714
        61                         -0.2134845              -5.8092
        62                         -0.1885824              -5.1316
        63                         -0.1588199              -4.3217
       ...                                ...                  ...
       128                          1.2944516              35.2238
      -------------------------------------------------------------
                  HL-Gap            0.1009344 Eh            2.7466 eV
             Fermi-level           -0.3177453 Eh           -8.6463 eV

 SCC (total)                   0 d,  0 h,  0 min,  0.060 sec
 SCC setup                      ...        0 min,  0.000 sec (  0.440%)
 Dispersion                     ...        0 min,  0.000 sec (  0.549%)
 classical contributions        ...        0 min,  0.000 sec (  0.100%)
 integral evaluation            ...        0 min,  0.012 sec ( 19.417%)
 iterations                     ...        0 min,  0.025 sec ( 42.028%)
 molecular gradient             ...        0 min,  0.022 sec ( 36.649%)
 printout                       ...        0 min,  0.000 sec (  0.790%)

         :::::::::::::::::::::::::::::::::::::::::::::::::::::
         ::                     SUMMARY                     ::
         :::::::::::::::::::::::::::::::::::::::::::::::::::::
         :: total energy             -65.009689406477 Eh    ::
         :: gradient norm              0.031330605683 Eh/a0 ::
         :: HOMO-LUMO gap              2.746564579761 eV    ::
         ::.................................................::
         :: SCC energy               -65.570797549981 Eh    ::
         :: -> isotropic ES            0.104534451657 Eh    ::
         :: -> anisotropic ES         -0.009773934782 Eh    ::
         :: -> anisotropic XC          0.031210112958 Eh    ::
         :: -> dispersion             -0.053100590187 Eh    ::
         :: repulsion energy           0.561108143504 Eh    ::
         :: add. restraining           0.000000000000 Eh    ::
         :: total charge              -0.000000000000 e     ::
         :::::::::::::::::::::::::::::::::::::::::::::::::::::

           -------------------------------------------------
          |                Property Printout                |
           -------------------------------------------------

    * Orbital Energies and Occupations

         #    Occupation            Energy/Eh            Energy/eV
      -------------------------------------------------------------
         1        2.0000           -0.7587954             -20.6479
       ...           ...                  ...                  ...
        46        2.0000           -0.4647553             -12.6466
        47        2.0000           -0.4639068             -12.6235
        48        2.0000           -0.4626781             -12.5901
        49        2.0000           -0.4577440             -12.4558
        50        2.0000           -0.4516009             -12.2887
        51        2.0000           -0.4438936             -12.0790
        52        2.0000           -0.4356449             -11.8545
        53        2.0000           -0.4118130             -11.2060
        54        2.0000           -0.4017683             -10.9327
        55        2.0000           -0.3746387             -10.1944
        56        2.0000           -0.3730649             -10.1516
        57        2.0000           -0.3710224             -10.0960
        58        2.0000           -0.3682125             -10.0196 (HOMO)
        59                         -0.2672781              -7.2730 (LUMO)
        60                         -0.2414956              -6.5714
        61                         -0.2134845              -5.8092
        62                         -0.1885824              -5.1316
        63                         -0.1588199              -4.3217
        64                         -0.1555925              -4.2339
        65                         -0.1544643              -4.2032
        66                         -0.1406865              -3.8283
        67                         -0.1317693              -3.5856
        68                         -0.1147121              -3.1215
        69                         -0.0424544              -1.1552
       ...                                ...                  ...
       128                          1.2944516              35.2238
      -------------------------------------------------------------
                  HL-Gap            0.1009344 Eh            2.7466 eV
             Fermi-level           -0.3177453 Eh           -8.6463 eV

     #   Z          covCN         q      C6AA      α(0)
     1   6 C        3.751    -0.118    22.826     6.814
     2   6 C        3.848     0.085    19.134     6.222
     3   8 O        1.655    -0.248    18.119     5.746
     4  15 P        3.824     0.389   144.092    21.563
     5  16 S        0.925    -0.419   157.511    21.228
     6   8 O        1.654    -0.243    18.044     5.734
     7   6 C        3.842     0.082    19.186     6.231
     8   6 C        3.751    -0.118    22.831     6.814
     9  16 S        2.004    -0.148   147.291    20.426
    10   6 C        3.816     0.045    19.802     6.333
    11  16 S        2.007    -0.181   148.737    20.526
    12  15 P        3.814     0.371   144.797    21.616
    13  16 S        0.926    -0.380   155.692    21.105
    14   8 O        1.654    -0.227    17.789     5.694
    15   6 C        3.846     0.083    19.167     6.228
    16   6 C        3.751    -0.116    22.777     6.806
    17   8 O        1.655    -0.246    18.095     5.742
    18   6 C        3.827     0.082    19.204     6.236
    19   6 C        3.752    -0.117    22.806     6.810
    20   1 H        0.925     0.058     2.227     2.333
    21   1 H        0.925     0.069     2.092     2.262
    22   1 H        0.925     0.063     2.165     2.301
    23   1 H        0.924     0.066     2.125     2.280
    24   1 H        0.924     0.051     2.306     2.375
    25   1 H        0.924     0.063     2.165     2.301
    26   1 H        0.924     0.069     2.099     2.266
    27   1 H        0.925     0.065     2.142     2.289
    28   1 H        0.925     0.059     2.215     2.328
    29   1 H        0.925     0.064     2.155     2.295
    30   1 H        0.925     0.077     2.012     2.218
    31   1 H        0.925     0.091     1.873     2.140
    32   1 H        0.924     0.062     2.181     2.309
    33   1 H        0.924     0.074     2.043     2.235
    34   1 H        0.925     0.059     2.216     2.328
    35   1 H        0.925     0.061     2.182     2.310
    36   1 H        0.925     0.060     2.198     2.319
    37   1 H        0.924     0.055     2.254     2.348
    38   1 H        0.924     0.067     2.117     2.275
    39   1 H        0.925     0.070     2.086     2.259
    40   1 H        0.925     0.063     2.164     2.300
    41   1 H        0.925     0.058     2.218     2.329

 Mol. C6AA /au·bohr⁶  :      26537.538735
 Mol. C8AA /au·bohr⁸  :     863408.640373
 Mol. α(0) /au        :        258.274001


Wiberg/Mayer (AO) data.
largest (>0.10) Wiberg bond orders for each atom

 ---------------------------------------------------------------------------
     #   Z sym  total        # sym  WBO       # sym  WBO       # sym  WBO
 ---------------------------------------------------------------------------
     1   6 C    3.988 --     2 C    1.019    22 H    0.984    20 H    0.981
                            21 H    0.978
     2   6 C    3.911 --     1 C    1.019    23 H    0.969    24 H    0.966
                             3 O    0.906
     3   8 O    2.405 --     4 P    1.300     2 C    0.906
     4  15 P    5.230 --     5 S    1.526     6 O    1.329     3 O    1.300
                             9 S    0.952
     5  16 S    1.867 --     4 P    1.526     9 S    0.140
     6   8 O    2.418 --     4 P    1.329     7 C    0.892
     7   6 C    3.901 --     8 C    1.022    25 H    0.970    26 H    0.959
                             6 O    0.892
     8   6 C    3.986 --     7 C    1.022    28 H    0.984    29 H    0.978
                            27 H    0.976
     9  16 S    2.271 --    10 C    0.983     4 P    0.952     5 S    0.140
    10   6 C    3.960 --    11 S    0.992     9 S    0.983    30 H    0.964
                            31 H    0.951
    11  16 S    2.280 --    10 C    0.992    12 P    0.933    13 S    0.144
    12  15 P    5.298 --    13 S    1.570    14 O    1.355    17 O    1.309
                            11 S    0.933
    13  16 S    1.906 --    12 P    1.570    11 S    0.144
    14   8 O    2.432 --    12 P    1.355    15 C    0.887
    15   6 C    3.907 --    16 C    1.021    33 H    0.968    32 H    0.967
                            14 O    0.887
    16   6 C    3.991 --    15 C    1.021    35 H    0.984    36 H    0.982
                            34 H    0.980
    17   8 O    2.412 --    12 P    1.309    18 C    0.905
    18   6 C    3.912 --    19 C    1.022    37 H    0.970    38 H    0.969
                            17 O    0.905
    19   6 C    3.989 --    18 C    1.022    39 H    0.982    41 H    0.980
                            40 H    0.974
    20   1 H    0.996 --     1 C    0.981
    21   1 H    0.995 --     1 C    0.978
    22   1 H    0.996 --     1 C    0.984
    23   1 H    0.995 --     2 C    0.969
    24   1 H    0.997 --     2 C    0.966
    25   1 H    0.996 --     7 C    0.970
    26   1 H    0.995 --     7 C    0.959
    27   1 H    0.996 --     8 C    0.976
    28   1 H    0.997 --     8 C    0.984
    29   1 H    0.995 --     8 C    0.978
    30   1 H    0.994 --    10 C    0.964
    31   1 H    0.992 --    10 C    0.951
    32   1 H    0.996 --    15 C    0.967
    33   1 H    0.995 --    15 C    0.968
    34   1 H    0.995 --    16 C    0.980
    35   1 H    0.996 --    16 C    0.984
    36   1 H    0.996 --    16 C    0.982
    37   1 H    0.997 --    18 C    0.970
    38   1 H    0.995 --    18 C    0.969
    39   1 H    0.995 --    19 C    0.982
    40   1 H    0.996 --    19 C    0.974
    41   1 H    0.996 --    19 C    0.980
 ---------------------------------------------------------------------------

Topologies differ in total number of bonds
Writing topology from bond orders to xtbtopo.mol

molecular dipole:
                 x           y           z       tot (Debye)
 q only:        0.156      -0.241       1.554
   full:        0.450      -0.289       1.534       4.129
molecular quadrupole (traceless):
                xx          xy          yy          xz          yz          zz
 q only:        9.114       1.017       5.392     -18.410     -14.699     -14.506
  q+dip:       16.208      -5.453       3.609     -19.099     -16.725     -19.817
   full:       15.350      -4.229       3.290     -19.414     -17.480     -18.640


           -------------------------------------------------
          | TOTAL ENERGY              -65.009689406477 Eh   |
          | GRADIENT NORM               0.031330605683 Eh/α |
          | HOMO-LUMO GAP               2.746564579761 eV   |
           -------------------------------------------------

------------------------------------------------------------------------
 * finished run on 2025/04/09 at 05:21:16.717     
------------------------------------------------------------------------
 total:
 * wall-time:     0 d,  0 h,  0 min,  0.103 sec
 *  cpu-time:     0 d,  0 h,  0 min,  0.070 sec
 * ratio c/w:     0.676 speedup
 SCF:
 * wall-time:     0 d,  0 h,  0 min,  0.060 sec
 *  cpu-time:     0 d,  0 h,  0 min,  0.056 sec
 * ratio c/w:     0.936 speedup

