      -----------------------------------------------------------      
     |                   =====================                   |     
     |                           x T B                           |     
     |                   =====================                   |     
     |                         S. Grimme                         |     
     |          Mulliken Center for Theoretical Chemistry        |     
     |                    University of Bonn                     |     
      -----------------------------------------------------------      

   * xtb version 6.7.1 (edcfbbe) compiled by 'albert@albert-system' on 2024-07-22

   xtb is free software: you can redistribute it and/or modify it under
   the terms of the GNU Lesser General Public License as published by
   the Free Software Foundation, either version 3 of the License, or
   (at your option) any later version.
   
   xtb is distributed in the hope that it will be useful,
   but WITHOUT ANY WARRANTY; without even the implied warranty of
   MERCHANTABILITY or FITNESS FOR A PARTICULAR PURPOSE.  See the
   GNU Lesser General Public License for more details.
   
   Cite this work as:
   * C. Bannwarth, E. Caldeweyher, S. Ehlert, A. Hansen, P. Pracht,
     J. Seibert, S. Spicher, S. Grimme, WIREs Comput. Mol. Sci., 2020, 11,
     e01493. DOI: 10.1002/wcms.1493
   
   for GFN2-xTB:
   * C. Bannwarth, S. Ehlert and S. Grimme., J. Chem. Theory Comput., 2019,
     15, 1652-1671. DOI: 10.1021/acs.jctc.8b01176
   for GFN1-xTB:
   * S. Grimme, C. Bannwarth, P. Shushkov, J. Chem. Theory Comput., 2017,
     13, 1989-2009. DOI: 10.1021/acs.jctc.7b00118
   for GFN0-xTB:
   * P. Pracht, E. Caldeweyher, S. Ehlert, S. Grimme, ChemRxiv, 2019, preprint.
     DOI: 10.26434/chemrxiv.8326202.v1
   for GFN-FF:
   * S. Spicher and S. Grimme, Angew. Chem. Int. Ed., 2020, 59, 15665-15673.
     DOI: 10.1002/anie.202004239
   
   for ALPB and GBSA implicit solvation:
   * S. Ehlert, M. Stahn, S. Spicher, S. Grimme, J. Chem. Theory Comput.,
     2021, 17, 4250-4261. DOI: 10.1021/acs.jctc.1c00471
   
   for ddCOSMO and CPCM-X implicit solvation:
   * M. Stahn, S. Ehlert, S. Grimme, J. Phys. Chem. A,
     2023, XX, XXXX-XXXX. DOI: 10.1021/acs.jpca.3c04382
   
   for DFT-D4:
   * E. Caldeweyher, C. Bannwarth and S. Grimme, J. Chem. Phys., 2017,
     147, 034112. DOI: 10.1063/1.4993215
   * E. Caldeweyher, S. Ehlert, A. Hansen, H. Neugebauer, S. Spicher,
     C. Bannwarth and S. Grimme, J. Chem. Phys., 2019, 150, 154122.
     DOI: 10.1063/1.5090222
   * E. Caldeweyher, J.-M. Mewes, S. Ehlert and S. Grimme, Phys. Chem. Chem. Phys.
     2020, 22, 8499-8512. DOI: 10.1039/D0CP00502A
   
   for sTDA-xTB:
   * S. Grimme and C. Bannwarth, J. Chem. Phys., 2016, 145, 054103.
     DOI: 10.1063/1.4959605
   
   in the mass-spec context:
   * V. Asgeirsson, C. Bauer and S. Grimme, Chem. Sci., 2017, 8, 4879.
     DOI: 10.1039/c7sc00601b
   * J. Koopman and S. Grimme, ACS Omega 2019, 4, 12, 15120-15133.
     DOI: 10.1021/acsomega.9b02011
   
   for metadynamics refer to:
   * S. Grimme, J. Chem. Theory Comput., 2019, 155, 2847-2862
     DOI: 10.1021/acs.jctc.9b00143
   
   for SPH calculations refer to:
   * S. Spicher and S. Grimme, J. Chem. Theory Comput., 2021, 17, 1701-1714
     DOI: 10.1021/acs.jctc.0c01306
   
   for ONIOM refer to:
   * C. Plett, A. Katbashev, S. Ehlert, S. Grimme, M. Bursch,
     Phys. Chem. Chem. Phys., 2023, 25, 17860-17868. DOI: 10.1039/D3CP02178E
   
   for DIPRO refer to:
   * J. Kohn, N. Gildemeister, S. Grimme, D. Fazzi, A. Hansen,
     J. Chem. Phys., 2023, just accepted.
   
   for PTB refer to:
   * S. Grimme, M. Mueller, A. Hansen, J. Chem. Phys., 2023, 158, 124111.
     DOI: 10.1063/5.0137838
   
   with help from (in alphabetical order)
   P. Atkinson, C. Bannwarth, F. Bohle, G. Brandenburg, E. Caldeweyher
   M. Checinski, S. Dohm, S. Ehlert, S. Ehrlich, I. Gerasimov, C. Hölzer
   A. Katbashev, J. Kohn, J. Koopman, C. Lavigne, S. Lehtola, F. März, M. Müller,
   F. Musil, H. Neugebauer, J. Pisarek, C. Plett, P. Pracht, F. Pultar,
   J. Seibert, P. Shushkov, S. Spicher, M. Stahn, M. Steiner, T. Strunk,
   J. Stückrath, T. Rose, and J. Unsleber
   
 * started run on 2025/04/09 at 05:20:51.594     
   ID    Z sym.   atoms
    1    6 C      1, 2, 7, 8, 10, 15, 16, 18, 19
    2    8 O      3, 6, 14, 17
    3   15 P      4, 12
    4   16 S      5, 9, 11, 13
    5    1 H      20-41

           -------------------------------------------------
          |                Calculation Setup                |
           -------------------------------------------------

          program call               : /srv/scratch/z5358697/.xtb/bin/xtb gas.coord --gfn2 --sp --chrg 0 --norestart --parallel 1
          hostname                   : k163
          coordinate file            : gas.coord
          omp threads                :                     1


           -------------------------------------------------
          |                 G F N 2 - x T B                 |
           -------------------------------------------------

        Reference                      10.1021/acs.jctc.8b01176
      * Hamiltonian:
        H0-scaling (s, p, d)           1.850000    2.230000    2.230000
        zeta-weighting                 0.500000
      * Dispersion:
        s8                             2.700000
        a1                             0.520000
        a2                             5.000000
        s9                             5.000000
      * Repulsion:
        kExp                           1.500000    1.000000
        rExp                           1.000000
      * Coulomb:
        alpha                          2.000000
        third order                    shell-resolved
        anisotropic                    true
        a3                             3.000000
        a5                             4.000000
        cn-shift                       1.200000
        cn-exp                         4.000000
        max-rad                        5.000000


          ...................................................
          :                      SETUP                      :
          :.................................................:
          :  # basis functions                 134          :
          :  # atomic orbitals                 128          :
          :  # shells                           66          :
          :  # electrons                       116          :
          :  max. iterations                   250          :
          :  Hamiltonian                  GFN2-xTB          :
          :  restarted?                      false          :
          :  GBSA solvation                  false          :
          :  PC potential                    false          :
          :  electronic temp.          300.0000000     K    :
          :  accuracy                    1.0000000          :
          :  -> integral cutoff          0.2500000E+02      :
          :  -> integral neglect         0.1000000E-07      :
          :  -> SCF convergence          0.1000000E-05 Eh   :
          :  -> wf. convergence          0.1000000E-03 e    :
          :  Broyden damping             0.4000000          :
          :  net charge                          0          :
          :  unpaired electrons                  0          :
          ...................................................

 iter      E             dE          RMSdq      gap      omega  full diag
   1    -65.3707721 -0.653708E+02  0.644E+00    4.31       0.0  T
   2    -65.5462267 -0.175455E+00  0.417E+00    3.02       1.0  T
   3    -65.5657767 -0.195501E-01  0.146E+00    2.91       1.0  T
   4    -65.5685076 -0.273088E-02  0.582E-01    2.64       1.0  T
   5    -65.5693578 -0.850196E-03  0.266E-01    2.77       1.0  T
   6    -65.5695490 -0.191239E-03  0.132E-01    2.74       1.0  T
   7    -65.5696032 -0.541933E-04  0.503E-02    2.76       1.0  T
   8    -65.5696139 -0.107061E-04  0.239E-02    2.76       1.0  T
   9    -65.5696157 -0.173777E-05  0.607E-03    2.76       2.6  T
  10    -65.5696158 -0.151250E-06  0.276E-03    2.76       5.7  T
  11    -65.5696158 -0.731313E-08  0.531E-04    2.76      29.4  T
  12    -65.5696158 -0.677346E-09  0.253E-04    2.76      61.8  T

   *** convergence criteria satisfied after 12 iterations ***

         #    Occupation            Energy/Eh            Energy/eV
      -------------------------------------------------------------
         1        2.0000           -0.7542593             -20.5244
       ...           ...                  ...                  ...
        52        2.0000           -0.4314123             -11.7393
        53        2.0000           -0.4098047             -11.1514
        54        2.0000           -0.4004090             -10.8957
        55        2.0000           -0.3704907             -10.0816
        56        2.0000           -0.3671598              -9.9909
        57        2.0000           -0.3644861              -9.9182
        58        2.0000           -0.3574278              -9.7261 (HOMO)
        59                         -0.2559327              -6.9643 (LUMO)
        60                         -0.2432721              -6.6198
        61                         -0.2064517              -5.6178
        62                         -0.1756464              -4.7796
        63                         -0.1646110              -4.4793
       ...                                ...                  ...
       128                          1.3496848              36.7268
      -------------------------------------------------------------
                  HL-Gap            0.1014951 Eh            2.7618 eV
             Fermi-level           -0.3066802 Eh           -8.3452 eV

 SCC (total)                   0 d,  0 h,  0 min,  0.058 sec
 SCC setup                      ...        0 min,  0.000 sec (  0.467%)
 Dispersion                     ...        0 min,  0.000 sec (  0.545%)
 classical contributions        ...        0 min,  0.000 sec (  0.104%)
 integral evaluation            ...        0 min,  0.009 sec ( 15.170%)
 iterations                     ...        0 min,  0.026 sec ( 44.421%)
 molecular gradient             ...        0 min,  0.022 sec ( 38.911%)
 printout                       ...        0 min,  0.000 sec (  0.358%)

         :::::::::::::::::::::::::::::::::::::::::::::::::::::
         ::                     SUMMARY                     ::
         :::::::::::::::::::::::::::::::::::::::::::::::::::::
         :: total energy             -65.008375629415 Eh    ::
         :: gradient norm              0.039122695047 Eh/a0 ::
         :: HOMO-LUMO gap              2.761823249940 eV    ::
         ::.................................................::
         :: SCC energy               -65.568457425552 Eh    ::
         :: -> isotropic ES            0.108112847839 Eh    ::
         :: -> anisotropic ES         -0.012066667855 Eh    ::
         :: -> anisotropic XC          0.030845115213 Eh    ::
         :: -> dispersion             -0.055877838232 Eh    ::
         :: repulsion energy           0.560081796138 Eh    ::
         :: add. restraining           0.000000000000 Eh    ::
         :: total charge              -0.000000000000 e     ::
         :::::::::::::::::::::::::::::::::::::::::::::::::::::

           -------------------------------------------------
          |                Property Printout                |
           -------------------------------------------------

    * Orbital Energies and Occupations

         #    Occupation            Energy/Eh            Energy/eV
      -------------------------------------------------------------
         1        2.0000           -0.7542593             -20.5244
       ...           ...                  ...                  ...
        46        2.0000           -0.4718439             -12.8395
        47        2.0000           -0.4631271             -12.6023
        48        2.0000           -0.4559527             -12.4071
        49        2.0000           -0.4506547             -12.2629
        50        2.0000           -0.4480733             -12.1927
        51        2.0000           -0.4382110             -11.9243
        52        2.0000           -0.4314123             -11.7393
        53        2.0000           -0.4098047             -11.1514
        54        2.0000           -0.4004090             -10.8957
        55        2.0000           -0.3704907             -10.0816
        56        2.0000           -0.3671598              -9.9909
        57        2.0000           -0.3644861              -9.9182
        58        2.0000           -0.3574278              -9.7261 (HOMO)
        59                         -0.2559327              -6.9643 (LUMO)
        60                         -0.2432721              -6.6198
        61                         -0.2064517              -5.6178
        62                         -0.1756464              -4.7796
        63                         -0.1646110              -4.4793
        64                         -0.1630584              -4.4370
        65                         -0.1512540              -4.1158
        66                         -0.1360741              -3.7028
        67                         -0.1139742              -3.1014
        68                         -0.1062214              -2.8904
        69                         -0.0415081              -1.1295
       ...                                ...                  ...
       128                          1.3496848              36.7268
      -------------------------------------------------------------
                  HL-Gap            0.1014951 Eh            2.7618 eV
             Fermi-level           -0.3066802 Eh           -8.3452 eV

     #   Z          covCN         q      C6AA      α(0)
     1   6 C        3.751    -0.117    22.808     6.811
     2   6 C        3.812     0.083    19.191     6.236
     3   8 O        1.655    -0.261    18.336     5.781
     4  15 P        3.773     0.385   144.271    21.576
     5  16 S        0.927    -0.393   156.279    21.145
     6   8 O        1.655    -0.241    18.007     5.728
     7   6 C        3.832     0.089    19.081     6.215
     8   6 C        3.751    -0.112    22.710     6.796
     9  16 S        2.011    -0.161   147.838    20.464
    10   6 C        3.806     0.043    19.850     6.342
    11  16 S        2.008    -0.156   147.656    20.452
    12  15 P        3.849     0.372   144.744    21.612
    13  16 S        0.926    -0.375   155.451    21.088
    14   8 O        1.653    -0.236    17.934     5.717
    15   6 C        3.862     0.086    19.124     6.219
    16   6 C        3.751    -0.113    22.726     6.798
    17   8 O        1.655    -0.258    18.295     5.774
    18   6 C        3.854     0.083    19.169     6.227
    19   6 C        3.751    -0.119    22.836     6.815
    20   1 H        0.925     0.064     2.155     2.296
    21   1 H        0.925     0.070     2.090     2.261
    22   1 H        0.925     0.057     2.229     2.335
    23   1 H        0.924     0.065     2.144     2.290
    24   1 H        0.924     0.053     2.279     2.361
    25   1 H        0.924     0.068     2.111     2.272
    26   1 H        0.924     0.049     2.332     2.388
    27   1 H        0.925     0.075     2.030     2.228
    28   1 H        0.925     0.053     2.283     2.363
    29   1 H        0.925     0.060     2.200     2.319
    30   1 H        0.925     0.083     1.951     2.184
    31   1 H        0.924     0.090     1.884     2.146
    32   1 H        0.924     0.057     2.234     2.337
    33   1 H        0.924     0.058     2.224     2.332
    34   1 H        0.925     0.067     2.122     2.278
    35   1 H        0.925     0.062     2.179     2.308
    36   1 H        0.925     0.058     2.221     2.330
    37   1 H        0.924     0.063     2.165     2.301
    38   1 H        0.924     0.063     2.161     2.299
    39   1 H        0.925     0.065     2.142     2.289
    40   1 H        0.925     0.062     2.180     2.309
    41   1 H        0.925     0.061     2.189     2.314

 Mol. C6AA /au·bohr⁶  :      26553.882102
 Mol. C8AA /au·bohr⁸  :     863267.160408
 Mol. α(0) /au        :        258.337207


Wiberg/Mayer (AO) data.
largest (>0.10) Wiberg bond orders for each atom

 ---------------------------------------------------------------------------
     #   Z sym  total        # sym  WBO       # sym  WBO       # sym  WBO
 ---------------------------------------------------------------------------
     1   6 C    3.989 --     2 C    1.022    21 H    0.982    22 H    0.980
                            20 H    0.975
     2   6 C    3.912 --     1 C    1.022    24 H    0.972    23 H    0.969
                             3 O    0.904
     3   8 O    2.394 --     4 P    1.296     2 C    0.904
     4  15 P    5.270 --     5 S    1.527     6 O    1.309     3 O    1.296
                             9 S    0.992
     5  16 S    1.895 --     4 P    1.527     9 S    0.153
     6   8 O    2.402 --     4 P    1.309     7 C    0.891
     7   6 C    3.911 --     8 C    1.022    26 H    0.973    25 H    0.969
                             6 O    0.891
     8   6 C    3.990 --     7 C    1.022    27 H    0.981    28 H    0.980
                            29 H    0.975
     9  16 S    2.295 --     4 P    0.992    10 C    0.982     5 S    0.153
    10   6 C    3.956 --    11 S    0.992     9 S    0.982    30 H    0.968
                            31 H    0.940
    11  16 S    2.273 --    10 C    0.992    12 P    0.948    13 S    0.141
    12  15 P    5.290 --    13 S    1.584    14 O    1.331    17 O    1.301
                            11 S    0.948
    13  16 S    1.905 --    12 P    1.584    11 S    0.141
    14   8 O    2.410 --    12 P    1.331    15 C    0.886
    15   6 C    3.912 --    16 C    1.021    32 H    0.973    33 H    0.965
                            14 O    0.886
    16   6 C    3.987 --    15 C    1.021    35 H    0.984    34 H    0.981
                            36 H    0.979
    17   8 O    2.400 --    12 P    1.301    18 C    0.906
    18   6 C    3.909 --    19 C    1.022    37 H    0.970    38 H    0.969
                            17 O    0.906
    19   6 C    3.990 --    18 C    1.022    40 H    0.983    41 H    0.980
                            39 H    0.976
    20   1 H    0.996 --     1 C    0.975
    21   1 H    0.995 --     1 C    0.982
    22   1 H    0.996 --     1 C    0.980
    23   1 H    0.996 --     2 C    0.969
    24   1 H    0.997 --     2 C    0.972
    25   1 H    0.995 --     7 C    0.969
    26   1 H    0.997 --     7 C    0.973
    27   1 H    0.994 --     8 C    0.981
    28   1 H    0.996 --     8 C    0.980
    29   1 H    0.996 --     8 C    0.975
    30   1 H    0.993 --    10 C    0.968
    31   1 H    0.992 --    10 C    0.940
    32   1 H    0.997 --    15 C    0.973
    33   1 H    0.997 --    15 C    0.965
    34   1 H    0.995 --    16 C    0.981
    35   1 H    0.996 --    16 C    0.984
    36   1 H    0.995 --    16 C    0.979
    37   1 H    0.996 --    18 C    0.970
    38   1 H    0.996 --    18 C    0.969
    39   1 H    0.996 --    19 C    0.976
    40   1 H    0.996 --    19 C    0.983
    41   1 H    0.996 --    19 C    0.980
 ---------------------------------------------------------------------------

Topologies differ in total number of bonds
Writing topology from bond orders to xtbtopo.mol

molecular dipole:
                 x           y           z       tot (Debye)
 q only:        0.014      -0.985       1.912
   full:        0.002      -0.609       2.477       6.485
molecular quadrupole (traceless):
                xx          xy          yy          xz          yz          zz
 q only:       20.355       1.274      -8.131       6.738       7.860     -12.224
  q+dip:       23.460       1.137      -9.701       5.223      10.883     -13.759
   full:       24.196       1.010      -9.481       6.103      11.047     -14.715


           -------------------------------------------------
          | TOTAL ENERGY              -65.008375629415 Eh   |
          | GRADIENT NORM               0.039122695047 Eh/α |
          | HOMO-LUMO GAP               2.761823249940 eV   |
           -------------------------------------------------

------------------------------------------------------------------------
 * finished run on 2025/04/09 at 05:20:51.705     
------------------------------------------------------------------------
 total:
 * wall-time:     0 d,  0 h,  0 min,  0.110 sec
 *  cpu-time:     0 d,  0 h,  0 min,  0.070 sec
 * ratio c/w:     0.636 speedup
 SCF:
 * wall-time:     0 d,  0 h,  0 min,  0.058 sec
 *  cpu-time:     0 d,  0 h,  0 min,  0.057 sec
 * ratio c/w:     0.985 speedup

